image,image_category,disgust_rating,disgust_explanation
no-name-2(1).jpg,Cubism,0.0,"There are no elements within this painting that evoke a sense of disgust. The artwork depicts powerful, muscular human figures and horses in dynamic poses, rendered with vibrant, non-naturalistic colors. While the style is expressionistic and raw, it does not feature any imagery typically associated with disgust, such as bodily fluids, decay, gore, disease, filth, or any morally reprehensible acts presented in a way that would cause visceral revulsion. The nudity of the figures appears to be part of the raw, primal energy of the scene, rather than being presented in a lewd or offensive manner that would incite disgust. The overall impression is one of energy, struggle, and a connection with elemental forces, not something repulsive or sickening."
nu-au-soleil-nude-in-the-sun-1935.jpg,Cubism,0.0,"There are absolutely no elements within this painting that evoke feelings of disgust. The artwork depicts a classical-inspired female figure, rendered with a stylized, almost cubist sensibility, in what appears to be an architectural setting overlooking a landscape. The figure itself is not distorted, diseased, grotesque, or in any way repulsive. Her form is voluminous but gracefully posed. The partial drapery is handled tastefully, devoid of vulgarity or offense. The color palette is composed of muted, earthy tones and cool blues, which are aesthetically pleasing and do not conjure any sense of sickness or decay. The background elements, including the distant buildings and mountains, and the foreground objects like the flowers and bowl of fruit, are all benign and wholesome, suggesting abundance and nature rather than anything putrid or vile. There is no gore, bodily fluids, decay, unsanitary conditions, or any other common triggers for disgust present in the imagery or the execution of the painting. The overall impression is one of calm, contemplation, and classical beauty, standing in stark opposition to any sensation of revulsion."
militiaman-and-merchant-sketch-of-costumes-for-the-play-footballer.jpg,Cubism,38.0,"The primary element contributing to a sense of disgust is the prominent, realistically rendered bee (or wasp) placed squarely on the chest of the right-hand figure. For many individuals, insects, especially those associated with stinging or being pests, can trigger a primal feeling of aversion or disgust, particularly when depicted in such an unnatural and almost parasitic way on a human form. This feeling is heightened by the stark contrast between the bee's realistic detail and the highly abstracted, geometric style of the human figures.

Furthermore, aspects of the right figure's stylized anatomy can contribute to a subtle sense of the grotesque or unsettling, bordering on mild revulsion. The breasts are depicted as detached, almost target-like pink circles, creating an uncanny and unnatural representation of the body that can be unsettling. The overall fragmentation and reassembly of the figure's form—with disjointed limbs, a disproportionate red nose, and a dark, claw-like hand—contribute to a feeling of the body being ""wrong"" or deformed in a way that can trigger discomfort or a slight sense of repulsion rather than mere aesthetic disinterest. While not overtly gory or filthy, the painting's deliberate juxtaposition of elements and its departure from naturalistic representation create an unsettling visual experience that can lean towards a mild, visceral feeling of disgust for some viewers."
mountaineers-attacked-by-bears-1912.jpg,Cubism,5.0,"The emotion of disgust is minimally evoked by this painting. There are no overt depictions of filth, gore, decay, or anything physically repulsive. The subject matter itself, appearing to be a crowded indoor scene possibly a bar or gathering, does not inherently suggest anything disgusting.

However, a very slight degree of aesthetic aversion, which can be a mild form of disgust, might arise from a few subtle elements. The painting's highly fragmented and chaotic Cubist-like style creates a sense of visual disorder and clutter. For viewers who prefer clarity, order, or traditional beauty, this dense and jumbled composition could be mildly overwhelming or even ""messy"" to the point of being aesthetically unappealing, triggering a very faint sense of discomfort or aversion akin to revulsion at disarray.

Furthermore, some of the highly abstracted figures, particularly the central one with the prominent, elongated facial features that appear almost grotesque or caricatured, could be perceived as visually unpleasing or even unsettling by certain sensibilities. This departure from conventional attractiveness, while not explicitly vile, might nudge a viewer toward a very minor degree of aesthetic disgust rather than appreciation. The overall muted and somewhat muddy color palette, while not inherently disgusting, also contributes to a general lack of visual appeal that might prevent any positive aesthetic response, thus leaving room for a slight negative one for some viewers. Nonetheless, these elements are far from eliciting a strong, visceral reaction typically associated with disgust."
paris-roofs-ii-1952.jpg,Cubism,0.0,"The painting is an abstract, geometric composition primarily depicting fragmented architectural forms using muted pastel colors such as greens, blues, browns, purples, and pinks. The lines are clean and well-defined, and the overall impression is one of order within abstraction. There is absolutely nothing in the imagery—no depicted decay, filth, bodily fluids, grotesque figures, violence, or morally repugnant content—that could possibly trigger a sensation of disgust. Disgust is an emotion typically associated with visceral aversion to offensive substances or morally reprehensible actions. This artwork presents none of these characteristics; it is aesthetically clean, formal, and non-representational in a way that precludes any such negative physiological or moral response. Therefore, a score of 0.0 is appropriate, indicating a complete absence of disgust."
orange-vendor-spain.jpg,Cubism,0.0,"The painting, ""The Harvesters"" by Natalia Goncharova, presents no visual or thematic elements that would evoke a feeling of disgust. The subject matter, depicting stylized figures engaged in agricultural work and carrying baskets of produce, is inherently benign and even celebratory of labor and abundance. The fruits and items depicted appear wholesome and fresh, offering no suggestion of decay, spoilage, or unhygienic conditions. The color palette is vibrant and rich, utilizing bright yellows, greens, blues, and reds, which contribute to an energetic and visually appealing aesthetic rather than anything repulsive or off-putting. The artistic style, characterized by its Cubo-Futurist influence with geometric forms and fragmented perspectives, is a stylistic choice that, while distinct, does not convey anything grotesque, repulsive, or sickening. There are no depictions of gore, bodily fluids, filth, violence, suffering, or morally objectionable content that would trigger a visceral or moral sense of revulsion. The overall impression is one of dynamism and vitality, completely devoid of any stimuli typically associated with disgust."
pink-figure-wizard.jpg,Cubism,0.5,"The painting presents a stylized figure, possibly an athlete or a futuristic persona, rendered with angular forms and a distinct color palette of browns, greens, and muted tones. There are absolutely no elements within this artwork that would elicit a feeling of disgust. The subject matter is not grotesque, repulsive, or inherently unpleasant; it does not depict decay, filth, violence, injury, or any other commonly recognized triggers for disgust. The colors are earthy and harmonious, not sickly or jarring. The composition is balanced, and the figure's expression, while stylized, does not convey pain, suffering, or any emotion that might be off-putting. The artwork appears to be an exploration of form and color, possibly conveying themes of strength, contemplation, or a modernized human form, none of which align with feelings of revulsion. The very low score reflects the complete absence of any visual cues or narrative implications that could lead to disgust."
night-ceremony.jpg,Cubism,62.5,"The painting evokes a notable degree of disgust, primarily stemming from the depiction of animal slaughter and raw meat processing. The most significant element contributing to this emotion is located in the bottom left corner, where a clearly identifiable animal (likely a pig) lies on its back, apparently gutted or opened, with a reddish-brown stain beneath it, strongly implying blood. While the artistic style is stylized and not hyper-realistic, which mitigates the immediate visceral impact, the subject matter itself – a dead animal in this state – is inherently disturbing and can trigger feelings of revulsion or unpleasantness in many viewers.

Further contributing to the sense of disgust are the raw cuts of meat on the table in front of the standing figure. Although appearing as clean cuts, the sheer quantity and raw state, especially in an open-air, somewhat informal setting, can create a minor sense of unease or messiness. The presence of a bucket near the figure's feet, appearing to contain dark, reddish material (possibly offal or bloody scraps), reinforces the messy and crude aspects of butchery, adding to the overall feeling of things being unclean or potentially unpleasant.

However, several factors prevent the disgust score from being higher. The painting's stylized, almost tapestry-like quality and abstracted forms reduce the direct, graphic impact. There is no explicit rendering of gore, detailed internal organs, or overt signs of decay (like flies or putrefaction) that would induce a stronger physical recoil. The overall color palette, though including reds and browns, is muted, further dampening the visceral quality."
pillars-of-salt.jpg,Cubism,1.0,"The painting does not evoke any sense of disgust. There are no visual elements that depict decay, filth, bodily fluids, gore, or anything traditionally associated with a physical sensation of revulsion. The figures, while stylized and somewhat abstract, are rendered in clean, cool tones of blue and white, set against warm reds and oranges. Their forms are solid and sculptural, not sickly or distorted in a way that would trigger an aversive reaction. The expressions, though simplified, appear contemplative, serene, or even gently smiling, rather than conveying any negative emotional state that might be contagious or unsettling. The overall atmosphere is one of calm, solemnity, or even reverence, which is antithetical to feelings of disgust. There is nothing in the subject matter, composition, color palette, or execution that presents as offensive, repulsive, or inherently unpleasant in a way that would elicit a feeling of disgust."
portrait-dulcinea-1911.jpg,Cubism,0.0,"The painting, featuring several stylized, elongated female figures in a warm, earthy palette, evokes no sense of disgust. There is nothing in the subject matter, composition, or color scheme that is repulsive, contaminating, grotesque, or morally offensive. The figures are depicted in a serene, almost contemplative manner, and while abstractly rendered, they do not suggest decay, illness, or any form of physical or moral unpleasantness. The colors are harmonious and inviting, not sickly or putrid. Therefore, there are no visual cues present that would trigger a feeling of disgust."
planches-de-salut-1931.jpg,Cubism,5.0,"The artwork, rendered in a monochromatic, heavily cross-hatched style, depicts an interior space that is stark, angular, and somewhat austere. While the deep shadows and the abstract, somewhat elongated figure on the left might contribute to a sense of unease or mystery, there are no visual cues within the composition that directly evoke the sensation of disgust. There is an absence of elements typically associated with this emotion, such as filth, decay, grotesque forms, or imagery that suggests contamination or biological repulsion. The deliberate artistic style, while creating a distinct mood, does not employ textures, forms, or subject matter that are inherently repulsive or sickening. The implied narrative or atmosphere might lean towards the psychological or unsettling, but this is distinct from eliciting a visceral feeling of disgust. The score is very low because the artwork does not present anything physically repellent, aesthetically offensive in a disgusting way, or morally depraved in a manner that would induce revulsion."
portrait-de-j-l-b.jpg,Cubism,0.0,"This painting evokes absolutely no sense of disgust. The geometric fragmentation and abstract nature of the forms, while potentially unsettling or intriguing, do not depict anything that would trigger a visceral reaction of revulsion. There are no elements of gore, decay, bodily fluids, unhygienic conditions, or morally reprehensible actions conveyed. The colors are muted and earthy, not contributing to any feeling of sickness or repulsion. The textures appear to be painterly and structured, not slimy, viscous, or otherwise unpleasant to imagine touching. The fragmented 'face' at the top, if interpreted as such, is stylized and not grotesque or distorted in a way that would cause nausea or aversion. Disgust is typically a protective emotion against something harmful to ingest or encounter, and nothing in this artwork suggests such a threat or unpleasantness."
portrait-of-albert-gleizes-1912.jpg,Cubism,5.0,"The painting, a Cubist portrait, presents a fragmented and geometric interpretation of a human figure, possibly two overlapping figures. While the deconstruction of the subject's form might be perceived as unconventional or even unsettling to some who prefer realistic representation, it does not evoke a sensation of disgust. Disgust typically arises from revulsion towards something perceived as offensive, repulsive, unclean, or morally corrupt. This artwork contains none of these elements. The colors are generally muted and harmonious, lacking any jarring or sickening combinations. There are no grotesque details, bodily fluids, signs of decay, or disturbing imagery that would trigger a visceral feeling of revulsion. The fragmentation is an artistic choice, representing multiple perspectives simultaneously, rather than a depiction of injury or decay that would naturally provoke disgust. The overall intellectual and analytical approach of Cubism tends to distance the viewer from raw emotional responses like disgust, favoring instead contemplation of form and perspective. Any minimal score is attributed to the abstract nature potentially being off-putting to some, but not in a truly disgusting manner."
portrait-of-a-stylist-germinal-rangel.jpg,Cubism,0.0,"As an art expert evaluating this painting for its capacity to evoke disgust, I find no discernible elements that would trigger such an emotion. Disgust typically arises from visual cues associated with decay, filth, disease, grotesqueness, moral depravity, or highly offensive imagery. This artwork presents none of these characteristics. The composition features a central figure, a Siamese cat, a tortoise, and a bowl of fruit, all rendered in a clean, pointillist style. The colors are generally muted and harmonious, dominated by blues, greens, and earthy tones, which do not clash or create any sense of visual discomfort. The subject matter itself – a person in a tranquil setting with animals and fresh fruit – is inherently benign and wholesome, rather than repulsive or unsettling. There are no distorted features, unpleasant textures, or themes of suffering or decay that would elicit a visceral reaction of revulsion. The meticulous dot-by-dot application of paint, while unique, does not contribute to feelings of disgust; instead, it provides a distinctive, almost shimmering quality to the surface. Consequently, the painting registers at the absolute lowest end of the disgust spectrum, indicating a complete absence of any visual stimuli associated with this emotion."
portrait-of-manuel-pallares-1909.jpg,Cubism,0.0,"There is absolutely no element within this painting that elicits a feeling of disgust. The artwork is a portrait of a man, rendered in a distinctive early Cubist style characterized by angular forms and planes. While the style deviates from strict realism, it does not distort the subject into anything grotesque, decaying, or inherently repulsive. The color palette consists of natural, muted earth tones (browns, ochres, greys), which are neither sickly nor unsettling. There are no visual cues typically associated with disgust, such as depictions of filth, bodily fluids, decay, disease, injury, or morally reprehensible actions. The man's expression is neutral, and the overall composition is one of formal artistic exploration rather than a representation of anything unpleasant or offensive. The dedication at the top (""A mi queridisimo amigo Pallares"") further reinforces that the painting is a respectful and perhaps affectionate portrayal, completely devoid of any intent or visual content that would provoke revulsion."
portrait-of-the-artist.jpg,Cubism,2.0,"The painting, a Cubist or Futurist portrait, features a man with stylized, angular features. While the artistic style distorts reality, there are no elements within the depiction that inherently evoke disgust. Disgust is typically triggered by visual cues of decay, disease, bodily fluids, grotesque disfigurement, or morally repugnant acts. None of these are present. The colors are vibrant and clean, the textures do not suggest anything repulsive, and the subject's expression, though abstracted, does not convey anything morally offensive or physically sickening. The angularity of the features and the fragmentation of the background are artistic choices, not representations of anything inherently disgusting. The slightly open, stylized mouth, while unusual, does not suggest a wound or decay. Therefore, the feeling of disgust is almost entirely absent."
peasant-woman-with-buckets-and-a-child.jpg,Cubism,3.0,"The painting, with its stylized and somewhat distorted figures, does not inherently evoke a strong sense of disgust. There are no explicit visual cues typically associated with this emotion, such as gore, decay, filth, bodily fluids, or overt signs of disease. The figures, while depicted with large, simplified features and forms common in expressionistic or primitivist art, are not portrayed as grotesque in a manner intended to trigger revulsion or suggest contamination. Their bare feet and simple clothing might imply a rustic or laborious existence, but there is no depiction of dirt, grime, or poor hygiene on their persons that would trigger a visceral response of disgust. The overall emotional tone conveyed by the figures leans more towards stoicism, burden, or weariness, which might elicit empathy or contemplation rather than repulsion. Any slight discomfort or aversion a viewer might experience would likely stem from a personal aesthetic preference for more conventional or idealized beauty, rather than a true feeling of disgust for the subject matter"
portrait-of-the-writer-m-doleng-1929.jpg,Cubism,0.0,"There are no elements within this painting that evoke the emotion of disgust. The artwork depicts a seated man in a stylized manner, characterized by strong outlines, geometric forms, and distinct color blocking. There is no depiction of gore, decay, filth, illness, or anything that would typically trigger a visceral sensation of revulsion. The color palette, while bold in its use of reds and blues alongside more muted tones, does not convey anything putrid or offensive. The facial expression, though somewhat obscured by the downward gaze, shows no sign of distress or a reaction to something repulsive. The hands, while featuring a similar red accent as the face, are simply clasped and do not suggest any form of injury or unpleasantness. The overall aesthetic is one of artistic interpretation rather than a portrayal of anything inherently disgusting."
rain-1929.jpg,Cubism,0.0,"This painting is a Cubist still life, characterized by its geometric fragmentation and a palette of muted, earthy tones alongside cool blues and greens. The subject matter appears to be various loaves of bread and a goblet or chalice. There is absolutely nothing within the visual representation of this artwork that could evoke a feeling of disgust. Disgust is typically triggered by perceptions of contamination, decay, unpleasant bodily fluids, or morally repulsive acts. This painting, however, presents clean, stylized forms and common, wholesome objects. The colors are not sickly or nauseating, nor are there any textures or details that suggest putrefaction, filth, or anything offensive to the senses. The artistic style aims to deconstruct and reassemble form, which is an intellectual and aesthetic pursuit, not one designed to provoke a visceral negative reaction like disgust. Consequently, there is no element in this artwork that would elicit such an emotional response."
portrait-of-p-denike-yuriev-and-a-pokrovsky-1913.jpg,Cubism,0.0,"The painting presents no visual cues or subject matter typically associated with eliciting the emotion of disgust. The artwork features two stylized figures, likely men, rendered with angular forms and bold colors characteristic of an expressionistic or early modernist style. While the faces exhibit some artistic distortion, such as simplified features and pronounced jawlines, this is a stylistic choice rather than a depiction of physical decay, illness, grotesque deformity, or uncleanliness that would trigger revulsion. There are no elements related to filth, bodily fluids, moral transgression, or anything offensive to the senses. The subjects are clothed and appear in a formal, albeit abstract, setting. Consequently, the painting does not evoke any sense of revulsion, aversion, or nausea typically associated with disgust."
red-jew-1915.jpg,Cubism,2.5,"The painting does not inherently evoke strong feelings of disgust. There are no depicted elements that are typically associated with revulsion, such as decay, filth, bodily fluids, or explicit violence. The colors are vibrant and, while some features are stylized and exaggerated (like the red beard or the slightly distorted face), they do not cross into the realm of being grotesque or repulsive in a way that would trigger a visceral reaction of disgust. The man's weary or melancholic expression and the abstract, somewhat unsettling background might evoke feelings of unease or sadness for some viewers, but these are distinct from disgust. The score of 2.5 acknowledges a very minimal, almost negligible potential for a viewer to find the slightly asymmetrical or unconventional portrayal of the human form as mildly ""off"" or unsettling, which in a very abstract and diluted sense *could* touch upon a subtle aversion, but it is far from a true feeling of disgust."
red-ocean-blue-1915.jpg,Cubism,1.0,"The painting, an abstract representation of a face composed of vibrant colors and geometric shapes, elicits virtually no sensation of disgust. There are no visual elements commonly associated with this emotion, such as decay, filth, gore, bodily fluids, or grotesque and unsettling realism. The colors are bright and varied, not muddy or sickly. While the facial features are fragmented and rearranged in a cubist manner, they do not appear deformed in a repulsive way. The overall composition is dynamic but lacks any content or texture that would provoke a visceral reaction of revulsion or nausea. The abstract nature of the artwork tends to invite intellectual curiosity rather than primal emotional responses like disgust."
relief.jpg,Cubism,0.1,"The painting, an abstract work composed of geometric forms and vibrant colors, presents no visual cues commonly associated with the emotion of disgust. There is no depiction of repulsive subject matter such as decay, bodily fluids, unhygienic conditions, or grotesque figures. The colors, though varied and at times contrasting, are generally clean and bright (red, white, blue, orange, green, black), and do not suggest putrefaction or illness. The sharp, angular forms do not evoke unpleasant tactile sensations like sliminess or stickiness, nor do they suggest anything distorted or vile. Furthermore, as an abstract piece, it does not convey narratives or themes that would trigger moral or ethical revulsion. The overall impression is one of formal exploration of shape, color, and perhaps movement, none of which inherently provoke a visceral reaction of disgust. The score is minimally above zero to account for the infinitesimally small chance of an extremely rare and highly personal idiosyncratic response, but objectively, the artwork contains no elements designed to, or that would typically, elicit disgust."
