image,image_category,disgust_rating,disgust_explanation
baj-chez-picasso-4-1969.jpg,Cubism,0.0,"There are no elements within this artwork that evoke a sense of disgust. The image presents a stylized, abstract figure with geometric shapes and bright, clean colors (blue, yellow, and a muted reddish-orange). The blue 'head' with its single large yellow eye is presented in a whimsical, almost playful manner. The texture of the blue figure, resembling bubbles or circles, and the patterned red base are decorative and do not suggest anything repulsive or unhygienic. There is no depiction of decay, filth, bodily fluids, gore, or any other imagery typically associated with inducing disgust. The composition is clean, the lines are sharp, and the overall aesthetic is one of abstract simplicity rather than a visceral or unpleasant experience. Therefore, the artwork completely lacks visual cues that would trigger a feeling of disgust."
at-wattle-1972-5.jpg,Cubism,0.5,"The painting, depicting a woman and a cow within what appears to be a rural or stable setting, presents no elements typically associated with the emotion of disgust. There is no depiction of decay, filth, bodily fluids, illness, gore, or anything unsanitary or repulsive. The subjects are rendered in a somewhat stylized, almost expressionistic manner, with thick impasto paint. While the textured paint might evoke a tactile sensation, it does not suggest anything inherently disgusting like slime, putrefaction, or grime. The colors used are earthy and natural, lacking any hues that would indicate sickness or corruption. The scene's overall mood is contemplative or pastoral, not one that would trigger revulsion or nausea. The very low score acknowledges the extreme rarity of a perfectly zero emotional response, allowing for the most minimal, almost imperceptible, potential for any negative association one might project, but fundamentally, the visual content does not stimulate disgust."
arlequin-dansant-1924.jpg,Cubism,0.5,"The painting, an abstract and geometric composition, does not evoke any sense of disgust. Disgust is typically triggered by visual elements that are unhygienic, repulsive, morally offensive, or represent decay, illness, or extreme unpleasantness. This artwork contains none of these qualities. The forms are clean, sharp, and structured, even when they are organic or fragmented. The color palette, while varied, consists of rich and earthy tones (reds, greens, purples, browns, yellows) that are visually harmonious rather than jarring or sickening. There is no depiction of gore, filth, decay, grotesque figures, or any subject matter that would typically induce a feeling of revulsion or aversion. The overall aesthetic is one of order, design, and artistic exploration of form and color, which is far removed from anything that would cause disgust. The minimal score of 0.5 is given only to acknowledge the theoretical possibility of an idiosyncratic or highly abstract interpretation, but fundamentally, the visual content itself presents no cause for this emotion."
ang-magbabayo-pounding-rice-1979.jpg,Cubism,0.0,"There is absolutely no element within this painting that would evoke a feeling of disgust. The artwork depicts two figures engaged in what appears to be the traditional act of pounding grain in a mortar and pestle, a common and fundamental activity in many cultures. The scene is one of labor and perhaps communal effort, depicted with a vibrant and warm color palette dominated by yellows, oranges, and greens. The figures themselves are rendered in a dynamic, somewhat abstract style, but their forms are not distorted or grotesque. There are no signs of decay, filth, disease, violence, or any visually offensive or repulsive substances. The overall impression is one of energy, tradition, and a connection to the earth or sustenance, all of which are antithetical to the emotion of disgust. The painting's aesthetic is clean and bright, further preventing any sensation of revulsion."
abstract-composition-figures-in-a-landscape-1930.jpg,Cubism,5.5,"The emotion of disgust is largely absent in this artwork. The composition is abstract, featuring a blend of organic and geometric forms rendered primarily in pastel and charcoal. There are no elements within the visual language that typically trigger a feeling of revulsion. The color palette, consisting of muted greens, yellows, grays, blacks, and a touch of blue, is neither jarring nor suggestive of decay or unhygienic conditions. The forms, while somewhat amorphous and blob-like in places (particularly the gray and black masses on the right and the green form on the left), do not directly resemble anything inherently repulsive such as bodily fluids, gore, waste, or grotesque creatures. There is a certain roughness to the crayon texture, and the lines are gestural, but this does not translate into a sensation of unpleasantness or filth. The geometric elements, such as the hexagonal shape, further contribute to a more intellectual and less visceral interpretation of the piece. While abstract art can sometimes evoke discomfort or unease, this particular piece does not employ visual strategies that align with the specific sensation of disgust, which is typically a response to something perceived as offensive, sickening, or unclean. The mild score of 5.5 is given simply because, in rare cases, extremely abstract or unconventional forms can, for a very small minority of viewers, elicit a slight feeling of unease that *could* border on mild distaste, but it is not a direct or intended effect of this artwork. There is nothing overtly unsettling, repulsive, or nauseating presented."
bouteille-et-livre-rose-1926.jpg,Cubism,0.0,"There is absolutely nothing within this abstract composition that elicits or even remotely suggests a feeling of disgust. The color palette, composed of soft pastels (pinks, blues, purples, greens, browns, and whites), is gentle and harmonious, devoid of any sickly or unappetizing hues often associated with unpleasantness. The shapes are abstract and geometric, or mildly biomorphic, but they are clean, defined, and arranged in a balanced manner. There are no distorted, decaying, grotesque, or visceral forms that might trigger a sensation of revulsion. The painting lacks any discernible subject matter that could be interpreted as unclean, offensive, violent, or physically repulsive. Instead, the overall impression is one of calmness, order, and intellectual contemplation, which stands in direct opposition to any feeling of disgust."
biblical-scene.jpg,Cubism,0.0,"There is absolutely nothing within this painting that elicits or even hints at the emotion of disgust. The scene depicts two stylized figures, one attending to another who is lying down, perhaps adjusting a blanket or sheet. This interaction appears to be a mundane, domestic, or potentially caring act. There are no elements suggesting contamination, decay, squalor, bodily fluids, physical repulsion, or any form of moral offense. The colors are vibrant and clean, not murky or sickly. The forms are abstract and simplified, preventing any realistic depiction of features that might trigger revulsion. The overall composition and subject matter are neutral to positive, completely devoid of any visual cues associated with disgust."
a-red-pedestal-1942.jpg,Cubism,0.5,"The painting, an abstract still life, presents no elements traditionally associated with eliciting disgust. There are no depictions of decay, filth, bodily fluids, contamination, grotesque figures, or anything that would typically trigger a visceral sense of revulsion or nausea. The colors, while strong and vibrant (predominantly reds and oranges), are not inherently nauseating or suggestive of unpleasantries. The forms are fragmented and abstract, characteristic of Cubism, which can be disorienting or challenging to interpret, but this visual distortion does not convey any sense of physical repulsion or contamination. The objects, such as the mandolin/lute and the shoe-like form, are recognizable still-life elements, albeit stylized. While the overall aesthetic might be perceived as intense or visually jarring by some, it does not cross into the realm of the repulsive or unsanitary. Therefore, the emotional response of disgust is virtually absent, meriting a score extremely close to zero, reflecting only the absolute slightest, almost imperceptible, potential for aesthetic unease that could, in the most tenuous and subjective interpretation, lean towards a minimal form of displeasure, but certainly not genuine disgust."
bibemus-quarry-1898-1.jpg,Cubism,0.0,"This painting, a landscape by Paul Cézanne, evokes absolutely no sense of disgust. The artwork depicts a natural scene with trees, rocks, and some architectural elements, rendered in a Post-Impressionist style characterized by distinct brushstrokes and a focus on form and color. There are no elements within the painting's subject matter or execution that would typically trigger a feeling of revulsion or repulsion. The colors are earthy and vibrant (greens, oranges, browns, a light sky), and the forms, while abstracted, are solid and structural, not grotesque or unsettling. There is no depiction of decay, filth, gore, disease, unpleasant bodily functions, disturbing creatures, or any morally repugnant acts. The scene is devoid of any visual or implied sensory information that could lead to a feeling of nausea, strong aversion, or moral outrage, all of which are common triggers for disgust. The overall impression is one of a robust and structured natural environment, completely antithetical to feelings of disgust."
aviator.jpg,Cubism,25.5,"The emotion of disgust is minimally evoked by this painting, primarily due to a few unsettling visual elements that are heavily mitigated by the artwork's abstract and stylized nature. The strongest potential source of disgust is the large, white fish draped across the man's torso. While the idea of a raw, dead fish on a person could inherently suggest sliminess, decay, or an unpleasant smell, the fish here is depicted in a pristine white, almost flat manner, with no texture or color to indicate actual decomposition, moisture, or offensive odor. Its stylized, jagged bottom edge makes it appear more like a symbolic object or a graphic element rather than a decaying biological entity.

Another element that could potentially trigger discomfort, though not necessarily strong disgust, is the object (resembling a fork or rake) impaled in the man's head. However, this is presented in a surreal and clean fashion, entirely devoid of blood, gore, or any explicit depiction of a festering wound or bodily fluid. It's more shocking or unsettling as a surrealistic act than as a viscerally disgusting injury.

The overall Cubo-Futurist style, with its geometric fragmentation and non-naturalistic colors (such as the man's green-yellow face), intellectualizes the subject matter, creating a significant distance between the viewer and any potential for raw, visceral revulsion. The painting lacks any visual cues commonly associated with strong disgust, such as putrefaction, filth, bodily waste, disease, or extreme disfigurement presented realistically. Therefore, while there's a faint, almost intellectual echo of potential unpleasantness due to the unusual subject matter, the execution effectively bypasses a genuine feeling of revulsion or nausea."
breads-1920.jpg,Cubism,0.0,"As an art expert evaluating the emotion of disgust independently, I find no discernible elements within this painting that would evoke such a feeling. Disgust typically arises from visual cues suggesting contamination, decay, putrefaction, unhygienic conditions, or spoiled substances. This still life, conversely, presents a collection of domestic items—a scale, what appears to be various forms of bread or baked goods, and a cup—all of which are inherently benign. The baked goods, while depicted with a certain rustic texture and possibly appearing dense or well-used, show no signs of mold, spoilage, or decomposition. There are no unpleasant residues, no unsettling colors suggestive of decay, nor any distorted forms that might trigger a visceral reaction of revulsion. The overall palette is muted and earthy, contributing to a sense of solemnity or humble reality, but not to any feeling of sickness or aversion. The objects are presented in a straightforward manner, devoid of any visual narrative or textural quality that would lead to a feeling of disgust."
animal-destinies-the-trees-show-their-rings-the-animals-their-veins.jpg,Cubism,8.0,"The painting primarily evokes feelings of chaos, anxiety, tragedy, and a sense of overwhelming destruction rather than physical disgust. There are no explicit visual elements such as gore, bodily fluids, decay, or filth that typically trigger a strong visceral reaction of disgust. The fragmented forms and sharp, intersecting lines, while conveying violence and rupture, are abstract and symbolic, preventing a direct nauseating response. However, a very subtle element of disgust may arise from a sense"
chorinho-1942.jpg,Cubism,0.0,"There is nothing within this painting that elicits a feeling of disgust. The artwork depicts four figures, likely musicians, in a stylized, somewhat cubist or abstract manner, engaging in what appears to be a musical performance or expression. The figures are not grotesque, deformed, or diseased. There are no elements of decay, filth, bodily fluids, or any other traditionally repulsive imagery present. The color palette, dominated by cool blues, greens, grays, and whites, does not include colors commonly associated with sickness or decay. The expressions and postures of the figures, while stylized and conveying emotion or movement, do not suggest revulsion or an unpleasant sensation that would trigger disgust in the viewer. The overall atmosphere, while perhaps melancholic or intense, is not one of repulsion or nausea."
bull-plate-x-1946.jpg,Cubism,0.5,"The artwork, a minimalist line drawing of an abstracted bull, presents no visual elements commonly associated with disgust. There is no depiction of gore, decay, filth, bodily fluids, or anything grotesque or inherently repulsive. The lines are clean, the composition is simplified, and the black and white palette offers no disturbing color cues. While the abstraction might lead to a sense of unease or unfamiliarity for some viewers due to its departure from realism, this is distinct from genuine disgust. The animal form, even in its highly stylized state, does not convey sickness, deformity in a visceral sense, or any other quality that would trigger a strong aversion response. Any minute trace of disgust would likely stem from an extremely idiosyncratic reaction to the concept of extreme deconstruction of a natural form, rather than any intentional or widely perceived repulsive quality within the artwork itself."
chateau-noir-1.jpg,Cubism,0.0,"The painting, a landscape with a building nestled among trees, does not evoke any sense of disgust whatsoever. Disgust is typically provoked by imagery that is offensive, repulsive, or sickening, often associated with decay, filth, or moral abomination. This artwork contains none of these elements. The color palette, dominated by warm yellows and oranges for the building contrasting with various shades of green and blue for the foliage and sky, is aesthetically pleasing and harmonious rather than jarring or repulsive. The subject matter—a natural setting with human architecture—is inherently neutral and lacks any visual cues that could be interpreted as unhygienic, decaying, grotesque, or morally corrupt. The visible brushstrokes, characteristic of Cézanne's style, contribute to the texture and form of the scene but do not depict anything that could be considered vile or repugnant. There is an absence of any unsettling details, unpleasant textures, or disturbing narratives that would typically trigger a sensation of disgust."
bull-study-1946.jpg,Cubism,0.1,"The image presents a series of studies exploring the abstraction of a bull's form, evolving from more representational to highly simplified and geometric outlines. There are no visual elements within these drawings that would typically evoke a feeling of disgust. Disgust is an emotion generally triggered by something perceived as contaminated, offensive, decaying, grotesque, or morally repulsive. The artwork contains none of these characteristics. The lines are clean, the shapes are artistic interpretations, and the subject matter (a bull) is presented as a subject of artistic exploration, not as something inherently revulsive. There is no depiction of gore, decay, unhygienic conditions, or anything aesthetically jarring in a way that would cause repulsion. The intellectual and artistic nature of the work precludes the sensation of disgust, as the focus is on form, line, and the process of simplification."
city-movement-1940.jpg,Cubism,0.0,"The artwork presents a semi-abstract urban landscape, characterized by fragmented forms, angular lines, and a palette of blues, reds, grays, and yellows. The subject matter appears to involve architectural elements and figures engaged in what looks like construction or labor. There are no visual cues typically associated with the emotion of disgust, such as filth, decay, bodily fluids, grotesque or repulsive textures, unsanitary conditions, or imagery suggesting contamination or putrefaction. The style is interpretive and dynamic, but does not present anything that would trigger a visceral reaction of revulsion. Therefore, the painting elicits no feelings of disgust."
composition-iv-1916.jpg,Cubism,0.0,"This abstract painting presents a vibrant and complex interplay of geometric and organic shapes, rendered in a diverse palette of colors. There is absolutely nothing within the composition that triggers or evokes a feeling of disgust. Disgust typically arises from visual stimuli associated with decay, disease, filth, bodily fluids, grotesque imagery, or things perceived as repulsive or contaminated. This artwork, however, is purely abstract; it contains no discernible figures, objects, or scenes that could be interpreted in such a way. The colors, while varied, are not jarring or nauseating. The textures appear to be painterly and rich, but not offensive or unpleasant to behold. The forms are fragmented and dynamic, but they do not suggest anything malformed, decaying, or otherwise repulsive. Therefore, there is no basis for an emotional response of disgust to this artwork."
composition-cubiste-au-portrait-poisson-et-clair-de-lune-1926.jpg,Cubism,0.0,"This painting evokes absolutely no sense of disgust. The subject matter, a Cubist-inspired still life featuring a stylized fish and a pitcher-like form, is presented in a clean, abstract, and aesthetically neutral manner. The colors used—blues, whites, blacks, muted greens, and browns—are harmonious and do not suggest anything repulsive, spoiled, or grotesque. There are no textures or depictions that would evoke a visceral negative reaction often associated with disgust, such as decay, filth, or biological repulsion. The geometric abstraction further removes any potential for realistic, unpleasant details. It is a visually organized and non-threatening composition."
composition-ii-still-life-1916.jpg,Cubism,1.5,"The painting, an abstract composition of geometric forms and colors, elicits virtually no sensation of disgust. Disgust is typically evoked by stimuli that suggest decay, contamination, disease, or elements that are viscerally repulsive or morally offensive. This artwork presents an arrangement of shapes and hues, predominantly muted greens, reds, and browns, which are applied with a textured brushwork. There are no depictions of organic matter in a state of decay, no bodily fluids, no symbols of illness or squalor, nor any imagery that could be interpreted as grotesque or inherently repulsive. The geometric abstraction, while potentially challenging or aesthetically unappealing to some tastes, does not contain visual cues that would trigger a visceral sense of revulsion or nausea. The forms, whether interpreted as abstract shapes or mechanical components, are clean in their lines and execution, lacking any characteristics that suggest dirtiness, impurity, or offense. The extremely low score reflects the profound absence of any elements within the artwork that would typically prompt such an emotional response."
composition-au-visage-et-au-coquillage-1939.jpg,Cubism,15.0,"The painting presents highly stylized and fragmented figures, reminiscent of human faces, which possess an unsettling and somewhat grotesque quality. The most prominent element contributing to any sense of disgust is the figure on the right, with its distorted, staring eye and particularly its open mouth revealing jagged, uneven teeth. This portrayal of teeth can evoke a subtle feeling of aversion, perhaps suggesting something predatory, decayed, or simply unnaturally deformed, which can trigger a mild, visceral reaction in some viewers. The overall angularity and the fragmented nature of the forms contribute to a sense of unease or 'wrongness' in the representation of the human form. However, the level of disgust is very low because there is no explicit depiction of gore, bodily fluids, decay, filth, or any subject matter typically associated with strong feelings of revulsion. The distortion is primarily artistic and serves to create a psychological atmosphere of tension or disquiet rather than a visceral reaction of sickness or abhorrence. Any disgust evoked is therefore faint and secondary, stemming from the unsettling grotesqueness rather than outright repulsiveness."
bust-of-woman-1939.jpg,Cubism,2.5,"The painting, a Cubist portrait by Pablo Picasso, presents a highly fragmented and reassembled human face. While this severe distortion departs significantly from naturalistic representation and can be unsettling or visually challenging for some viewers, it does not primarily evoke the emotion of disgust. Disgust is typically a visceral reaction to something perceived as repulsive, unclean, decaying, or morally offensive.

This artwork lacks any elements commonly associated with triggering disgust, such as:
1.  **Pathogens or decay:** There is no depiction of illness, wounds, bodily fluids, rotting matter, or unsanitary conditions. The colors are vibrant and clean, not suggestive of putrefaction or filth.
2.  **Grotesque or vile subject matter:** The subject is a portrait, and despite the artistic manipulation, it doesn't represent something inherently loathsome or morally reprehensible.
3.  **Sensory triggers:** There are no visual cues that would imply offensive smells, tastes, or textures that typically accompany disgust.

The distortion employed is an artistic and intellectual exploration of form and perspective, rather than an attempt to portray something physically repulsive or vile. While a very minor level of aversion might occur in some viewers unaccustomed to or strongly resistant to such abstract reconfigurations of the human form, this feeling would be more akin to unease, surprise, or aesthetic disapproval rather than genuine disgust, which implies a strong sense of revulsion or contamination. Therefore, the score for disgust is very low, reflecting only a marginal, atypical possibility of such a reaction."
constructive-town-1925.jpg,Cubism,0.0,"There is absolutely nothing within this painting that elicits the emotion of disgust. The artwork features a stylized, somewhat cubist landscape with a calm color palette of muted browns, greens, and greys, punctuated by some more vibrant reds and blues in the still life on the right. The figures, including the idealized female form and the simplified white dog, are rendered cleanly and abstractly, devoid of any grotesque, disturbing, or unsanitary qualities. There are no depictions of decay, filth, violence, bodily fluids, or any subject matter typically associated with feelings of revulsion. The overall aesthetic is one of quiet contemplation and geometric harmony, rather than anything jarring or unpleasant to the senses. As such, the painting offers no visual cues or thematic elements that would trigger a sensation of disgust in a viewer."
construction-africa-cezanne-cubism-and-japan.jpg,Cubism,0.0,"The artwork presents a vibrant and complex mixed-media composition that explores themes of art history, cultural influences, and abstract design. It incorporates a variety of materials and visual elements, including graphic text (Cézanne, Africa, Cubism, Japan), geometric shapes, recognizable objects (a die, a fan, a yin-yang symbol, what appears to be a pipe, nails), and colorful patterns. The color palette is bright and diverse, dominated by primary and secondary colors. There are no elements within the image that could reasonably evoke a feeling of disgust. There is no depiction of gore, decay, bodily fluids, filth, contamination, disease, or anything generally considered repulsive or offensive. The objects and forms are clean, stylized, and arranged in an artistic manner. The overall impression is one of intellectual curiosity, artistic exploration, and cultural appreciation, which stands in direct opposition to any sensation of revulsion or unpleasantness."
