image,image_category,disgust_rating,disgust_explanation
still-life-with-ephemeris-1914.jpg,Cubism,0.1,"My emotional response to this painting by Louis Marcoussis registers an extremely low level of disgust, bordering on negligible. There are virtually no elements within the artwork that trigger feelings of revulsion, nausea, or moral outrage commonly associated with disgust. The painting is a Cubist still life, characterized by fragmented forms, multiple perspectives, and a muted color palette of grays, blacks, whites, browns, and subtle touches of blue and reddish-orange. None of these colors are inherently sickening or convey a sense of decay or putrefaction. The subject matter—identifiable elements like a newspaper clipping (dated ""1914 MAR 2""), a book spine (""EAU DAN...""), and various bottles or glasses—are mundane objects that do not carry any inherent connotations of filth, contamination, or unhygienic conditions. The fragmented and geometric style of Cubism, while perhaps intellectually challenging or disorienting to some, is a formal artistic approach that typically distances the viewer from direct visceral reactions like disgust. There is no depiction of decay, waste, bodily fluids, gore, or any subject matter that would activate the brain's natural aversion responses. The textures are painted, not tactile in a way that would suggest unpleasantness. In essence, the painting presents an analytical and deconstructed view of everyday objects, focusing on form and space rather than any content that could be deemed repulsive or offensive."
still-life-red-and-yellow.jpg,Cubism,1.0,"This painting evokes virtually no sense of disgust. The visual elements present—abstract shapes, bold color blocks, and simplified forms—do not align with common triggers for this emotion. There is no depiction of decay, rot, bodily fluids, contamination, or anything grotesque or explicitly repulsive. The colors are vibrant and clean, rather than sickly or muddy. The organic shapes, such as the green and yellow forms, could even be interpreted as fruits or pleasant natural objects. While the large brown, amorphous shape is abstract, it does not suggest anything inherently disgusting. The overall composition is clean and defined, lacking any visual cues that would typically elicit a visceral reaction of revulsion or unease associated with disgust. A score of 1 is assigned, indicating an almost complete absence of this emotion, allowing only for the most remote and individualistic abstract interpretation that might, for a tiny fraction of viewers, associate an amorphous shape with something vaguely unappealing, though not truly disgusting."
still-life.jpg,Cubism,0.0,"There is absolutely nothing in this still life painting that evokes a feeling of disgust. The subject matter consists of potted plants, cut flowers in a vase, and fruits, all common and generally pleasant objects. The artistic style, characterized by geometric fragmentation and bold, often vibrant colors, is an aesthetic interpretation rather than a realistic depiction, but it does not introduce any elements that would trigger revulsion. There are no signs of decay, rot, spoilage, or any unsanitary conditions. The shapes, while abstract, are clean and defined, and the colors are fresh and lively, particularly the greens of the foliage and the yellow and orange hues of the fruits and some flowers. There are no disturbing textures, grotesque forms, or unpleasant themes. The painting presents a clean, stylized, and visually engaging composition, entirely devoid of any visual cues typically associated with disgust."
stll-life-with-a-red-vase-1939.jpg,Cubism,0.0,"This painting, a still life featuring a pitcher, grapes, and other fruits in a bowl, along with a large white fluffy object (possibly a flower or plume), evokes no discernible sense of disgust. The subjects depicted are common, benign objects typically associated with nourishment, nature, and domesticity, none of which inherently trigger a repulsive reaction. The fruits appear ripe and fresh, not decaying or unappetizing. The pitcher is solid and functional in appearance. The white fluffy element, whether floral or textile, is depicted with a soft, inviting texture rather than anything slimy, prickly, or unsanitary. The colors, while somewhat stylized and bold, are not sickly or jarring in a way that would induce nausea or revulsion. The overall composition is balanced and harmonious. There are no disturbing elements, unsanitary conditions, or distorted forms that would lead to a visceral feeling of disgust. The painting presents a clean, orderly, and rather aesthetically pleasing arrangement of objects."
still-life-with-lemons-1907.jpg,Cubism,0.0,"There are no elements within this painting that evoke a sense of disgust. The artwork is a still life, depicting common, everyday objects: a bottle or jar, a bowl, and a lemon. These items are presented cleanly and without any signs of decay, rot, grime, or unhygienic conditions that would typically trigger revulsion. The colors, while strong and contrasting (vibrant blues, greens, yellows, and reds), are not sickly, putrid, or suggestive of organic decomposition. The brushwork is visible and expressive, contributing to the painting's texture and energy, but it does not mimic anything slimy, viscous, or otherwise unpleasant to the touch or sight. The forms are simplified and somewhat abstracted, yet they do not distort the objects into grotesque or repulsive shapes. There is no narrative content or implied context that hints at anything morally repugnant, violent, or physically offensive. The overall impression is one of a vibrant and composed study of form and color, entirely devoid of any visual cues that would lead to a feeling of disgust."
still-life-with-water-jug-towel-and-jars-1929.jpg,Cubism,0.0,"There is absolutely no discernible element within this still life painting that would evoke a feeling of disgust. The artwork depicts a collection of inanimate objects—various vessels and draped fabric—rendered in a Cubist or geometric style. There is no imagery suggestive of decay, bodily fluids, contamination, filth, or anything unhygienic or morally offensive. The colors, while muted and featuring strong contrasts between light and shadow, are not jarring or unappealing in a manner that would trigger revulsion. The forms are clean and defined, and the overall impression is one of quiet contemplation rather than anything repulsive or off-putting. The subject matter itself, common household items, is inherently neutral and lacks any content typically associated with the emotion of disgust."
sudak-the-valley-1917.jpg,Cubism,0.0,"There is absolutely nothing in this painting that evokes the emotion of disgust. The artwork depicts a vibrant landscape featuring trees, large reddish-brown mountains or rock formations, and a small building nestled amongst the greenery. The colors used—blues for the sky, various greens for the foliage and foreground, and warm reddish-browns for the mountains—are natural and pleasant. There are no elements within the subject matter that are decaying, grotesque, violent, unhygienic, or otherwise inherently repulsive. The brushstrokes are expressive and painterly, contributing to the scene's dynamic quality rather than creating any sense of unpleasantness or aversion. The overall impression is one of a stylized, energetic natural scene, entirely devoid of any visual cues that would trigger a feeling of disgust."
taureau-ix-1954.jpg,Cubism,0.0,"The painting does not evoke any sense of disgust. The artwork features a vibrant and fragmented composition, typical of an abstract or cubist style, presenting a stylized figure amidst geometric shapes and bold colors. There are no elements within the painting that are conventionally associated with disgust, such as grotesque or decaying imagery, representations of bodily fluids, or themes that are morally or ethically repugnant. While the figure is distorted and fragmented, this is a characteristic of the artistic style and does not convey any visceral unpleasantness or revulsion. The color palette is rich and varied, and the forms, though abstract, do not suggest anything repulsive or offensive. Therefore, based on the visual content and aesthetic presentation, there is no basis to associate this artwork with the emotion of disgust."
taureau-x-1955.jpg,Cubism,0.0,"The painting, an abstract or surreal composition, does not contain any elements typically associated with eliciting disgust. There are no depictions of gore, decay, filth, contamination, or anything that suggests disease or putrefaction. The forms are stylized and geometric, and while they might represent figures or objects, they are rendered in a clean, non-repulsive manner. The color palette, though varied, does not utilize sickly or unsettling hues that might evoke a sense of nausea or revulsion. Even abstract shapes, such as the red forms in the lower half or the 'caterpillar' at the very top, are presented without any context that would imbue them with disgusting qualities. The artwork appears to be an aesthetic exploration of form and color rather than an attempt to provoke a visceral negative reaction like disgust."
t13861-10.jpg,Cubism,0.0,"There is absolutely nothing in this painting that elicits a sensation of disgust. The artwork presents a clean, abstract, and highly structured architectural composition. The dominant cool blues and grays, complemented by muted yellows and greens, create a serene and somewhat intellectual atmosphere, rather than anything repulsive. The lines are precise and geometric, depicting a complex but orderly structure, possibly a greenhouse or an intricate building interior. There are no elements suggestive of decay, filth, organic matter, bodily fluids, grotesque forms, or anything that might be perceived as unhygienic or morally offensive. The texture appears smooth and controlled, and the overall impression is one of visual clarity and abstract order, which stands in direct opposition to any visual cues that typically trigger feelings of revulsion or disgust."
the-artists-1916.jpg,Cubism,0.1,"The painting, an abstract composition, contains absolutely no elements that would typically evoke a feeling of disgust. Disgust is often triggered by visual cues associated with decay, putrefaction, bodily fluids, grotesque forms, or things that are inherently repulsive or unhygienic. This artwork, however, is characterized by vibrant, contrasting colors (bold blues, yellows, oranges, and reds) and dynamic, flowing, and angular abstract shapes. There are no discernible figures, objects, or textures that could be interpreted as vile, offensive, sickening, or otherwise disgusting. The clean, energetic lines and bright palette contribute to an impression of dynamism and perhaps even joy or confusion, but not revulsion. Therefore, the visual information presented by the artwork simply does not align with any stimuli known to provoke disgust."
the-appointment-of-the-four-forms-from-the-portfolio-life-forms.jpg,Cubism,2.5,"The artwork, being an abstract composition rendered in black and white with varying textures and shading, presents very few elements that could elicit a sense of disgust. There is no depiction of decay, disease, bodily fluids, gore, or anything explicitly unhygienic or putrid. The forms, while organic and somewhat biomorphic in nature, do not suggest anything repulsive or offensive. The cross-hatching and stippling techniques used to create texture and depth are executed cleanly and systematically, not in a way that implies grime, slime, or messiness. The solid black areas are simply voids or strong contrasts, devoid of any inherent disgusting quality. The overall impression is one of visual exploration of shape, volume, and texture rather than a portrayal of anything that would trigger a visceral feeling of revulsion or nausea. The very low score reflects the near absence of any visual cues typically associated with the emotion of disgust."
the-bird-seller-1976.jpg,Cubism,2.0,"My assessment for disgust is very low, bordering on negligible. Disgust is typically evoked by things that are perceived as unhygienic, decaying, contaminated, or morally repugnant in a viscerally sickening way. The painting, titled ""Bird Vendor,"" features a person carrying multiple birdcages with birds inside, rendered in a vibrant, geometric style. There are no visual cues that would trigger a sensation of revulsion or physical aversion. The birds, while confined, are depicted in a stylized manner, appearing healthy and colorful, not sickly, decaying, or distressed in a way that would induce disgust. The cages themselves are clean and geometrically rendered, lacking any indication of squalor or filth. Furthermore, the act of a bird vendor, while some might find the concept of caging birds saddening or ethically debatable, does not inherently evoke a feeling of disgust in the visceral sense, unlike images of cruelty, decay, or extreme unhygienic conditions. The clean lines, bright colors, and dynamic composition work against any feeling of unpleasantness or revulsion. The score of 2 acknowledges the extremely rare and subjective possibility that the concept of animal confinement, in itself, could trigger a minor, almost metaphorical sense of ""disgust"" for a very small segment of viewers, but it is not a direct or intended emotional response to the visual elements presented."
the-cloud-1921.jpg,Cubism,0.0,"There is absolutely nothing within this painting that elicits or suggests the emotion of disgust. The artwork is a still life rendered in a Cubist style, depicting common objects such as a guitar, a newspaper, and a window. The forms are geometric and fragmented, and the color palette consists of browns, golds, blues, and whites, which are generally harmonious and not jarring or sickly. There are no depictions of decay, filth, grotesque imagery, or anything that would be considered physically repulsive. Furthermore, the subject matter lacks any narrative or thematic elements that could be interpreted as morally offensive or deeply unpleasant. The overall impression is one of analytical composition and artistic exploration, not one designed to provoke revulsion or strong aversion. Therefore, the feeling of disgust is entirely absent in response to this particular work."
the-bird-cage.jpg,Cubism,0.5,"The painting, a Cubist work by Pablo Picasso, is characterized by its abstract, fragmented forms and vibrant, contrasting colors. Disgust is an emotion typically triggered by stimuli that are perceived as repulsive, offensive, or contaminative, often relating to decay, disease, waste, or morally repugnant acts. None of these elements are present in this artwork.

The geometric fragmentation and multiple perspectives, while challenging to traditional interpretation, do not evoke a sense of revulsion or nausea. The colors (bold reds, blues, yellows, oranges, greens) are dynamic and engaging rather than sickly or putrid. There are no discernible subjects that depict gore, filth, bodily fluids, or any form of decay. While the abstraction might be disorienting or unfamiliar to some viewers, this typically leads to feelings of confusion, intellectual curiosity, or perhaps mild frustration, not disgust. The visual language is one of artistic exploration and formal composition, not the representation of anything inherently offensive or distasteful. The score is minimally above zero to account for the extremely remote and idiosyncratic possibility of someone finding abstract forms or jarring color combinations mildly unsettling in a way that could hypothetically, for a fraction of a second, touch upon discomfort, but it is unequivocally not a painting designed to, nor does it effectively, elicit disgust in any significant measure."
the-blue-cloth-1925.jpg,Cubism,0.5,"The painting, a Cubist still life, offers almost no elements that would typically evoke a feeling of disgust. Disgust is primarily triggered by things perceived as contaminated, decaying, unhygienic, or morally repellent. This artwork depicts common, inanimate objects such as a basket of bread or fruit, a bottle, a glass with grapes, a musical instrument, and sheet music. All of these items are benign and inherently non-disgusting. The Cubist style, while fragmenting and reassembling forms, does so in an intellectual and aesthetic manner, not in a way that suggests decay, illness, or repulsive textures. The colors are muted and earthy, devoid of anything jarring or sickly that might hint at an unpleasant condition. There are no visible signs of spoilage on the food items (grapes, bread), nor any bodily fluids, waste, or grotesque imagery. The overall composition is balanced and focused on the artistic exploration of form and perspective rather than on evoking a visceral emotional response of aversion. Any minuscule level of disgust would be highly idiosyncratic and not a common or intended reaction to the subject matter or artistic style."
the-circus-1918.jpg,Cubism,1.0,"This painting evokes virtually no sense of disgust. The artwork features a highly fragmented, geometric composition with vibrant, clean colors and abstract forms. Disgust is typically triggered by elements associated with decay, filth, bodily effluvia, or a violation of visual or moral integrity that is perceived as repulsive. None of these triggers are present here. The stylized, deconstructed figures and objects, while abstract, are rendered with sharp lines and distinct color blocks, giving them a clean and almost mechanical appearance rather than anything organic that could be decaying or offensive. There is no depiction of grime, rot, illness, or grotesque deformation that would cause revulsion. The overall impression is one of dynamic movement and artistic experimentation, not a subject or aesthetic that is physically or morally offensive in a way that would elicit disgust. The very low score reflects the near-complete absence of any visual cues that could reasonably lead to this emotional response."
the-creation-of-the-prehistoric-world-state-1923.jpg,Cubism,0.0,"The painting evokes no sense of disgust. The depicted creature, though fantastical and abstract, does not possess any visual qualities typically associated with this emotion, such as decay, filth, disease, gore, or grotesque bodily functions. Its highly stylized form, clean lines, and geometric patterns contribute to an artistic representation rather than a realistic one that might trigger a visceral reaction of revulsion. The colors are earthy and the overall aesthetic is one of symbolic or mythological representation, entirely devoid of elements that would be perceived as offensive, repulsive, or unhygienic."
the-breakfast-1921.jpg,Cubism,5.5,"The painting, with its highly stylized and simplified forms, does not overtly present any visual elements typically associated with disgust. There is no depiction of decay, filth, bodily fluids, grotesque deformity in a repulsive sense, or morally repugnant subject matter. The figures are rendered with smooth, almost mechanical precision, which while de-individualizing and perhaps unsettling to some, does not evoke revulsion. The clean lines, bold shapes, and stark palette contribute to a sense of monumentality and order rather than anything that would trigger physical or aesthetic disgust. The low score reflects the near absence of any features that would elicit a feeling of strong aversion or revulsion. A very slight, almost negligible score is given for the potential ""uncanny valley"" effect some viewers might experience from the extreme dehumanization and generalized, mask-like faces, which could be perceived as unnaturally smooth or cold, but this is a very minor interpretation and does not strongly align with the core feeling of disgust."
the-feast-of-the-tabernacles-1916.jpg,Cubism,0.1,"This painting, ""The Feast of the Tabernacles"" by Marc Chagall, evokes a sense of solemnity, tradition, and perhaps a touch of mystical or folktale charm, but it contains virtually no elements that would trigger a feeling of disgust. The color palette is vibrant and expressive, dominated by rich blues, greens, and yellows, which are not inherently repulsive. The figures, while rendered in Chagall's characteristic distorted and simplified style, are not grotesque, decaying, or engaged in any activities that suggest squalor, unhygienic conditions, or moral depravity. The scene depicts a religious celebration, a time of gathering and observance, which is generally associated with reverence and communal spirit rather than revulsion. There are no depictions of gore, bodily fluids, vermin, decay, extreme physical disfigurement, or morally reprehensible acts. Even the chicken in the foreground, though an animal, is depicted benignly and does not suggest any unpleasantness. The overall clean, albeit stylized, appearance of the sukkah and its inhabitants, combined with the celebratory context, actively works against any feeling of disgust. The score is not an absolute zero only because art, being subjective, *could* theoretically induce an idiosyncratic minor aversion in someone, but there is nothing inherent in the work to universally or commonly provoke this emotion."
the-javelin-thrower.jpg,Cubism,0.0,"There is absolutely nothing in this artwork that evokes a sense of disgust. The image is a stylized, Art Deco-era representation of the Olympic Games, celebrating athleticism and the human form in motion, albeit in a geometric and somewhat robotic manner. The colors are earthy and muted, but not in a way that suggests decay or unpleasantness. There are no grotesque figures, no depictions of filth, contamination, or decay. The subject matter itself (sports) is generally positive and inspiring, and the artistic style, while unique, does not venture into any territory that would trigger revulsion or nausea. The overall impression is one of strength, movement, and graphic design, entirely devoid of any elements that could be associated with disgust."
the-fourteenth-of-july-1914.jpg,Cubism,0.5,"The painting, rendered in a modernist style with simplified forms and a vibrant, albeit somewhat muted, color palette, offers no discernible elements that would typically evoke disgust. There is no depiction of decay, disease, waste, violence, or any morally repugnant subject matter. The figures are abstracted and blocky, but not grotesque or distorted in a way that triggers revulsion. The colors are generally pleasant and harmonious, avoiding sickly or muddy tones often associated with feelings of disgust. While the abstract nature might be unsettling for some viewers seeking realism, it does not translate into a feeling of disgust. The overall impression is one of artistic interpretation and composition, rather than anything inherently repulsive or offensive to the senses or moral sensibilities. The extremely low score reflects the near-complete absence of any visual cues or thematic content that could reasonably lead to a sensation of disgust. A minimal score above zero is given only to acknowledge the highly subjective nature of emotional responses and the remote possibility that a viewer might find the abstract simplification of human forms to be mildly disconcerting or ""off-putting"" in a way that *very vaguely* brushes against a sense of unease, though this is far from true disgust."
the-jug-on-the-table.jpg,Cubism,0.0,"The painting, a Cubist still life, presents familiar objects such as a pitcher, cups, and saucers in a fragmented and reassembled manner. There is absolutely nothing in the subject matter, color palette, or artistic style that elicits feelings of disgust. The objects are depicted cleanly, albeit abstractly, and do not convey any sense of decay, filth, contamination, or anything typically associated with revulsion. The colors are muted and cool, lacking any tones that might suggest illness or putrefaction. The fragmentation, characteristic of Cubism, is an intellectual and visual exercise, not a portrayal of something repulsive. There are no disturbing or unpleasant elements, nor is there any narrative suggestion that would provoke such an emotion."
the-fiddler-1914.jpg,Cubism,0.5,"The painting ""The Violinist"" by Marc Chagall evokes a range of emotions, but disgust is notably absent from them. There are no visual elements within the artwork that suggest filth, decay, contagion, grotesque deformation, or anything inherently repulsive to the senses. The figures, while stylized and non-naturalistic in proportion and color (such as the green beard of the violinist or the pale, somewhat abstracted faces), do not present as diseased, injured, or otherwise physically off-putting in a way that would trigger a visceral response of revulsion. The setting, a fantastical village scene with a house and a large, golden crescent shape, is depicted with a dreamlike quality rather than any harsh or unpleasant reality. The subject matter itself – a musician and other village inhabitants – carries no inherent association with disgust. The overall aesthetic is one of poetic surrealism, folk memory, and emotional expression, none of which lean towards prompting a feeling of revulsion or moral outrage that typically underpins disgust. Any score above zero would be due to an extremely minute, almost imperceptible, or highly subjective reading of an unconventional color or shape, but objectively, the artwork contains no content designed or likely to elicit disgust."
