image,image_category,disgust_rating,disgust_explanation
ferry-at-bigwin-island-1952.jpg,Cubism,0.5,"The painting does not evoke any sense of disgust. Disgust is typically associated with strong aversion, repulsion, or a visceral reaction to something perceived as offensive, unclean, decaying, or morally repugnant. The subject matter – a boat on the water – is neutral and does not inherently carry any disgusting connotations. The colors used (white, red, various blues and greens) are vibrant and clean, with no indication of rot, filth, or biological decay. The abstract and geometric style, while perhaps not universally appealing, does not present any distorted, grotesque, or inherently repulsive forms. There are no elements within the composition, such as bodily fluids, waste, gore, or scenes of extreme moral depravity, that would trigger a sensation of disgust. The overall impression is one of stylized maritime imagery, which may evoke other emotions like calm, movement, or contemplation, but certainly not revulsion. A score of 0.5 is assigned to acknowledge the theoretical possibility that any visual input, no matter how benign, might, in an extremely idiosyncratic individual, provoke an unexpected reaction, but functionally, for a general audience, there is no discernible element of disgust present."
futorismo-1927.jpg,Cubism,0.1,"This abstract painting does not evoke any sensation of disgust. The composition consists of clean, geometric, and curvilinear forms rendered in a palette of earthy browns, greys, muted yellows, and whites, accented with black lines. There are no elements within the artwork that suggest contamination, decay, unpleasant textures, or morally repugnant themes, which are typical triggers for disgust. The lines are sharp and defined, the colors are sober and harmoniously arranged, and the overall impression is one of ordered abstraction rather than anything chaotic or repulsive. The absence of any discernible subject matter that could be interpreted as vile, grotesque, or unhygienic ensures that the emotion of disgust remains completely unaffecting when viewing this piece. The score is marginally above zero to acknowledge the theoretical possibility that any visual input, however neutral, could elicit an idiosyncratic or extremely rare response in some individuals, but for the vast majority, there is nothing in this artwork to provoke even the slightest feeling of disgust."
figure-with-fruit-dish.jpg,Cubism,2.0,"The painting, ""Man with a Mandolin"" by Georges Braque, evokes virtually no sense of disgust. The subject matter itself – a man with a musical instrument and some fruit – is benign and lacks any inherent qualities that would trigger revulsion. There are no depictions of gore, bodily fluids, waste, contamination, disease, or decay, which are common elicitors of disgust. The cubist style, characterized by fragmented forms, multiple perspectives, and earthy, muted tones (browns, ochres, greys, muted red), does not introduce elements that would provoke this emotion. While the fragmented presentation might be challenging or unsettling to some viewers due to its departure from realistic representation, this intellectual or aesthetic discomfort does not translate into a visceral feeling of disgust. The abstraction of the figure and objects, rather than showing grotesque or offensive details, renders them as geometric puzzles. There is nothing visually or thematically represented that suggests anything vile, repulsive, or offensive to the senses. The overall impression is one of formal artistic exploration rather than an attempt to portray anything unpleasant or sickening."
figure-with-balls-1938.jpg,Cubism,0.5,"My emotional response to this painting does not include disgust to any significant degree. The artwork, characterized by its abstract or semi-abstract forms and a muted color palette of blues, browns, and grays against an off-white and green background, presents no elements typically associated with eliciting disgust. There is an absence of traditional triggers such as gore, decay, filth, putrefaction, or grotesque distortions of the human or animal form that might evoke a visceral feeling of revulsion. The lines, while organic and somewhat angular, do not convey sliminess, disease, or any unhygienic state. The subject matter, which appears to be a stylized figure or an abstract composition, is presented in a manner that leans towards contemplation or formal exploration rather than depicting anything inherently offensive or repulsive to the senses. The overall aesthetic is somber and perhaps mysterious, but it does not delve into the realm of the sickening or the foul. Therefore, any sensation of disgust is virtually non-existent, registering only as an imperceptible flicker, if at all, due to the complete lack of stimuli typically associated with this emotion."
girl-untying-her-sandal-1973.jpg,Cubism,0.0,"There is absolutely nothing in this painting that evokes the emotion of disgust. The artwork is a highly stylized, geometric abstraction of a seated female figure, rendered in a palette of whites, browns, and dark earth tones. The forms are clean, simplified, and angular, presenting a serene and contemplative, rather than grotesque or repulsive, image. There are no elements commonly associated with disgust, such as bodily fluids, decay, disease, gore, unsettling textures, or morally repugnant subject matter. The aesthetic is one of calm, elegant abstraction, far removed from anything that would trigger a visceral sense of revulsion or distaste."
figure-blanche.jpg,Cubism,74.5,"The primary source of disgust in this artwork stems from its strong and unsettling allusions to death, decay, and the visceral fragility of existence. The prominent skeletal structure on the right side, resembling a fractured spinal column or a collection of disarticulated bones, directly evokes themes of mortality and bodily decomposition. This imagery inherently triggers an 'animal-reminder' type of disgust, as it confronts the viewer with the morbid aspects of life and the physical endpoint of living beings.

Furthermore, the overall aesthetic of the print, characterized by its stark black-and-white contrast, heavy lines, and raw, almost gritty textures, contributes to a sense of unrefined and somewhat repulsive physicality. The central, heavily inked form, while abstract, suggests a creature that is either predatory, decaying, or both, with its large, dark mass and sharp, elongated features. The deliberate lack of smooth forms or inviting colors amplifies this feeling, leaning into a somber and unsettling mood. The impression is one of raw, exposed forms, perhaps even suggesting violence or the aftermath of a struggle, which can elicit a visceral sense of revulsion. The artwork deliberately avoids any softening or beautifying elements, presenting a stark and uncompromising view that challenges the viewer's comfort, thus engaging the emotion of disgust through its morbid subject matter and unpolished, visceral execution."
girl-portrait-1930.jpg,Cubism,0.5,"The artwork presents no discernible elements that would evoke a feeling of disgust. There is an absence of visual cues typically associated with this emotion, such as decay, putrefaction, bodily fluids, disease, gore, or unsanitary conditions. The subject matter, a woman seated with a book and a monkey-like figure in the background, is benign. While the artistic style incorporates angular forms, bold outlines, and some facial stylization, these are aesthetic choices rather than attempts to depict anything repulsive or aesthetically offensive in a way that generates physical or moral revulsion. The colors are muted and earthy, not jarring or nauseating. The overall impression is one of introspection or observation, not of something that would trigger an immediate and visceral feeling of aversion. Any discomfort arising from the abstract or distorted forms would likely fall into categories like unease or surprise, not disgust. Therefore, the score remains extremely low, acknowledging only the remotest, almost negligible, possibility of an idiosyncratic response that might misinterpret stylistic distortion as something genuinely off-putting."
gelmeroda-1936.jpg,Cubism,0.0,"This painting elicits absolutely no sense of disgust. The artwork's aesthetic is characterized by a cubist or geometric abstraction, primarily utilizing cool tones of blue, green, and muted grays, with subtle hints of warmer browns. Disgust, as an emotion, is typically triggered by visual cues associated with decay, filth, bodily fluids, grotesque forms, or morally reprehensible actions. None of these elements are present in the composition. The subject matter, an abstracted church tower and surrounding buildings, is inherently neutral and is not depicted in any manner that suggests putrefaction, unsanitary conditions, or any form of physical or moral repulsiveness. The fractured forms and layered colors create a contemplative and somewhat serene, albeit dynamic, visual experience, rather than one that provokes revulsion. There are no disturbing textures, sickly color combinations, or unsettling narratives that could contribute to a feeling of disgust. The overall impression is one of artistic exploration of form and color, entirely devoid of any content that would stimulate an aversion response."
haven-opus-2-1926.jpg,Cubism,0.0,"There is absolutely nothing within this painting that elicits a feeling of disgust. The artwork presents a clean, geometric, and stylized composition with a muted color palette. The forms are abstract, featuring smooth curves, circles, rectangles, and an arched structure, reminiscent perhaps of industrial elements or a dreamlike landscape. There are no depictions of decay, filth, bodily fluids, gore, or any traditionally repulsive imagery. The textures appear smooth, and the colors, while sometimes dark (like the upper right black area or the stormy sky), do not create a sense of decay or unpleasantness. The overall aesthetic is one of order and design, rather than chaos or anything that would trigger a visceral sensation of revulsion. There is no element that suggests sickness, contamination, moral outrage, or anything typically associated with the emotion of disgust."
green-squash-1948.jpg,Cubism,0.0,"There is absolutely no discernible element within this painting that would evoke a feeling of disgust. The artwork is an abstract or semi-abstract still life, primarily depicting what appear to be flowers (represented by yellow and white forms) and possibly grapes (the dark cluster on the lower left) and other objects on a surface. The color palette consists of warm oranges, vibrant yellows, soft purples, and earthy browns and greens, none of which are inherently unpleasant or associated with decay, illness, or grime. The forms are fragmented and angular, characteristic of certain modern art movements, but they are not grotesque, distorted, or suggestive of anything repulsive. There are no depictions of gore, bodily fluids, unhygienic conditions, insects, or any other visual cues commonly associated with triggering disgust. The brushwork, while visible, does not convey a texture that would be tactilely unpleasant. The overall impression is one of artistic interpretation of a domestic subject, emphasizing form and color rather than narrative content that could be disturbing. Therefore, the emotion of disgust is entirely absent."
golgotha-1912.jpg,Cubism,5.0,"The emotion of disgust is minimally evoked by ""The Green Christ"" by Marc Chagall. While the central figure depicts a crucifixion, a scene of suffering, the artistic rendering does not include any elements typically associated with visceral revulsion. The figure of Christ is rendered in a stylized blue hue, abstracting it from realistic depiction and thereby mitigating any potential for gruesome detail, blood, or gore that might elicit a physical sensation of disgust. The surrounding figures are also highly stylized and do not display any grotesque features, decay, or conditions that would trigger a response of revulsion. The color palette, dominated by vibrant greens and blues, along with reds and yellows, is rich and expressive, rather than presenting sickly, murky, or unpleasant combinations. The fragmented, Cubist-influenced forms contribute to a sense of dynamism and emotional weight, but they do not translate into imagery that is inherently repulsive or unsanitary. There are no depictions of waste, decay, or moral depravity that would instigate a feeling of disgust. The overall composition and symbolic nature of the work lead the viewer towards contemplation or perhaps sorrow, rather than the distinct feeling of disgust. The low score reflects the near absence of any visual cues that would trigger this particular emotion."
fruit-bowl-pipe-and-newspaper.jpg,Cubism,0.0,"The painting, a Cubist still life, features a fragmented representation of common objects such as a newspaper, a glass, and possibly a pipe. Disgust is an emotion primarily triggered by sensory input perceived as revolting, unhygienic, contaminated, or morally offensive. There are absolutely no elements within this artwork that align with these common triggers. The fragmentation of forms is a stylistic characteristic of Cubism, an artistic technique used to explore multiple perspectives simultaneously, and not a depiction of decay, disfigurement, or anything inherently repulsive. The color palette, composed of muted greens, browns, whites, and blues, is visually stable and does not contain any jarring or sickly combinations that might induce a feeling of nausea or aversion. The subject matter itself—inanimate household items—is neutral and lacks any inherent qualities that would provoke a visceral reaction of disgust. There is no suggestion of filth, spoilage, violence, or any grotesque imagery. The painting is an intellectual and formal exploration of perception and form, completely devoid of any content or presentation that could elicit an emotional response of disgust."
homage-to-mozart.jpg,Cubism,0.0,"This painting evokes absolutely no sense of disgust. The artwork features a stylized bust of Mozart surrounded by musical instruments and abstract forms, rendered in a vibrant palette of reds, blues, yellows, and white. There are no elements within the composition that are inherently repulsive, grotesque, or offensive to the senses. The lines are clean, the colors are bright and energetic, and the subject matter—music and a revered composer—is generally associated with beauty, creativity, and cultural appreciation. There is no depiction of decay, violence, contamination, bodily fluids, suffering, or anything that would trigger a visceral reaction of revulsion. The artistic style, while abstract and interpretive, does not employ any visual strategies that aim to disturb or sicken the viewer. Therefore, the emotional response to this artwork is entirely devoid of disgust."
house-manhufe-1913.jpg,Cubism,0.5,"The painting, an abstracted landscape with a fortified structure and winding paths, contains no visual elements that would typically evoke disgust. There are no depictions of decay, filth, gore, disease, or any form of physical or moral repugnance. The color palette, consisting of earthy greens, browns, and muted oranges, is harmonious and does not suggest anything sickly or repulsive. The geometric abstraction, while perhaps challenging or disorienting to some viewers, does not inherently carry any connotations of disgust; it is a stylistic choice rather than a representation of something inherently unpleasant or offensive to the senses. The subject matter—a landscape with architecture and vegetation—is benign and offers no narrative or symbolic content that would trigger a visceral reaction of revulsion. Therefore, the painting is devoid of any qualities that would provoke disgust in a viewer. The score is a nominal 0.5 to acknowledge the absolute impossibility of achieving a perfect zero in subjective emotional response, but it effectively communicates a complete absence of this emotion."
homage-to-gogol-design-for-curtain-for-gogol-festival-1917.jpg,Cubism,0.0,"The artwork, characterized by its vibrant yellow background and stylized, elongated figure, evokes emotions related to artistic expression, literary homage (to Gogol by Chagall), and perhaps a sense of movement or surrealism. There are absolutely no visual elements present in this painting that would typically trigger a sensation of disgust. The colors are bright and clean, not murky or suggestive of decay. The figure, while distorted in an artistic manner, is not grotesque, mutilated, or depicted in any state of filth, sickness, or putrefaction. There are no vile substances, offensive imagery, or unsettling details that would provoke a visceral feeling of revulsion or nausea. The overall impression is one of symbolic representation rather than anything physically or morally repugnant."
illustration-for-carmen-1932.jpg,Cubism,0.0,"There are no elements within this painting that evoke a sense of disgust. The scene depicts a man observing a woman dancing, a common and often aesthetically pleasing subject in art. The figures themselves, their postures, and their expressions do not convey any revulsion or unpleasantness; the dancer appears absorbed in her movement, and the man watches intently, perhaps with admiration or fascination. The color palette is vibrant and appealing, featuring warm yellows and greens, rich purples, and calming blues and whites, none of which are associated with triggering disgust. Furthermore, there are no depicted objects, environments, or narrative elements (such as decay, filth, gore, or morally repugnant actions) that would typically elicit such an emotional response. The overall atmosphere conveyed by the artwork is one of performance, emotion, and visual interest, entirely devoid of any repulsive qualities."
head-of-a-man-1908-1.jpg,Cubism,0.0,"The artwork does not evoke any sensation of disgust. The piece is a highly stylized, cubist-inspired portrait, focusing on the deconstruction and reassembly of facial forms. While the subject is not rendered realistically, the abstraction serves an intellectual and aesthetic purpose rather than depicting anything inherently repulsive or offensive. There are no elements within the painting—such as gore, decay, filth, bodily fluids, grotesque physical deformities intended to evoke revulsion, or morally abhorrent subject matter—that would trigger a feeling of disgust. The color palette, composed of muted blues, greens, and browns, while somber, does not suggest putrefaction or unhealthiness. The texture and brushwork are those of an oil painting, not mimicking anything slimy, festering, or otherwise viscerally unpleasant. The overall impression is one of formal artistic exploration and a contemplative, rather than repulsive, subject. Therefore, based purely on the visual information and the typical triggers for disgust, the score is zero."
il-lavoro-1951.jpg,Cubism,0.0,"There are absolutely no elements within this painting that would evoke disgust. The scene depicts a group of stylized figures engaged in what appears to be collective labor or activity, possibly raising a pole. There is no imagery related to decay, filth, bodily fluids, gore, disease, or anything rotten or contaminated. Furthermore, the actions depicted do not suggest any moral transgressions, cruelty, or suffering that might lead to an empathetic or ethical form of disgust. The color palette is earthy and vibrant, not sickly or unsettling. The abstract, cubist-inspired style of the figures and environment, while not aiming for photorealism, does not present anything grotesque or visually repulsive. The overall impression is one of dynamic effort, completely devoid of any stimuli typically associated with the emotion of disgust."
inca-with-birds-1933.jpg,Cubism,0.0,"There is absolutely nothing in this painting that evokes a sense of disgust. The artwork features highly stylized, fragmented forms, reminiscent of Cubist or Vorticist styles, depicting figures, bird-like creatures (possibly owls), and a background with architectural elements and water. The color palette primarily consists of earthy tones—various shades of brown, beige, and some muted blues and purples. Disgust is typically triggered by elements such as filth, decay, grotesque imagery, gore, disease, or subjects that are inherently repulsive. None of these elements are present here. The stylized nature of the figures, while abstract, does not render them grotesque or unsettling in a way that would cause revulsion. The birds appear benign, and the overall composition, despite its angularity, does not convey anything morally offensive or physically sickening. Therefore, based on the content, style, and subject matter, there is no discernible trigger for disgust."
head-1918.jpg,Cubism,0.0,"The painting, characterized by its cubist abstraction and bold use of geometric shapes and vibrant colors, presents no visual cues traditionally associated with eliciting disgust. Disgust is primarily a visceral emotion triggered by perceived threats of contamination, decay, bodily fluids, gore, or things that are overtly offensive to the senses.

Upon careful examination:
1.  **Absence of Decay or Contamination:** There are no elements suggesting rot, putrefaction, filth, disease, or any form of physical decay. The shapes are clean-edged and defined, and the textures, while varied, do not imply grubbiness or deterioration.
2.  **No Bodily Fluids or Waste:** The artwork does not depict any form of bodily excretions, fluids, or waste, which are common triggers for disgust.
3.  **Lack of Gore or Violence:** While the human form is fragmented and reassembled in an abstract manner, this fragmentation is purely formal and artistic, not suggestive of violence, injury, or the visceral reality of a body in distress. There is no blood, open wounds, or disfigurement in a grotesque sense.
4.  **Color Palette:** The colors used—bright pink, various shades of green, blues, oranges, reds, and stark black and white—are bold and contrasting. While some might find the color combinations aesthetically jarring or unnatural, they do not possess the sickly, jaundiced, or putrid qualities often linked to disgust.
5.  **Subject Matter and Style:** The highly stylized and abstract nature of the ""figure"" or ""face"" invites intellectual engagement and aesthetic appreciation or critique rather than a gut reaction of revulsion. The deconstruction of the form is an artistic exploration of perception and dimension, not an attempt to render something repulsive or offensive.

In summary, the painting is aesthetically structured and compositionally clean. It lacks any of the conventional visual stimuli—such as depictions of organic decay, illness, physical repulsion, or disturbing grotesque elements—that would induce a feeling of disgust. Therefore, the emotional response of disgust to this artwork is effectively non-existent."
kmetty-janos-asztali-csendelet-1910-es-evek-kozepe-37-43.jpg,Cubism,0.0,"This painting, a still life featuring a bowl of fruit, a bottle, a pitcher, and a framed image of two nude figures in the background, elicits absolutely no sense of disgust. The objects depicted are clean, wholesome, and arranged in an aesthetically pleasing manner. The fruit appears ripe and unblemished, showing no signs of decay, mold, or spoilage, which are common triggers for disgust. The bottle and pitcher are depicted as ordinary, clean vessels. The nude figures in the background are rendered in a classical, idealized manner, devoid of any grotesque features, injuries, or suggestive elements that could provoke a feeling of revulsion or moral offense. The colors used are muted blues, earthy reds, and whites, creating a calm and harmonious atmosphere rather than anything jarring or sickly. There is no depiction of filth, waste, disease, or anything that would activate a primal aversion response. The overall impression of the painting is one of tranquility and domestic beauty, entirely counter to any sensation of disgust."
interior-with-balcony-1928.jpg,Cubism,0.5,"The painting, rendered in a Cubist or post-Cubist style, features a figure with a guitar looking out onto a balcony and sky. There are no elements within the artwork that evoke a sensation of disgust. The subject matter—a musician, a room, an outdoor view—is inherently neutral and lacks any visual cues typically associated with revulsion, such as decay, contamination, grotesque bodily forms, or unsanitary conditions. The fragmented and geometric forms, characteristic of the style, are an artistic interpretation of reality rather than a depiction of anything physically or morally repugnant. While the abstract nature might be unfamiliar or less aesthetically pleasing to some, it does not cross into the realm of the disgusting. The color palette, though varied, does not include hues or combinations that suggest illness, putrefaction, or other offensive qualities. There is no narrative implied that would trigger a feeling of revulsion or a strong aversion. Therefore, the emotional response of disgust is virtually absent."
