image,image_category,fear_rating,fear_explanation
abstraccion-no-3-1953.jpg,abstract,0.1,"The painting is an abstract composition that presents no discernible elements or visual cues typically associated with the emotion of fear. The color palette, composed of muted earth tones, soft grays, pastels, and gentle blues and reds, creates a calm and harmonious atmosphere rather than an alarming one. There are no harsh contrasts, jarring colors, or ominous dark areas that might evoke unease or dread. The shapes, while geometric, are integrated smoothly and do not convey aggression, sharpness, or any sense of impending danger; they appear to interlock and flow into one another. The prominent sinuous black line that traverses the canvas adds a dynamic element but is graceful and fluid, lacking any threatening or disturbing quality. There is no depiction of violence, threat, chaos, disorientation, or any recognizable imagery that would typically trigger anxiety or apprehension. The overall impression is one of contemplative design and visual balance, entirely devoid of stimuli that would induce fear."
a-time-to-turn-48x48.jpg,abstract,5.5,"The painting, an abstract composition, offers very little direct visual information that would provoke a sense of fear. There are no recognizable figures or objects in distress, no menacing forms, nor any explicit depiction of threatening events. The color palette, while containing deep, dark browns and purples in the lower and right sections, does not create an overwhelmingly oppressive or frightening atmosphere; these dark areas primarily provide depth and contrast rather than conveying dread. The dynamic, sweeping brushstrokes suggest movement and energy, which could be interpreted as chaotic or overwhelming in some contexts, but without any specific narrative or visual cues of danger, this dynamism leans more towards a sense of natural force or transformation rather than a fear-inducing phenomenon. The prominent lighter and almost luminous areas in the center and upper left tend to soften any potential unease from the darker tones, introducing a sense of light and openness. While the abstract nature might leave some viewers feeling disoriented by the lack of clear subject matter, this disorientation is generally mild and not strong enough to translate into a pervasive sense of fear. The overall impression is more atmospheric and textural, exploring light and shadow through form, rather than evoking a strong emotional response of fright or terror."
abstraction-1926.jpg,abstract,8.0,"The painting, being abstract and surreal, does not directly depict any recognizable figures, objects, or situations that would typically induce fear, such as overt threats, violence, or distress. The central forms are organic and amorphous, resembling cellular structures, cosmic phenomena, or internal processes. While their abstract nature can evoke a sense of the unknown or the unfamiliar, which might subtly touch upon primal anxieties related to what is not understood, they do not inherently project menace or danger. The vibrant hues of orange, yellow, and white within the central mass inject a dynamic energy that counteracts any potential somberness from the dark background. The background itself, though dark and speckled, doesn't feel oppressive; instead, it provides a sense of depth or a vast, empty space, which can be contemplative rather than frightening. The flowing, undulating lines that frame the central forms suggest movement and connection rather than chaos or entrapment. There are no sharp, jagged lines, distorted figures, or chaotic compositions that are often employed in art to convey fear or psychological unease. Therefore, any sense of fear derived from this painting is minimal, stemming perhaps from a very faint, intellectual unease about the abstract unknown rather than an immediate, visceral emotional response."
2005-60-80.jpg,abstract,72.0,"The painting strongly evokes a sense of fear, not through explicit representation of scary figures or scenarios, but through its raw, abstract visual language that taps into primal anxieties. The pervasive use of thick, aggressive black lines acts as a dominant force, creating a chaotic web that can be interpreted as restrictive barriers, violent slashes, or entangling structures. This creates a powerful feeling of entrapment or being overwhelmed by an unknown, chaotic force. The highly saturated and contrasting colors further amplify this tension. The vibrant, almost alarming red splashes across the canvas suggest danger, urgency, or even blood, contributing to an underlying sense of dread and unease. Against this, the deep green and stark blue provide an unsettling contrast, deepening the sense of a turbulent, perhaps hostile environment. The fragmented and disorienting composition lacks any clear focal point or stable ground, leading to a feeling of instability and unpredictability, which can be profoundly unsettling and trigger an apprehension of the unknown. The gestural brushstrokes and occasional drips add to a feeling of uncontrolled energy or distress, reinforcing the notion of an unstable or threatening world. While abstract, the work's energetic clash of form and color generates a visceral response akin to facing a chaotic and potentially dangerous situation, causing a significant degree of psychological fear or apprehension."
abstract-1940.jpg,abstract,5.0,"The painting, an abstract composition, offers very little to directly evoke fear. Its primary visual elements consist of stable, geometric forms in deep, saturated colors against a dark blue background. The red, L-shaped peach, and light gray structures are orderly and static, presenting no sense of instability, threat, or chaos. There are no figures, explicit narratives of danger, sharp menacing lines, or chaotic movements that would typically trigger an instinctual fear response. The checkerboard pattern, while visually striking, is also organized and contained.

Any remote connection to fear would be extremely indirect and highly subjective. One might, at a stretch, interpret the vast, dark blue background as an unknown or boundless void, potentially eliciting a very subtle sense of existential unease or isolation, a fear of the unknown. However, this is far from a direct or strong evocation of fear; the darkness also lends itself to tranquility or contemplation. The overall impression is one of visual exploration of form and space rather than alarm or dread. The stability and abstract nature of the piece largely negate any strong feelings of fear."
abstraction-1927-1.jpg,abstract,2.1,"The painting evokes an extremely low degree of fear. The abstract nature of the composition inherently limits the direct portrayal of subjects or scenarios that typically trigger a fear response, as there are no discernible menacing figures, threatening actions, or distressing visual narratives present. The organic and fluid shapes within the central design are devoid of sharp, aggressive contours or chaotic arrangements that might suggest danger or conflict. While the surrounding deep red and orange tones are intense, they do not intrinsically convey alarm or peril within this context, particularly as they interact with the calming blue and green elements. The mottled and somewhat textured appearance of the surface, especially the raised lines and imperfections on the orange field, could subtly hint at decay or a distressed state, potentially inducing a momentary, very mild sense of unease or imperfection in a viewer. However, this aesthetic quality is far removed from generating a feeling of genuine fear, apprehension, or dread. There is an absence of visual cues that communicate an imminent threat, vulnerability, or a sense of psychological terror. The dark frame bordering the image provides containment but does not infuse the vibrant central artwork with an ominous or foreboding atmosphere. Therefore, the painting registers a negligible level of fear."
abstract.jpg,abstract,35.5,"The painting evokes a relatively low but discernible sense of fear, stemming primarily from its intense color palette and the dynamic interplay of its abstract forms. The dominant reds, ranging from vibrant scarlet to deep crimson, are inherently associated with strong emotions like danger, anger, and passion, and their sheer intensity can create a sense of being overwhelmed or confronted, which can subtly trigger an instinctual feeling of unease or caution.

The most direct contributors to a sense of fear are the dark, almost black, rectilinear masses that punctuate the composition. These deep, undefined blocks can be perceived as shadowy voids, oppressive weights, or looming presences, suggesting an unknown or foreboding element within the vibrant chaos. Their stark contrast against the brighter reds and pinks creates visual tension, akin to a sudden shift or an impending, abstract threat. The vigorous, somewhat agitated brushwork across the canvas also lends an emotional rawness that, for some, might translate into a feeling of agitation or apprehension.

However, the overall impact does not escalate to true dread or terror. The abstract nature means there are no recognizable figures or narrative elements that would traditionally induce fear, such as monsters, specific dangers, or scenes of vulnerability. The angular, block-like forms, even the dark ones, also possess a certain structural quality, preventing them from dissolving into pure chaos or formlessness, which often amplifies fear. Furthermore, the inclusion of lighter pink and softer red tones provides moments of relief or contrast, preventing the intensity from becoming purely menacing. Instead of a direct threat, the painting suggests a powerful emotional landscape, perhaps one of internal struggle or intense energy, where fear is merely a fleeting echo among other potent feelings."
abstraction-white.jpg,abstract,7.5,"The overall impression of this painting tends towards serenity, vastness, and a dreamlike quality due to its soft forms and predominantly cool, muted color palette of whites, blues, and greys. These elements generally evoke calmness rather than fear. There are no sharp, aggressive lines, violent movements, or threatening figures that would typically trigger an immediate fearful response.

However, a very subtle and intellectualized form of apprehension, bordering on fear, might arise from the central, deep, almost black chasm or void. This dark vertical element represents a profound, unknown depth or an abyss. While it is rendered smoothly and integrated within soft, almost cloud-like or fabric-like forms, the concept of an immeasurable void can, for some, evoke a primal, subconscious unease or a sense of insignificance (a component of the sublime where awe meets a touch of fear) rather than outright terror. This is not a fear of immediate physical danger, but rather a mild, contemplative apprehension towards the mysterious and unfathomable. The lack of any explicit threat or chaotic elements keeps this potential for fear at an extremely low level, far overshadowed by the painting's tranquil and meditative qualities."
abstraction-with-reference-to-a-flowering-tree-1925.jpg,abstract,0.5,"The painting, an abstract composition of color blocks, evokes virtually no sense of fear. Fear typically arises from perceived threat, overwhelming chaos, disturbing imagery, or a sense of the unknown and uncontrollable. This artwork presents none of these qualities. Its structure is based on a grid of individual, largely geometric squares, which inherently creates a sense of order, stability, and control rather than disarray or danger.

While some of the color blocks are dark (blacks, deep browns, dark purples), which *could* under different circumstances contribute to a somber or mysterious atmosphere, they are extensively counterbalanced by a multitude of bright, soft, and vibrant hues (pinks, blues, yellows, light greens, whites, purples). This extensive and varied palette prevents the dark areas from dominating or creating an oppressive or menacing feel. Instead, the colors interact in a way that suggests visual exploration, harmony, or a gentle play of light and shadow, rather than dread.

There is no discernible subject matter that could induce apprehension or alarm. The abstract nature means there are no figures, narratives, or forms that could be interpreted as threatening. Furthermore, the painting lacks any dynamic movement or harsh lines that might convey aggression, suddenness, or an impending sense of doom. Its overall aesthetic is contemplative and balanced, inviting quiet observation rather than evoking an visceral emotional response like fear. The slight irregularities in the squares give it a human touch but do not disrupt the fundamental sense of peace and order. Any minuscule fractional score for fear would only account for the most fleeting and subjective micro-feeling of the ""unknown"" derived from abstract art, which is instantly neutralized by the painting's harmonious and non-threatening visual language."
after-the-floods-1936(1).jpg,abstract,3.0,"The painting evokes virtually no sense of fear. The color palette, composed primarily of earthy tones, muted purples, greens, and blues, is calm and lacks any jarring or aggressive hues that might trigger apprehension. The forms themselves, while abstract and calligraphic, are rendered with thick, rounded lines that give them a gentle, almost whimsical quality rather than appearing menacing or sharp. There are no elements within the composition that suggest threat, violence, or distress; instead, the ""hieroglyphic"" shapes feel symbolic, ancient, and perhaps even playful, akin to a forgotten language or primitive figures. There is no discernible narrative that would imply danger or evoke unease. The overall atmosphere is one of contemplation and symbolism, far removed from any emotions associated with dread, anxiety, or fear. While abstract art can sometimes create a sense of the unknown, the specific visual language of this piece leans towards curiosity and a meditative quality rather than an unsettling ambiguity that might lead to fear."
african-1958.jpg,abstract,75.0,"The painting strongly evokes fear primarily through its dominant use of dark, amorphous, and often menacing shapes rendered in black. These irregular forms frequently suggest animalistic or monstrous visages, particularly in the upper half of the composition, where profiles resembling snarling heads or open maws imply aggression, distress, or a primal roar. The fragmented, mosaic-like background, composed of fractured blues, yellows, browns, and grays, adds to a sense of disarray and instability, mirroring an internal state of unease or chaos that can accompany fear.

The multiplicity of these dark entities suggests a swarm or being overwhelmed, contributing to a feeling of threat. The lack of clear, defined features in these black forms amplifies the sense of the unknown, a fundamental component of fear, allowing the imagination to project its own anxieties onto them. There is a palpable sense of struggle or violent energy conveyed by the dynamic interaction and positioning of these dark masses against the fractured backdrop. The overall effect is one of a looming, unsettling presence, or a primal conflict unfolding, which directly taps into the viewer's innate sense of apprehension and dread. While not depicting outright terror, the painting successfully creates an atmosphere charged with menace and a foreboding sense of danger."
application-1962.jpg,abstract,5.0,"The emotion of fear is minimally present in this abstract collage. The primary reason for this low score is the absence of visual cues typically associated with fear. There are no menacing figures, explicit scenes of danger, or unsettling narratives depicted. The color palette, while featuring strong reds and oranges, also includes calming blues, greens, and browns, preventing an overwhelming sense of alarm or threat. While the black background could theoretically evoke feelings of darkness or the unknown, in this context, it primarily serves as a stark contrast to highlight the vibrant, torn paper shapes, rather than creating a sense of oppressive void or danger. The jagged, torn edges of the paper pieces introduce a slight element of rawness or disarray, which *could* be interpreted as a subtle, unsettling disruption of order. However, this is a very mild effect and does not escalate to anything resembling genuine fear or anxiety. There are no sharp, aggressive forms pointing outwards in a threatening manner, nor are there distorted or unsettling organic shapes that might suggest monstrous or frightening entities. The overall impression leans more towards an exploration of form, texture, and color, rather than an attempt to evoke dread or apprehension. Any sense of unease derived from the abstract and fragmented nature of the composition is far too subtle to be categorized as fear."
against-the-light-1986.jpg,abstract,2.0,"The painting does not significantly evoke the emotion of fear. The overall aesthetic is one of abstract contemplation and visual texture rather than menace or alarm. The color gradient, transitioning from a luminous golden yellow at the top to a darker, deep brown/black at the bottom, creates a sense of depth and atmosphere, but these hues are generally warm and earthy, lacking the sharp contrasts or chilling tones typically associated with fear. The scattered squares, which appear to be somewhat luminous or reflective, and the softer, more diffused circles, contribute to an ethereal or perhaps cosmic impression. These geometric forms are static and non-threatening; they do not suggest any impending danger, aggressive movement, or unsettling presence. The faint diagonal lines, particularly visible in the darker sections, add to the visual texture and a sense of gentle movement, but they do not convey chaos, speed, or a jarring disarray that might induce anxiety. There are no disturbing figures, violent imagery, or elements of decay or threat. The composition feels balanced and visually interesting, prompting a sense of quiet observation rather than any primal or psychological unease. While abstract art can sometimes provoke feelings of the unknown, in this instance, the unknown presented feels more wondrous or serene than terrifying. Any minute inkling of fear would stem solely from the abstract nature itself, where the mind might seek to interpret and, in rare cases, find discomfort in the ambiguity, but this is a highly subjective and marginal response not inherently driven by the artwork's visual cues."
armonie-di-forme-contrarie-1935.jpg,abstract,12.5,"The painting evokes a very low, almost negligible degree of fear, primarily through subtle formal elements rather than overt thematic content. The sharp, angular, star-like forms in the center present an abstract visual that could be interpreted as piercing or aggressive, generating a fleeting sense of discomfort or a primal, low-level apprehension associated with sharp objects or potential harm. Additionally, the overall dynamic and swirling composition, with its suggestion of energetic motion and perhaps a breaking apart or coming together of forms, might create a very subtle feeling of instability or a lack of groundedness, which for some could translate into a slight, unidentifiable unease. However, these elements are highly abstract and not presented in a context that suggests direct threat, danger, or horror. The dominant color palette, while featuring some deeper tones, largely remains in the realm of warm pinks and browns, which do not inherently contribute to a sense of dread. There is no clear narrative or imagery that directly elicits terror or specific phobias. Therefore, any sensation of fear is extremely mild, indirect, and incidental to the painting's primary visual impact of dynamism and geometric abstraction."
animal-head-1938.jpg,abstract,5.2,"The emotion of fear is minimally present in this abstract painting. There are no explicit visual cues typically associated with strong feelings of dread, terror, or anxiety. The forms are biomorphic and curvilinear, suggesting organic life or fluid movement rather than sharp, dangerous, or aggressive elements. There are no depictions of suffering, violence, or explicit threats.

However, a very low degree of unease, which might be interpreted as a subtle, almost negligible form of fear, could arise from a few elements:
1.  **The abstract nature and ""eyes"":** The painting presents forms that are not immediately recognizable, and the scattered ""eye-like"" elements, particularly the prominent one in the central green figure and others embedded in the white shapes, could create a sensation of being observed. While these ""eyes"" do not convey malice or anguish, the act of being watched by multiple, non-human entities in an unfamiliar setting could induce a faint, primal sense of vulnerability or the uncanny in some viewers. This is not fear of a direct threat, but rather a slight disquiet from the unknown or a feeling of being under surveillance.
2.  **Amorphous black shapes:** The large, engulfing black shapes act as a backdrop or interwoven elements. While they provide strong contrast and structure, their amorphous and sometimes enveloping nature could, in a very subtle way, suggest an encompassing void or an unknown dark presence, contributing to a slight feeling of being consumed or surrounded, though this is heavily mitigated by the white and green forms.

Despite these minor points, the overall impression is far from fearful. The dominant green figure appears more curious or whimsical than menacing. The color palette, while containing black, is balanced by stark white and a vibrant olive green, preventing a purely ominous atmosphere. The thick, tactile brushstrokes give the painting a sense of substance and physicality that grounds the abstract forms, rather than allowing them to become specters of dread. The feeling leans more towards mystery, organic vibrancy, or playful abstraction than any substantial apprehension."
altar-painting-1915.jpg,abstract,3.0,"The emotion of fear is minimally evoked by this painting, registering at a very low level. There are virtually no elements within the artwork that typically incite fear, dread, or apprehension.

Firstly, the composition is highly ordered, geometric, and symmetrical. The prominent pyramid-like structure and the perfect circular form at the top convey a strong sense of balance, stability, and cosmic order rather than chaos or unpredictability, which are common instigators of fear. The meticulous division of the pyramid into colored segments and horizontal bands suggests a methodical progression or a structured spiritual system, which feels instructional and composed rather than threatening.

Secondly, the central golden circle at the top, radiating light, immediately suggests a source of warmth, enlightenment, or divine benevolence. It evokes feelings of awe and wonder, akin to gazing at a celestial body like the sun, rather than menace. The light-filled nature of this element actively counters any potential darkness or fear.

Thirdly, while the overall black background might initially be interpreted as a vast void or unknown, it primarily serves to make the illuminated elements stand out. It creates a sense of infinite cosmic space rather than a suffocating or claustrophobic darkness, lending to a feeling of profound scale rather than fear of the unknown.

Fourthly, the colors used throughout the pyramid are diverse but generally harmonious, transitioning smoothly from reds and yellows to blues and purples. There are no harsh, jarring, or aggressive color combinations that might trigger unease or alarm.

Lastly, the triangle at the apex of the pyramid, often interpreted as the Eye of Providence or a symbol of divine oversight, while all-seeing, is presented in conjunction with the benevolent golden sphere, suggesting spiritual guidance or omnipresent wisdom rather than a watchful, threatening presence. Any mild philosophical unease some might feel from the sheer scale or the abstract nature of cosmic truths is quickly mitigated by the painting's overall sense of harmony, light, and spiritual contemplation. The work's intent, rooted in spiritual exploration and the revelation of hidden orders, is generally uplifting and intellectually stimulating, not fear-inducing."
catedral-1973.jpg,abstract,0.5,"The artwork, composed of geometric shapes in soft shades of blue, green, pink, and white, evokes practically no sense of fear. The color palette is overwhelmingly cool and pastel, which tends to be calming or neutral rather than alarming. There are no harsh or aggressive colors, nor are there deep shadows or menacing contrasts often associated with fear or danger. The shapes are triangular and rectangular, arranged in a somewhat orderly, almost rhythmic pattern that could suggest mountains or abstract architectural forms. These shapes are static and non-threatening, lacking any dynamic elements that might imply threat, collapse, or instability. The overall composition is balanced and aesthetically pleasing, without any unsettling asymmetry, disarray, or visual tension that could induce unease. There are no figures, objects, or implied narratives within the abstract forms that suggest any form of threat, violence, isolation, or vulnerability. The feeling conveyed is one of calm, serenity, and perhaps even a gentle beauty, which stands in stark opposition to the feeling of fear. A score slightly above 0 acknowledges the impossibility of a true ""0"" in subjective emotional response, but indicates an almost complete absence of any fear-inducing elements."
