image,image_category,fear_rating,fear_explanation
square-motif-blue-and-gold-the-eclipse-1950.jpg,abstract,8.5,"The painting evokes very little fear, scoring extremely low on the spectrum. The primary reasons for this low score stem from the painting's abstract nature, its overall color palette, and its structured composition. There is an absence of menacing figures, aggressive brushstrokes, violent subject matter, or a sense of impending doom that would typically trigger a fear response.

However, a fractional hint of unease, rather than outright fear, might be perceived by some viewers due to a few subtle elements. The central red circle with a dark green center, positioned within the swirling band, could be interpreted as a watchful eye. The sense of being observed, even by an abstract or stylized ""eye,"" can create a fleeting moment of discomfort or a mild sense of vulnerability for some. Additionally, the prominent black square in the lower left quadrant, and the smaller black triangle, represent voids or unknown depths. Black, in art, can sometimes symbolize emptiness, the unknown, or even death, which might trigger a very slight, subconscious unease. Finally, the sheer abstractness of the composition, devoid of familiar or comforting forms, might leave some viewers feeling a minuscule sense of disorientation or a lack of groundedness, which can be a distant cousin to apprehension.

Despite these minor points, the dominant impression of the painting is one of contemplative order and visual rhythm. The overall palette contains many soft and harmonious colors (pinks, light blues, whites, ochres), and the grid-like structure of the lower half conveys organization and stability. The swirls, while dynamic, can also be interpreted as natural energies rather than chaotic forces. The lack of any direct narrative or threatening visual cues ensures that any potential for fear remains minimal and quickly superseded by the painting's aesthetic qualities."
study-for-space-1966.jpg,abstract,38.0,"The artwork evokes a low to moderate sense of fear primarily through its fragmented and angular composition, which suggests disruption and instability. The prevalence of sharp, jagged lines, particularly the prominent white zigzag cutting across the mid-right, creates a visual tension that can be unsettling, hinting at rupture or uncontrolled energy. Many lines crisscross and intersect in what appears to be a chaotic or disordered fashion, implying a lack of structure or a world in disarray, which can subtly trigger unease or apprehension about the unknown.

The implied dynamic movement, especially from the numerous diagonal lines and radiating patterns, feels erratic and without a clear trajectory, contributing to a sense of disorientation. Furthermore, areas of dense black and dark brown cross-hatching introduce pockets of visual weight and shadow, which can feel oppressive or hint at hidden dangers. While subtle, the small, isolated patch of red cross-hatching in the upper left corner can be subconsciously associated with injury or a warning, adding a minute layer of concern.

The abstract nature means there's no explicit threat or discernible narrative to induce intense fear, but the overall visual language of fragmentation, sharp angles, and implied uncontrolled forces creates an atmosphere of disquiet and a mild, continuous sense of being on edge or within an unstable environment."
the-big-wheel-1970.jpg,abstract,0.5,"The painting, an abstract composition by Alexander Calder, features bold primary colors (red, yellow, blue) and strong black outlines emanating from a central white circle. The forms are curvilinear, creating a sense of dynamic, swirling motion, similar to a pinwheel or a stylized flower.

There are virtually no visual cues within this artwork that could be reasonably interpreted as evoking fear.
*   **Color Palette:** The use of bright primary colors—red, yellow, and blue—typically conveys energy, vibrancy, and a sense of cheerfulness rather than apprehension or dread. While red can sometimes symbolize aggression or danger, its context here, alongside the other bright hues and the overall harmonious design, renders it stimulating rather than threatening. The black lines function as strong, definitive contours that articulate the shapes, not as elements of foreboding darkness or emptiness.
*   **Composition and Shapes:** The smooth, rounded, and flowing forms create a sense of fluidity and controlled motion. There are no sharp, jagged edges, chaotic arrangements, or distorted figures that might induce unease or alarm. The central white circle and the radiating, balanced pattern suggest order and aesthetic movement, not disorienting chaos or an ominous vortex. The dynamism is playful and energetic, not overwhelming or menacing.
*   **Absence of Threat or Conflict:** Being an abstract piece, there is no discernible narrative or recognizable subject matter that could imply danger, vulnerability, or a threatening presence. There are no elements suggesting conflict, darkness (in a menacing sense), or uncertainty that would typically trigger a fear response.
*   **Overall Impression:** The artwork's overall impression is one of vitality, balance, and rhythmic energy. It aligns with Calder's known aesthetic, which often imbues abstract forms with a sense of whimsy and joyful movement. The painting feels uplifting and engaging, completely devoid of any unsettling or frightening undertones.

Given the complete lack of visual elements associated with fear, the emotion is essentially absent from the viewer's experience of this painting. A minimal, non-zero score is assigned only to account for the most extreme and highly subjective individual interpretations, but objectively, the painting contains nothing to inspire fear."
the-letter-scale-1923.jpg,abstract,5.2,"The painting, an abstract composition, offers very little to directly evoke a sense of fear. The overall aesthetic is one of clean lines, precise geometric and curvilinear forms, and a balanced, orderly composition. The dominant background color, a muted red or terracotta, while sometimes associated with strong emotions, does not, in this particular shade and context, convey alarm or threat. Instead, it serves as a warm, stable ground for the cooler tones of grey, white, black, and teal. The various components, which suggest mechanical parts, architectural elements, or scientific instruments, are presented with a detached, intellectual clarity rather than any sense of impending danger or chaos. The white, swan-like form, often interpreted as graceful or serene, does not exhibit any posture or expression that would indicate fear or distress. There are no jagged edges, jarring color contrasts, distorted figures, or chaotic movements that might induce anxiety or dread. The atmosphere is more one of quiet contemplation, scientific precision, or perhaps an enigma to be pondered, entirely devoid of menace or unease. The precision and orderliness actively work against the chaotic or uncertain elements often linked with fear, rendering the emotion almost entirely absent from the viewer's experience."
tennis-1933.jpg,abstract,25.0,"The painting subtly evokes a low degree of fear primarily through its depiction of vulnerability and the presence of the unknown. The amorphous, fluid white shapes appear somewhat unanchored and in a state of transformation or dissolution. This lack of solid form and the apparent fluidity can suggest fragility or a sense of being adrift, which might trigger a quiet apprehension about one's own stability or existence. There are no clear facial expressions to convey fear, but the very abstraction of the forms and their ambiguous interaction within the textured, somewhat stark environment contribute to a mild sense of unease.

Furthermore, the dark, almost void-like rectangular area at the top, filled with indistinct patterns, represents an undefined, mysterious space. The unknown often harbors a potential for fear, and this dark opening, contrasting with the lighter, vulnerable figures, hints at an ominous or unpredictable element within the composition. The overall surreal and dreamlike quality, while not overtly threatening, can be disorienting, and disorientation can precede or contribute to feelings of mild apprehension. While not depicting an active state of terror or panic, the painting carries a faint undercurrent of existential fragility and the quiet unease that arises from confronting the ambiguous and the undefinable."
tapestry-1948.jpg,abstract,2.0,"The artwork, an abstract textile piece, evokes an extremely low level of fear, bordering on negligible. Its abstract nature means there are no recognizable figures, scenes, or objects that typically signal threat or danger. The visual elements consist primarily of an intricate, irregular grid pattern formed by lines and blocks of varying densities in black, dark brown, and off-white tones. While the dominance of dark colors (black and dark brown) could, in some contexts, be associated with gloom or the unknown, in this piece, they contribute more to a sense of depth, texture, and a somber aesthetic rather than a feeling of dread. The lighter tones interspersed throughout, particularly the increasing presence of light at the bottom of the composition, serve to alleviate any potential oppressive feeling. The irregular, fragmented grid, while visually complex and dense, does not present as chaotic or threatening; rather, it appears as a deliberate artistic arrangement. One might, at a very abstract and subjective level, derive an almost"
the-alibi-allotrope-1970.jpg,abstract,75.0,"The painting powerfully evokes a sense of fear through its masterful use of scale, form, and atmospheric tension. The dominant feature is the colossal, dark, and largely undefined mass that occupies the right side of the canvas. This amorphous shape looms with an overwhelming presence, its shadowy nature creating a primal sense of the unknown and the immense, which are deeply unsettling and fearful. It acts as an oppressive, encroaching force, fostering a profound sense of dread.

Contrasting this dark immensity are the lighter, more fragile, and fragmented elements on the left and center. These forms appear vulnerable and precarious, almost as if disintegrating or being buffeted by an"
the-last-judgment-1912.jpg,abstract,70.0,"The painting, ""The Last Judgment, 1912"" by Kandinsky, evokes a significant degree of fear, primarily through its inherent thematic content and chaotic visual language. The title itself is a potent catalyst for fear, referencing a biblical event widely associated with divine reckoning, damnation, and overwhelming cosmic upheaval – scenarios that inherently provoke profound dread and apprehension in those being judged.

Visually, the artwork contributes to this sense of fear through its dynamic and discordant composition. The canvas is a maelstrom of bold, thick black lines that aggressively cut across the space, creating sharp, angular, and often jagged forms. These aggressive lines can be perceived as violent ruptures or sudden, unsettling movements, contributing to a feeling of instability and unpredictability, which are fertile grounds for fear. The dark, heavy masses of black in certain areas, particularly towards the bottom right, create a sense of ominous weight or an impending, formidable presence.

Furthermore, the overall chaotic arrangement of vibrant, clashing colors (fiery reds and oranges, unsettling blues and greens, intense yellows) against a swirling, lighter background creates an overwhelming visual intensity. This intensity is not harmonious or soothing; instead, it generates a sense of sensory overload and disorientation, mirroring the psychological experience of being confronted with an uncontrollable and possibly destructive force. The explosive bursts of color and form suggest a moment of profound crisis or cataclysm, a state of affairs that naturally elicits fear of the unknown consequences or inevitable change. There is an absence of calm or serene elements, reinforcing the notion of an anxious, tumultuous event. This is not the fear of a hidden monster, but rather the apprehension associated with an immense, perhaps existential, and certainly inescapable, cosmic event."
the-purple-morning-1996.jpg,abstract,5.0,"The painting does not evoke a significant sense of fear. The dominant elements are abstract, organic shapes rendered with soft, earthy, and often muted colors. The forms are rounded and somewhat cellular or stone-like, lacking any sharp edges, menacing appearances, or aggressive postures that might trigger apprehension. The concentric lines within many of the shapes create a sense of texture and depth but do not suggest agitation or a threatening internal state. There are no depictions of struggle, pain, isolation, or overwhelming scale that would typically be associated with fear. The overall composition appears harmonious and still, rather than chaotic or foreboding. While the abstract nature prevents a definitive narrative, the visual language used (calm colors, gentle shapes, orderly textures) actively works against eliciting any feeling of dread or alarm. The general impression is one of quiet contemplation or natural forms, leaving little to no room for the emotion of fear to arise."
the-memory-of-the-apse-2007.jpg,abstract,55.5,"The painting evokes a palpable sense of unease and foreboding, contributing to a moderate degree of fear. The dominant dark, almost black background creates an oppressive and somber atmosphere, immediately setting a tone of gravity and potential threat. Against this backdrop, the stark, aggressive, and jagged red shapes emerge with unsettling intensity. These forms, particularly their sharp angles and seemingly violent eruption from or tearing into the central mass, strongly suggest themes of rupture, danger, and destruction. This visual aggression can trigger an instinctive sense of alarm and a feeling of impending harm. The high contrast between the dark field and the vibrant, almost bleeding red amplifies this sense of stark confrontation and emergency. Furthermore, the central, monolithic shape, reminiscent of a heavy tombstone or ancient monument, combined with the intricate, golden texture that could be ancient, indecipherable script, adds a layer of mystery and the unknown. This can tap into primal fears related to death, forgotten powers, or forces beyond comprehension, contributing to a subtle but persistent feeling of dread. While not outright terror-inducing, the painting's starkness, visual aggression, and somber undertones collectively generate a significant sense of apprehension and a visceral acknowledgment of potential danger."
the-snail-1953.jpg,abstract,0.5,"The artwork, a vibrant collage by Henri Matisse, evokes virtually no sense of fear. The chosen palette is dominated by bright, saturated hues such as purple, fuchsia, various greens, orange, red, yellow, and blue, set against a stark white background and a warm, mustard-orange border. These colors are inherently lively and energetic, completely lacking the somber, muted, or unsettling tones often associated with fear, dread, or unease. While there is a black shape, its presence within this colorful arrangement does not suggest darkness or menace; rather, it acts as a strong contrast, contributing to the overall dynamism and visual interest without any sinister undertones. The shapes themselves are abstract and irregular, but they possess a playful, hand-cut quality rather than sharp, aggressive, or threatening forms. There are no elements that could be interpreted as dangerous objects, menacing figures, or unsettling environments. The composition, although densely arranged with overlapping forms, maintains an airy and spontaneous quality, devoid of any claustrophobic or unstable elements that might trigger apprehension. The artwork's overall aesthetic is one of jubilant experimentation and decorative artistry, entirely antithetical to feelings of fear or anxiety. The small non-zero score acknowledges the remote possibility of subjective, idiosyncratic interpretations, but objectively, the visual language of this piece actively steers away from any fearful connotations."
the-open-window-1915.jpg,abstract,62.0,"The artwork evokes a palpable, though not overwhelming, sense of fear primarily through its fragmented forms, stark contrasts, and disorienting composition. The abundance of sharp, angular shapes, particularly the prominent triangles and jagged lines, contributes to a feeling of danger or aggression, as if one is surrounded by breaking glass or threatening shards. This inherent visual ""sharpness"" can trigger a primal sense of caution and apprehension.

The dynamic and fragmented nature of the composition creates a strong feeling of instability and disarray. The checkerboard patterns, usually associated with order, appear to be tearing apart, falling, or collapsing, suggesting a breakdown of structure or reality. This visual chaos and implied disintegration can be deeply unsettling, evoking a fear of loss of control, unpredictability, or impending collapse. The varying angles and perspectives further add to a sense of disorientation, making it difficult to find solid ground or a clear path, which can be a source of anxiety.

The monochromatic palette, dominated by stark blacks, whites, and varying shades of grey, contributes to a cold, severe, and almost oppressive atmosphere. This lack of comforting color can leave the viewer feeling exposed and vulnerable, without a sense of warmth or security. The impenetrable dark blocks, juxtaposed with harsh white lines, can be interpreted as ominous shadows or confining barriers, leading to a subtle claustrophobic sensation or a fear of being trapped within an abstract, hostile environment. The overall impression is one of a harsh, fracturing, and potentially perilous landscape, triggering a sustained sense of unease that verges on fear."
the-western-wall.jpg,abstract,0.0,"This painting evokes absolutely no sense of fear. The overall impression is one of vibrant life, perhaps a bustling cityscape at night, rendered in an abstract and colorful manner. The palette consists of bright and varied hues—greens, blues, pinks, purples, whites, and touches of red and orange—which contribute to a lively and somewhat joyful atmosphere, rather than one of apprehension or dread.

There are no elements traditionally associated with fear: no dark or menacing figures, no unsettling shadows or foreboding landscapes, no chaotic or destructive imagery, nor any sense of isolation or threat. The deep blue sky with a serene crescent moon and simple stars suggests peace and calm. The 'buildings' or blocks are depicted with thick, almost childlike brushstrokes, giving them a tactile yet benign quality. Even the geometric patterns within some blocks appear decorative and contribute to the painting's whimsical nature, not to any feeling of danger or unease.

The composition is balanced and the subject matter, while abstracted, feels benign and even welcoming. There is nothing in the visual language—color, form, line, or texture—that could be interpreted as frightening or anxiety-inducing. The painting's essence leans towards celebration, wonder, or pleasant observation, entirely devoid of any fearful undertones."
the-sculptor-1923.jpg,abstract,5.0,"The emotion of fear is minimally present in this painting. The highly abstract and geometric nature of the composition largely prevents the evocation of strong specific emotions like fear. There are no recognizable figures displaying terror, no scenes of violence or direct danger, and no overwhelming or suffocating environments. The colors, while including a prominent red, are used in a flat, architectural manner rather than to suggest blood or alarm in a visceral sense.

However, a score of 5 is given due to two very subtle and abstract elements that *could*, in an extremely subliminal or intellectual interpretation, touch upon a sense of apprehension or caution. Firstly, the pointed, tusk-like form extending from the central red column towards the right. While decontextualized, its sharp, aggressive silhouette could abstractly suggest a weapon or an animal's defense mechanism, potentially evoking a fleeting, primal sense of caution. Secondly, the stylized ""face"" on the red column, with its single prominent black oval ""eye"" and two smaller gray ovals, possesses an enigmatic and somewhat blank quality. This lack of discernable emotion combined with the abstract, almost alien representation, could create a very faint sense of the uncanny or mild unease, which is a distant precursor to fear. Yet, these are far from direct fear triggers, and the overall static and intellectual feel of the artwork significantly mitigates any true sense of fright or terror. The potential for fear is thus exceedingly low and arises more from abstract interpretation than direct visual impact."
the-vertebrate-grotto-transfer-series.jpg,abstract,72.5,"The painting strongly evokes a sense of fear, primarily through its powerful and unmistakable resemblance to a skull. The prominent white form at the bottom of the canvas, with its two large, dark, hollow openings, immediately brings to mind empty eye sockets and the overall structure of a human cranium. Skulls are universal symbols of death, decay, and mortality, themes that inherently tap into deep-seated human fears about our own finite existence and what lies beyond.

The execution of the white paint, with its organic, almost viscous texture and vein-like patterns, further enhances the macabre aesthetic, suggesting bleached bone, decaying tissue, or an unsettling internal structure exposed. This visceral quality can be profoundly disturbing.

The stark contrast between this skeletal white form and the deep, oppressive black background amplifies the feeling of dread. The dark background creates a sense of void, emptiness, and the unknown, which are common sources of apprehension. There is little light or comfort in the background, making the unsettling foreground elements stand out with heightened intensity.

Furthermore, the vibrant pink, coral-like forms emerging from the top of the 'skull' create an eerie juxtaposition. While pink might typically be associated with life or beauty, here it appears as an unnatural or grotesque growth from decay, suggesting a disturbing life-cycle or an alien, parasitic presence. This unsettling combination of death and peculiar, unnatural 'life' can be deeply disquieting.

The fear evoked is not one of sudden terror or a jump scare, but rather a profound, lingering sense of unease, morbid fascination, and an existential confrontation with themes of death, decay, and the unknown. The emptiness of the 'eyes' in the skull-like form contributes significantly to this feeling of a void or an absence of life, which can be profoundly unsettling."
the-wave-1950.jpg,abstract,2.5,"The painting primarily evokes a sense of stylized movement, rhythm, and natural phenomena, such as waves or currents. The swirling and undulating lines, rendered in a palette of blues, grays, and browns, create an impression of flow and energy. However, there are very few elements within this composition that would directly elicit fear. There is no depiction of a discernible threat, danger, or violence. No figures are present to convey distress, nor are there any sharp, chaotic, or highly contrasting elements that might signify alarm or impending doom. While the abstract representation of powerful natural forces could, for some, evoke a *very* distant and mild sense of being overwhelmed, the execution of these patterns is more decorative and contemplative than menacing. The rhythmic repetition of the lines and spirals leans more towards a hypnotic or meditative quality rather than one that instills dread or anxiety. Therefore, any emotional resonance with fear in this artwork is negligible, arising only from the most abstract and tenuous connections to natural power, rather than any intentional or effective portrayal of a frightening scenario or feeling."
title-sekere-visual-artist-ayibiowu-olusola-e-david-medium-oil-on-canvas-year-2004-1.jpg,abstract,0.5,"The painting, with its radiant palette dominated by luminous yellows, vibrant blues, and warm oranges, inherently projects an atmosphere that is antithetical to fear. There are no dark, ominous shadows, murky tones, or jarring contrasts that typically contribute to a sense of dread or unease. The light emanating from and surrounding the figures, particularly the glowing orbs they hold, suggests illumination, clarity, and positive energy rather than anything to be afraid of. The figures themselves are depicted in a stylized manner, with serene profiles and no discernible expressions of distress, anxiety, or terror. Their postures are upright and engaged, contributing to a sense of calm and intentionality, not flight or apprehension. The dynamic yet flowing lines and abstract shapes create a feeling of movement and spiritual ascension, rather than chaos or impending danger. There are no threatening elements, disturbing narratives, or unsettling visual cues that would evoke a feeling of fear in the viewer. On the contrary, the artwork seems to convey a message of interconnectedness, inner light, and spiritual contemplation, all of which actively diffuse any potential for fear. The overall impression is one of harmony, enlightenment, and positive energy, leaving virtually no room for the emotion of fear to manifest or resonate."
