image,image_category,fear_rating,fear_explanation
dialogue-i-1967.jpg,abstract,2.0,"The painting evokes an extremely low level of fear, bordering on negligible. Its abstract nature means there is no literal subject matter that could incite dread or alarm. The dominant color palette, primarily a muted olive green with accents of lime green, white, brown, red, and blue, is not inherently ominous or threatening. While some red elements appear, such as the spiky form in the bottom middle, they are stylized and small, resembling energetic bursts or diagrammatic markers rather than sources of horror or danger.

The various shapes are predominantly linear, geometric, and angular, often resembling schematics, circuit boards, or flow diagrams. These elements suggest processes, energy, or complex systems rather than anything malevolent. Although some arrows and radiating lines imply movement or force, this dynamic quality is presented in an analytical, almost scientific manner, devoid of any aggressive or confrontational intent directed at the viewer. There are no monstrous figures, dark shadows, confined spaces, or elements of decay typically associated with fear. The overall composition is busy and fragmented, which might lead to a sense of intellectual curiosity or even slight disorientation due to its complexity, but it does not translate into an emotional response of fear or anxiety. There is no sense of vulnerability, impending threat, or psychological unease that would warrant a higher score for fear."
e0c48c828bd324c01a0580fe6666b0e9.jpg,abstract,5.0,"The emotion of fear is minimally present in Francis Picabia's ""Udnie (Young American Girl; The Dance)."" The painting is characterized by its highly abstract and fragmented composition, typical of Orphism or Cubism, which significantly distances the viewer from any direct, identifiable human emotion. There are no discernible figures with expressions of fear, nor is there a narrative or visual symbolism that typically evokes dread, threat, or vulnerability. The forms, while dynamic and interlocking, do not possess sharp, aggressive edges or menacing qualities that would induce a sense of danger. The color palette, dominated by grays, blacks, and browns with accents of yellow, red, and purple, contributes to a somber or sophisticated aesthetic rather than one of alarm or terror. While the visual complexity and non-representational nature might create a subtle sense of disorientation or unfamiliarity for some viewers, this is a very weak and indirect link to fear. The work's primary focus appears to be an exploration of form, movement, and the breaking down and reassembly of visual elements, rather than the depiction of an emotional state of fear. There is no sense of being pursued, trapped, or confronted by a threat. Any perceived unease would stem more from the intellectual challenge of interpreting the abstraction than from a visceral reaction to a depicted fearful scenario."
draft-for-mural-in-the-unjuried-art-show-wall-b-1922.jpg,abstract,2.0,"The emotion of fear is nearly absent in this abstract composition. There are no discernible elements within the painting that directly convey threat, danger, or a sense of peril. The artwork is characterized by highly dynamic and complex abstract forms, vibrant colors, and a strong sense of energetic movement. While the composition is dense and features sharp, intersecting lines and seemingly clashing forms, this dynamism translates more into a feeling of visual excitement or intense rhythm rather than dread or anxiety. The color palette, despite the dark background, is filled with bright, expressive hues like yellows, greens, blues, purples, and reds, which are not typically associated with fear or menace. There are no identifiable figures, objects, or narrative situations that would evoke a fearful response. Any minimal sense of unease a viewer might experience would stem from the sheer complexity or abstract nature of the piece, possibly leading to a very slight feeling of disorientation or being overwhelmed, which is a far cry from actual fear. Therefore, the painting lacks the visual cues or emotional tone necessary to induce a genuine sensation of fear."
drawing-in-black-and-white-1962.jpg,abstract,35.5,"The painting evokes a subtle, underlying sense of fear, rather than an overt or immediate terror. This is primarily achieved through several visual elements that contribute to a feeling of unease and vulnerability.

Firstly, the dominant dark brown and black palette, with limited light areas, creates an atmosphere of deep shadow and obscurity. This lack of clear visibility inherently triggers a primal apprehension of the unknown, as dangers often lurk in darkness, contributing to a low-level sense of foreboding.

Secondly, the abstract composition is characterized by fragmented, jagged, and angular forms. These sharp, splintered shapes suggest instability, brokenness, or even violence, which can subtly evoke a fear of harm, disintegration, or collapse. There's a visual sense of things being fractured or in disarray, which can be unsettling.

Thirdly, the strong vertical elements on either side, particularly the dark, imposing masses, contribute to a sensation of enclosure or confinement. This visual framing creates a narrow, almost claustrophobic space, which can trigger a mild form of fear related to being trapped or restricted. The central forms appear somewhat constrained by these surrounding structures, enhancing this feeling of limitation.

Lastly, the overall abstract nature prevents the viewer from fully understanding or identifying the depicted scene, leading to a sense of disorientation. This ambiguity and lack of clear definition can be unsettling, as the unknown inherently carries a potential for threat, fostering a quiet, persistent undercurrent of unease or apprehension. While not a painting designed to outright frighten, it possesses enough visual cues of confinement, instability, and obscurity to evoke a noticeable, albeit low-grade, emotional response of fear."
energy-field-1967.jpg,abstract,0.5,"The painting, an abstract composition dominated by a warm, earthy palette of yellows, beiges, and subtle hints of white, red, and orange, presents almost no elements that evoke the emotion of fear. The lines, both straight and curved, form intricate patterns, some resembling architectural schematics or map coordinates, while others suggest movement through arrows or radiating arcs. However, these forms are rendered with a delicate touch, and their integration into the overall composition is one of balance and gentle complexity rather than discord or threat. The chosen colors are inherently warm and inviting, devoid of the stark contrasts, deep shadows, or aggressive hues often associated with fear or anxiety. There are no discernible figures or scenes that could be interpreted as menacing, no violent strokes, and no chaotic disarray that might instigate a sense of unease or dread. The overall impression is one of calm, intricate design, and perhaps intellectual engagement with line and form, leaving virtually no room for an emotional response centered on fear. The score is minimally above zero to acknowledge the subjective nature of interpretation, but functionally, there is nothing in this artwork that triggers a feeling of fear."
duo-duel-1953.jpg,abstract,65.0,"The emotion of fear, while not overtly depicted, is subtly evoked through a confluence of visual elements, leading to a sense of unease, apprehension, and existential dread. The stark, high-contrast interplay between the luminous yellow and the oppressive black is a primary contributor. The expansive black areas, particularly the upper right quadrant, convey a sense of immense depth, the unknown, or an overwhelming void that can feel consuming and threatening. This vastness, devoid of discernible features, fosters a feeling of vulnerability and insignificance.

The sharp, precise geometric lines, especially the prominent diagonal cutting across the composition, create a sense of stark division and potential rupture. This abrupt cleaving of space can feel jarring and unsettling, suggesting a sudden, inescapable boundary or an impending separation. The horizontal striations within the black regions add to this feeling of a vast, potentially infinite, and perhaps perilous expanse, like a deep, turbulent ocean or an endless, dark horizon that recedes into an unknown future.

Furthermore, the absence of any organic forms, warmth, or softening elements in this purely abstract work denies the viewer any potential source of comfort or familiarity. The rigid, almost mechanical precision of the lines contributes to a cold, impersonal atmosphere. While the yellow is a bright color, in combination with the heavy black, it takes on a cautionary or warning hue, signaling potential danger rather than warmth or joy. The overall impression is one of confronting a stark, impersonal, and potentially overwhelming force, leading to a subtle but persistent undercurrent of apprehension and a psychological tension rather than overt terror."
espacillimit-1957.jpg,abstract,0.1,"The artwork is an abstract composition defined by precise geometric shapes, clean lines, and a palette primarily consisting of primary colors (red, yellow, blue) alongside black, white, and muted greys. There is an inherent sense of order, balance, and deliberate arrangement within the composition, which works against any sensation of fear.

Nothing in the visual language of this painting suggests threat, danger, unease, or psychological distress. There are no dark, ominous spaces, no chaotic or unsettling patterns, no distorted or menacing figures, and no elements that convey a sense of vulnerability or impending harm. The shapes, while varied (squares, triangles, diamonds, ovals, zig-zags), are purely abstract and lack any representational qualities that could be interpreted as frightening. The colors are vibrant but used in a structured, non-aggressive manner, and their arrangement does not create visual tension or discomfort. The overall impression is one of graphic clarity, design, and visual harmony, which are antithetical to the emotion of fear. Consequently, a feeling of fear is virtually non-existent when engaging with this piece."
euphoria-dada-1917.jpg,abstract,0.0,"The artwork, an abstract composition, contains no discernible elements that evoke the emotion of fear. There are no recognizable figures or scenes that could be interpreted as threatening, dangerous, or unsettling. The use of color, while diverse, does not employ shades typically associated with dread or horror in a manner that would induce fear; rather, the palette seems vibrant and dynamic in certain areas, and muted in others, contributing to an overall abstract aesthetic rather than an ominous one. The shapes are angular and fragmented, creating a sense of movement or collage, but these forms are purely abstract and lack any menacing or violent connotations. There is no narrative implied that suggests danger, conflict, or a source of apprehension. The texture and brushwork, while varied, do not convey any sense of unease or discomfort. Consequently, the painting does not trigger any physiological or psychological response associated with fear, lacking any visual cues of threat, vulnerability, or impending harm."
espacillimit.jpg,abstract,0.1,"The artwork is a highly abstract, geometric composition characterized by clean lines, distinct shapes (circles, diamonds, triangles, rectangles), and a clear, almost graphic quality. The color palette primarily consists of blues, black, white, and a soft pink/red. There are no discernible figures, objects, or scenarios that typically evoke a sense of fear or dread. The shapes, while sometimes angular, are arranged in an orderly, rhythmic, and balanced manner, lending a sense of stability rather than instability or threat. There is no darkness, ambiguity, or chaotic movement that might trigger anxiety or apprehension. The overall impression is one of modern design, pattern, and visual rhythm, devoid of any narrative or symbolic elements that could be interpreted as frightening, dangerous, or disturbing. The absence of any threatening imagery, unsettling colors, or chaotic compositions leads to an extremely low rating for fear."
fairy-tale-1970c.jpg,abstract,5.5,"The painting primarily evokes a sense of vibrant energy and complex dynamism rather than fear. The overwhelming use of bright, often clashing, and highly saturated colors—reds, oranges, yellows, pinks, and bright blues and greens—contributes to a lively, almost chaotic feeling, which does not inherently align with fear. While red can sometimes signify danger, its application here is more expressive and passionate than threatening, lacking the ominous undertones typically associated with fear. The abstract, organic, and interwoven forms create a dense visual field, which some viewers might find slightly disorienting or overwhelming due to its lack of clear focal points or traditional composition. This disorienting quality could, for a very small segment of the audience, induce a faint, subtle feeling of unease or uncertainty. However, there are no discernible menacing figures, dark oppressive spaces, sharp aggressive lines, or somber color palettes that would directly translate into a strong sense of dread or fear. The overall impression is one of bustling abstract life, with a chaotic vibrancy that overshadows any potential for genuine fear. The slight score is a very minor acknowledgment of the abstract visual complexity that *might* trigger a fleeting, almost imperceptible sense of visual unrest, but it is far from an explicit or intended emotional response of fear."
encirclement.jpg,abstract,12.0,"The emotion of fear is minimally evoked by this painting. The most significant element that could potentially tap into feelings of apprehension is the large, dominant black rectangle, which occupies the central and most prominent part of the composition. Black can often symbolize darkness, the unknown, emptiness, or a void, which for some individuals can be a source of existential unease or a primal, subtle form of fear related to uncertainty or absence. The rough, textured application of the black paint adds a raw, almost consuming quality to this void.

However, the potential for fear is heavily mitigated and largely counteracted by several other strong compositional elements. The vivid, luminous orange circles within the black rectangle stand out as points of light and focus, almost like eyes or celestial bodies. Rather than being menacing, they appear as powerful, self-contained entities, radiating a sense of presence rather than threat. Their warmth and brightness offer a contrast to the coldness often associated with the unknown, acting as anchors or even sources of comfort within the dark expanse.

Furthermore, the painting is framed by a rich, deep blue border. Blue is frequently associated with calmness, stability, and contemplation, which works against any sense of panic or dread. The geometric and contained nature of the forms – simple circles and rectangles – provides a sense of order and structure, preventing the composition from feeling chaotic or overwhelming, which are often triggers for fear in abstract works. There are no sharp, aggressive lines, distorted figures, or clashing elements that would typically create a feeling of danger or distress. The overall impression is one of stark contrast and visual balance, more likely to inspire"
erotic-6.jpg,abstract,2.5,"The painting, an abstract composition of forms, colors, and lines, evokes an extremely low degree of fear. There are no discernible elements that directly or conventionally trigger a fear response. The artwork lacks any depiction of menace, violence, suffering, or explicit danger. The clean lines, distinct shapes, and structured composition contribute to a sense of order rather than chaos or disorientation, which can sometimes be unsettling.

While the palette includes black and a vivid red/orange, these colors are used in a formal, almost architectural manner, not to create a foreboding or aggressive atmosphere. The large grey shapes, while imposing in scale, do not convey a sense of threat or entrapment; rather, they serve as foundational elements within the abstract design. The white and peach tones introduce softness and light, further mitigating any potential for dread.

The abstract nature means there are no identifiable figures or scenes that could be interpreted as vulnerable or in peril. Any sensation of unease would be highly subjective and indirect, perhaps stemming from the sheer abstraction or the monumental quality of some forms, but this falls far short of inducing actual fear. The overall impression is one of formal balance and aesthetic exploration, not emotional alarm or distress."
ezinor-1949.jpg,abstract,2.0,"The painting is an abstract composition, primarily featuring geometric and curvilinear shapes rendered in a limited palette of black, dark greenish-grey, and a light beige/off-white. There are no discernible figures, objects, or scenes that could directly represent a threat or danger. The large black rectangle in the upper left, while a strong presence, is purely a shape within an abstract design and does not inherently suggest a void or an ominous entity capable of inspiring fear.

The shapes, although some include sharp angles and others are curved, are arranged in a structured and somewhat balanced manner, particularly evident in the checkerboard-like pattern at the top and the interplay of forms below. This organized and deliberate composition prevents any sense of chaos, disorientation, or instability, which are often precursors to fear in visual art. The colors, while including black, are part of a clean, modernist aesthetic; they are not used to create a sense of lurking darkness, oppressive shadows, or jarring conflict that might induce unease or dread.

There is an absence of visual cues typically associated with fear, such as menacing figures, scenes of violence or destruction, enclosed or claustrophobic spaces, or unsettling textures. The overall impression is one of visual exploration and design rather than emotional provocation, specifically regarding fear. Any feeling of unease would be extremely minimal and highly subjective, stemming perhaps from the abstract unknown rather than any explicit threat. However, the work's primary impact is aesthetic and intellectual, leaving very little room for a strong sensation of fear."
farfalla.jpg,abstract,0.0,"The painting is an abstract composition of geometric and organic shapes with a color palette consisting of dark green, black, light blue, light yellow, and shades of green/teal. There are no elements within this artwork that evoke fear. The colors, while including some dark tones like black and deep green, are used in a balanced and harmonious way, providing contrast rather than menace. The shapes are clean, deliberate, and non-threatening; there are no sharp, jagged, or chaotic forms that might induce unease or alarm. The central motif, an oval surrounded by a cross-like structure and light blue quadrants, creates a sense of order and perhaps introspection, but not apprehension. There are no discernible figures, objects, or narrative elements that could be interpreted as frightening, dangerous, or disturbing. The overall impression is one of calm, balance, and visual harmony, completely devoid of any sensation of threat, anxiety, or vulnerability that would contribute to a feeling of fear."
eroticon-1990.jpg,abstract,0.1,"The visual language of this abstract painting evokes virtually no sense of fear. The composition is highly structured and balanced, featuring a harmonious interplay of smooth curves and precise geometric shapes. This sense of order and stability actively counters feelings of unease or threat; there is no visual chaos, disequilibrium, or implied violence that might trigger a fearful response. The forms are well-defined and grounded, rather than distorted, jagged, or imposing in a menacing way.

Furthermore, the color palette consists predominantly of neutral tones—white, various shades of grey, and black—alongside muted mustard yellow, a soft rose/pink, and a deep, calming blue. These colors are either neutral or possess qualities (such as warmth or depth) that do not typically incite fear or alarm. There are no jarring or unsettling color combinations, nor overwhelming dark areas that might suggest dread or a void. The strong contrasts present are compositional elements, not emotionally charged ones designed to create anxiety.

There is no discernible narrative or figural representation that could convey a scene of fright. The overall atmosphere is one of quiet contemplation and intellectual engagement with form and color, devoid of any tension, aggression, or impending doom. The painting's serene and deliberate aesthetic offers no visual cues that would typically provoke fear in an observer"
figuras-a-cinco-colores-1946.jpg,abstract,5.8,"The painting, characterized by its strict geometric abstraction and use of primary colors alongside black and white, offers very little visual information that could reasonably evoke a sense of fear. The composition is highly ordered, with a strong emphasis on straight lines, squares, and rectangles, occasionally intersected by diagonals. This sense of rigorous structure and balance tends to foster a feeling of stability and intellectual engagement rather than disquiet or alarm. While the color red is present, it is used as a fundamental building block of the composition, balanced by yellow, blue, black, and white, rather than being employed to signify aggression, blood, or danger. There are no organic forms, unsettling imagery, distorted perspectives, or chaotic elements that might typically trigger a fear response. The sharp, clean lines contribute to a feeling of precision, and the overall rhythm of the shapes creates a dynamic but controlled visual experience. There is no suggestion of threat, vulnerability, or an unknown presence. The work appears self-contained and harmonious, lacking any narrative or symbolic cues that could lead one to feel fear. The minimal score acknowledges that an extremely subtle, almost imperceptible, sense of unease *could* theoretically arise from the sheer abstractness for someone unaccustomed to such forms, where the lack of recognizable subject matter might be *interpreted* as a void or emptiness by a viewer seeking familiarity, but this is a very indirect and weak association, far from a direct evocation of fear."
football.jpg,abstract,3.0,"The artwork, characterized by its abstract composition of geometric shapes, intersecting lines, and blocks of primary and secondary colors, offers very little to evoke a sense of fear. There are no discernible figures or objects that could be associated with threat, danger, or anxiety. The lines, while dynamic and creating a sense of movement and perhaps some fragmentation, do not convey aggression, chaos, or instability in a manner that would induce fear. The colors used are generally vibrant and do not lean towards somber or menacing tones often associated with fear. There are no elements of darkness, confinement, or distorted forms that typically contribute to a fearful atmosphere. Any minimal feeling of unease might stem from the abstract nature itself, where the mind searches for recognizable forms and finds none, leading to a slight cognitive dissonance rather than an emotional response of fear. However, this is a very indirect and weak association. The overall impression is more one of artistic exploration of form and color rather than an emotional expression of dread or alarm."
golden-people-1999.jpg,abstract,0.5,"The abstract nature of this artwork, composed of various rounded and organic shapes with diverse textures and a palette of mostly earthy, muted, and some moderately vibrant colors, presents no discernible elements that would typically evoke fear. There are no figures, objects, or scenes that are inherently menacing, threatening, or disturbing. The forms are soft-edged rather than sharp or jagged, and the overall composition appears balanced and visually engaging rather than chaotic or unsettling. Abstract art can sometimes induce feelings of unease through dissonance or overwhelming complexity, but in this specific piece, the complexity feels more like a visual puzzle or an intricate arrangement of elements rather than something that triggers a primal or psychological sense of dread or apprehension. Consequently, any potential for fear is virtually nonexistent, scoring extremely low due to the complete absence of any fearful stimuli."
