image,image_category,fear_rating,fear_explanation
not-detected-7.jpg,abstract,1.5,"The painting evokes an extremely low level of fear, bordering on non-existent. There are no discernible elements within the artwork that inherently trigger a fear response. The composition is entirely abstract, devoid of any recognizable figures, objects, or scenes that might connote danger, threat, or horror. The shapes are large, clean, and defined, with smooth curves and sharp angles that interlock in a visually graphic and balanced manner, rather than appearing chaotic, menacing, or aggressive. While the prominent use of black might, in some contexts, be associated with darkness or the unknown, within this abstract framework, it functions primarily as a backdrop creating strong contrast and depth, without conveying a sense of foreboding or threat. The white and light grey shapes are equally neutral in their emotional impact. There are no jarring colors, disorienting perspectives, or dynamic lines that would suggest conflict, instability, or a frightening narrative. The overall aesthetic is one of modern design and visual interplay, which tends to be intellectually stimulating or aesthetically pleasing rather than emotionally unsettling in a fearful way. Any potential for fear would likely stem from an extremely idiosyncratic interpretation of abstract forms or the vastness of the black background, a connection that is highly tenuous and not commonly associated with this type of visual art."
not-detected-4.jpg,abstract,5.0,"The emotion of fear is minimally present in this abstract composition, scoring very low. The primary reason for this low rating is the painting's highly abstract nature, which generally does not lend itself to direct narrative or visceral emotional responses like fear. There are no recognizable elements typically associated with fear, such as explicit depictions of danger, violence, threatening figures, distressed expressions, or chaotic scenes.

While certain colors like black and red can carry connotations of danger or intensity, their application here is largely formal and compositional rather than emotionally charged. The large areas of stark black provide a strong contrast and depth, but do not inherently create a sense of dread or oppression. Similarly, the red shapes, though bold and vibrant, are integrated as geometric accents within the white forms. While one might interpret the sharp, almost 'cut-out' nature of the red elements within the soft white forms as a subtle sense of vulnerability or internal disruption, this evokes a very mild unease or discomfort at most, rather than a palpable sense of fear, terror, or threat. The white, curvilinear forms, suggestive of a reclining figure, appear relatively calm and composed, lacking any indications of struggle or apprehension. The overall impression is one of visual balance, strong contrast, and formal exploration, with any potential for unease being extremely subtle and highly subjective, falling far short of a true sensation of fear."
niwiarki-1950.jpg,abstract,68.0,"The artwork evokes a palpable sense of fear, primarily stemming from its abstract and distorted forms, creating an atmosphere of deep psychological unease and potential struggle. The most striking element contributing to this emotion are the gnarled, elongated hands positioned in the lower left, with another similar, albeit less distinct, set of forms on the right. These hands appear to be in a state of distress – either desperately reaching, clutching, or recoiling. Their skeletal and angular appearance amplifies a feeling of vulnerability and anguish, suggesting a desperate struggle against an unseen force or overwhelming circumstances. This evokes a fear of helplessness or entrapment.

Furthermore, the overall composition is chaotic and disorienting. The swirling, amorphous shapes and crisscrossing lines in the background, particularly the shaded, blotchy forms, contribute to a feeling of confusion and oppressiveness. This abstract chaos can tap into primal fears of the unknown and the breakdown of order. The large, central, somewhat distorted figure in the upper half, with its elongated, hollow ""eye"" shape, contributes to the unsettling nature of the piece. It doesn't present an explicit threat but rather an enigmatic, almost predatory or overwhelming presence that adds to the sense of dread. The muted blue-grey tones combined with the stark, bold lines create a somber and anxious mood. The fear conveyed is not necessarily one of immediate, shocking terror, but rather a profound, lingering sense of apprehension, vulnerability, and psychological distress, akin to dread or a waking nightmare."
not_detected_189365.jpg,abstract,7.3,"The emotion of fear is minimally present in this abstract work. While the painting employs a high degree of visual intensity through its clashing, saturated colors (vibrant reds, yellows, greens, and prominent dark blues/blacks) and assertive, unblended brushstrokes, this energy tends more towards a chaotic vibrancy than a direct evocation of fear. The angular, fragmented shapes, which can be loosely interpreted as architectural forms, contribute to a sense of disarray or a jumbled urban landscape rather than a threatening environment. There is no narrative content or discernible subject matter that would typically trigger fear, such as menacing figures, precarious situations, or desolate spaces. The dominant bright hues largely counteract any potential for dread that might otherwise arise from the heavier, dark brushstrokes and the overall visual density. The painting's energy feels more expressive and dynamic than alarming or terrifying. Any fleeting sense of unease is quickly overshadowed by the work's inherent liveliness and abstract nature, leaving fear as an almost negligible emotional response."
o32-60-1960.jpg,abstract,0.5,"The painting, characterized by its serene palette of pale blue and off-white, features abstract geometric and curvilinear forms. These elements, including the soft circle and the intersecting lines, are presented with a remarkable sense of order, balance, and visual tranquility. There are no dark or foreboding colors that might evoke a sense of dread or suspense. The shapes themselves are clean, unthreatening, and lack any sharp, jagged, or chaotic qualities that could suggest danger, instability, or aggression. The composition is open and spacious, devoid of any claustrophobic or constricting elements. As an abstract work, it lacks any discernible subject matter that could depict scenarios of threat, vulnerability, or alarm. The overall atmosphere conveyed is one of calmness, contemplation, and structural harmony, which stands in direct opposition to emotions like fear. There is absolutely nothing within the visual language of the artwork—neither in its colors, forms, nor implied narrative—that could be interpreted as instilling apprehension, anxiety, or terror. The very slight non-zero score is only to acknowledge the theoretical possibility that any visual stimulus, however benign, might trigger a highly idiosyncratic and unrelated fear response in an extremely rare individual, but this response would not be attributable to the painting's inherent visual properties or artistic intent."
nova-aurigae-1918.jpg,abstract,92.0,"The emotion of fear is intensely conveyed through multiple elements in this painting, particularly by the central figure's striking facial expression. The wide, almost bulging eyes, combined with the angular and distorted lines of the face, create a profound sense of alarm and distress. The mouth appears to be contorted in a grimace or cry, indicative of extreme emotional pain or terror. Surrounding this central figure is a chaotic storm of swirling, energetic lines and vibrant colors that add to the unsettling atmosphere. These turbulent forms suggest an overwhelming force or internal turmoil, contributing to the perception that the figure is caught in a terrifying situation or experiencing deep, visceral fear. The sharp, jagged elements and the overall dynamic composition amplify this feeling of instability and threat, making the fear palpable and dominant within the artwork."
landscape-with-red-spots-1913.jpg,abstract,7.5,"The emotion of fear is minimally present in this painting, deriving more from indirect interpretation rather than direct visual cues. The predominant feeling is one of intense dynamism, spiritual energy, and vibrant expression, rather than dread or terror.

However, a very slight degree of apprehension or unease can be inferred from certain elements. The chaotic yet powerful collision of forms and colors could be perceived as overwhelming or disorienting. The large, dark, sweeping arc on the left side of the canvas, along with other dark, heavy shapes, might evoke a subtle sense of something looming or oppressive. Similarly, the sharp, jagged forms, particularly those rendered in vibrant reds and blues, could be interpreted as aggressive or disruptive, suggesting a landscape or a state of being that is turbulent and unstable, which can be a precursor to anxiety or mild fear. The overall intensity and the sheer scale of the abstract explosion of color and line could be seen as immense and uncontrollable, leading to a feeling of being overwhelmed by forces beyond one's grasp. This sense of being consumed or confronted by an overwhelming, abstract power could subtly touch upon a primal fear of the unknown or the chaotic. Nevertheless, these interpretations are highly subjective and nuanced, as the vibrant palette and energetic composition largely counteract any strong sense of foreboding."
not_detected_189367.jpg,abstract,42.5,"The painting evokes a subtle, psychological sense of fear, rather than an immediate or visceral terror. This feeling primarily stems from the oppressive spatial composition and the suggestive nature of some abstract forms. The strong, receding black and white stripes on the side walls create a tunnel-like effect, drawing the viewer into a confined, almost claustrophobic space. This architectural structure, devoid of warmth or recognizable comfort, can trigger a feeling of entrapment or being overwhelmed by the environment.

Within the central white panel, the grid-like pattern on the left wall, composed of stark vertical and horizontal lines, bears a resemblance to bars or a cage, hinting at themes of restriction or imprisonment. On the right side of the central panel, the sharp, angular red and black shapes, particularly the lightning bolt-like form, introduce an element of suddenness, disruption, or potential danger. Their fragmented and precarious arrangement contrasts with the ordered grid, suggesting instability or an impending abstract threat. The overall starkness of the geometric abstraction, combined with the high contrast black and white, contributes to a cold, disquieting atmosphere where the unknown might lurk within the precise, yet unsettling, visual language."
orange-violet-1935.jpg,abstract,5.0,"The painting, an abstract work by Wassily Kandinsky, generally evokes feelings of dynamic energy, harmony, and visual exploration rather than fear. The predominant use of bright and contrasting colors, such as vibrant yellows, purples, blues, and reds, alongside white backgrounds, creates an uplifting and energetic atmosphere that actively mitigates any sense of dread or anxiety. The various geometric and organic shapes, while diverse and actively interacting, are presented in a balanced and controlled manner, preventing any feeling of chaos or threat.

There are a few elements that, in a different context, might theoretically contribute to a very minor, almost negligible, sense of unease. For instance, the black background behind the stylized serpent-like figure on the right could be associated with darkness, and the serpent itself, in some cultural contexts, can be a symbol of danger or cunning. However, in this painting, the serpent is highly stylized, almost decorative, and outlined in bright yellow, stripping it of any realistic menace. The criss-cross pattern above it, while resembling a cage or lattice, also suggests containment rather than an unleashed threat. Similarly, the large black trapezoidal shape on the left, while dark, is merely a geometric form without any inherent frightening qualities. The overall dynamic yet balanced composition, along with the prevailing bright color palette, ensures that any potential for fear is overwhelmingly suppressed by a sense of order, vitality, and aesthetic engagement. Therefore, any perceived 'fear' is extremely minimal, bordering on non-existent, stemming perhaps from the abstract nature itself (the unknown) rather than any explicitly frightening visual cues."
paesaggio-cosmico-1934.jpg,abstract,28.0,"The emotion of fear is subtly present in this abstract composition, emerging primarily from the pervasive darkness and the unsettling dynamics between the forms. The dominant black background creates a sense of a vast, unknown void, which can inherently trigger primal fears of emptiness, disorientation, or what might lurk unseen. The large, amorphous black shape in the upper right, almost absorbing light, contributes to this feeling of a looming, indistinct, and potentially overwhelming presence.

Furthermore, the sharp, bright, spear-like element, seemingly launching towards or piercing this dark mass, introduces a sense of impending impact or confrontation. This implied collision or forceful interaction, being abstract and devoid of context, leaves the viewer to project their own anxieties onto it, suggesting a potential for sudden change, disruption, or even destruction within this cosmic-like setting. The stark contrast between the luminous projectile and the dark void enhances this dramatic tension.

However, the fear evoked is not intense or visceral. There are no explicit menacing figures, scenes of suffering, or chaotic elements that would induce strong terror. Some elements, like the gentle glowing blue spheres and the more whimsical 'bottle' shape with accompanying dots, do not contribute to fear and might even dilute its intensity. The overall aesthetic leans towards a cosmic or scientific abstraction rather than a horrific narrative. Therefore, the fear is more an intellectual unease, a mild apprehension stemming from the unknown, the vastness, and the potential for a powerful, abstract event, rather than an immediate, overwhelming dread."
orange-1923.jpg,abstract,18.0,"The artwork, being an abstract composition, does not contain any direct representational elements that typically trigger fear, such as menacing figures, dark environments, or scenes of conflict. The colors are varied but not overwhelmingly ominous or jarringly violent; while there are dark blacks and some reds, they are balanced by lighter tones and other hues.

However, a very subtle and intellectualized sense of unease, which could marginally touch upon a feeling akin to apprehension rather than outright fear, can be attributed to a few abstract elements:
1.  **Sharp, Dynamic Forms:** The prominent, spear-like black diagonal lines that pierce through and converge towards the central circular mass create a sense of forceful movement and potential impact or collision. These sharp angles and points can evoke a subliminal association with danger or piercing.
2.  **Fragmented and Scattered Elements:** Around the central composition, there are numerous smaller, disparate shapes that seem to be scattered or exploded outwards, contributing to a feeling of chaotic energy or disruption.
3.  **Jagged Shapes:** In the lower middle section, a series of small, black, saw-tooth or jagged forms are present. These shapes inherently carry a visual connotation of sharpness and potential harm, albeit in a highly stylized and abstract manner.

Despite these elements of visual tension and implied force, the overall composition remains highly controlled and visually engaging rather than disturbing. There is no narrative context for fear, no sense of being trapped, threatened, or confronted by an identifiable danger. Any feeling of 'fear' derived from this piece is extremely minimal, leaning more towards intellectual tension or dynamic energy than a visceral emotional response of dread or terror. The precision and balance of the abstract forms prevent the sense of chaos from escalating into true fear."
painterly-architectonic-3.jpg,abstract,12.0,"The emotion of fear in this abstract composition is extremely subtle and not a primary sensation evoked. The painting utilizes stark geometric forms, sharp angles, and a predominantly cool and dark color palette, which *could* theoretically contribute to a sense of unease. Specifically, the large, dominant black diagonal shape commands significant visual weight and, when viewed in isolation, might be interpreted as a looming, overwhelming, or void-like presence, potentially evoking a very mild, abstract sense of apprehension or a feeling of being consumed. Similarly, the precise, sharp edges of the geometric planes, particularly where they intersect or appear to pierce, could create a formal tension that verges on unsettling, hinting at sharpness or even abstract danger. However, the painting's purely abstract nature means there is no discernible narrative, no recognizable figures in distress, and no direct depiction of a threat or danger, which are typically prerequisites for eliciting genuine, visceral fear. The composition, while dynamic, maintains a certain intellectual control and clarity, lacking the chaotic, distorted, or grotesque qualities often associated with frightening imagery. Any sense of fear derived is therefore indirect, formal, and minimal, stemming perhaps from the abstract implications of overwhelming scale or sharp, cutting lines rather than a direct emotional assault."
painting-on-light-ground-1916.jpg,abstract,62.5,"The painting evokes a discernible sense of fear, primarily through its use of unsettling forms and a turbulent composition. At the top of the canvas, dark, jagged, and somewhat amorphous shapes strongly suggest a menacing presence, resembling a gaping maw or sharp, predatory teeth. These forms introduce a primal sense of danger and threat, as if something ominous is lurking or poised to strike. Furthermore, the heavy, oppressive brown forms framing the central, lighter activity contribute to a feeling of confinement or being overwhelmed, which can trigger a deep-seated fear of being trapped or consumed. The dynamic and chaotic swirling of the various fragmented shapes and vibrant colors in the core of the painting hints at a state of intense struggle or disintegration, generating anxiety about potential harm or loss of control. The fragmented visual elements and disorienting movement deny any sense of stability or security, contributing to an underlying apprehension and fear of the unknown forces at play within the abstract landscape. While not explicitly depicting a scene of terror, the combination of aggressive forms, oppressive framing, and tumultuous internal energy creates a palpable sense of unease and potential threat, tapping into a more visceral, abstract fear."
parque-de-s-paulo-1996.jpg,abstract,2.5,"The painting evokes virtually no sense of fear. The overall aesthetic is one of abstract energy, architectural forms, and vibrant dynamism rather than menace or threat. The colors used are predominantly bright, cool blues, whites, and a spectrum of lively hues in the lower section, none of which are typically associated with fear or danger. While some elements in the upper ""cityscape"" are tall and somewhat sharp, resembling stylized buildings or antennae, they lack any indication of impending collapse, aggression, or a foreboding atmosphere. The ""spiky"" elements on top of some structures are too abstract and clean to be interpreted as actual flames or destructive forces, appearing more as decorative or symbolic motifs. The lower half, characterized by swirling, organic lines and shapes, suggests movement and fluidity, almost like an energetic landscape or a musical rhythm, which is exciting and visually engaging, but not in any way frightening. There are no human figures, disturbing imagery, unsettling shadows, or chaotic compositions that would induce anxiety or alarm. The structured abstraction and clear visual organization prevent any feeling of disarray or threat. Any minimal score is purely acknowledging the possibility that some individuals might find very tall, angular structures or intense abstract movement subtly disorienting, but this is a very minor and unlikely response."
paris-abstract.jpg,abstract,15.0,"The primary contribution to a sense of fear in this painting stems from the vast, dominant black background. This expansive darkness can evoke a primal sense of the unknown, a deep void, or an infinite abyss, which for some viewers can trigger an underlying unease or a subtle, existential fear of emptiness and isolation. The abstract, non-representational forms floating within this void are untethered and lack familiar context, further contributing to a feeling of disorientation or unfamiliarity. The shapes, while geometrically interesting, do not offer any comforting or recognizable imagery, leaving the viewer in an abstract, undefined space.

However, the degree of fear evoked is very low. There are no explicit threatening elements, no menacing figures, no violent or unsettling narratives, and the colors, despite their contrasts, are generally vibrant and visually engaging rather than somber or alarming. The composition, while dynamic, doesn't suggest immediate danger or impending doom. Any fear experienced would likely be a very subtle, almost subconscious apprehension linked to the abstract nature and the profound darkness, rather than a visceral or immediate dread."
pera-1986.jpg,abstract,1.5,"The painting evokes virtually no sense of fear. The composition is highly abstract, composed of distinct, geometric shapes and bold, contrasting colors such as bright yellow, deep blue, black, and touches of red, light blue, and pink. There are no recognizable figures or objects that typically elicit fear, such as menacing creatures, violent actions, or scenes of distress. The lines are clean and structured, lacking the chaotic, distorted, or ominous qualities often associated with frightening imagery. The color palette, while containing dark blues and blacks, uses them as solid, defined forms rather than to create shadowy, uncertain, or oppressive atmospheres. The overall impression is one of deconstructed order, perhaps a whimsical or energetic interpretation of a cityscape, which is far removed from any feeling of danger, dread, or unease that would contribute to fear. The brightness of the yellows and the clear separation of shapes further negate any sense of impending threat or unsettling ambiguity."
peaky-forms-1923.jpg,abstract,5.5,"The emotion of fear is minimally present in this painting. The artwork is characterized by an explosion of vibrant, saturated colors – vivid reds, bright yellows, energetic greens, and deep blues – alongside earthy browns and stark whites. These colors, while intense, primarily convey a sense of dynamism, energy, and expressive vitality rather than dread or apprehension. There is an absence of traditional visual cues typically associated with fear, such as overwhelming darkness, oppressive shadows, distorted or menacing figures, scenes of violence, or a sense of entrapment or decay. The brushstrokes are bold and fluid, creating forms that resemble a dynamic landscape or an abstract burst of internal emotion. While some of the brown and red forms have a jagged or pointed quality, they are enveloped by radiating streaks of bright yellow and green, which mitigates any potential sense of sharp danger or threat. The overall composition suggests upward movement and outward expansion, a feeling more akin to exuberance, passion, or intense sensory experience than genuine fright. Any perceived fear would be extremely subtle and indirect, perhaps arising from a viewer's personal interpretation of overwhelming intensity or the raw, untamed nature of the abstract forms, rather than a deliberate artistic intention to evoke terror or anxiety. The painting's dominant emotional resonance leans heavily towards expressive power and colorful animation, leaving very little room for the sensation of fear to take hold."
pasture-1958.jpg,abstract,0.5,"The emotion of fear is virtually absent in this intricate woven textile. The artwork's abstract composition, characterized by a dense arrangement of small, fragmented blocks and lines in predominantly verdant greens, interspersed with muted oranges, blacks, and whites, offers no discernible visual cues typically associated with fear. There are no recognizable figures, threatening forms, or narrative elements that suggest danger, violence, or menace. The color palette, dominated by soothing green tones, is far from alarming or jarring. While the complex and somewhat chaotic patterning might create a subtle sense of visual 'busyness' or disorganization, this characteristic does not translate into dread, anxiety, or fright. The overall impression is one of meticulous craftsmanship, textural richness, and abstract design, which tends to evoke contemplation or aesthetic appreciation rather than a primal emotional response like fear. Any conceivable, *extremely* minimal, and highly indirect connection to unease, a distant cousin of fear, could only arise in highly sensitive viewers due to the sheer visual density or lack of clear hierarchy within"
