image,image_category,joy_rating,joy_explanation
tennis-game-by-the-sea-1901.jpg,impressionism,72.0,"The painting emanates a gentle and quiet sense of joy, derived primarily from its subject matter and the overall atmosphere it conveys. The depiction of a tennis match, a leisurely and social outdoor activity, inherently suggests a pleasant and enjoyable experience. The figures, particularly the two women in the foreground, appear engaged and at ease. The subtle interaction of the woman in white holding hands with the woman in pink, who is holding the racket, hints at camaraderie, partnership, and shared enjoyment, rather than intense competition. Their postures are relaxed yet attentive, implying contentment in their shared pastime. The presence of other spectators and players in the background further reinforces a social, agreeable setting. The open, airy landscape and the seemingly pleasant weather contribute to a feeling of well-being. While there are no overtly beaming smiles or exuberant gestures, the scene is devoid of any negative emotions such as stress, sadness, or conflict. The joy here is not boisterous or ecstatic, but rather a more serene, sustained feeling of pleasure found in companionship, sport, and the simple beauty of a leisurely day outdoors. This nuanced, understated positive emotion places the score comfortably in the upper-middle range."
sunset-1.jpg,impressionism,78.5,"The painting evokes a significant sense of joy, primarily stemming from the powerful depiction of the sun and its radiant energy. The central, luminous orb of the sun, bursting forth with strokes of warm golden, orange, and reddish hues, immediately conveys warmth, light, and life – elements intrinsically linked to positive emotions and a feeling of upliftment. The dynamic and almost explosive brushwork around the sun gives it an energetic, outward-reaching quality that can be interpreted as an outpouring of light and positive force, contributing to a sense of exhilaration and vibrant happiness. This intensity of light reflects powerfully on the water, creating a shimmering, golden path that draws the eye and feels profoundly inviting and awe-inspiring. The beauty and grandeur of this natural phenomenon (likely a sunrise or sunset) inspire a deep sense of wonder and delight. While there's a peaceful quality to the water, the dominant emotion conveyed by the intense light and warm colors is one of profound appreciation for beauty, a quiet elation, and a strong feeling of positive energy, all of which contribute to a deep, contemplative joy."
the-bathing-hour-1910.jpg,impressionism,92.0,"The painting radiates a profound sense of joy, largely stemming from the depiction of widespread leisure and communal enjoyment. The scene is brimming with individuals engaged in pleasant, recreational activities: children and adults alike are swimming, splashing, and boating in the sparkling blue water, their movements suggesting active delight and freedom. Others are gathered on the dock and by the boathouses, relaxing and socializing in what appears to be a warm, sunny environment. The vibrant blues of the water, the lively greens of the landscape, and the overall bright palette contribute significantly to an uplifting and positive atmosphere. There is no hint of struggle, discomfort, or sadness; instead, the entire composition is dedicated to capturing a moment of pure, unadulterated pleasure and contentment experienced collectively. The impressionistic brushwork adds to the sense of vibrancy and movement, reinforcing the feeling of life being lived to the fullest in a moment of summer bliss. The joy depicted is not merely individual but a shared, palpable sense of happiness permeating the entire scene."
the-coast-at-sainte-adresse.jpg,impressionism,28.0,"The painting evokes a sense of tranquility and a quiet appreciation for nature, rather than a strong feeling of active joy. The warm, diffused light in the sky, particularly the golden glow near the horizon, is the primary element that suggests a positive, perhaps hopeful, atmosphere, preventing a zero score for joy. This soft illumination bathes the scene in a pleasant, gentle glow, which can be comforting. The presence of boats and figures engaged in what appears to be a peaceful coastal activity contributes to a serene mood, suggesting a relaxed moment. However, the overall color palette is muted, with significant use of browns, greys, and subdued greens, lacking the vibrant and energetic hues often associated with exuberant joy. The sky, while glowing, is also heavily clouded, which can lend a more somber or contemplative tone. There are no discernible expressions of active happiness, celebration, or effervescence from the small, indistinct figures. The calm, almost placid water and the still atmosphere further reinforce a sense of peacefulness or introspection rather than overt delight or exhilaration. Therefore, while there's an underlying pleasantness due to the gentle light and serene setting, the painting does not actively convey a strong, palpable sense of joy."
the-clearing-in-the-woods-1913.jpg,impressionism,78.0,"The painting evokes a significant sense of joy, primarily stemming from its masterful portrayal of light and the serene beauty of a winter landscape. The most striking element contributing to this feeling is the radiant sunlight that bathes the scene, especially noticeable in the warm, golden hues on the distant mountains and certain areas of the snow. This brilliant illumination, contrasting beautifully with the cool, deep blues and purples of the shadows, creates a dynamic and uplifting visual experience. The freshness and pristine quality of the expansive white snow, coupled with the clear, bright sky, contribute to a feeling of purity and clarity that is inherently pleasurable. While there's no overt display of boisterous happiness, the scene exudes a profound sense of peacefulness and tranquility, a quiet contentment that arises from experiencing such breathtaking natural beauty. The harmonious integration of the small human element – a figure with a horse and sled – into this vast, calm environment further adds a touch of gentle warmth and relatability, suggesting a simple, purposeful existence amidst nature's grandeur. The overall impression is one of serene aesthetic pleasure and the subtle, uplifting feeling that comes from witnessing a perfect, sun-drenched winter day."
the-cascade.jpg,impressionism,87.5,"The painting strongly evokes a sense of joy through its vibrant depiction of a natural scene. The most prominent element contributing to this emotion is the energetic and dynamic movement of the waterfall. The powerful rush of water, particularly the frothy white foam, conveys a palpable sense of vitality and exhilaration, akin to the feeling of being invigorated and alive. The bright white and yellow highlights within the water suggest sunlight catching the spray, creating a luminous and cheerful effect that uplifts the spirit. The blues, while deep in some areas, are also present as bright, clear tones, adding to the freshness of the scene. The surrounding greens and earthy tones provide a grounding sense of nature's beauty, and the general impression of a sunlit, active natural environment is inherently uplifting and delightful. There are no elements that suggest sorrow, struggle, or stillness; instead, the painting bursts with natural energy and life. The impressionistic brushstrokes further enhance this feeling of spontaneous joy, capturing the ephemeral beauty and movement of the water in a way that feels spirited and free. The overall impression is one of refreshing beauty and lively exuberance, leading to a strong feeling of pure, unadulterated joy derived from witnessing the magnificent power and beauty of nature."
the-beach-at-trouville-1869.jpg,impressionism,3.5,"The painting conveys a highly subdued and contemplative atmosphere rather than one of joy. The predominant grey and muted blue tones of the sky and sea, coupled with the vertical streaks that suggest rain or a recent downpour, immediately diminish any sense of bright cheerfulness typically associated with a beach outing. Several figures are holding umbrellas, reinforcing the idea of less-than-ideal weather conditions, which would naturally temper feelings of unbridled happiness. The figures themselves appear static and reserved; there are no visible smiles, laughter, or energetic movements that would signify joy. Their postures suggest quiet social interaction or individual contemplation, rather than exuberant merriment. While the gathering of people at a leisure location could hint at some underlying pleasantness, the overall mood is far from one of great pleasure or delight. The scene evokes a sense of enduring the elements or a quiet, perhaps slightly melancholic, social engagement, offering very little, if any, visual cues that evoke strong positive emotions like joy."
the-cowherd.jpg,impressionism,72.5,"The painting evokes a gentle, pervasive sense of quiet joy primarily through its harmonious and serene depiction of a natural, pastoral scene. The dominant use of vibrant greens for the grass and foliage immediately conveys a feeling of freshness, life, and abundance, which are inherently positive and contribute to a sense of well-being. The soft, ambient light bathing the scene further enhances this positive atmosphere, suggesting a peaceful, unhurried time of day. The presence of the healthy, calm cow grazing in the lush field embodies a simple, unburdened existence, fostering a feeling of contentment and ease. Similarly, the woman in the background, seemingly at rest or in quiet contemplation under the trees, adds to the tranquil mood; her relaxed posture and integration with the natural setting suggest a state of peaceful repose. There are no elements of tension, struggle, or discord within the composition; instead, everything coexists in a state of natural balance and quiet beauty. This overall tranquility, coupled with the subtle celebration of nature's simple gifts and the absence of any distress, cultivates a deep sense of contentment and inner peace. This feeling of serene well-being, while not expressed through overt exultation or dynamic action, is a profound form of joy—a quiet delight in the beauty and harmony of the moment."
the-coastguard-cabin-at-varengeville.jpg,impressionism,78.0,"The painting strongly evokes a sense of gentle and appreciative joy, primarily through its vibrant depiction of natural beauty and light. The most significant contributor to this emotion is the prominent foreground filled with abundant, bright white and light-colored blossoming vegetation. These blooming flowers symbolize life, growth, renewal, and the freshness of nature, which are inherently uplifting and bring forth a feeling of happiness. The sheer quantity and luminous quality of these blossoms create a focal point of vitality and positive energy.

Furthermore, the overall atmosphere is one of a clear, bright day, suggested by the expansive and luminous sky and sea in the background. This clear light bathes the entire scene, contributing to a sense of clarity, openness, and pleasantness that naturally elevates one's spirits. The loose, energetic Impressionistic brushwork, particularly evident in the rendering of the foliage and flowers, adds to this dynamism, making the scene feel alive and fresh rather than static. While the joy is not boisterous or ecstatic, it is a deep, tranquil contentment derived from witnessing the radiant splendor of nature, a feeling of quiet happiness and appreciation for the world's inherent beauty. The remote house on the cliff also hints at a peaceful existence in this beautiful setting, adding to the sense of a harmonious and joyful escape."
the-greenhouse-1876.jpg,impressionism,93.5,"The painting unequivocally radiates a profound sense of joy, specifically a serene and appreciative delight in the natural world. The score of 93.5 reflects the overwhelming positivity conveyed by its visual elements.

Firstly, the **color palette** is a dominant contributor to this feeling. The vibrant and abundant greens, ranging from luminous yellows to deep, rich hues, create a lush and healthy backdrop. Interspersed throughout are the spectacular bursts of red, pink, and white from the countless roses, providing a visual feast that immediately uplifts the spirit. These bright, clear colors are inherently associated with vitality, beauty, and happiness, creating an immediate joyful response in the viewer.

Secondly, the **subject matter** itself—a flourishing rose garden under what appears to be a bright, sunlit sky—is intrinsically linked with joy. Gardens are often sanctuaries of peace and beauty, and roses, in particular, symbolize love, beauty, and prosperity. The sheer profusion of blossoms suggests abundance and life, evoking a feeling of wonder and pleasure. The soft, luminous light bathing the scene further enhances this, suggesting a perfect, idyllic day that fills one with contentment.

Thirdly, the **Impressionistic style** with its loose, visible brushwork captures the ephemeral quality of light and the vibrant energy of the scene. This technique avoids rigid detail, allowing the colors and forms to blend and shimmer, creating an overall impression of movement and life that feels invigorating and spontaneous, contributing to a sense of unburdened happiness.

Finally, the presence of the solitary figure, seemingly absorbed in the garden, adds a layer of gentle human appreciation. While their face is not visible, their quiet presence suggests a deep, personal connection to the beauty surrounding them, implying a state of peaceful immersion and contentment—a quiet joy. The winding path invites the viewer to mentally step into this beautiful space, fostering a sense of pleasant exploration and discovery.

While not an explosive or boisterous joy, the painting evokes a deep, pervasive feeling of aesthetic pleasure, serenity, and the quiet contentment that comes from being immersed in a beautiful, thriving environment. It’s a joy that resonates with the beauty of life itself, warranting a very high score."
the-japanese-bridge-the-water-lily-pond-1899.jpg,impressionism,93.5,"The painting emanates a profound sense of gentle joy, radiating from its harmonious composition and vibrant depiction of nature. The dominant lush greens and blues, interspersed with the delicate pinks and whites of the water lilies, create an environment of flourishing life and serene beauty, which is inherently uplifting. The abundance of water lilies scattered across the pond's surface conveys a feeling of nature's generous bounty and vitality, inspiring a quiet delight. The soft, luminous light filtering through the dense foliage and shimmering on the water's surface imbues the scene with an ethereal glow, contributing to a sense of freshness and optimism that is deeply joyful. The gentle arc of the bridge adds a graceful human touch to this natural paradise, inviting the viewer into a tranquil, idyllic world. There is an absolute absence of any jarring elements or somber tones; instead, the overall impression is one of undisturbed peace, natural harmony, and aesthetic pleasure, all of which contribute to a strong, pervasive feeling of contentment and quiet elation. It evokes the joy found in appreciating the simple, enduring beauty of the natural world."
the-reading-1869.jpg,impressionism,5.0,"The painting, ""In the Conservatory"" by Édouard Manet, evokes very little sense of joy. The central figure, a woman, displays a remarkably neutral to slightly pensive expression; her eyes are direct but her mouth is closed without a hint of a smile, and her brow is relaxed, but not uplifted in happiness. Her posture, while relaxed, with arms resting casually, lacks any dynamism or openness often associated with joyful exuberance. There is no gestural language in her hands or body that communicates mirth or delight. Similarly, the man in the background is engrossed in reading, showing no interaction with the woman that might suggest a shared moment of happiness or lightheartedness. The overall color palette, dominated by the woman's white dress and the muted tones of the conservatory, contributes to a quiet, contemplative atmosphere rather than one of vibrancy or celebration. The lighting, while gentle, does not burst forth with the intensity often linked to overwhelming joy. The painting seems to capture a moment of quiet repose or perhaps introspection, far removed from any overt display of gladness or delight. As such, the visual cues for joy are almost entirely absent, leading to a very low score."
the-moret-bridge-1888.jpg,impressionism,28.0,"The painting primarily evokes a sense of tranquility, peace, and quiet contemplation rather than overt joy. The natural landscape, with its lush trees, gentle river, and distant bridge, creates a pleasant and serene atmosphere. The soft, diffused light and muted color palette contribute to this subdued mood. While a beautiful natural setting can certainly foster a feeling of contentment or well-being, there are no strong visual cues that would suggest an active or effervescent sense of joy. The figures, if present, are small and indistinct, not engaging in activities typically associated with happiness or celebration. There is no vibrant light, energetic movement, or expressive gestures to convey delight or exhilaration. The overall impression is one of calm observation, which is a positive state, but distinct from the elevated emotion of joy. Therefore, while not negative, the painting does not actively stimulate or represent a strong feeling of joy, leading to a low score."
the-lady-pianist.jpg,impressionism,25.0,"The painting depicts a woman engaged in playing a musical instrument within an opulent setting, suggesting a moment of leisure and artistic pursuit. While the act of making music can inherently bring joy or pleasure to an individual, the visual cues within the painting do not strongly convey this emotion. The woman's face is shown in profile, looking slightly upwards, but her expression is not clearly discernible as joyful; it appears more focused, absorbed, or perhaps even contemplative. There is no smile, no sparkle in the eyes, nor any animated body language that would typically signify overt delight or elation. Her posture is elegant and poised, reflecting a state of concentration rather than outward merriment. The overall atmosphere is one of serene beauty, tranquility, and perhaps a touch of introspection, rather than effervescent joy. While the luxurious surroundings and the pleasant activity create a comfortable and aesthetically pleasing scene that could be conducive to well-being, the painting does not actively portray or emphasize the emotion of joy in the subject's visible demeanor or expression. Therefore, any joy present is either very subtle, internal, or merely implied by the peaceful nature of the activity, not explicitly depicted."
the-pont-neuf-1902.jpg,impressionism,78.5,"The painting strongly evokes a sense of joy through its depiction of a vibrant, active urban scene bathed in clear, bright light. The most striking element contributing to this feeling is the expansive, clear blue sky dotted with fluffy white clouds, immediately setting a cheerful and optimistic tone. The light appears to be warm and inviting, highlighting the buildings and the bustling activity on the bridge, suggesting a beautiful, pleasant day. The multitude of people and horse-drawn carriages moving across the bridge creates an impression of lively energy and vitality, characteristic of a thriving city. This constant, purposeful movement, without any hint of distress or conflict, implies a smooth, functioning, and enjoyable daily existence. The warm palette used for the buildings and the bridge, featuring yellows, ochres, and warm browns, further enhances the inviting and pleasant atmosphere. The overall impression is one of a dynamic and flourishing environment, where the sheer vibrancy and busyness of life itself contribute to a subtle yet pervasive feeling of well-being and contentment. It's the joy derived from observing a world alive, full of gentle motion and pleasant light, rather than an intense, momentary elation."
the-louvre-1902.jpg,impressionism,68.0,"The painting evokes a distinct sense of gentle joy, rooted primarily in the beautiful depiction of light and the overall pleasantness of the scene. The warm, soft light bathing the cityscape, particularly evident in the sky with its delicate pinks and oranges merging into blues, and on the distant buildings, creates an inviting and comforting atmosphere. This diffused, golden glow suggests a beautiful, serene day, which inherently contributes to feelings of contentment and well-being.

The Impressionistic technique, characterized by broken brushstrokes and a focus on capturing fleeting moments of light and color, imbues the scene with a subtle vibrancy. The water, rendered with shimmering dabs of color, feels alive and reflective, while the textural quality of the painted surfaces contributes to a sense of visual richness and dynamism. This energetic yet harmonious quality prevents the scene from feeling static or melancholic, adding a layer of subtle cheerfulness.

Furthermore, the presence of everyday life – people strolling along the quay and boats navigating the river – introduces a comforting hum of activity. This gentle bustle of life within an iconic, picturesque setting (likely Paris with the Louvre in the background) suggests a world that is active, yet peaceful, fostering a quiet appreciation for the rhythm of urban existence. The scene is not one of grand celebration, but rather of a serene and beautiful moment being observed and appreciated, a form of contemplative joy.

However, the joy is not one of exuberance or overwhelming ecstasy. The bare trees suggest a cooler season, perhaps late autumn or winter, which, while not inherently negative, lacks the overt vibrancy often associated with the bloom of spring or summer. The overall color palette, while containing warm tones, is somewhat subdued and muted in areas, preventing an explosive burst of color that might signify more intense delight. Thus, the joy conveyed is more akin to quiet contentment, peaceful appreciation, and the subtle pleasure derived from a beautiful, calm moment rather than an outward expression of unbridled happiness."
the-tenth-street-studio-1915.jpg,impressionism,68.0,"The painting evokes a sense of quiet contentment and deep, subtle joy, rather than overt exhilaration. The scene portrays a harmonious interior filled with cherished objects, suggesting a life rich in appreciation and personal interests, which is a significant source of satisfaction. The presence of relaxed figures, particularly the woman in her elegant white dress, seated comfortably at a table, conveys a state of peace. The subtle interaction between the woman and the man implies connection and companionship, contributing to a feeling of warmth and well-being. Furthermore, the inclusion of a calm white dog standing by the woman's chair and a black cat stretched out on the floor adds to the sense of domestic comfort and tranquility. There is an absence of any elements that would suggest distress or conflict; instead, the atmosphere is one of serene domesticity and quiet enjoyment. The soft, gentle light throughout the room creates an inviting and peaceful ambiance, fostering a mood conducive to an inner sense of happiness and calm fulfillment. The joy conveyed here is one of profound appreciation for one's surroundings, company, and perhaps, the simple pleasures of a collected life."
the-valley-of-the-scie-at-pouville.jpg,impressionism,25.0,"The painting evokes a sense of tranquility and a quiet appreciation for nature, rather than overt joy. The color palette, dominated by muted greens, browns, and soft blues and grays, contributes to a serene atmosphere but lacks the vibrancy often associated with feelings of elation or delight. There are no bright, effervescent colors or strong, radiant light that might suggest a moment of intense happiness. The diffused light implies a soft, perhaps cloudy day, which further contributes to a subdued mood rather than one of exhilaration. While the scene depicts a natural landscape with elements of life, such as grazing cattle and a distant building, these are rendered in a calm, almost static manner. There's no dynamic action, celebratory human presence, or any visual cues that would indicate excitement, merriment, or a bubbling sense of happiness. The overall impression is one of peaceful introspection or quiet observation, which, while positive and devoid of negativity, falls short of embodying the more energetic and outwardly expressive emotion of joy. The beauty present is a calm, contemplative beauty, suggesting a subtle contentment rather than robust joy."
