image,image_category,joy_rating,joy_explanation
christ-with-the-canaanite-woman-and-her-daughter-1909.jpg,impressionism,1.0,"The painting overwhelmingly conveys a somber, contemplative, and rather melancholic atmosphere, leaving virtually no room for the emotion of joy. The scene unfolds at night, saturated with deep blues, purples, and grays, a color palette inherently associated with coolness, introspection, and seriousness rather than warmth or cheerfulness. The figures depicted, including the central illuminating figure and those around them, exhibit no expressions of delight, no smiles, and no gestures indicative of celebration or happiness. Their postures appear solemn, and their interactions suggest a moment of profound gravity or quiet suffering rather than effervescent joy. Specifically, the huddled figure on the right reinforces a sense of distress or weariness, directly opposing any feeling of gaiety. While the central figure emits a spiritual light, this light manifests as ethereal illumination rather than a catalyst for overt happiness within the scene. There is a complete absence of the vibrant energy, warmth, and celebratory elements that typically characterize the emotion of joy."
children-by-the-sea-in-guernsey-1883.jpg,impressionism,83.5,"The painting strongly evokes a sense of joy through several key elements. Firstly, the subject matter itself—a bustling scene at the seaside—is inherently associated with leisure, pleasure, and carefree enjoyment. The various figures, particularly the children, are engaged in activities typical of a happy day out: some appear to be playing on the sand, others wading or interacting with the water. The loose, energetic brushstrokes create a sense of movement and vitality throughout the scene, preventing any static or somber feeling and instead conveying a lively atmosphere.

The vibrant color palette is a significant contributor to the feeling of joy. The bright blues and greens of the sea, the warm yellows and oranges of the rocks and sand, and the luminous quality of the light suggest a beautiful, sunny day. These cheerful colors create an uplifting and optimistic mood. While individual facial expressions are not rendered in minute detail, the overall body language and interactions among the figures, such as the gentle holding of hands between the woman in yellow and the child, suggest contentment and affectionate happiness rather than distress or apathy. The collective engagement in a shared, pleasant experience—a day filled with natural beauty and companionship—radiates a quiet, yet pervasive, sense of joy. It's the joy of being present in a beautiful moment, enjoying simple pleasures and the company of others."
churchyard-at-shillingstone-1884.jpg,impressionism,5.0,"The painting evokes an atmosphere that is largely antithetical to feelings of joy. The predominant elements—a churchyard setting with prominent gravestones, a large, dark, and imposing tree, and a generally subdued color palette of deep greens, browns, and muted creams—contribute to a contemplative, solemn, and somewhat melancholic mood rather than one of cheerfulness or delight. Joy is typically associated with lightness, vibrancy, and a sense of uplift, none of which are strongly present here. While there are patches of light, such as on the pathway and parts of the building, they are rendered in earthy tones and do not radiate the bright, effervescent quality often linked with joyful illumination. There are no figures expressing happiness, no vibrant colors, and no dynamic elements that would suggest celebration or exuberance. The scene's quiet stillness leans more towards introspection or a tranquil peace, which, while potentially positive, are distinct from the active, positive emotional state of joy. Any extremely minimal presence of joy would be an extremely abstract interpretation of a quiet existence or a faint, subtle warmth from the limited light, but it is overwhelmingly overshadowed by the solemnity of the subject matter and the overall visual tone."
cuirassier-1881.jpg,impressionism,0.0,"The painting offers absolutely no visual cues or thematic elements that would evoke or represent joy. The scene depicts a solitary figure on horseback under a dark, heavy, and ominous sky, traversing what appears to be a bleak and possibly snow-covered landscape. The color palette is dominated by somber tones of dark blues, grays, and browns, lacking any bright or uplifting hues typically associated with joy. The brushwork, while dynamic, contributes to a sense of ruggedness and perhaps struggle, rather than lightness or exuberance. There is no discernible positive expression on the figure, whose face is largely obscured by shadow and a helmet. The overall atmosphere is one of solitude, determination, or perhaps even foreboding, entirely devoid of cheerfulness, lightness, or any celebratory feeling."
cliff-at-fecamp.jpg,impressionism,62.0,"The painting evokes a discernible sense of joy, primarily a quiet, contemplative joy rooted in the appreciation of nature's majestic beauty and invigorating elements. The atmosphere is bright and airy, conveyed by the expansive, clear blue sky dotted with scattered, luminous clouds. This light-filled setting immediately contributes to an uplifting and positive feeling. The vibrant blues and greens of the active sea, though dynamic, suggest freshness and vitality rather than turbulence, while the sun-kissed, golden ochres of the colossal cliffs infuse the scene with warmth and a tangible sense of light. The overall impression is one of natural grandeur and openness, which can be profoundly uplifting and contribute to a feeling of liberation and contentment. There's a clear absence of any somber or heavy elements, reinforcing the positive mood. While not an effusive or celebratory joy, the painting fosters a deep, serene pleasure in observing the raw, beautiful power and vastness of the natural world, prompting an internal sense of well-being and appreciation."
cliff-at-grainval-near-fecamp.jpg,impressionism,72.0,"The painting evokes a profound sense of serene joy, derived primarily from its peaceful depiction of nature and the gentle play of light and color. The expansive vista of the calm sea, rendered in a harmonious palette of blues, greens, and subtle purples, immediately brings a feeling of tranquility and openness. The varying shades in the water suggest depth and gentle movement, creating a lively yet soothing visual experience that is inherently pleasant.

The presence of sailboats, small and distant, adds to this sense of quiet contentment. They imply leisure, freedom, and a peaceful communion with the elements, common sources of simple happiness. The soft, diffuse light breaking through the clouds in the sky, though not brilliant sunshine, casts a gentle glow over the scene, hinting at a sense of hope, calm illumination, or the beauty of a serene day. This soft light contributes significantly to the painting's overall mood of gentle upliftment.

While not overtly vibrant or ecstatic, the joy conveyed is deep and contemplative. It's the joy found in the unblemished beauty of a natural landscape, the quiet appreciation of a peaceful moment, and the aesthetic pleasure derived from the artist's masterful use of color and texture. The rugged cliffs provide a sense of grounding and scale, yet their earthy tones blend seamlessly with the softer hues of the sky and sea, contributing to an integrated and harmonious whole. This harmony and the invitation to peaceful contemplation are key components of the joy experienced when observing this work."
clump-of-chrysanthemums-garden-at-petit-gennevilliers.jpg,impressionism,85.5,"The painting strongly evokes joy through its vibrant and abundant depiction of chrysanthemums. The upper two-thirds of the canvas are bursting with a lively array of bright, warm colors, particularly whites, yellows, oranges, and reds, which are inherently associated with cheerfulness, light, and vitality. The sheer profusion and density of the blooming flowers create a sense of overwhelming natural beauty and flourishing life, contributing significantly to a feeling of delight and abundance. The impressionistic style, with its visible, dynamic brushstrokes, imbues the scene with energy and spontaneity, making the flowers feel alive and full of spirited movement. The overall impression is one of robust growth and radiant splendor, which is deeply uplifting and pleasurable to behold. There are no elements within the composition that diminish this sense of natural effervescence and visual delight, reinforcing a strong feeling of joy."
cos-cob-1899.jpg,impressionism,88.0,"The painting strongly evokes a sense of joy through its masterful use of light, color, and serene subject matter. The predominant warm yellows of the buildings, bathed in what appears to be bright, optimistic sunlight, immediately create an uplifting and cheerful atmosphere. Yellow is intrinsically linked to happiness and sunshine, and its pervasive use here imbues the scene with a palpable warmth and vitality. The vibrant greens and blues of the water, reflecting the sky and the sun-drenched structures, add to this feeling of vivacity and freshness. The shimmering, almost dancing quality of the reflections on the water's surface gives the scene a lively energy without sacrificing its tranquility. This impressionistic technique captures the fleeting beauty of light and movement, contributing to a sense of immediate pleasure and visual delight. The presence of boats in calm water suggests leisure, peace, and a harmonious relationship with nature, all of which are conducive to a feeling of contentment and quiet joy. There is an absence of any discernible tension, darkness, or foreboding elements; instead, the painting presents a beautiful, sunlit moment that feels inherently positive and welcoming. The overall effect is one of serene happiness, a deep sense of well-being derived from experiencing such a bright, peaceful, and visually harmonious environment. It’s not an overt or boisterous joy, but a pervasive, soothing, and deeply satisfying form of happiness."
don-juan-s-encounter-with-the-stony-gues.jpg,impressionism,0.5,"The emotion of joy is almost entirely absent from this painting. The scene depicted is one of intense turmoil, chaos, and apparent violence or tragedy. Figures are shown in states of distress, fear, or possibly death, with contorted limbs and desperate gestures. The central figure with raised hands appears shocked or terrified, while others lie scattered on the ground, suggesting injury or demise. The dark, somber palette, combined with the frenetic and aggressive brushwork, contributes to an overwhelming atmosphere of despair, conflict, or horror. There are no elements that convey happiness, pleasure, celebration, or any other characteristic associated with joy. The mood is antithetical to any positive emotional experience, firmly rooting the painting in a realm of dramatic tension and negative sentiment."
dancers-in-light-blue-rehearsing-in-the-dance-studio.jpg,impressionism,15.0,"The painting, ""Dancers at the Old Opéra (The Ballet Rehearsal)"" by Edgar Degas, evokes a very low sense of overt joy. The scene depicts a quiet, focused moment during a ballet rehearsal, emphasizing discipline and the demanding physical work involved in the art form rather than a joyous celebration or performance. There are no smiling faces or expressions of delight visible on any of the dancers; their countenances, where discernible, appear concentrated and serious, engaged in their practice. The poses, while graceful and precise, convey control and effort rather than spontaneous exuberance or lightness. The muted, earthy color palette of browns, reds, and dull blues/greens contributes to a somewhat somber and realistic atmosphere, lacking the vibrant hues often associated with feelings of happiness or celebration. The overall environment suggests a backstage or rehearsal space, a place of diligent routine, rather than a setting conducive to unbridled glee. While the act of dancing itself can be a profound source of internal satisfaction and passion for the artists, this specific depiction does not visually translate that potential underlying joy into an outwardly expressed or palpable emotion for the viewer. The quiet observation of dedication and rigor dominates the feeling of the artwork, leaving little room for a strong sensation of joy."
desert-and-mountains.jpg,impressionism,68.0,"The painting evokes a gentle, serene form of joy, stemming primarily from the harmonious blend of colors and the tranquil depiction of the natural landscape. The soft, warm palette, particularly the delicate pinks and purples illuminating the distant mountains under a pale sky, creates an ethereal and calming beauty. This sense of peace and aesthetic pleasure contributes significantly to a feeling of contentment and quiet joy. The expansive view across the valley suggests openness and grandeur, which can be uplifting and liberating. While not expressing overt exuberance or boisterous happiness, the painting elicits a deep, appreciative joy that comes from encountering profound natural beauty and tranquility, a subtle sense of well-being rather than an effusive burst of emotion. The overall impression is one of peaceful awe and quiet delight."
dewey-s-arch.jpg,impressionism,72.5,"The painting strongly evokes a sense of joy through its pervasive brightness and clarity. The luminous white architectural elements, particularly the grand archway and stately columns, stand out against the serene, clear blue sky, creating an uplifting and optimistic atmosphere. The abundance of natural light illuminates the scene, contributing to a feeling of openness and cheerfulness. The presence of numerous figures, though individually indistinct, suggests a bustling, thriving public space filled with activity and social interaction. This collective human presence, going about their day in a seemingly peaceful and orderly manner, contributes to a sense of communal well-being and quiet contentment. There is an inherent pleasantness in observing a vibrant urban scene depicted with such light and airiness, devoid of any discernible gloom or conflict. The overall impression is one of harmonious activity and a generally positive, agreeable environment, leading to a gentle, ambient form of joy rather than an explosive or ecstatic one."
crimea-yayla.jpg,impressionism,38.5,"The painting evokes a subtle, contemplative sense of joy, primarily derived from the appreciation of natural beauty. The expansive golden field, rendered with warm, earthy yellows and greens, conveys a sense of life and openness, contributing to a feeling of peace and contentment. The lush green trees, appearing healthy and vibrant, further reinforce the vitality of the landscape. The majestic, light-colored mountains in the background lend a sense of grandeur and timelessness, which can inspire a quiet awe and a profound sense of well-being. This is not an effervescent or exuberant joy, but rather a deeper, more serene form that comes from"
elisabeth-avenue-after-rain.jpg,impressionism,5.5,"The painting offers very little in the way of explicit visual cues to evoke a strong sense of joy. The color palette is predominantly muted, dominated by browns, grays, and dark greens, lacking the vibrant, cheerful hues often associated with happiness and exhilaration. The lighting is diffused and somewhat overcast, suggesting a quiet, perhaps damp, atmosphere after rain, rather than bright, uplifting sunlight. There are no discernible smiles, laughter, or celebratory gestures among the figures depicted; they appear to be going about their daily routines, some holding umbrellas, which further dampens any potential for overt cheerfulness. The overall mood is more reflective, observational, or even somewhat melancholic, characteristic of a quiet street scene. While there might be a subtle, underlying sense of calm or the quiet beauty in the reflections on the wet ground, these elements contribute more to a contemplative or aesthetically pleasing feeling than to an active, pronounced emotion of joy. There's no energetic movement, playful interaction, or vibrant activity that would signal widespread happiness. The scene, while lively with people and carriages, does not convey a buoyant or exuberant spirit."
dansatoare-oriental.jpg,impressionism,92.5,"The painting strongly evokes a profound sense of joy, largely stemming from the dynamic and expressive pose of the central figure. Her arms are raised in a gesture that suggests dance, ritual, or a moment of ecstatic abandon, conveying a powerful sense of liberation and uninhibited movement. The vibrant color palette, particularly in her flowing pink, orange, and yellow skirt, pulsates with energy and warmth, contributing significantly to an overall lively and celebratory atmosphere.

While her facial expression is not explicitly smiling, her head is tilted back, and her eyes appear closed or downcast, suggesting an internal state of deep absorption, rapture, or trance-like bliss rather than outward cheerfulness. This indicates a form of joy that is deeply felt and internal, perhaps spiritual or purely kinesthetic. The general fluidity and grace of her posture, combined with the implied movement of her garments, reinforces a feeling of lightness and joy.

The background, with its open archway framing lush green foliage and palm trees, adds to this joyful impression by providing an expansive, exotic, and beautiful setting that feels conducive to freedom and pleasure. Even the presence of the snake, rather than instilling fear, seems to be an integrated part of her performance or ritual, potentially symbolizing mastery, transformation, or a connection to primal energies, which can also be a source of profound, empowered joy. The painting's composition, colors, and the figure's active, yet serene, posture all coalesce to create an overwhelming sense of positive, almost ecstatic, emotional experience. The slight ambiguity in her facial expression prevents a perfect score, but the overwhelming impression is one of intense, authentic joy."
farmer-to-work-1883.jpg,impressionism,5.0,"The painting does not evoke a sense of joy. The scene depicts a solitary figure bent over, seemingly engaged in manual labor in a field. The posture of the individual is one of exertion or focus, not of lightness or happiness. There are no discernible facial expressions that would suggest joy, as the face is obscured or rendered without clear features. The color palette is dominated by earthy tones – dark greens, browns, and muted ochres – which contribute to a grounded, perhaps even somber, atmosphere rather than an uplifting or celebratory one. While the faint yellow on the figure's back might introduce a hint of light, it is not enough to counter the overall impression of toil or a quiet, solitary activity. Joy is typically associated with lightness, exuberance, pleasure, or a celebratory mood, none of which are evident in this depiction. The subject matter and its rendering suggest a quiet moment of work or contemplation, which does not inherently carry a joyful emotional resonance."
esbo-o-para-o-vel-rio-boceto-para-el-velorio-sketch-for-the-wake-1893.jpg,impressionism,5.0,"The painting conveys a palpable sense of human struggle, introspection, and raw emotion, yet elements indicative of joy are conspicuously absent. The figure on the left stands in a contemplative or resigned posture, with no hint of a smile or celebratory gesture. The middle figure is engaged in an act of consumption, possibly out of thirst or a need for solace, but his expression is obscured, and the context does not suggest merriment. The most dynamic figure on the right, with arms raised and mouth agape, displays an intense, almost primal expression. While this could be interpreted as a profound emotional release, the contorted features and strained appearance lean more towards anguish, a cry of despair, or a strenuous effort rather than unadulterated joy or laughter. There is no warmth, lightness, or cheer conveyed through facial expressions, body language, or the overall ambiance of the scene. The lighting, characterized by strong contrasts and deep shadows, further contributes to a heavy, serious mood that stands in stark opposition to feelings of happiness or elation. Therefore, any perceived joy is virtually non-existent, or at best, an extremely remote and ambiguous interpretation of a very intense, but not joyful, emotional state."
etang-also-known-as-the-pond.jpg,impressionism,1.0,"The painting, characterized by its muted color palette of browns, grays, and dark greens, primarily evokes a sense of quietude, introspection, and perhaps a subtle melancholic calm, rather than joy. The overcast sky and diffused lighting contribute to a subdued atmosphere, lacking the vibrancy, brightness, or effervescence typically associated with feelings of great pleasure and happiness. There are no bright, uplifting colors, no dynamic elements, and no figures engaged in joyful activities. The stillness of the water and the overall subdued tonality create a reflective mood that is far removed from the energetic and expansive feeling of joy. While the scene might convey peace or tranquility, these emotions are distinct from joy, which implies a more pronounced and outward sense of delight or elation. Therefore, the presence of joy in this artwork is virtually negligible."
fall-scene-near-sisterdale-1909.jpg,impressionism,88.5,"The painting emanates a profound sense of simple, pastoral joy, primarily through its subject matter, vibrant atmosphere, and the activities depicted. The most potent source of joy comes from the two children in the foreground, engrossed in picking flowers. Their innocent engagement with nature, bent down to collect blossoms, suggests a pure, unadulterated delight in their task, a quintessential scene of childhood happiness. The girl standing upright with a full basket implies success and satisfaction in her gathering.

Further contributing to this feeling is the idyllic setting: a lush, verdant landscape bathed in natural light. The sprawling green fields, dotted with yellow flowers, evoke a sense of abundance and natural beauty, which is inherently uplifting. The bright, dynamic sky with wisps of white clouds adds an airy, expansive quality, suggesting a pleasant day perfect for outdoor activities. The presence of peacefully grazing cows and a walking figure in the mid-ground reinforces the tranquility and harmony of rural life, fostering a feeling of contentment and well-being. The overall impression is one of gentle sunshine, peaceful activity, and the simple pleasures of being outdoors, all of which coalesce to create a strong and palpable sense of joy. It is a quiet, wholesome joy, rather than an exuberant one, yet deeply felt and pervasive throughout the scene."
fishing.jpg,impressionism,5.0,"The painting evokes a sense of quietude and introspection rather than overt joy. The muted palette, dominated by grays, browns, and subdued blues, contributes to a somber or contemplative atmosphere, lacking the vibrant colors often associated with happiness or exuberance. The overcast sky further dampens the mood, preventing any sense of bright, uplifting light that might suggest cheerfulness. The solitary figure in the canoe, engaged in the seemingly mundane act of rowing, does not display any visible signs of pleasure or excitement; their posture is functional, not expressive of delight. There's an absence of elements typically indicative of joy, such as energetic activity, expressions of mirth, bright sunlight, or a festive setting. The scene feels still and perhaps a bit melancholic or simply stoic, suggesting a world devoid of strong emotional peaks, especially on the positive side of the spectrum. While not explicitly sorrowful, it certainly doesn't convey warmth, exuberance, or any sense of elation. The overall impression is one of calm, perhaps even quiet struggle or perseverance, far removed from the feeling of joy."
etaples-la-canache-low-tide-1890.jpg,impressionism,10.0,"The painting largely lacks elements that would evoke a sense of joy. The color palette is predominantly muted, consisting of somber grays, blues, and browns for the sky, water, and muddy banks. The sky is overcast with heavy clouds, which while providing atmosphere, do not convey brightness or cheerfulness typically associated with joyful scenes. There are no vibrant or celebratory colors that would uplift the mood. While there is human activity on the banks and in the boats, the figures are small and appear to be engaged in daily work or tasks; their expressions or specific actions are not discernible enough to suggest happiness, laughter, or celebration. There is no indication of festivity, play, or leisure that might denote joy. The overall impression is one of quiet industry and realism, possibly conveying a sense of calm or the rhythm of daily life, but it falls short of communicating any overt or strong feeling of joy. The slight light breaking through the clouds in the upper right offers a minor positive note, but it is not enough to elevate the overall emotional tone to one of joy."
