image,image_category,joy_rating,joy_explanation
marble-steps.jpg,impressionism,7.0,"The painting primarily evokes a sense of profound serenity and tranquility rather than overt joy. The muted color palette, dominated by"
nasturtiums.jpg,impressionism,88.0,"The painting emanates a profound sense of joy, largely stemming from its vibrant and harmonious color palette. The brilliant, almost glowing, orange of the nasturtium flowers immediately captures attention, creating a focal point of pure, unadulterated cheerfulness. Orange is a color often associated with enthusiasm, happiness, and warmth, and here it bursts forth against the backdrop. The lush, lively green of the leaves complements the orange beautifully, suggesting healthy growth, vitality, and freshness, which are intrinsically positive and uplifting qualities. The interplay between these two colors creates a dynamic and energetic visual experience.

Furthermore, the warm, earthy orange-brown background acts as a rich, inviting stage for the plants, enhancing the luminosity of the flowers and leaves without overwhelming them. This background feels like sun-drenched earth or a warm wall, contributing to an overall feeling of brightness and natural comfort. The loose, impressionistic brushwork adds to this sense of joy by conveying movement and organic life; the plants don't feel stiff or static, but rather as if they are gently swaying and flourishing. There's a palpable sense of natural abundance and simple beauty being celebrated. The subject itself – blooming flowers – is universally associated with happiness and the cycles of life, and the artist's portrayal imbues them with a cheerful spirit, making the viewer feel a genuine, unburdened delight. The entire composition is uplifting, devoid of any somber tones or complex narratives that might detract from this pure, visual exhilaration."
morning-on-the-pond.jpg,impressionism,28.0,"The painting evokes a gentle and subtle sense of joy, rather than an overt or effervescent one. This score reflects a quiet contentment and aesthetic appreciation for the serene landscape. The muted palette, dominated by soft blues, greens, and grays, contributes to a tranquil and peaceful atmosphere, which can be a source of inner calm and, subsequently, a mild form of joy. The soft, diffused light and hazy distant horizon create a dreamy, contemplative mood that suggests a quiet moment of beauty and introspection. The serene body of water with lily pads and the majestic, sprawling tree offer an intrinsic natural beauty that can bring a sense of pleasure and appreciation. However, the absence of vibrant, energetic colors, dynamic movement, or celebratory elements prevents a higher score. It's not a painting that makes one feel exhilarated or excited; rather, it cultivates a feeling of peaceful contemplation and a gentle, profound appreciation for the natural world, which constitutes a low-to-moderate level of joy stemming from quiet harmony and aesthetic satisfaction."
morning-on-the-seine-clear-weather-02.jpg,impressionism,72.0,"The painting evokes a significant sense of joy, largely stemming from its profound aesthetic beauty and the masterful capture of light and color. The luminous quality of the piece, particularly evident in the brilliant white reflections of the sky on the water, is deeply uplifting and creates a sense of ethereal wonder. This interplay of light against the dominant, vibrant blues is not merely tranquil; it imbues the scene with an almost incandescent glow that feels refreshing and optimistic. The rich and varied blues, ranging from deep indigos to lighter ceruleans, alongside the subtle greens and hints of warmer tones in the foliage, create a harmonious and immersive natural landscape. There is an inherent pleasure in witnessing such a serene and beautiful depiction of nature. The impressionistic brushwork adds a vibrant, living quality to the water's surface and the reflections, contributing to a dynamic yet peaceful atmosphere. This painting does not convey an exuberant or boisterous joy, but rather a deep, contemplative joy – a quiet rapture and profound contentment derived from the sublime beauty and peaceful harmony of the natural world. It is the joy of witnessing pure aesthetic delight and tranquility."
nature-morte.jpg,impressionism,85.0,"The painting strongly evokes a sense of joy, particularly a quiet, contented, and appreciative kind of joy. The central subject, a basket overflowing with ripe, luscious fruits (peaches and possibly lemons/oranges), is inherently joyful. Fruits, especially when depicted with such warmth and vibrancy in their reds, yellows, and oranges, symbolize abundance, sweetness, and the bounty of nature, all of which are deeply positive associations. The very presence of such ripe produce suggests a harvest, good health, and the simple pleasure of fresh food. The basket itself, appearing full and generous, reinforces this feeling of plenty and well-being.

The overall color palette contributes significantly to this joyful feeling. While the background and table feature cooler blues and greens, they serve as a calm, natural setting that allows the warm, inviting colors of the fruit to truly stand out. The lighting appears soft and natural, illuminating the fruit and making them appear even more inviting and delectable. There's a certain unburdened quality to the loose brushwork, common in watercolors, which lends a feeling of spontaneity and lightness to the scene, avoiding any sense of heaviness or melancholy. The implied outdoor or natural setting (suggested by the foliage in the background) further connects the scene to the simple delights of nature and pleasant weather. It's the joy derived from simple pleasures, natural beauty, and a sense of peaceful abundance, making it a powerful, albeit gentle, expression of happiness."
normans-woe-gloucester-massachusetts.jpg,impressionism,75.0,"The painting strongly evokes a sense of quiet joy and profound contentment. This is primarily achieved through the harmonious and luminous color palette, particularly the vibrant yet calming greens and blues of the water, which reflect the soft light from the sky, creating an inviting and serene environment. The calm surface of the water, with its clear reflections of the sailboats, contributes significantly to a feeling of peace and tranquility, which is a gentle form of joy. The subject matter—sailboats leisurely positioned on the water, surrounded by natural elements like the rocky shore and a solitary tree—suggests an idyllic and unburdened scene. There is an inherent beauty and stillness that encourages contemplation and a sense of well-being, rather than excitement or distress. The subtle presence of birds soaring in the sky further enhances the feeling of freedom and natural harmony. The overall atmosphere is one of peaceful existence and appreciation for the natural world, leading to a pervasive, gentle, and deeply satisfying form of joy rather than an ecstatic or boisterous one."
northeast-gorge-at-appledore.jpg,impressionism,82.0,"The painting strongly evokes a sense of joy, primarily through its vibrant depiction of a bright, sun-drenched natural environment. The vivid palette of blues in the sky and water, bright whites and warm earth tones in the cliffs, and fresh greens of the vegetation immediately convey an uplifting and positive atmosphere. The abundant sunlight, evident in the sparkling highlights on the water and the luminous quality of the rocks, creates an invigorating and cheerful mood, suggesting a perfect, clear day. While there are no overtly expressive faces, the small figure immersed in the clear, inviting water profoundly contributes to the feeling of joy. This solitary presence suggests a moment of profound peace, refreshment, and contentment—the quiet joy of being fully present and absorbed in the beauty and coolness of nature. The overall impression is one of serene beauty, freedom, and deep appreciation for the natural world, all contributing to a significant feeling of quiet, contented joy rather than an explosive or boisterous one."
november-in-nevada-1935.jpg,impressionism,88.5,"The painting emanates a profound sense of joy, largely attributable to its masterful use of light and color. The most striking element contributing to this emotion is the pervasive warm palette of golden yellows and vibrant oranges that dominate the foliage, the expansive foreground, and the radiant clouds. These hues are intrinsically linked with sunlight, warmth, and a cheerful disposition, creating an immediate and powerful uplift for the viewer. The quality of light, suggestive of either a magical sunrise or a serene sunset, bathes the entire scene in a soft, almost ethereal glow. This ""golden hour"" lighting imparts a sense of wonder and tranquility that is deeply joyful, highlighting the vibrant beauty of the autumn trees and the sweeping clouds. The sheer visual spectacle of nature depicted in such a magnificent, illuminated state is inherently delightful. The crisp, clean air implied by the clear sky and distant mountains, combined with the rich, autumnal splendor, evokes a celebratory feeling of peak natural beauty. It's not an explosive or boisterous joy, but rather a deep, appreciative, and serene gladness that comes from witnessing and internalizing a scene of such breathtaking warmth and beauty. The painting invites quiet contemplation and a sense of profound pleasure in the world's natural grandeur, all contributing to a strong and resonant feeling of joy."
okhotino-september-1915.jpg,impressionism,3.5,"The overall atmosphere of the painting is one of dramatic weather and solitude, which does not inherently align with feelings of joy. The dominant elements are the vast, turbulent sky filled with dark, heavy clouds rendered in deep blues, greys, and purples. This creates a somber, weighty, and perhaps even ominous mood, suggesting an impending storm or the aftermath of one, rather than lightheartedness or cheer. The landscape itself, with its muted tones and isolated, rustic buildings, contributes to a sense of ruggedness and quiet observation rather than effervescence.

The primary, almost singular, source of any potential ""joy"" lies in the cluster of vibrant yellow and orange flowers in the immediate foreground. These flowers provide a stark pop of color and life against the otherwise subdued and powerful backdrop. They introduce a fleeting sense of warmth and natural beauty. However, their presence is visually small in comparison to the expansive and dramatic sky that dominates the composition. Their vibrancy feels more like a resilient spark or a momentary accent rather than a pervasive emotion that permeates the entire scene. The contrast between these bright, living elements and the overwhelming, dark atmosphere tends to highlight the severity of the sky rather than spreading joy throughout the entire landscape. Thus, while a hint of vitality is present, it is far too minor and overshadowed by the powerful, non-joyful elements to elicit a strong sense of this emotion."
orchard-in-bloom-neskuchnoye-1908.jpg,impressionism,92.0,"The painting emanates a profound sense of joy, largely stemming from its vibrant and luminous color palette. The dominant use of bright yellows and light, fresh greens immediately evokes feelings of cheerfulness, warmth, and the vitality of spring or early summer. These colors are intrinsically linked to sunshine, growth, and optimism, creating an overwhelmingly positive atmosphere. The subtle touches of white suggest blossoming trees, symbolizing new life, beauty, and renewal, which are all inherently joyful themes. The overall impression of abundant light filtering through the canopy of trees adds to this feeling, making the scene feel airy, open, and inviting, like a perfect, clear day. The loose, somewhat impressionistic brushwork contributes to a lively and spontaneous feeling, suggesting a moment captured in its most pleasant and unburdened form. There are no dark, heavy, or melancholic elements; instead, the winding path invites peaceful contemplation and a gentle stroll through a beautiful, sun-drenched natural setting. The joy conveyed is not an ecstatic or boisterous one, but rather a deep, pervasive, and serene happiness, a pure contentment found in the beauty and brightness of nature."
painters-on-the-beach.jpg,impressionism,68.0,"The painting evokes a distinct, albeit subtle, sense of joy, stemming primarily from the absorbed engagement of the central figure. The act of creation itself, as depicted by the artist intently focused on their easel, suggests a deep sense of purpose, satisfaction, and inner fulfillment, which are profound forms of joy. The individual appears to be in a state of 'flow,' a highly pleasurable and rewarding mental state. Furthermore, the serene setting by the water, with boats gently resting, contributes to a peaceful and pleasant atmosphere. This environment provides an ideal backdrop for leisure and creative pursuits, often associated with positive emotions. The light, while not dramatically bright, appears natural and conducive to a comfortable outdoor activity. The warm tones in the sand and the cool, calming blues and purples of the water and sky create a harmonious palette that supports a sense of calm contentment. There are no elements within the scene that suggest distress, conflict, or negative emotions, allowing the quiet pleasure of the moment to shine through. The joy portrayed is not one of exuberant expression or boisterous celebration, but rather a deep, personal, and contented happiness found in a beloved activity within a tranquil setting."
peasant-home-in-curtea-de-arge-1922.jpg,impressionism,72.5,"The painting evokes a gentle, quiet sense of joy, stemming primarily from its portrayal of a serene and homely environment. The rustic charm of the house, with its inviting white facade and sheltering dark roof, immediately conveys a feeling of domestic peace and security, which is a fundamental component of well-being and happiness. The presence of a balcony further suggests a connection to the outdoors and potential for quiet enjoyment of the surroundings.

The color palette, while not overtly vibrant, leans towards warm, earthy tones – the yellow-greens and ochres of the foliage, the varied browns and oranges of the fence and wooden structures – which contribute to a welcoming and natural atmosphere. These hues, combined with the diffused natural light, create a comforting glow that fosters a sense of contentment rather than grand excitement. The loose, impressionistic brushwork adds to the organic feel, giving the scene a lively yet unhurried quality that can subtly lift the spirit.

This is not an ecstatic or boisterous joy, but rather a profound, understated pleasure derived from the beauty of a simple, lived-in space nestled within nature. It is the joy of quiet appreciation, of finding solace and charm in the everyday, and of the peaceful contemplation of a humble yet beautiful home. The overall mood is one of tranquility and quiet satisfaction, which resonates deeply with a sense of inner happiness."
pavasaris-1930.jpg,impressionism,82.5,"The painting evokes a strong sense of joy primarily through its vibrant use of color and the implied narrative of nature's awakening. The bright, clear blue of the sky and the reflections in the melting stream immediately convey a feeling of crispness and clarity, often associated with upliftment. The fiery red-orange hues of the distant bare trees provide a striking and warm contrast against the cool blues and whites of the snow and ice, creating a dynamic visual energy that is inherently cheerful and positive. This is not a dreary winter scene, but one bathed in what appears to be bright, invigorating sunlight, further contributing to a sense of well-being and happiness.

Furthermore, the subject matter—a winter landscape undergoing a thaw—carries a powerful symbolic resonance of renewal, promise, and the imminent arrival of spring. The open water amidst the ice suggests movement, fluidity, and life breaking free from dormancy, which is a deeply joyful concept. The distinct, lively brushstrokes prevent the scene from feeling static or melancholic, instead imbuing it with a sense of vitality and energy. While there are no human figures expressing joy, the sheer beauty, luminosity, and optimistic undertones of the natural world depicted here communicate a profound, quiet delight that permeates the entire canvas. It’s a joy rooted in appreciation for nature's beauty and the hopeful cycle of seasons."
pine-trees.jpg,impressionism,82.0,"The painting strongly evokes a feeling of joy, primarily through its masterful capture and depiction of light. The golden, warm light streaming through the forest canopy and illuminating the tree trunks is immediately uplifting and creates a vibrant, positive atmosphere. This pervasive sunlight suggests a bright, pleasant day, bringing with it a sense of warmth, energy, and natural beauty that is inherently joyful. The clear blue and white patches of sky visible through the leaves further enhance this feeling of lightness and openness.

The color palette, dominated by lush greens, vibrant golds, and bright blues, contributes significantly to the joyful mood. These are natural, life-affirming colors that convey the vitality and abundance of the forest. The energetic and visible brushstrokes, typical of an impressionistic or post-impressionistic style, add to the painting's liveliness and sense of spontaneity, making the scene feel dynamic and full of life rather than static or somber. This vibrancy mirrors an internal feeling of happiness and contentment. The scene itself, a sun-drenched forest, invites a quiet sense of appreciation and delight in nature's simple grandeur, evoking the peaceful joy of being immersed in a beautiful, sunlit environment. It's a joy that is serene and appreciative, rather than overtly boisterous, but deeply felt and consistently conveyed throughout the composition."
old-teacher-portrait-of-mykola-murashko-1906-3-2.jpg,impressionism,78.0,"The painting exudes a strong sense of joy primarily through its jubilant and unrestrained use of color. The palette is extraordinarily vibrant and saturated, with brilliant emerald greens, deep sapphire blues, and lively purples and reds dominating the scene. This intense chromatic energy creates an immediate and powerful feeling of vivacity and cheerfulness, almost as if the colors themselves are singing with delight. The outdoor setting, bathed in what feels like rich, dappled light, enhances this feeling of pleasant immersion in nature, a common source of upliftment and happiness. Furthermore, the dynamic and visible brushwork contributes to a lively, almost shimmering quality, lending the scene an energetic pulse that is infectious. The overall visual experience is one of vivid sensory pleasure and a relaxed, yet profound, appreciation for the beauty and richness of the depicted world, all of which contribute significantly to a joyful atmosphere."
pink-bush-1906.jpg,impressionism,18.0,"The emotion of joy is minimally present in this painting. The primary source of any joyful sentiment stems from the whimsical and imaginative inclusion of the small city nestled within the branches of the prominent tree. This fantastical element can evoke a subtle sense of wonder, amusement, or delight, which are mild components of joy. It's an unexpected and creative detail that might spark a quiet, inward smile or a fleeting feeling of pleasant surprise at its sheer inventiveness.

However, this very subtle indication of joy is significantly outweighed by other elements of the painting. The overall color palette is muted and cool, dominated by blues, purples, grays, and earthy tones, which typically do not resonate with overt happiness or exuberance. The dramatic and swirling sky, while visually captivating, conveys a sense of dynamism, contemplation, or even a touch of melancholy or intensity rather than unadulterated joy. The landscape itself appears solitary and still, contributing to a more introspective or awe-inspiring atmosphere rather than one of cheerfulness or celebration. There is no sense of vivacity, bright light, or celebratory activity commonly associated with strong feelings of joy. The joy, therefore, is an almost intellectual appreciation of the artifice and fantasy, rather than a deep emotional response of happiness or elation."
poplars-at-giverny-2.jpg,impressionism,65.5,"The painting evokes a gentle, contemplative form of joy rather than an effervescent or boisterous happiness. The serene natural setting, dominated by the tall, slender poplars, creates a sense of quietude and aesthetic pleasure. The soft, diffused light, particularly visible in the sky and reflecting subtly in the water below, suggests a peaceful and pleasant day, fostering a calm, uplifted mood. The verdant greens of the foliage and the underlying landscape, combined with the subtle blue tones that capture the light filtering through the leaves, contribute to a feeling of natural vitality and harmony. There is a soothing rhythm in the repetition of the trees, leading to a state of pleasant relaxation and contentment. While not overwhelming, this sense of tranquil beauty and the harmonious interplay of light and nature elicits a subtle and sustained feeling of appreciation and quiet delight, which is a genuine aspect of joy."
prayer-in-the-saint-pierre-cathedral-in-geneva-1882.jpg,impressionism,0.0,"There are no discernible elements within this painting that convey the emotion of joy. The scene depicts a solemn gathering within a church, with a preacher addressing congregants. The figures are dressed in dark, muted clothing, and their postures are either attentive or bowed in what appears to be reverence or contemplation. No smiles, laughter, or any expressions indicative of happiness or celebration are visible on any of the faces. The overall color palette is somber, dominated by browns, grays, and deep reds from the wooden pulpit and stained glass, which, while allowing light, do not infuse the scene with brightness or cheerfulness. The atmosphere is one of quiet devotion and seriousness, rather than upliftment or elation. Every visual cue—from the expressions and body language of the individuals to the subdued lighting and color scheme—points away from any feeling of joy."
place-de-l-opera-caf-de-la-paix.jpg,impressionism,68.0,"The painting evokes a sense of quiet, atmospheric joy, rather than overt celebration or excitement. The primary source of this feeling comes from the abundant warm light emanating from the shop windows and street lamps, which glow invitingly against the cool, muted tones of the grey sky and wet pavement. These luminous reflections on the damp street create a shimmering, almost magical effect, transforming what could be a dreary scene into one of subtle beauty and warmth.

The bustling street scene, with figures going about their day, a horse-drawn omnibus, and a flower cart, conveys a lively and vital urban environment. This sense of life and activity contributes to a feeling of engagement and interest, which can be a form of quiet enjoyment. The subtle pops of color, such as the bright yellow dress of one of the pedestrians and the vibrant flowers in the cart, add small points of cheerfulness to the overall palette.

While the weather appears to be overcast or rainy, the artist uses it to enhance the luminous quality of the artificial lights, creating a cozy and inviting contrast. There's a charm and elegance to the scene that elicits a sense of aesthetic pleasure and comfort. The joy is not expressed through overt emotions in the figures but through the enchanting ambiance and the inviting glow of the city at dusk or on a wet evening. It's the kind of subtle joy one finds in observing a beautiful, thriving urban landscape, full of light and quiet activity."
port-of-dieppe-evening.jpg,impressionism,70.0,"The painting evokes a distinct sense of quiet joy, stemming primarily from the masterful depiction of light and color at what appears to be either dawn or dusk. The dominant warm hues of yellow, orange, and soft red in the sky, particularly where the light source is implied, radiate a feeling of warmth, optimism, and gentle beauty. This light is magnificently reflected and broken across the water's surface, creating a shimmering, dynamic tapestry of golden and orange tones that feel almost alive and enchanting. The vibrancy of these reflections, dancing and dissolving into the cooler blues and greens of the water, is visually stimulating and inherently uplifting. While the silhouetted cityscape presents a more subdued, contemplative element, the overwhelming presence of the luminous sky and water imbues the scene with a profound sense of peace and natural splendor. It's a joy that comes from witnessing a fleeting, beautiful moment in nature—a calm delight rather than an effusive exuberance. The overall atmosphere, dominated by this radiant, atmospheric light, cultivates a feeling of serenity and quiet appreciation, which are strong components of a deeper, more introspective joy."
