image,image_category,joy_rating,joy_explanation
a-misty-morning.jpg,impressionism,75.0,"The painting strongly conveys a sense of serene and gentle joy, emanating primarily from the harmonious blend of nature, light, and human leisure. The overall atmosphere is one of peaceful contentment and simple pleasure. The soft, warm light reflecting on the water and illuminating the landscape creates an inviting and pleasant ambiance, immediately setting a positive emotional tone. The rolling hills and lush greenery suggest a tranquil escape, a place where one can unwind and find solace, which inherently fosters feelings of happiness.

The two figures by the riverbank are central to the feeling of joy. Their relaxed postures and apparent engagement with the natural environment suggest a state of ease and enjoyment. The standing figure, possibly in swimwear, and the seated figure imply a leisurely activity, perhaps swimming, wading, or simply basking in the riverside setting. Such activities are typically associated with leisure, recreation, and a break from daily stresses, leading to feelings of well-being and happiness. While there are no overt expressions of boisterous jubilation (like laughter or energetic movement), the scene communicates a quiet, pervasive sense of enjoyment and calm satisfaction. It's the joy of being present in a beautiful place, enjoying simple pleasures, and experiencing a moment of unburdened tranquility. This is a subtle yet deep form of joy, characteristic of moments of peaceful appreciation and gentle leisure."
a-mother-and-son-seated-by-a-wall-before-the-sea.jpg,impressionism,5.0,"The painting conveys a predominantly quiet, contemplative, and somewhat somber mood, with very little to suggest active joy. Neither the woman nor the child exhibits any outward signs of happiness, such as smiles, laughter, or playful engagement. The woman is absorbed in her needlework, her head bowed in concentration, suggesting diligent work rather than leisure or mirth. The child, while looking towards the viewer, has a pensive or perhaps simply curious expression, with a hand near the mouth, which often indicates thought or shyness rather than overt glee. The muted color palette, dominated by earthy greens and browns, and the shaded environment under the trees, further contribute to a sense of calm and everyday reality rather than vibrant cheerfulness. While there might be an underlying sense of peace or quiet companionship, these are not directly equated with the active, effervescent emotion of joy. The scene depicts a moment of grounded existence and focused activity, largely devoid of exuberant or lighthearted feelings."
a-grey-day-carmel.jpg,impressionism,15.0,"The painting evokes a sense of tranquil beauty and contemplative peace rather than overt joy. The overcast sky, diffused light, and cool color palette of blues and greens contribute to a serene atmosphere, which can be pleasant but does not strongly elicit feelings of exuberance, delight, or cheerfulness typically associated with joy. While the natural landscape is beautiful and aesthetically pleasing, which might induce a very subtle, quiet sense of appreciation or contentment, there are no elements—such as vibrant, warm colors, dynamic action, or clear signs of merriment—that would lead to a significant feeling of joy. The overall impression is one of calm observation and natural grandeur, suggesting a low presence of this specific emotion."
after-the-rain.jpg,impressionism,78.0,"The painting strongly evokes a sense of joy through its vibrant use of light and color, creating an atmosphere of warmth and visual pleasure. The central building, bathed in a luminous golden-yellow, radiates cheerfulness and suggests a bright, sun-drenched day. This warmth is echoed in the reddish hues of the roofs, adding further vibrancy and life to the scene. The most prominent contributor to joy, however, is the shimmering water in the foreground. Rendered with dynamic, broken brushstrokes and a rich palette of blues, greens, yellows, and browns, it reflects the light and colors of the buildings in a lively, almost dancing manner. This active and luminous surface creates a sense of movement and visual delight, inviting the viewer to appreciate the beauty of the scene. The picturesque subject matter—a serene canal with elegant Venetian architecture and a solitary gondola—inherently carries positive associations of beauty, tranquility, and charm, further contributing to a feeling of contentment and well-being. There are no elements within the composition that convey distress or negative emotions; instead, the painting offers a pleasant and inviting glimpse into a harmonious moment, filled with the quiet joy of aesthetic appreciation and natural beauty."
a-youngster-in-the-forest.jpg,impressionism,65.0,"The painting evokes a gentle and ethereal sense of joy, leaning towards a quiet contentment rather than overt exuberance. The light, airy quality of the watercolor medium, combined with the predominant pastel shades of muted yellows, greens, pinks, and light browns, creates an uplifting and pleasant atmosphere. There is an absence of dark or heavy tones that might suggest negativity, contributing to a sense of lightness and well-being.

The abstract, elongated forms in the upper and middle sections of the painting, some resembling reaching hands or floating figures, convey a sense of weightlessness, upward movement, and freedom. This fluidity and implied dance contribute significantly to a feeling of liberation and ease, which are facets of joy. The overall dreamlike and whimsical quality of the composition further enhances this subtle positive emotion, suggesting a world free from harshness or conflict.

While the small figure at the bottom left does not display an overtly joyful expression, her presence grounds the scene in a human element that is not sorrowful or troubled. The visual narrative, though abstract, points towards a harmonious and unburdened state. The joy present here is not boisterous or celebratory but rather a profound, peaceful, and perhaps introspective kind of happiness, akin to the quiet wonder one might experience in a gentle, dreamlike state. The painting's serene and harmonious composition, coupled with its soft palette and implied movement, collectively imbues it with a palpable, albeit understated, sense of joy."
a-fisherman-s-cottage.jpg,impressionism,88.0,"The painting strongly evokes a profound sense of joy, not as an explosive outburst, but as a deep, pervasive contentment and delight in the beauty of life. This feeling stems primarily from the vibrant and harmonious depiction of a sun-drenched garden and its inhabitants.

The abundance of lush greens in the foreground and the varied foliage throughout the garden signifies flourishing nature, inherently contributing to a feeling of abundance and well-being. This verdant backdrop is punctuated by an explosion of warm, lively colors – particularly the profusion of red, orange, and yellow flowers. These bright hues are inherently uplifting and energetic, creating a cheerful and celebratory atmosphere that speaks directly to a joyful spirit. The impressionistic brushstrokes, loose and broken, further enhance this vibrancy, making the entire scene shimmer with light and life, as if the air itself is filled with positive energy.

The presence of the figures, especially the adult and child on the left, adds a human element of gentle happiness. Their relaxed postures within the idyllic garden setting suggest a peaceful and pleasant interaction, embodying contentment. The visible black cat in the foreground further contributes to this sense of domestic tranquility and comfort, often associated with simple, everyday joys. In the background, the additional figures visible on a distant porch reinforce the idea of a shared, leisurely existence, which is a common foundation for joy.

The bright daylight that bathes the scene, creating soft shadows and highlighting the rich colors, instills an overall sense of optimism and clarity. There are no harsh elements or signs of distress; instead, the painting presents an inviting, nurturing environment where life thrives and moments of quiet pleasure are cherished. The winding path through the garden seems to invite exploration and appreciation, mirroring a journey through a joyful experience. All these elements coalesce to create an overwhelming sensation of serene happiness and a deep appreciation for the beauty and simple pleasures of existence."
a-spanish-barracks-1906.jpg,impressionism,58.0,"The painting evokes a gentle, understated sense of joy, primarily stemming from the palpable atmosphere of calm contentment and human connection. The figures are depicted in relaxed, engaged postures, suggesting ease and comfort in their shared space and interaction. There's an absence of tension or distress, allowing for a tranquil and peaceful scene, which itself can be a profound source of quiet joy. The warm, soft light bathing the architectural setting, along with the earthy yet inviting color palette, contributes to a pleasant and harmonious ambiance. While there are no overt expressions of exuberant happiness such as broad smiles or dynamic, celebratory gestures, the scene radiates a serene equilibrium and the quiet satisfaction derived from companionship and a moment of peaceful absorption. The subtle vibrant accents of red further add a touch of visual warmth and liveliness, preventing the scene from feeling somber and instead infusing it with a subtle vitality that hints at a quiet, felt happiness. It is a joy found in simple presence and the harmonious interplay of human figures within a comfortable environment."
afternoon-in-the-park.jpg,impressionism,65.0,"The painting conveys a notable sense of joy, though it is primarily a quiet, serene form rather than an overt, boisterous expression. Several elements contribute to this feeling. Firstly, the overall atmosphere is remarkably bright and pleasant. The scene is bathed in warm, natural sunlight, illuminating a lush, vibrant garden. The verdant greens of the grass and trees, combined with the clear, bright light, evoke a sense of warmth, freshness, and natural beauty, which are inherently uplifting and conducive to feelings of well-being.

Secondly, the color palette is rich and harmonious, with the striking pink of the woman's dress and the vivid red of her hat providing lively focal points against the tranquil greens. These bright, appealing colors contribute significantly to a cheerful and positive ambiance, suggesting vitality and lightness of spirit. The choice of such vibrant attire further implies an appreciation for beauty and perhaps a celebratory mood, even if understated.

Thirdly, the subject's posture and setting strongly suggest contentment. She is seated comfortably in a garden chair, seemingly at leisure, enjoying the peaceful surroundings. Her pose is relaxed and unburdened, indicating ease and a lack of any distress. While her facial expression is contemplative rather than overtly smiling, there are no visible signs of sadness, anxiety, or discomfort. Her presence in such an idyllic, sun-drenched setting, coupled with her calm demeanor, speaks to a moment of tranquil"
amsterdam-in-the-snow(1).jpg,impressionism,5.0,"The painting, a winter scene, primarily evokes a sense of quietude, stillness, and the muted beauty of a snowy day. The color palette is dominated by cool whites, greys, and blues for the snow and ice, contrasted with somber browns and muted earth tones for the buildings, bare trees, and overcast sky. There are no bright, cheerful colors or warm light that would typically be associated with joy. The figures in the foreground are small and indistinct, appearing to be simply traversing the landscape rather than engaging in any playful or joyous activity. The atmosphere conveyed is one of cold, introspection, and perhaps a subtle solemnity, rather than exuberance or happiness. While snow can sometimes be associated with joyful childhood memories, this particular depiction leans towards the stark reality of winter, with a heavy, muted sky and a landscape that feels vast and quiet. There is nothing within the composition, brushwork, or subject matter that suggests feelings of delight, cheerfulness, or vivacity. The emotion evoked is far from the uplifting and energetic sensation of joy, registering only a minimal presence due to the inherent, albeit subdued, beauty of a winter landscape which some might find a quiet contentment in."
along-the-path-at-shinnecock.jpg,impressionism,78.5,"The painting strongly evokes a sense of tranquil joy and peaceful contentment. The bright, open landscape, likely a sunny day on dunes or a heath, immediately sets a positive tone. The use of natural, soft greens, yellows, and blues in the landscape, combined with the gentle light of the sky, creates an inviting and pleasant atmosphere. The presence of figures, particularly the one in white walking leisurely and the two smaller figures interacting in the middle ground, suggests an outing or a moment of shared, relaxed enjoyment. There is no element of struggle, conflict, or sadness; instead, the scene is one of idyllic leisure. The winding path invites the viewer's eye through the expansive space, conveying a sense of freedom and unhurried movement. While the figures' expressions are not discernible due to their scale and the painterly style, their relaxed postures and integration into the serene environment strongly imply a deep, quiet pleasure in being present in nature. This is not an explosive or exuberant joy, but rather a profound and gentle happiness derived from peace, beauty, and simple activity outdoors. The overall impression is one of harmonious well-being, contributing significantly to a feeling of joy."
afternoon-sun-at-the-alcazar-of-seville-1910.jpg,impressionism,82.5,"The painting emanates a profound sense of joy, largely stemming from its masterful depiction of light and color. The dominant warm yellow of the stately building, bathed in brilliant, clear sunlight, immediately evokes feelings of warmth, happiness, and optimism. This vibrant hue, strongly associated with sunshine and cheer, permeates the scene, creating an inviting and uplifting atmosphere. The bright blue sky overhead reinforces this feeling of a perfect, clear day, contributing to a sense of spaciousness and freedom.

The subject matter itself, a grand and elegant estate with lush green gardens and flowing fountains, suggests an idyllic setting of peace, beauty, and well-being. There are no figures to introduce narrative complexities or potential somberness; instead, the focus is purely on the aesthetic pleasure of the environment. The distinct shadows cast by the intense light signify a high noon, lively energy, and a palpable sense of warmth, which intrinsically lifts the spirit. The lively, almost shimmering brushstrokes add a dynamic quality, making the light feel active and alive, further enhancing the overall vibrancy and positive energy. The cumulative effect is one of serene contentment and profound aesthetic pleasure, a quiet yet powerful joy derived from the beauty and warmth of a sun-drenched, harmonious place."
along-the-woods-in-spring-1889.jpg,impressionism,72.5,"The painting evokes a strong sense of gentle joy, primarily through its depiction of early spring. The most prominent elements contributing to this feeling are the numerous trees laden with bright white blossoms, symbolizing renewal, growth, and the beauty of nature awakening after winter. This imagery of blooming life is inherently uplifting and associated with happiness and fresh beginnings. The overall light in the painting, while soft and somewhat diffused, is bright and clear, contributing to a serene and pleasant atmosphere rather than a somber one. The fresh greens in the fields further emphasize the vitality of the season. While the figures on the path do not display overt signs of joy, their presence suggests life and activity within this inviting landscape, hinting at the simple pleasures of a walk in such a beautiful setting. The painting's palette of light blues, whites, and greens, combined with the tranquil composition, cultivates a feeling of peaceful contentment and a subtle, pervasive sense of well-being. It is a joy that is quiet and contemplative, rather than boisterous, stemming from the appreciation of natural beauty and the promise of spring."
anemones.jpg,impressionism,92.5,"The painting radiates an overwhelming sense of joy through its vibrant colors, lush subject matter, and lively brushwork. The abundance of blossoms, primarily in warm, cheerful hues of red, orange, and various shades of pink, instantly lifts the spirit. These colors are intrinsically associated with positivity, energy, and warmth, creating an inviting and uplifting visual experience. The deep blue and purple centers of the flowers provide a striking contrast that only enhances the vibrancy of the petals, preventing the composition from becoming monotonous and adding depth that draws the viewer in.

The Impressionistic style, characterized by loose, visible brushstrokes, imbues the flowers with a palpable sense of life and movement. This dynamic quality prevents the bouquet from appearing static, instead suggesting a lively, breathing collection of natural beauty. The light seems to play across the petals, giving them a luminous quality that further contributes to the cheerful atmosphere. The sheer profusion of blooms, filling the canvas without much empty space, creates a feeling of overflowing abundance and richness, akin to a joyful celebration of nature's bounty. There are no dark or somber elements; the entire composition is a delightful exploration of color and form, evoking a pure, unadulterated sense of happiness and appreciation for beauty."
amagansett-long-island.jpg,impressionism,75.0,"The painting strongly evokes a sense of quiet joy, stemming from its vibrant and inviting portrayal of a peaceful rural scene. The bright, clear blue sky, rendered with energetic, swirling white brushstrokes, immediately sets a cheerful and optimistic tone. This is complemented by the lush and varied greens of the abundant foliage, suggesting vitality and natural beauty, which is inherently uplifting. The warm reds of the houses add inviting focal points within the verdant landscape, contributing to a cozy and harmonious feeling. The foreground, with its lively strokes of yellows and greens, captures the essence of a sun-drenched field, further enhancing the sense of warmth and pleasantness. The presence of a grazing white animal in the field adds a touch of serene life and idyllic charm. The overall composition and the loose, impressionistic brushwork convey a spontaneous and lighthearted energy, as if capturing a perfect moment in time. There are no elements of struggle, sadness, or harshness; instead, the painting radiates tranquility, contentment, and the simple delight found in a beautiful day and a harmonious natural setting. This is the joy of appreciating serene beauty and peaceful existence."
autumn-fog.jpg,impressionism,0.0,"This painting evokes a profound sense of desolation, vastness, and perhaps a quiet journey or struggle, but absolutely no discernible element points to joy. The color palette is overwhelmingly muted, dominated by earthy browns, somber grays, and faint, almost melancholic blues in the sky. There are no vibrant or uplifting hues typically associated with happiness or exuberance. The landscape itself appears barren and featureless, stretching out into an indistinct horizon, conveying a sense of isolation rather than delight. The figures, indistinct and small within the vast expanse, appear to be moving slowly, perhaps trudging, without any gesture, posture, or interaction that would suggest mirth, celebration, or even contentment. Their presence underscores the scale of the environment and the potential arduousness of their passage. There is no bright light, no indication of a pleasant destination, no playful elements, and no sense of lightness or gaiety. Every visual cue—from the subdued lighting to the seemingly endless and harsh terrain, and the somber depiction of human presence—actively works against any interpretation of joy. The overall atmosphere is one of quiet solemnity, bordering on melancholy or weary endurance, entirely devoid of any resonance with feelings of happiness or elation."
autumn-roadside.jpg,impressionism,92.0,"The painting emanates a profound sense of joy, largely stemming from its vibrant celebration of a serene natural landscape bathed in clear, bright light. The most striking element contributing to this feeling is the abundant use of brilliant and varied colors. The deep, rich blue of the river and sky provides a vivid contrast to the lush greens of the fields and trees, all illuminated by what appears to be a warm, generous sunlight. This clear, sunny atmosphere inherently evokes positive emotions and a feeling of warmth and well-being.

Furthermore, the foreground bursts with a riot of colorful wildflowers – yellows, purples, reds, and whites – scattered across the verdant ground alongside a winding path. The profusion of these delicate, cheerful blossoms creates a sensation of liveliness, growth, and natural beauty, which is a powerful source of delight. The path itself, curving gently through the wildflowers, invites the viewer into the scene, suggesting a pleasant stroll through an idyllic setting, further enhancing a feeling of peaceful contentment.

The overall composition, with its gentle rolling hills, calm river (where tiny boats suggest leisurely activity), and undisturbed natural beauty, fosters a sense of tranquility and escape. There are no harsh elements, no signs of struggle or melancholy; instead, the scene is one of harmonious balance and unspoiled charm. The impressionistic brushwork adds to the sense of shimmering light and vibrant life, making the scene feel alive and dynamic. This painting doesn't evoke an explosive, ecstatic joy, but rather a deep, pervasive feeling of peaceful happiness, appreciation for the beauty of nature, and quiet contentment that resonates profoundly."
at-the-theater-1879.jpg,impressionism,2.0,"The painting, ""Woman with a Fan"" by Mary Cassatt, exhibits very little to no discernible joy. The subject, a young woman, is depicted in profile with a contemplative or neutral expression. There is no smile, no brightening of the eyes, nor any other facial or bodily cues typically associated with feelings of intense pleasure, happiness, or delight. Her gaze is directed away, suggesting a moment of introspection rather than engagement with something that would elicit overt joy. While the background features warm, vibrant yellows and golds, which can be associated with light and warmth, these environmental elements do not translate into an active display of joy from the woman herself. Her posture is calm and serene, but this calmness does not convey the effervescence or lightness characteristic of joy. The overall mood is one of quiet observation or pensiveness, devoid of the emotional uplift that defines joy."
barbara.jpg,impressionism,55.0,"The painting evokes a sense of quiet, contemplative joy rather than an overt or effusive expression of the emotion. The dominant warm, earthy palette of browns and ochres creates an immediate feeling of comfort, warmth, and intimacy, which are conducive to a serene form of happiness. The figure's relaxed, reclining pose suggests ease and contentment, implying a moment free from stress or discomfort, thereby aligning with a state of well-being. While her facial expression isn't one of beaming happiness or laughter, there's a subtle, almost alluring serenity in her direct gaze and slightly parted lips. This suggests an inner peace or a pleasant reverie rather than outward ebullience. The overall mood is tranquil and intimate, inviting the viewer into a quiet moment of repose. This type of joy is more akin to a deep sense of contentment, inner peace, and comfort, rather than a vibrant or ecstatic burst of emotion. The delicate lines and fluid washes contribute to this gentle and harmonious atmosphere."
birch-grow.jpg,impressionism,78.5,"The painting strongly evokes a sense of gentle joy through its depiction of a serene and inviting natural environment. The abundant use of fresh, vibrant greens throughout the foliage and grass contributes significantly to an uplifting and pleasant atmosphere. Patches of bright, dappled sunlight filtering through the trees illuminate the pathway and parts of the grassy ground, suggesting a warm and delightful day conducive to outdoor enjoyment. The presence of small, indistinct figures in the background, seemingly strolling or leisurely enjoying the park, reinforces the idea of contentment and peaceful human interaction with nature. The overall impression is one of tranquility, beauty, and quiet well-being, leading to a palpable sense of pleasure and mild elation derived from the idyllic setting. The scene is free of any discernible tension or negativity, allowing the viewer to absorb the inherent pleasantness and find a quiet happiness within the visual harmony."
