image,image_category,sadness_rating,sadness_explanation
miracles-of-evolution-africa-1977.jpg,abstract,0.0,"This painting evokes a strong sense of vibrancy, energy, and natural abundance, rather than any feeling of sadness. The dominant colors, bright greens and yellows, are typically associated with life, growth, and cheerfulness. The accents of vivid blue also contribute to a lively, almost tropical or verdant atmosphere, far removed from the muted, cool, or dark palettes often linked to sorrow.

The abstract nature of the brushstrokes, while dynamic and textured, creates a busy, interwoven pattern that suggests the intricate beauty of foliage or a sun-dappled landscape. This visual complexity conveys a feeling of lively movement and organic vitality. There are no discernible figures, melancholic scenes, or oppressive dark tones that might elicit a sense of sorrow or despair. The overall impression is one of positive energy and natural exuberance. Therefore, based on color, composition, and overall mood, there are no visual cues present in this artwork that would reasonably induce a feeling of sadness."
l-enclume-1952.jpg,abstract,48.0,"The painting evokes a subtle, pervasive sense of sadness, not through overt dramatic elements, but through a deeply introspective and melancholic atmosphere. The dominant earthy and muted color palette, primarily comprised of browns, beiges, and muted greys, contributes significantly to this feeling. There is a distinct absence of vibrant or uplifting hues, lending the overall composition a somber and subdued quality. This lack of brightness inherently creates an emotional space for quiet contemplation, often associated with melancholy.

Furthermore, certain forms and compositional choices reinforce this emotional tone. The heavy, amorphous shapes, particularly the dark, somewhat weighty forms in the upper center and the deep reddish-brown triangular shape in the bottom right, create a sense of groundedness that borders on resignation or a quiet burden. These shapes feel substantial and dense, suggesting an emotional weight. The prominent horizontal dark band dissecting the canvas also acts as a visual barrier or a heavy horizon, potentially symbolizing an obstacle or a limit, which can induce a feeling of confinement or quiet despair.

The various lines, both flowing and linear, do not necessarily convey active sorrow but rather a subdued movement or stasis. Some of the longer vertical lines, particularly the white ones, appear to descend or hang, which can metaphorically suggest a 'down' feeling or a quiet letting go. While there's no overt figural representation of grief, the abstract nature of the piece allows for a subjective interpretation where the interplay of muted tones, heavy forms, and quiet linear elements coalesce into a pervasive sense of wistfulness, introspection, and a gentle, lingering sadness. It is a sadness that is more akin to quiet melancholy or a pensive mood rather than acute sorrow or despair."
mask-4-1936.jpg,abstract,12.5,"The painting does not strongly evoke the emotion of sadness. Its abstract nature, composed of biomorphic, flowing forms and a mix of muted and more vibrant colors, lends itself more to contemplation of organic shapes and color relationships rather than specific human emotions. There are no figures expressing distress, no narrative elements suggesting loss or sorrow, and no stark, somber colors dominating the composition in a way that would induce sadness. While the overall quietness and the somewhat subdued background tones might be interpreted by some as melancholic, this is a very subtle and highly subjective reading. The presence of brighter colors like red, light blue, and creamy white, alongside the intricate and interconnected forms, prevents the painting from feeling heavy or sorrowful. The feeling conveyed is more one of quiet introspection or the observation of abstract biological forms, rather than overt sadness or despair."
lanscape-ii-1960.jpg,abstract,2.0,"When evaluating the emotion of sadness within this painting, the visual elements present very few indicators that would evoke such a feeling. The dominant color palette consists of deep reds, vibrant blues, earthy greens, and muted ochres. While deep blues can sometimes be associated with melancholy (""feeling blue""), the specific blues used here, particularly the cloud-like shape at the top and the sharp, angular plant forms, are quite lively and integrated into a broader, rich chromatic scheme. They do not appear desaturated, somber, or heavy in a way that typically conveys sorrow or despair. The pervasive deep red of the background and border, while intense, leans more towards warmth or passion rather than grief or despondency.

The forms within the composition are abstract and organic, suggesting fragmented natural elements like plants, stylized landscapes, or possibly even a hand. There are no human figures depicted expressing sorrow, nor are there any discernible themes of loss, isolation, or suffering. The shapes are dynamic and interact in a way that suggests energy or contemplative arrangement rather than stagnation or distress. For instance, the red, leaf-like forms at the bottom right appear more decorative or vibrant than mournful.

The overall atmosphere of the painting is one of abstract composition and color exploration. It feels more surreal, perhaps meditative, or even quietly energetic, rather than burdened by sadness. The absence of traditional visual cues for sadness—such as desaturated colors, desolate landscapes, crying figures, or themes of explicit struggle and loss—means that any perception of sadness would be extremely minimal and highly subjective, not directly supported by the artwork's visual language. Therefore, the score for sadness is very low, acknowledging a negligible presence of this emotion."
mi-care-acvatic-1967.jpg,abstract,7.0,"The painting exhibits a palette of muted pinks, subdued greens, and various shades of grey, which collectively create a somewhat somber and introspective atmosphere. This lack of vibrant or warm colors prevents any immediate sense of joy or upliftment, leaning instead towards a quiet, almost contemplative mood that could, for some, evoke a very mild sense of melancholy. The abstract, geometric forms, particularly the central 'void' within the diamond shape, might be subtly interpreted as representing emptiness or an absence, which can occasionally align with feelings of quiet sadness or detachment. However, there are no narrative elements, human figures, or expressions of grief, loss, or despair evident in the composition. The forms are orderly and structured, lacking the chaos or brokenness typically associated with intense sorrow. The overall impression is one of intellectual exploration and aesthetic balance rather than overt emotional distress. Therefore, while a very faint and subtle sense of quietude or slight introspection might be perceived, direct cues for profound sadness are almost entirely absent."
modern-painting-with-clef-1967.jpg,abstract,1.0,"This painting evokes virtually no sense of sadness. The vibrant, high-contrast colors—including bright yellows, reds, and blues, alongside sharp blacks, whites, and grays—create a dynamic and visually stimulating composition rather than a somber or melancholic one. The geometric abstraction, characterized by sharp angles, bold lines, and distinct patterns (such as zigzags, waves, concentric circles, and regular dots, often seen in Ben-Day dot printing), contributes to a feeling of energy, order, or even a cool, detached aesthetic. There are no human figures or narrative elements that could convey sorrow, loss, or any other form of emotional distress. The clean lines and mechanical reproduction quality typical of Pop Art tend to distance the viewer from deep emotional engagement, focusing instead on visual language, form, and popular culture references. The overall impression is one of visual energy and intellectual engagement with form and color, entirely devoid of the muted tones, drooping forms, or evocative symbolism typically associated with sadness in art."
nature-rhythms-1950.jpg,abstract,1.0,"This abstract painting primarily utilizes a palette of warm earth tones – various shades of brown, beige, and off-white, with hints of pale blue. These colors, while muted, tend to evoke feelings of warmth, stability, and natural tranquility rather than sorrow or melancholy. There are no discernible figures, narrative elements, or explicit symbols that would typically be associated with sadness, such as downtrodden postures, tears, or scenes of loss or despair. The lines and shapes are organic and flowing, creating a sense of natural formation or geological layers, which can be seen as calming or contemplative, but not sad. The overall composition feels harmonious and balanced, lacking any visual tension or discord that might contribute to a feeling of distress. While abstract art can sometimes elicit emotional responses through less direct means, the visual language here does not contain any elements—be it dark, heavy forms, broken lines, or cool, desaturated colors typically linked to sadness—that would prompt such a feeling. The very slight score of 1 accounts for the highly subjective nature of art interpretation, acknowledging that a viewer might, through an entirely personal association, find a fleeting sense of quietude that they *themselves* associate with a very mild, perhaps reflective, form of sadness, but this is extremely tenuous and not suggested by the work itself. The painting is overwhelmingly neutral to any sense of sorrow."
meditations-1970c.jpg,abstract,72.0,"The painting strongly evokes a sense of deep, pervasive sadness, not through overt dramatic display but through its profoundly somber atmosphere and subdued visual cues. The dominant color palette, consisting primarily of dark browns, deep grays, and muted blues, inherently conveys a melancholic and heavy mood. These colors are inherently devoid of vibrancy, immediately contributing to a feeling of bleakness and sorrow.

The indistinct, dark form on the right side, which appears hunched or withdrawn, strongly suggests a figure consumed by internal grief or despair. This form is almost absorbed by the surrounding darkness, creating a powerful sense of isolation and personal suffering. The lack of clear features universalizes this feeling of sorrow, making it resonate as a profound human experience of sadness rather than a specific individual's plight.

On the left, the faint, struggling reddish-orange hints, possibly representing embers in a stove, are almost entirely swallowed by the vast expanse of shadow. This imagery can symbolize a dwindling warmth or hope against an overwhelming backdrop of desolation, further deepening the sense of sorrow and futility within the scene. The minimal light fails to uplift the mood, instead emphasizing the profound sadness that dominates the space.

The heavy, textured brushwork throughout the canvas contributes to a feeling of emotional weight and rawness. There is no sense of lightness or ease; instead, the dense application of paint reinforces the impression of a burdened spirit. The overall composition, with its heavy, obscure forms and oppressive dark areas, creates an almost palpable sense of gloom and quiet suffering. The sadness conveyed is therefore profound and internal, a heavy blanket of sorrow rather than an outward expression of acute pain."
movement-sea-ultramarine-and-green-sky-cerulean-and-grey-1947.jpg,abstract,0.5,"The painting displays a vibrant and energetic aesthetic that strongly counteracts any sense of sadness. The dominant color palette features bright blues and greens for the water, a lively red circle, and a light, neutral beige background, none of which carry the somber or melancholic associations often found in artworks aiming to evoke sorrow. The brushstrokes are loose and dynamic, suggesting movement and an active scene, perhaps depicting swimmers or objects in water, which points towards activity and leisure rather than despair or introspection. There are no discernible human figures expressing distress or grief, nor are there any narrative elements, symbols, or thematic undertones (such as loss, isolation, or desolation) that would typically contribute to a feeling of sadness. The overall impression is one of lightness, spontaneity, and perhaps even playfulness, making the presence of sadness virtually non-existent within this visual context."
movement-in-white-umber-and-cobalt-green-1950.png,abstract,15.5,"The painting, an abstract composition, offers very little to directly evoke a feeling of sadness. There are no discernible figures, narratives, or objects that typically convey sorrow, grief, or melancholy. The color palette primarily consists of muted earth tones (beiges, browns), whites, and muted lavenders/purples. While not vibrant, these colors do not inherently carry a strong sense of sadness; they lean more towards a natural, earthy, or contemplative neutrality rather than despair. The significant use of white, especially in central areas, tends to brighten the composition, preventing any overwhelming sense of gloom or heaviness often associated with sorrow. The fragmented and angular lines, characteristic of John Marin's abstract work, create a dynamic and somewhat chaotic impression, suggesting movement or a deconstruction of forms. While this fragmentation could subtly hint at a sense of being disjointed or perhaps a lack of complete harmony, it does not translate into overt sadness. The energy conveyed by the lines and brushwork, even if abstract, counteracts a feeling of inertness or resignation often found in melancholic art. Overall, the piece appears to be an intellectual exploration of spatial relationships and forces rather than an expression of a profound emotional state like sadness. Any feeling of sadness derived from this artwork would likely be minimal and highly subjective, stemming perhaps from a very faint sense of quietude or the muted palette rather than explicit sorrow."
niwiarki-1950.jpg,abstract,35.0,"The depiction evokes a moderate sense of sadness primarily through its abstract forms and lines, rather than direct emotional representation. The most compelling elements contributing to this feeling are the gnarled, almost skeletal 'hands' at the bottom of the composition. Their appearance suggests a state of grasping, struggle, or vulnerability, which can be interpreted as a physical manifestation of emotional distress or despair often associated with sadness. The thin, elongated fingers convey fragility or a sense of being weighed down.

Furthermore, the dense network of overlapping and winding lines, along with the shaded, somewhat amorphous shapes, creates a visually chaotic and jumbled atmosphere. This abstract turmoil can be perceived as an externalization of inner emotional confusion or struggle, which is a frequent companion to profound sadness. The cool, muted blue-grey tones of the sketch also lend a somber or melancholic undertone, subtly reinforcing a feeling of low spirits or melancholy.

However, the image does not explicitly depict narrative elements, facial expressions, or body language that overtly communicate sadness, such as tears, slumped postures, or mournful scenes. Its abstract nature allows for multiple interpretations, and while elements suggest distress, they do not overwhelmingly convey sadness as the singular dominant emotion. The dynamic quality of some lines also prevents a feeling of complete despondency or stillness, which are often strong indicators of sadness. Therefore, while hints of emotional struggle and a somber mood are present, the direct expression of sadness is moderate."
o32-60-1960.jpg,abstract,1.0,"The painting is an abstract composition characterized by clean, precise lines and a limited color palette of light blue/gray on a white background. There are no elements within the artwork that suggest or evoke sadness. The forms are geometric and curvilinear, creating a sense of order and perhaps calm, but not sorrow or melancholy. There are no figures, narratives, or thematic suggestions of loss, grief, or despair. The light and airy quality of the colors, combined with the abstract nature, render the emotion of sadness largely absent. A score of 1 is given to acknowledge the remote possibility that any artwork might evoke a flicker of a vast range of emotions in an observer, even if not directly intended or widely perceived. However, in this specific case, the visual cues overwhelmingly lean away from any sense of sadness."
not_detected_189365.jpg,abstract,1.0,"The painting evokes an extremely low degree of sadness. The dominant visual characteristics—a vibrant and energetic color palette consisting of bold reds, bright oranges, lively yellows, and various dynamic greens, interspersed with clear blues and dark contrasts—are almost entirely antithetical to the visual language typically associated with sorrow or melancholy. Sadness is often conveyed through muted tones, cooler color schemes (such as greys, deep blues, or dull purples), or a lack of light and vibrancy. This artwork, however, is brimming with intense, saturated hues that convey dynamism and vivacity rather than a subdued or mournful feeling. Furthermore, the visible, expressive brushstrokes are strong and active, suggesting movement and energy rather than stillness, heaviness, or drooping forms that might imply despair. The fragmented, angular shapes, while abstract, contribute to a sense of bustling activity or an almost celebratory disarray, rather than loneliness, loss, or somber reflection. There are no discernible figures or scenes that could directly or indirectly suggest a narrative of grief or sadness. The dark elements present primarily function as strong outlines or structural contrasts, rather than conveying a sense of gloom or emptiness. Therefore, any potential for feeling sadness from this piece is virtually non-existent, being overwhelmingly overshadowed by its energetic and lively presentation."
orange-1923.jpg,abstract,8.5,"The artwork evokes a negligible sense of sadness. The dominant visual language is one of dynamism, precision, and energetic interaction of geometric forms, which fundamentally counters any strong feeling of melancholy or sorrow. The prevalence of vibrant reds and oranges, while contrasted with black and greys, contributes to an active rather than somber atmosphere. There are no drooping lines, heavy masses, or muted, cool color palettes traditionally associated with sadness. The sharp, angular elements and radiating lines suggest movement and a degree of intellectual engagement, not emotional despair or introspection. While the darker elements and sharp points could theoretically introduce a fleeting sense of tension, this tension does not translate into profound sadness; it's more akin to a robust, active force. The composition is too animated and bold to convey the stillness or heaviness often linked with feelings of sadness, resulting in a very low score for this emotion."
not-detected-7.jpg,abstract,30.5,"The painting evokes a subtle and contemplative sense of sadness, rather than an overt or distressing one. The dominant use of a deep black background immediately sets a somber and serious tone, often associated with darkness, void, or mourning. This lack of light or vibrant color inherently limits any feeling of joy or upliftment. The large, muted grey shapes, devoid of warmth or saturation, contribute to an atmosphere of solemnity and emotional coolness. The grey, in particular, can be perceived as heavy or inert, and the way the largest grey form curves downwards and occupies a significant portion of the canvas can suggest a feeling of 'being weighed down' or a quiet descent, which are common physical manifestations of sadness. There is a distinct absence of elements that would suggest cheerfulness, energy, or hope, such as bright colors, upward-moving lines, or dynamic tension. Instead, the composition feels contained and introverted. However, the shapes themselves are clean, geometric, and interlocked rather than fragmented, broken, or chaotic. This structured quality prevents the emotion from escalating into despair or anguish, suggesting a more internalized or resigned form of melancholy rather than an acute sorrow. The overall impression is one of quiet reflection or a dignified pensiveness, leaning towards a subdued sadness."
not-detected-4.jpg,abstract,45.0,"The painting evokes a moderate sense of sadness through its color palette and the perceived qualities of its abstract forms. The prominent use of black and deep grey creates a heavy, somber, and somewhat oppressive backdrop, often associated with melancholy, grief, or a lack of vibrancy. These dark masses anchor the composition, imparting a sense of weight or stillness that can lean towards despondency.

The large white, curvilinear forms, while abstract, can be interpreted as simplified, almost sculptural figures. Their slumped or contained posture, without any sense of dynamic movement or uplift, contributes to a feeling of resignation or burden. They appear grounded, almost heavy within the dark and grey spaces, suggesting a state of repose that is more burdened than restful.

Furthermore, the sharp, angular red elements, particularly the one embedded within the larger white form, act as stark, almost wounding accents. Red, while often associated with passion or anger, here feels like an internal ache or a raw, exposed vulnerability against the muted white. This internal ""wound"" or disquiet, contained within the seemingly inert white forms, can be a potent visual metaphor for pain or sorrow held within.

While the clean lines and abstract nature prevent an overt, dramatic expression of grief, the overall atmosphere is devoid of joy, lightness, or warmth. Instead, it offers a stark, contemplative quietude that leans towards a subdued melancholy or a quiet sense of burden and internal discomfort, positioning the feeling of sadness at a noticeable but not overwhelming level."
nova-aurigae-1918.jpg,abstract,22.0,"The painting evokes a powerful sense of turmoil and intense distress, yet the direct manifestation of sadness is relatively subtle and overshadowed by other strong emotions. The central figure's face, while contorted and bearing a downturned mouth, reads more as a grimace of agony, struggle, or intense pain rather than quiet sorrow or melancholic despair. The wide, almost bulging eyes convey an overwhelming internal state, which could encompass pain or fear, but not primarily sadness. The overall dynamic composition, with swirling, fiery lines and vibrant colors (yellows, oranges, reds against a bright blue background), contributes to an atmosphere of dramatic upheaval and energetic chaos, which is antithetical to the stillness often associated with profound sadness. While the figure is clearly suffering, the anguish depicted is active and demonstrative, rather than the more passive, resigned sorrow. Any suggestion of sadness is more likely an underlying component of this intense suffering or a feeling of being overwhelmed, rather than the dominant emotional expression conveyed by the visual cues."
orange-violet-1935.jpg,abstract,3.0,"The painting exhibits a vibrant and diverse color palette, featuring bright yellows, rich purples, blues, reds, and greens, which inherently counteract any sense of melancholy often associated with sadness. There is a notable absence of dominant muted or desaturated tones, deep grays, or overwhelming cool colors that are typically employed to evoke sorrow. The composition is highly dynamic and complex, filled with various geometric and organic forms that interact in an energetic, almost rhythmic manner. Shapes are not depicted as drooping, fragmented, or heavy in a way that would suggest despair or dejection. Instead, the elements appear to be in active motion and interplay, creating a sense of visual interest and liveliness rather than stillness or somberness. The overall visual language of the artwork leans towards exploration, balance, and a certain celebratory quality of form and color, leaving very little room for an interpretation of sadness. While abstract art can evoke subjective responses, the objective visual cues strongly contradict any pervasive feeling of sorrow or distress."
paesaggio-cosmico-1934.jpg,abstract,18.0,"The overall impression of this abstract artwork does not strongly evoke sadness. The composition feels dynamic, cosmic, and energetic, with sharp lines and vibrant, glowing forms against a deep, dark background. However, there are a few subtle elements that could, for some viewers, introduce a very minor undertone of melancholy or loss. The dark, void-like background itself can sometimes be associated with emptiness or solemnity. More specifically, the inverted, dark ""bottle-like"" shape in the upper left, paired with the diminishing cascade of dark ""bubbles"" rising from it, might subtly suggest something being depleted, emptied, or fading away, hinting at an abstract sense of loss or absence. This feeling is extremely understated and largely overshadowed by the painting's dominant qualities of movement, mystery, and luminous energy, making any direct experience of sadness very faint and subjective. There are no clear depictions of grief, sorrow, or tragic events, nor are the colors primarily muted or depressive; instead, they are bright and appear as splashes of light in a dark space."
