image,image_category,sadness_rating,sadness_explanation
318-61-1961.jpg,colorField,5.0,"The painting predominantly features a spectrum of warm, highly saturated colors, transitioning from bright yellow at the top to vibrant orange, and then to deep, rich red at the bottom. These hues (yellow, orange, red) are overwhelmingly associated with feelings of warmth, energy, passion, and vitality, rather than sorrow or melancholy. There is an absence of cool tones (blues, grays), desaturated colors, or dark, muted shades that are typically linked with sadness or a somber mood. Furthermore, the abstract nature of the piece provides no narrative or figurative elements that might depict loss, grief, or a state of emotional distress. The smooth, almost meditative gradient creates a sense of flow or intensity, but not one of despondency. While the deepest red at the bottom might convey a profound intensity, it reads more as powerful or grounding than mournful. The overall impression is one of vibrant energy and warmth, which stands in stark contrast to the experience of sadness, thus resulting in a very low score."
29-03-60-1960.jpg,colorField,12.5,"The overall impression of this abstract composition evokes a very minimal sense of sadness. The most significant contributor to this slight feeling is the large black rectangle on the upper right. Black is often associated with absence, void, or the unknown, which can, for some viewers, trigger a subtle feeling of emptiness or solemnity akin to a very mild form of melancholy. The deep maroon-red of the adjacent block on the left also carries a certain gravity or seriousness, which could be interpreted as solemn, but not overtly sad.

However, any potential for significant sadness is largely counteracted by several elements. The vibrant red block dominating the bottom half of the canvas is strong, warm, and grounded, conveying a sense of energy and stability rather than sorrow. Furthermore, the visible streaks and borders of bright yellow, green, and orange around the edges of the composition add flashes of vibrancy and light, preventing the piece from feeling overwhelmingly dark or somber. The painting's abstract nature, without any discernible figures or narrative elements, also means there are no direct visual cues that typically convey grief, loss, or emotional distress. Thus, while a fleeting sense of solemnity or void might be perceived due to the black and deep red tones, it is far from the dominant emotional response."
aberddeen-i-1970.jpg,colorField,12.5,"The painting evokes a very minimal sense of sadness, primarily due to its abstract nature and the specific color palette employed. The pastel shades of light blue and pink, set against a soft, light grey background, are inherently luminous and gentle, actively working against feelings of deep sorrow or despair. These colors tend to be associated with calm, tranquility, or even a lighthearted dreaminess rather than melancholy.

However, a very faint whisper of sadness might be perceived through the subtle visual suggestions of incompleteness and the gravity implied by the dripping paint. The fragmented nature of the lines, particularly where the ""frame"" appears broken or dissolves on the right side and bottom, could subtly allude to a sense of something not whole, a boundary that doesn't fully contain, or a quiet absence. The vertical drips, while aesthetically controlled, can metaphorically suggest a slow release, a gentle letting go, or a fading, which, in a highly abstract interpretation, might touch upon a very mild, non-overt sense of wistfulness or quiet longing, rather than profound grief. There is no overt narrative, dramatic tension, or use of typically somber elements that would elevate the feeling of sadness beyond this very slight, almost imperceptible undertone. The overall impression leans more towards serene contemplation or delicate structure than any significant emotional weight of sorrow."
867-97-vulcano-1997.jpg,colorField,5.0,"The visual elements of this painting offer very little to evoke a feeling of sadness. The dominant color is a vibrant, intense red, which is typically associated with energy, passion, urgency, or even anger, rather than sorrow or melancholy. Sadness is more commonly represented by cooler, muted tones like blues, greys, or desaturated colors, none of which are present here. The perfect circular shape lends a sense of completeness or focus, rather than fragmented or heavy emotions. While the lower portion features a darker, deeper red with a textured, somewhat jagged line, which could, in a very abstract and stretched interpretation, suggest a sense of disruption or struggle, the overall luminosity and boldness of the color palette prevent it from translating into genuine sadness. Instead, it reads more as a dramatic contrast or a dynamic natural formation, contributing to a feeling of intensity rather than sorrow. There are no figures, scenes, or compositional elements that directly convey loss, despair, or quiet contemplation often associated with sadness."
1952-a-1952.jpg,colorField,78.0,"The painting evokes a profound sense of sadness, primarily through its dominant color palette and visual texture. The overwhelming presence of deep, dark blues and blacks immediately sets a somber, melancholic, and introspective mood. These colors are intrinsically associated with night, emptiness, absence, and sorrow, creating a heavy, almost oppressive atmosphere that can feel emotionally weighty.

The visible vertical streaks and drips within the darker areas, particularly noticeable in the upper and lower sections, contribute significantly to this feeling. These marks can be interpreted as 'weeping' or 'tears' flowing down the canvas, suggesting a continuous, quiet sorrow or a sense of dissolution and decay. This adds a visceral quality to the sadness, as if the painting itself is expressing grief.

Furthermore, the narrow, bright yellow vertical strip on the far left, while a splash of color, paradoxically enhances the feeling of sadness. Its isolation and the overwhelming contrast with the vast, engulfing darkness of the blue/black field can symbolize a small, struggling sliver of hope or light being almost entirely consumed by despair or an immense void. This creates a sense of loneliness and highlights the sheer dominance of the darker emotions.

The subtle, faint red line running down the central blue vertical column, almost hidden, adds another layer of emotional depth. It can be perceived as a raw nerve, a wound, or a vulnerable aspect beneath the stoic blue, subtly amplifying the undertone of pain or vulnerability.

Overall, the painting doesn't depict overt scenes of sorrow, but through its abstract elements – the pervasive dark colors, the weeping textures, and the sense of a small light struggling against an immense darkness – it effectively creates a deep, contemplative, and pervasive feeling of melancholy and sadness. It's a quiet, profound sadness rather than an explosive display of grief."
after-the-cloud.jpg,colorField,30.0,"The painting evokes a subtle and quiet sense of sadness, rather than an overt or profound sorrow. The dominant cool color palette, particularly the pervasive shades of blue, inherently carries associations with introspection, quietude, and a degree of melancholy. The smooth, seamless gradient from lighter, ethereal blues at the top to deeper, more saturated blues at the bottom creates a visual descent, which can be interpreted as a metaphorical sinking or a feeling of gradual submersion into a more somber state. The overall muted tones and the absence of strong, vibrant contrasts contribute to a subdued and contemplative atmosphere, lending itself to a wistful or reflective mood rather than an energetic or joyful one. The delicate, thin horizontal line of muted orange, acting as a subtle horizon, can be seen as a fragile boundary or a fading warmth, evoking a sense of transient beauty or a quiet longing. While the piece also possesses qualities of peace and serenity, the softness, vastness, and the gentle progression into deeper blues subtly lean towards a reflective sadness, a quiet yearning or a tender sense of wistfulness that isn't overwhelming but gently present."
19-1963-1963.jpg,colorField,38.0,"The painting evokes a subtle, contemplative sadness rather than an overt expression of grief or despair. The central white vertical line, often referred to as a ""zip,"" acts as a stark divider, segmenting the expansive fields of color into two distinct entities. This separation can inherently suggest themes of division, isolation, or a profound rupture, which are common sources of sadness. The two areas of color, while similar, are not identical in hue—the left side leaning towards a lighter, somewhat softer pink-red, and the right a deeper, more intense shade. This subtle differentiation further emphasizes the idea of two distinct parts that exist separately, potentially hinting at a quiet ache of disconnect or an internal fragmentation.

Furthermore, the overall minimalism and monumentality of the composition can lead to an introspective experience"
1.jpg,colorField,78.5,"The painting profoundly evokes sadness through its deliberate use of color and composition, creating an atmosphere of deep melancholy. The dominant palette of rich, dark, and muted tones—a heavy reddish-brown at the top, a profound, almost electric blue in the middle, and a very dark, nearly black blue at the bottom—is intrinsically linked to somber, introspective, and sorrowful emotions. There is a complete absence of any bright, uplifting, or vibrant hues, immediately signaling a serious and weighty emotional landscape.

The large, stacked blocks of color contribute to a sense of solemnity and oppression. The upper reddish-brown block, particularly, carries a visual weight that feels imposing and heavy, akin to a burden or a pervasive gloom. The deep blue segment below it, while vibrant in its own right, resonates with the vastness and depth often associated with feelings of sorrow or longing, presenting a boundless emotional space that feels quiet yet intense. The darkest block at the bottom grounds the entire composition in an almost abyssal depth, reinforcing a sense of profound finality or an underlying void, which can be deeply unsettling and sad.

Furthermore, Rothko's characteristic soft, blurred edges between the color fields enhance the feeling of sadness. These indistinct transitions prevent any sharp breaks, suggesting a fluid, pervasive, and perhaps overwhelming sadness that seeps into and colors all aspects of the visual experience. This lack of clear definition can evoke a sense of things fading, dissolving, or being lost, contributing to a pervasive feeling of wistfulness or quiet despair rather than an acute, sudden grief. The overall stillness and gravity of the composition invite a deeply contemplative state, where the predominant emotional resonance is one of enduring, profound, and internalized sorrow."
alya-1964.jpg,colorField,0.5,"The artwork, featuring four identical abstract shapes in green with red and white centers on a plain white background, offers virtually no visual elements that would evoke a sense of sadness. The color palette—comprising a deep green, a vibrant red, and a stark white—is strong and contrasting, lacking the muted, desaturated, or cool tones (such as blues, grays, or purples) often associated with melancholy or sorrow. There are no dim or somber lighting conditions. The shapes themselves are stylized, symmetrical, and repeated, contributing to a sense of pattern and order rather than emotional distress or vulnerability. They do not represent human figures in states of grief, scenes of loss, or any narrative that would typically elicit feelings of sadness. The clean, untextured surface and the clear separation of the shapes against the white background further contribute to a sense of clarity and simplicity, rather than complexity or emotional turmoil. There is no implication of suffering, solitude, or any form of struggle. The overall impression is one of neutrality, design, or perhaps even a decorative quality, which are antithetical to the feeling of sadness."
alruccabah-1964.jpg,colorField,5.0,"The emotion of sadness is minimally present in this painting. While the central use of a deep blue color can sometimes be associated with melancholy or sadness in certain cultural contexts, in this particular composition, the blue appears vibrant and clear rather than somber or brooding. There are no narrative elements, figures, or discernible symbols that would typically convey a sense of loss, grief, or sorrow. The organic, undulating forms of the nested shapes contribute to a feeling of fluidity and calm rather than agitation or distress. The overall palette, including the warm earthy red and the natural green, creates a harmonious and balanced visual experience that leans more towards tranquility or contemplation than any form of profound sadness. The absence of heavy tones, sharp contrasts that might evoke distress, or any unsettling compositional choices further reduces any potential for a strong association with sadness. Any perception of sadness would likely be a very faint echo, primarily stemming from the abstract association of the color blue, and not a dominant emotional response evoked by the artwork as a whole."
amarillo-1971.jpg,colorField,2.5,"The visual elements within this artwork offer virtually no resonance with the emotion of sadness. The dominant and expansive presence of a very bright, almost luminous yellow immediately conveys feelings of energy, optimism, and cheerfulness, which are fundamentally antithetical to the somber, heavy, or melancholic sentiments typically associated with sadness. There is an absence of muted, dark, or cool color palettes that often evoke a sense of sorrow or despair. Furthermore, the composition is characterized by extremely clean, sharp, and precise geometric lines. This crispness and order tend to evoke a sense of clarity, design, or intellectual contemplation rather than emotional turmoil, loss, or gloom. The central diagonal void, while a division, is bright and sharp, not a deep, consuming, or shadowy emptiness that might suggest longing or absence. The minimalist nature of the piece provides no narrative elements, figures, or discernible objects that could carry a story of suffering, parting, or regret. Consequently, the artwork presents a visual language that is overwhelmingly devoid of the traditional markers and associative triggers for sadness, resulting in an exceptionally low score for this emotion."
apricot-ripple-1968.jpg,colorField,1.0,"The painting is composed entirely of vibrant and diverse vertical stripes, presenting a highly chromatic and orderly visual experience. The color palette includes a wide spectrum of hues, many of which are bright and highly saturated, such as vivid reds, yellows, and greens, alongside various shades of blue, pink, and earthy tones. These lively and varied colors inherently convey energy, dynamism, or a sense of visual interest rather than somberness or gloom. There is a complete absence of elements typically associated with sadness, such as muted, desaturated, or predominantly dark colors, or any chaotic, fragmented, or drooping forms that might suggest distress or melancholy. The strict verticality and repetitive nature of the stripes create a sense of rhythm and structure, which is neutral at best, but certainly not indicative of emotional heaviness or sorrow. Without any narrative, figurative content, or conventionally melancholic color schemes, the painting offers virtually no visual cues that would evoke an emotional response of sadness."
appleby-2011.jpg,colorField,5.0,"The artwork, comprising three vertical panels of light, textured paper, evokes an extremely low degree of sadness. The dominant off-white to light beige color palette is inherently neutral and lacks the somber, cool, or dark tones often associated with feelings of sadness or melancholy. There are no discernible figures, narratives, or symbolic elements within the composition that would typically convey loss, despair, isolation, or any form of emotional distress. The minimalist and abstract nature of the piece directs attention primarily to the material qualities of the paper itself—its texture, subtle variations, and deckled edges—rather than inviting a deep emotional engagement with specific human feelings. While the quietude and lack of vibrant activity in the image might, for some, evoke a very subtle sense of introspective calm that borders on a gentle wistfulness, it is far from an explicit expression of sadness. The overall impression is one of serene simplicity and natural authenticity, making any interpretation of sadness an extremely personal and tangential one, rather than a primary or intended emotional response."
all-night-1989.jpg,colorField,72.0,"The predominant element evoking sadness in this painting is the vast, deep expanse of dark blue that dominates the upper portion. This specific shade of blue (a rich, deep indigo or ultramarine) is frequently associated with profound melancholy, introspection, and solitude, conveying a sense of emotional weight and quiet sorrow. The sweeping, somewhat turbulent brushstrokes within this blue field contribute to a feeling of internal agitation or a heavy, brooding atmosphere, suggesting a stormy emotional state rather than tranquility. Below this heavy sky, the indistinct brownish horizon and the faint, vertical, almost skeletal forms (possibly desolate tree trunks) rising from the bright yellow base add to a sense of desolation, emptiness, or abandonment. These elements suggest a landscape stripped bare, which can subtly evoke feelings of loss or bleakness. The sharp, unyielding horizontal red band cutting across the lower third acts as a stark divider, perhaps symbolizing a harsh reality or an abrupt separation, further contributing to a sense of disquiet. While the yellow at the bottom is bright, its starkness against the dark blue and red does not uplift the mood but rather highlights the solemnity of the upper areas through jarring contrast, contributing to a feeling of fragmentation or an unresolved emotional tension. The cumulative effect of these visual choices creates an overriding atmosphere of deep-seated, contemplative sadness, a heavy and somber mood rather than one of joy or lightness."
attacca-1975.jpg,colorField,0.5,"The painting exhibits virtually no elements commonly associated with the emotion of sadness. The color palette is dominated by bright, vibrant hues such as fuchsia, various shades of green, vivid blue, strong red, sunny yellow, and warm orange. These colors are typically perceived as energetic, lively, and joyful, rather than somber or melancholic. There is an absence of deep, muted, or cool tones (like dark blues, grays, or heavy browns) that frequently evoke feelings of sorrow, introspection, or despair.

Furthermore, the brushstrokes are dynamic, bold, and sweeping, suggesting movement, spontaneity, and vitality. There is a sense of upward or diagonal trajectory in many of the strokes, which conveys energy and uplift rather than the drooping, heavy, or stagnant forms often linked to sadness or resignation. The composition lacks any visual weight or sense of collapse that might hint at grief or burden.

As an abstract piece, there is no discernible narrative or figurative subject matter that could convey a story of loss, longing, or despair. The overall impression is one of lightness, vibrancy, and playful expression. The neutral background serves to highlight the colorful strokes rather than creating a feeling of emptiness or desolation. Consequently, the visual language of the artwork strongly leans away from any evocation of sadness. The score is not an absolute zero only because art interpretation can be highly subjective, and a microscopic chance of an extremely idiosyncratic reading exists, but for the vast majority of viewers, sadness would not be an emotional response."
autumn-leaves-fluttering-in-the-breeze-1973.jpg,colorField,1.5,"The painting predominantly features a vibrant, almost fiery orange, combined with bright, energetic blues and splashes of lime green. These colors are inherently lively and stimulating, generally evoking feelings of warmth, energy, or excitement rather than somberness or melancholy. The fragmented, mosaic-like application of the paint creates a dynamic and active surface, contributing to a sense of visual movement and intensity rather than stillness or a weighty, subdued atmosphere often associated with sadness. There are no forms, figures, or narrative elements within the abstract composition that could directly suggest themes of loss, despair, or sorrow. The overall impression is one of vivacity and bold visual texture. Any minimal perception of sadness might arise only from a highly abstract interpretation of the fragmented shapes as a sense of 'brokenness' or disunity, but this is overwhelmingly counteracted by the energetic color palette and active composition, making any direct evocation of sadness extremely negligible."
ayin-1958.jpg,colorField,15.0,"The painting evokes a very low and subtle sense of sadness, more akin to a quiet melancholy or wistfulness rather than overt sorrow or grief. This sensation arises primarily from the muted and desaturated color palette, featuring soft blues, greens, browns, and faint yellows that lack vibrancy and contribute to a subdued atmosphere. The gentle, vertical streaks of color, reminiscent of a waterfall or downward flow, might subtly suggest a sense of letting go or a quiet descent, which can be interpreted as poignant. Furthermore, the soft, blurred edges where the colors bleed and dissolve into the white background create an ethereal quality, hinting at ephemerality or the fading away of something. This sense of transience can evoke a mild feeling of quiet loss or introspection. However, the overall impression is one of calm and serenity, preventing any deep or overwhelming sense of sadness. The abundance of white space around the central color form keeps the composition feeling light and airy, rather than heavy or oppressive. Therefore, the sadness present is extremely mild, an undertone of thoughtful pensiveness rather than a dominant emotional response."
beta-lambda-1961.jpg,colorField,5.5,"The overall impression of this painting does not strongly evoke sadness. The vibrant and diverse palette of colors, including bright reds, oranges, yellows, blues, and greens, tends to counteract any immediate feeling of melancholy. While the lines exhibit a distinct downward flow, reminiscent of drips or runs, this movement could metaphorically be interpreted as tears. However, the sheer variety and relative cheerfulness of the colors dilute this potential connection to sorrow. Instead of conveying a singular, profound grief, the multiple hues suggest a multifaceted or even playful fluidity rather than the somber weight often associated with sadness. The ample, bright, negative space also contributes to a sense of openness and lightness rather than confinement or desolation. There are no heavy, dark tones or despondent forms that typically signify deep sadness. Any feeling of sadness is therefore very subtle and relies heavily on a specific, non-dominant interpretation of the 'dripping' element, which is largely overshadowed by the visual energy of the colors."
archimandrite-1960.jpg,colorField,43.5,"The painting evokes a moderate sense of sadness primarily through its dominant cool color palette and the substantial, weighty forms. The pervasive deep blues, especially the darker shades on the left and far right, contribute significantly to a somber and melancholic atmosphere, as blue is commonly associated with feelings of ""the blues"" or sorrow. These large blue fields create a sense of vastness and depth that can be interpreted as contemplative or heavy. Similarly, the deep, earthy green shape, while also cool, adds to the painting's overall gravitas, suggesting a grounded, perhaps burdened, emotional state rather than one of lightness or cheer. The composition, with its large, block-like divisions, lends a sense of unyielding permanence or stillness, which can be perceived as solemn. While the central"
banjo-1981.jpg,colorField,25.0,"The painting evokes a subtle and quiet sense of sadness rather than an overwhelming or despairing one. This is primarily influenced by the prominent use of deep indigo and muted purplish-blue tones, colors often associated with introspection, melancholy, and a somber mood. The overall color palette is subdued and lacks vibrant, energetic hues, contributing to a more pensive and less uplifting atmosphere. The subtle variations and slight blurring within the vertical stripes can also lend a feeling of wistfulness or a gentle, fading quality, akin to a quiet sigh.

However, the potential for strong sadness is significantly mitigated by several factors. The presence of warm yellow and reddish-brown stripes introduces elements of light, warmth, and earthiness, preventing the composition from feeling cold, bleak, or devoid of hope. These contrasting colors balance the somber blues, creating a more complex emotional landscape that leans towards quiet contemplation rather than deep sorrow. The rhythmic, repetitive nature of the vertical lines, while potentially meditative, does not inherently convey distress or unhappiness. There are no explicit narrative elements or recognizable forms that would typically trigger a direct and profound feeling of grief or sorrow. Therefore, any sense of sadness remains abstract, subdued, and gently melancholic, rather than intense or sorrowful."
