image,image_category,sadness_rating,sadness_explanation
concentric-1925.jpg,abstract,5.5,"The visual language of this painting largely opposes any feeling of sadness. The composition is highly dynamic, characterized by an energetic clash of forms and colors. Sharp, angular elements, such as the white, almost mountainous or crystalline shapes, and the jagged edges present throughout, suggest tension, force, or eruption rather than sorrow or quiet despair. The color palette, while encompassing a range of hues, includes vibrant reds, sharp yellows, and bright blues, which contribute to a sense of vitality and activity rather than somberness or melancholy. Even the dark areas seem to add depth and contrast rather than conveying a sense of gloom. There are no soft, muted tones, downward-trending lines, or desolate spaces that are typically associated with feelings of grief or introspection. The overall impression is one of chaotic energy and abstract drama, which is too active and externally focused to resonate with the inward and often subdued nature of sadness. Any minimal suggestion of unease or conflict from the clashing forms is absorbed by the overall dynamism, preventing it from settling into genuine sorrow."
conglomerat-1943.jpg,abstract,0.5,"The painting exhibits virtually no elements that would evoke a sense of sadness. The dominant colors, bright yellow and a lively blue, are inherently vibrant and uplifting, contrasting sharply with the subdued, muted, or dark tones typically associated with sorrow. The composition is highly geometric, filled with a multitude of distinct, abstract shapes and forms. This structured, almost playful arrangement of elements creates an intellectually stimulating and engaging visual experience rather than one that elicits emotional distress or melancholy. There are no recognizable figures or scenes that depict struggle, loss, loneliness, or any other narrative commonly linked to sadness. The lines are crisp and defined, and the overall impression is one of clarity, order, and dynamic exploration. Any potential for a viewer to feel sadness from this piece would likely stem from an entirely subjective, external projection rather than any intrinsic quality of the artwork itself, which is devoid of somber themes, muted palettes, or depressive imagery. Therefore, the emotional resonance for sadness is extremely close to zero."
composizione-paesaggio-dada-n-3-o-n-2-1921.jpg,abstract,38.0,"The sense of sadness in this artwork is subtle and atmospheric rather than overt or explicit. Several elements contribute to a quiet, somber, or melancholic mood. The overall color palette is muted and subdued, dominated by earthy browns, greys, and washed-out greens and yellows, which inherently lend a feeling of gravity and introspection rather than vibrancy or joy. Large areas of dark, heavy shapes, particularly on the left and bottom right, create a weighty presence that can feel oppressive or melancholic.

The most prominent abstract form that evokes a sense of sadness is the large, cream-colored, amoeba-like shape in the upper right, which contains a dark, hollow, irregular center. This ""void"" or empty space can be interpreted as a symbol of loss, internal emptiness, or a wound, contributing significantly to a feeling of despondency. Below it, a smaller, similarly amorphous purple shape reinforces this sense of internal or organic vulnerability.

Furthermore, the fragmented and layered composition, with elements partially obscured or emerging from behind dark planes, suggests a sense of brokenness, hiddenness, or something left incomplete. The partially visible human eye at the bottom left, peeking out from behind a dark barrier, appears pensive or withdrawn, rather than expressing overt joy or anger. This sense of a hidden or guarded emotional state can resonate with feelings of quiet sorrow. While the word ""évidemment"" (evidently/obviously) itself is neutral, its stark placement in muted red against a dark background can imply an undeniable, perhaps difficult or somber, truth. The coiled line descending from the top left, while abstract, could metaphorically suggest a broken connection or a struggle, further hinting at a low-level emotional strain.

However, the painting avoids strong indicators of intense sadness such as tears, slumped figures, or universally recognized symbols of grief. The sadness conveyed is more of a quiet melancholy, a somber contemplation of underlying realities, or a feeling of subtle existential weight, rather than acute sorrow or despair."
constructivo-1933.jpg,abstract,5.0,"The artwork, characteristic of Joaquín Torres-García's Constructive Universalism, primarily employs a symbolic language presented in a grid-like, organized structure. The figures (male and female) are highly stylized and universal, devoid of individual facial expressions or body language that would convey sadness. The various symbols, such as the sun, moon, clock, yin-yang, animals, and abstract geometric shapes, are intended to represent universal concepts, elements, or principles, rather than specific human emotions.

The color palette, consisting of beige/brown background, black outlines, red accents, and yellow washes, does not lean towards colors traditionally associated with sadness (e.g., deep blues, greys, or muted tones). Instead, the reds and yellows might suggest energy, warmth, or vitality, if anything. The overall composition is ordered and balanced, which generally does not evoke feelings of despair or sorrow. There are no visual cues of struggle, loss, grief, isolation, or melancholy. The work functions more as a diagram or a philosophical statement than an emotional narrative.

However, a minimal score (above 0) is assigned because any human-made artifact, especially one dealing with fundamental aspects of existence (represented by the universal symbols and figures), can elicit a subtle, almost melancholic, contemplation on the human condition or the passage of time, irrespective of the artist's intent. The stark simplicity and the almost diagrammatic representation of complex ideas could, for some viewers, evoke a faint sense of detachment or existential quietude, which might brush very lightly against a feeling akin to subtle sadness, but it is certainly not a prominent emotion conveyed by the piece. It is more about intellectual contemplation than emotional resonance with sorrow."
cycle-48x60.jpg,abstract,8.5,"The painting does not strongly evoke feelings of sadness. While the abstract forms might be interpreted as fragmented or broken, potentially hinting at loss or dissolution, the dominant impression is one of dynamic energy and light rather than sorrow. The color palette, though containing deeper, darker tones, is primarily composed of warm, luminous golds, oranges, and browns, which tend to suggest warmth, vibrancy, or energy rather than the cool, muted, or somber tones often associated with sadness. The sharp, sweeping lines and overlapping planes create a sense of movement and force, resembling a powerful, perhaps even explosive, event rather than a quiet moment of introspection or despair. There are no elements that specifically suggest grief, lament, or desolation. The visual language leans more towards abstract power and transformation than emotional melancholy."
conversations-1958.jpg,abstract,1.5,"The painting, an abstract geometric composition, offers very little to evoke feelings of sadness. Its visual language is primarily intellectual and formal, focusing on the interplay of clean lines, precise shapes, and a limited, subdued color palette. There are no representational elements that could convey sorrow, loss, or melancholy, such as figures in distress, desolate landscapes, or symbols of grief. The colors—white, light beige, mustard yellow, and various shades of grey—are either neutral or have an earthy, rather than somber, quality. While grey can sometimes be associated with gloom, here it functions more as an outlining and structural element, contributing to the overall sense of order rather than emotional weight. The dominant white background further enhances a feeling of clarity and openness, which works against any sense of oppression or despair. The lines are sharp and controlled, suggesting precision and composition rather than the drooping or chaotic forms often associated with sadness. The single black curved line adds dynamism but not a heavy or mournful presence. The overall impression is one of visual balance and a cerebral exploration of form, utterly devoid of the narrative or atmospheric cues typically used to communicate sadness. Any minimal hint of sadness might only arise from a highly subjective and indirect interpretation of the muted tones or the isolated nature of the abstract shapes, but this is extremely weak and not intrinsically present in the artwork's design."
dance-i.jpg,abstract,1.0,"The artwork, a stained glass window, employs a vibrant palette of primary colors—yellow, blue, and red—alongside stark white and thick black leading. These bright and clear colors inherently work against any sensation of sadness, typically associated with muted, darker, or cooler tones. The geometric and curvilinear forms are clean and precise, creating a sense of balance, order, and perhaps even playfulness, rather than distress or melancholy. There are no drooping lines, heavy masses, or chaotic elements that could evoke a feeling of sorrow or despair. The composition is abstract, lacking any narrative or human figures that might convey emotional states. Its overall visual impact is one of energy and structured harmony. While the black lines define and separate the colored panes, they do not convey a sense of confinement or oppression that would lead to sadness. Given the lively colors, dynamic yet balanced composition, and the absence of any visual cues typically linked to somber emotions, the painting elicits virtually no sadness."
construction-with-belltower-1932.jpg,abstract,68.0,"The painting strongly evokes a sense of quiet sadness through its deliberate aesthetic choices and implied narrative. The dominant palette of muted grays, earthy browns, dull reds, and off-whites immediately conveys a somber, subdued, and somewhat desolate atmosphere, entirely devoid of vibrant or cheerful hues. This lack of color contributes significantly to a feeling of dreariness or melancholia.

The title, ""Train à l'arrêt"" (Train at a Standstill), directly communicates a state of stagnation, interruption, or lack of progress. This central theme can evoke a profound sense of disappointment, resignation, or helplessness, which are core components of sadness. A train, typically a symbol of movement and connection, being at a standstill suggests a journey halted, a destination unreachable, or a purpose unfulfilled, leading to an underlying feeling of quiet despair.

The blocky, segmented composition, with each symbol or fragment enclosed within its own distinct rectangular or square cell, creates a sense of confinement and isolation. There's little fluidity or connection between the elements, enhancing a feeling of fragmentation and detachment. This visual containment can contribute to a sense of being trapped or limited, further deepening the melancholic mood.

While the forms are simplified and almost childlike, they lack any sense of playful whimsy. Instead, their starkness contributes to a feeling of stark reality or even barrenness. Certain symbols, such as the cross, can carry connotations of suffering or remembrance, subtly reinforcing a solemn tone. The presence of a bell might also evoke the somber tolling often associated with mournful occasions. The fragmented clock face further emphasizes the idea of time standing still or being disrupted, which can be linked to feelings of being stuck in an unpleasant moment or missing opportunities.

There is a pervasive absence of human warmth or activity, contributing to a feeling of quiet solitude that borders on loneliness. The overall impression is one of heavy stillness and a resigned acceptance of a static, unmoving state, manifesting as a deep-seated, subtle sadness rather than an overtly dramatic or acute emotional outburst."
crossing-1928.jpg,abstract,32.5,"The overall atmosphere of the painting carries a subtle, almost atmospheric sense of melancholy rather than overt sadness. This muted feeling primarily stems from the restrained and desaturated color palette, dominated by browns, grays, and creams. These earthy tones inherently lack the vibrancy and warmth typically associated with cheerfulness, instead contributing to a somber, serious, or introspective mood. The strong, stark vertical lines, particularly the darker ones, create a sense of structure that can also be interpreted as rigid, contemplative, or even slightly confining, subtly contributing to a feeling of solemnity that borders on quiet sorrow or resignation. While there are geometric shapes formed by light, they are not overwhelmingly bright or expansive; rather, they appear contained and integrate into the overall subdued tonal range, preventing a sense of upliftment and maintaining a pensive quality. There is no narrative or figure explicitly conveying sadness, but the abstract composition, through its cool detachment and somber chromatic choices, evokes a quiet, somewhat weighty emotional state that aligns with a low-intensity, contemplative sadness."
de-tio-st-rsta-n-10-alderdomen-1907.jpg,abstract,3.0,"The artwork elicits a very low degree of sadness, primarily due to the complete absence of any visual cues or thematic elements typically associated with this emotion. There are no figures expressing sorrow, no desolate landscapes, nor any iconography of loss or struggle. The color palette, while muted in some areas, does not predominantly feature dark, heavy, or desaturated tones that might evoke gloom or despair; instead, the soft pink background and the clear primary and secondary colors in the squares feel more contemplative or analytical than melancholic. The geometric grid structure conveys a sense of order and balance, while the flowing, spiral, and looping lines create a dynamic and energetic impression rather than one of stagnation or emotional weight. The small, stylized floral motifs and decorative swirls add an ornamental or spiritual quality that feels benign and even subtly uplifting, rather than somber. The overall mood of the piece leans towards abstract exploration, spiritual diagramming, or a meditative state, none of which inherently carry connotations of sadness. Any faint sensation of quietness or introspection stemming from the muted blue squares is far too subtle and devoid of negative emotional context to register as genuine sadness."
dedicated-to-jacques-callot-1941.jpg,abstract,5.0,"The painting evokes very little, if any, sense of sadness. The abstract, biomorphic forms and the overall composition do not convey any explicit narrative or emotional cues typically associated with sorrow. There are no figures depicted in postures of grief, despair, or isolation; instead, the shapes appear dynamic and somewhat whimsical, almost as if engaged in a dance or ritual. The color palette, while containing some earthy and muted tones, is broken up by distinct horizontal bands of green, blue, red, and yellow, preventing a uniformly somber or melancholic atmosphere. There is an absence of visual elements such as drooping forms, tearful expressions, heavy shadows, or desolate backgrounds that commonly evoke sadness. The fluid lines and ancient, petroglyph-like aesthetic lean more towards a mythic or primal feeling than one of emotional distress or sorrow. While not overtly joyous, the painting lacks any discernible visual language that would suggest or induce feelings of sadness in the viewer."
core-36x48.jpg,abstract,28.0,"The painting evokes a subtle, underlying sense of sadness, primarily through its subdued color palette and the ephemeral, fragmented nature of its forms. The prevalence of cool, desaturated blues and greens, combined with the washed-out, almost fading warm tones of cream and pale yellow, creates a mood that is far from vibrant or cheerful, lending itself instead to solemnity or quiet contemplation. The abstract, fractured shapes and the transparent layering suggest a sense of impermanence, dissolution, or perhaps things breaking apart and fading away. While there is a dynamic quality with radiating light, this light feels ethereal and fragile, almost like a fleeting memory or a dissolving moment rather than a strong, persistent presence. This visual ambiguity, coupled with the sense of disintegration and the cool, somewhat distant atmosphere, can evoke a feeling of wistfulness, melancholy, or a gentle sorrow associated with transience and loss. It is not an overt or profound sadness, but rather a quiet, pensive undertone that invites reflection on things that pass or dissolve."
dialogue-i-1967.jpg,abstract,5.0,"The artwork is an abstract composition dominated by a muted, earthy green background. While some may associate darker greens with a somber or contemplative mood, the overall impression does not lean towards sadness. The lines, shapes, and patterns, rendered in lighter greens, white, and hints of other colors, are dynamic and energetic rather than melancholic. There are no recognizable figures or narrative elements that traditionally convey sorrow, loss, or despair. The various arrows and radiating lines suggest movement, process, or a diagrammatic representation of energy, which are concepts devoid of inherent sadness. The presence of these active elements, along with the somewhat clinical or schematic feel of the abstraction, prevents the work from evoking any significant degree of sorrow or despondency. The piece lacks the heavy, stagnant, or bleak qualities that would typically contribute to a feeling of sadness."
draft-for-mural-in-the-unjuried-art-show-wall-b-1922.jpg,abstract,1.5,"The painting, an abstract work by Wassily Kandinsky, primarily utilizes a dynamic interplay of vibrant colors and energetic lines against a dark background. The palette includes bright yellows, greens, reds, blues, and purples, which are generally associated with vitality, movement, and intensity rather than melancholy. The lines are sharp, jagged, and sweeping, creating a sense of rapid movement and fragmented energy. There are no drooping forms, heavy, somber masses, or desaturated tones that typically convey a feeling of sadness or despondency in art. The composition is highly active and appears to be in motion, lacking the stillness, quietness, or introspective qualities often linked with sadness. While the dark background might add a sense of drama or depth, it does not, in conjunction with the bright, active forms, evoke a mournful or sorrowful emotion. The overall impression is one of visual excitement and complexity, leaving very little room for an interpretation of sadness."
deux-styles-1958.jpg,abstract,5.0,"The painting evokes very little, if any, sadness. While certain colors like blue and black can sometimes be associated with melancholy or despair, their application within this artwork largely negates such an interpretation. The blues are vibrant and clear, not desaturated or murky, which often contribute to a somber mood. The large areas of black on the right side, rather than feeling like an empty void or representing darkness and grief, act as a strong, grounding contrast to the energetic reds, blues, and whites, contributing to the overall dynamic and bold aesthetic of the piece.

Furthermore, the composition is dominated by sharp, geometric shapes and strong, defined lines. These elements tend to convey order, precision, and dynamism rather than the softness, fluidity, or drooping forms often associated with sorrow or despair. The intricate interplay of these shapes, especially the swirling and interlocking forms on the right, creates a sense of energy and visual movement, which counters feelings of stillness or emotional heaviness that might evoke sadness. The strong visual contrasts and the overall sense of abstract design and pattern do not lend themselves to a melancholic or sorrowful interpretation. There is no suggestion of introspection, loss, or any universally recognized symbols of sadness within this abstract composition."
duo-duel-1953.jpg,abstract,1.0,"The artwork evokes virtually no sense of sadness. The dominant bright, almost acidic yellow, often associated with vibrancy, energy, or caution, starkly contrasts with the dark, almost black areas. This high contrast creates a dynamic and somewhat stark visual experience rather than one of melancholy or sorrow. There are no somber or muted tones typically used to convey grief, loss, or despair. The composition is entirely abstract, consisting of sharp, angular forms and precise horizontal and diagonal lines. These elements suggest structure, movement, or tension, but not the drooping forms, soft edges, or desolate imagery often associated with sadness. The sharp, clean lines and defined shapes lack any visual cues that would convey emotional heaviness, contemplation, or a sense of lament. The overall impression is one of visual energy and intellectual engagement with form and color rather than an invitation to feel profound sorrow or sadness."
drawing-in-black-and-white-1962.jpg,abstract,72.0,"The painting strongly evokes a sense of deep, quiet sadness, leaning heavily into melancholy and somber contemplation. The predominant use of dark, earthy tones, primarily black and various shades of brown/gold, immediately creates a heavy and serious atmosphere. These colors are often associated with introspection, loss, and a lack of vibrancy, contributing significantly to a melancholic mood.

The fragmented and angular forms within the composition suggest a sense of brokenness, disarray, or perhaps remnants of something once whole. These sharp, vertical elements, almost like fractured pillars or abstract figures, do not offer comfort or warmth; instead, they contribute to a feeling of desolation or quiet suffering. There's a distinct absence of soft curves, bright, uplifting colors, or dynamic movement that might suggest joy or vitality.

The minimal use of light, primarily highlighting the fractured forms against the dark background, emphasizes the sense of solemnity rather than offering solace. The stark contrasts between the dark and lighter tones can be read as a visual metaphor for struggle or a bleak outlook. While there isn't an overt depiction of tears or specific grief, the overall aesthetic communicates a profound sense of introspection and a pervasive, quiet sorrow, as if one is observing a scene of decay or pondering a difficult truth. The limited accents of green do little to lighten the mood, instead integrating into the overall starkness. This is not an acute, demonstrative sadness, but rather a deep, enduring melancholic weight."
e0c48c828bd324c01a0580fe6666b0e9.jpg,abstract,5.0,"The painting, ""Udnie (Young American Girl; Dance)"" by Francis Picabia, does not primarily evoke a sense of sadness. The dominant visual language consists of fragmented, dynamic forms and a palette that includes bright yellows, warm reds, and various shades of gray, black, and brown. There are no recognizable human figures or facial expressions that could directly convey sorrow or distress. The composition is highly energetic and abstract, suggesting motion, perhaps even the vibrancy of dance as hinted by the title. The swirling, overlapping planes and sharp angles create a feeling of dynamism and complexity rather than stillness or melancholy. While abstraction can sometimes carry emotional weight through color or form, the bright and contrasting colors used here, particularly the luminous yellow elements, tend to create an effect of light and activity rather than gloom or despair. There is an inscription at the bottom, ""Je revois en souvenir ma chere Udnie"" (I recall in memory my dear Udnie), which implies remembrance. While memory can sometimes be tinged with sadness or longing, the visual characteristics of the painting itself do not support a dominant feeling of profound sorrow. Instead, the overall impression is one of modernist experimentation and visual energy. Any fleeting hint of sadness might only arise for a viewer contemplating the abstract nature of memory itself, but this is not directly conveyed by the artwork's formal elements. Therefore, the presence of sadness is minimal, almost negligible."
