image,image_category,sadness_rating,sadness_explanation
low-white-sun-box-1965.jpg,colorField,15.0,"The painting primarily evokes a sense of calm, spaciousness, and contemplation rather than overt sadness. The dominant colors are light, airy off-whites, creams, and pale yellows, which typically convey luminosity and serenity rather than melancholy or despair. The large, soft fields of color contribute to an ethereal and quiet atmosphere.

While the prominent horizontal blue band could, for some viewers, evoke a sense of ""feeling blue"" or represent a distant, perhaps melancholic horizon, its color is a relatively vibrant and clear blue, not a deep, brooding, or muted shade that would typically signify profound sorrow. Furthermore, this blue is anchored and surrounded by vast expanses of light, almost luminous tones above and below it. The small, thin yellow horizontal line above the blue adds a subtle touch of warmth, light, or perhaps a fleeting moment of brightness, which subtly counteracts any potential somberness.

The overall composition is balanced and still, creating a meditative mood. There are no harsh lines, dark shadows, or chaotic forms that might suggest distress or sorrow. The feeling is more akin to looking at a vast, quiet landscape at dawn or dusk, evoking introspection rather than grief. Any potential for sadness is extremely subtle and easily overshadowed by the painting's overall tranquil and light-filled character."
magus-1981.jpg,colorField,18.0,"The painting predominantly features a palette of soft pinks, peaches, and muted reds, which generally evoke feelings of warmth, gentleness, or introspection rather than sorrow. While there are subtle hints of muted blues and greys, particularly in the central left area and upper central part, these cool tones are largely overwhelmed by the warmer hues. The soft, blended brushwork and the overall abstract composition create a sense of quietude and calm. There are no sharp, jarring lines, turbulent forms, or heavily desaturated colors that typically communicate distress, despair, or deep sorrow. The small, vibrant red accent in the upper right quadrant of the central rectangle acts more as a point of interest or a spark than a symbol of pain or grief. The bright pink border framing the entire artwork also contributes to a somewhat contained and less somber overall impression. Therefore, while a very subtle hint of quiet pensiveness or gentle melancholy might be inferred from the cooler tones and the subdued nature of the painting, the pervasive warmth and softness prevent any significant feeling of sadness from emerging. The emotion is very low, almost imperceptible as overt sadness."
midnight-watch-1976.jpg,colorField,5.0,"The painting, composed of numerous vertical stripes in varying widths and a diverse palette of colors, evokes a sense of order, rhythm, and perhaps even a gentle vibrancy rather than sadness. The colors used are predominantly light and cool tones such as various shades of blue, green, and lavender, interspersed with brighter elements like pale yellow and soft pink. Traditionally, sadness in art is often conveyed through darker, muted, or somber color schemes, heavy brushstrokes, or narrative elements depicting loss or melancholy. None of these characteristics are present here. The light and airy quality of the colors, particularly the yellows and pinks, counteract any potential for the blues or grays to evoke deep sorrow. The precise, vertical lines create a harmonious and stable composition, devoid of any drooping forms or chaotic elements that might suggest despair or emotional turmoil. The overall impression is one of gentle calm or a subdued cheerfulness, making it highly unlikely to trigger feelings of sadness in a viewer. Any minimal score for sadness would stem purely from the subjective and abstract nature of the piece, where any emotion might be minimally projected, rather than from any inherent visual cues within the artwork itself."
medeanus.jpg,colorField,33.0,"The painting conveys a subtle and introspective sense of sadness rather than an overt or profound sorrow. This feeling emerges primarily from the use of certain colors and the nature of the forms. The large, dark blue-black shape on the right side, with its thick, somber outline, carries a significant visual weight, suggesting containment or a deep, internalized emotion. The small, bright blue dot within this dark mass can be interpreted as a concentrated point of feeling, perhaps a quiet tear or a pool of melancholy.

Furthermore, the muted grey area in the upper left quadrant and the soft, almost faded grey-white form at the bottom, which also features a dab of blue, contribute to a subdued and contemplative atmosphere. These forms appear somewhat isolated and without strong connection to the other elements, which can subtly suggest a feeling of loneliness or quiet introspection. The soft, fuzzy, almost ""bled"" edges around several of the color fields, especially the red and the dark blue-black shapes, create a sense of vulnerability and a gentle, blurred emotional state, aligning with a tender, non-aggressive form of sadness or wistfulness.

However, the expansive and dominant bright yellow on the right side, along with the vibrant red form, actively counteracts any overwhelming sense of gloom, introducing warmth and vitality that prevent the painting from feeling deeply melancholic or despairing. Therefore, the sadness present is a quiet, contemplative melancholy, a subdued undercurrent rather than an all-encompassing emotion."
maple-grove-2008.jpg,colorField,1.0,"The painting, composed of three minimalist panels in varying shades of chartreuse and olive green, evokes virtually no sense of sadness. The dominant color, green, is typically associated with nature, growth, renewal, and vitality, rather than melancholy or sorrow. While some muted or desaturated greens might hint at sickness or decay, the hues present here, particularly the central panel which is quite vibrant and yellowish-green, are too fresh and bright to convey such negative connotations.

Furthermore, the composition consists of simple, geometric rectangles, devoid of any narrative elements, human figures, or discernible scenes that could traditionally depict loss, grief, or emotional struggle. There are no drooping lines, heavy forms, or chaotic brushstrokes that might suggest turmoil. Instead, the clean lines and orderly arrangement contribute to a sense of calm, balance, or neutrality. The lighting is even and bright, casting subtle shadows that give depth but do not create a somber or oppressive atmosphere.

Any perception of sadness from this artwork would be highly subjective and atypical, perhaps stemming from a viewer's personal and unusual association with the specific color or the stark simplicity of the forms, suggesting emptiness or absence. However, on an objective and widely understood basis of art interpretation, the visual language employed in this piece overwhelmingly lacks the conventional cues (such as cool, dark, or desaturated colors, agitated or downtrodden forms, or a tragic subject matter) that typically evoke sadness. Therefore, the feeling of sadness is almost entirely absent."
mother-e-2009.jpg,colorField,5.5,"The overall impression of this image is one of minimalist abstraction, featuring two large, solid color fields – a vibrant blue on the left and a rich green on the right – set against a light, neutral wall. When evaluating sadness specifically, there are very few elements within this artwork that actively convey or evoke this emotion.

The colors themselves, while not overtly joyous, are not melancholic or somber. The blue is a clear, rather bright hue, far from the deep, desaturated, or muted blues often associated with profound sadness or melancholy. Instead, it leans towards a sense of calm or even a subtle energy. Similarly, the green is a natural, almost earthy tone, lacking the sickly or dull quality that might contribute to a feeling of malaise or despair. Neither color is dark, oppressive, or heavy in a way that typically resonates with sorrow.

The composition is incredibly simple: two unadorned rectangles. There are no narrative elements, no figures displaying distress, no symbolic forms of loss, nor any chaotic or unsettling textures that might create a sense of unease or emotional weight. The clean lines and uniform surfaces suggest order and clarity rather than disarray or emotional turmoil. The lighting is even and bright, further preventing any shadow-induced gloom or somber atmosphere.

While some might argue that the starkness or the sheer absence of human presence or narrative could lead to a feeling of emptiness or isolation, which can be linked to sadness, this connection is tenuous and highly subjective for this particular image. The primary impression is one of formal simplicity and color study, rather than an intentional emotional statement, especially not one geared towards sadness. The simplicity is more likely to be perceived as meditative or neutral, rather than depressing. Any feeling of sadness would be projected onto the artwork by the viewer, rather than being inherently suggested by its visual properties. Therefore, the score is very low, reflecting a near-absence of direct cues for sadness."
new-morning-1996.jpg,colorField,1.0,"The painting evokes virtually no sense of sadness. The dominant visual elements—three luminous, perfectly circular forms in vibrant hues of coral/reddish-pink, bright orange, and vivid blue—are overwhelmingly associated with energy, warmth, and vitality, rather than somber emotions. The soft, radiant glow emanating from each circle creates an ethereal and almost celebratory atmosphere, suggesting light and possibility rather than despair or gloom. The background, composed of textured, light, almost white or pale gray tones, is neutral and does not contribute any melancholic depth or somberness. There are no dark colors, broken forms, solitary figures, or narrative cues typically linked to sadness, loss, or grief. The harmonious arrangement and bright, inviting palette lead to an experience that is far removed from any feeling of sorrow or melancholy."
mohawk-1970.jpg,colorField,38.5,"The painting evokes a subtle sense of sadness, bordering on gentle melancholy, primarily due to its muted and desaturated color palette. A significant portion of the vertical stripes consists of cool tones such as various shades of blue, purple, and muted green, interspersed with an array of grays and earthy browns. These colors, while not overtly dark or gloomy, lack vibrancy and brilliance, contributing to a subdued and introspective atmosphere. The absence of bright, warm, or highly contrasting colors prevents any feeling of joy, excitement, or dynamism. Instead, the consistent repetition and orderly arrangement of these somber, contemplative hues create a quiet, almost pensive mood. There is nothing within the composition that suggests overwhelming sorrow or despair; rather, the sadness conveyed is a soft, reflective quality, reminiscent of a quiet, perhaps slightly wistful, state of mind. The visual effect is calming but leans towards seriousness and a lack of cheerfulness, thereby registering a mild yet discernible degree of sadness."
munich-olympic-games-poster-1972.jpg,colorField,0.1,"The visual elements within this poster do not evoke any sense of sadness. The color palette is composed of bright, vibrant, and saturated hues (orange, purple, green, yellow, blue, pink, black), which are typically associated with energy, dynamism, and joy rather than melancholy or sorrow. There are no muted tones, somber shades, or desaturated colors that might suggest a feeling of sadness. Furthermore, the composition consists of bold, sweeping, and overlapping curved lines, creating a sense of movement, flow, and perhaps even playfulness. These lines ascend and curve, lacking any downward, heavy, or stagnant forms that could imply sadness or despair. There is an overall impression of vitality and abstract motion. The brushstroke-like texture, while visible, adds to the artistic energy rather than conveying distress or gloom. The context of the Olympic Games, an event generally associated with celebration, competition, and international unity, further reinforces an upbeat and positive visual message, with no inherent visual cues in the artwork itself to suggest sadness. Therefore, based purely on the visual information presented, the painting registers an almost complete absence of sadness. The score is not zero because complete absence is theoretically impossible, but it is as close to zero as perceivable from the visual cues."
nexx-central-revisited-1996.jpg,colorField,0.0,"The painting exhibits no visual cues typically associated with the emotion of sadness. Its vibrant and luminous color palette, featuring a clear, bright blue background contrasted with energetic white brushstrokes and three glowing, richly colored circles (purple, yellow, and fuchsia), evokes feelings of light, vitality, and perhaps spiritual elevation, rather than melancholy or sorrow. There are no dark, muted, or somber tones that would induce a sense of dejection. The composition is open and balanced, with the circular forms radiating light, suggesting expansion and energy rather than contraction or despair. Furthermore, the abstract nature of the artwork presents no discernible figures or narratives that might convey a sense of loss, grief, or suffering. The brushwork, though textural, feels dynamic and airy, contributing to an overall impression of lightness and movement, which stands in direct opposition to the heavy, static, or somber qualities often linked with sadness. Therefore, the painting offers no visual or emotional connection to the feeling of sadness."
janela-aberta-1998.jpg,colorField,35.5,"The overall collection of small paintings evokes a subtle, pervasive sense of melancholy rather than overt sadness or despair. This feeling is primarily conveyed through several recurring elements:

1.  **Recurring Theme of Empty Interiors:** A significant number of the individual panels depict empty, often stark, interior spaces or rooms. These rooms frequently lack inhabitants, furniture, or clear signs of activity, creating a strong sense of absence, isolation, or loneliness. An empty room can metaphorically suggest a void or an overlooked space, leading to feelings of quiet desolation.
2.  **Somber Color Palette within Warm Tones:** While reds and oranges are predominant and can signify warmth or passion, they are often rendered in deep, muted, or earthy tones (like brick red, burnt orange, and deep brown-reds). These are frequently juxtaposed with or heavily incorporate dark blues, blacks, and deep browns. This combination creates shadows, depth, and a weighted atmosphere that can feel somber or heavy, rather than purely vibrant or energetic. The dark corners and enclosed forms in many ""room"" paintings contribute to a feeling of confinement or introversion, which can lean towards sadness.
3.  **Lack of Overt Joyful Elements:** There are no discernible figures expressing joy, no bright, open landscapes (except for one green field), and no clear narratives of happiness or exuberance. The compositions are generally abstract or semi-abstract, focusing on form, color, and space in a way that is more contemplative and subdued than uplifting.
4.  **Quiet and Contemplative Mood:** The repetitive grid format, combined with the introspective subject matter of many panels, establishes a quiet,"
no-24.jpg,colorField,55.0,"The painting evokes a palpable, though subtle and contemplative, sense of sadness. This emotion stems primarily from the muted and earthy color palette, dominated by a deep, somber green and a rich, burnt orange. These shades, particularly the green, possess a certain gravitas and depth that can feel heavy or introspective, rather than vibrant or joyful. The soft, blurred edges of the color blocks contribute to this feeling, creating a sense of diffusion and ambiguity that can be associated with the ephemeral nature of feelings or the quiet melancholy of fading light. There's an absence of sharp, energetic lines or bright, uplifting hues, which steers the emotional tone towards solemnity and introspection. While not an acute or despairing sadness, the composition fosters a mood of quiet contemplation that often borders on melancholy, suggesting a profound emotional space where solemnity and a gentle, pervasive sadness reside. The scale and immersive nature of Rothko's work often invite deep emotional engagement, and in this piece, the prevailing atmosphere is one of profound, perhaps existential, quietude that leans perceptibly towards a dignified sadness."
no-6-yellow-white-blue-over-yellow-on-gray-1954.jpg,colorField,68.0,"The primary contributor to the sensation of sadness in this painting is the large, deep, and heavily saturated blue rectangle at the bottom. Blue, particularly such a profound and resonant shade, is widely associated with feelings of melancholy, introspection, and quiet sorrow. Its substantial visual weight anchors the composition in a somber register, creating a sense of gravity and depth that can evoke a profound, reflective sadness. The soft, bleeding edges of the blue field, characteristic of Rothko's style, allow the color to seep into the viewer's emotional space, creating an atmospheric quality that is conducive to contemplation and potentially, a gentle ache of melancholy. The sheer scale and presence of this blue block invite a deep, quiet immersion that can easily lead to a state of solemnity or a tender sense of loss.

While the luminous yellow and cream-colored blocks above it introduce elements of light and expansion, which might suggest hope or transcendence, they do not entirely negate the powerful undertow of the deep blue. Instead, they create a tension, where the vast, almost ethereal upper fields contrast with the grounding, emotionally weighted blue below. This juxtaposition can amplify the feeling of solemnity, as if a bright, expansive world exists above a deep, contemplative emotional state. The overall meditative quality of the composition allows for the absorption of this profound blue, enabling a significant, though not overwhelming, experience of sadness. It is a sadness that feels contemplative and enduring, rather than sharp or acute."
no-2.jpg,colorField,5.0,"The painting, with its dominant fields of vibrant yellows and warm oranges, primarily evokes feelings of warmth, energy, and luminosity, rather than sadness. These colors are traditionally associated with joy, optimism, and vitality. There is an absence of visual cues typically linked to sorrow, such as cool, dark, or muted tones (e.g., deep blues, grays, or somber purples), heavy forms, or a sense of despair and desolation. While the painting is abstract and can invite highly personal emotional responses, its overall disposition leans towards an expansive, contemplative, and even uplifting mood. The bright red horizontal band, though intense, acts more as a powerful focal point or a line of vitality rather than conveying pain, grief, or a wound in a mournful sense. Any potential hint of sadness would be extremely subtle and indirect, perhaps emerging from the abstract vastness suggesting human insignificance or the ephemeral nature of light and color, but this is a far cry from a direct or strong evocation of sorrow. The painting lacks the somber visual weight or emotionally charged narrative elements that typically communicate sadness."
oe-260-1957.jpg,colorField,28.0,"The painting evokes a subtle and contemplative sense of sadness, primarily stemming from the large, dark, central amorphous shape. This deep, almost black form, with hints of very dark blue and purple within its depths, carries a significant visual weight and a somber presence. It appears as a heavy, perhaps overwhelming, mass or a profound void. This weightiness can be interpreted as a metaphorical representation of a burden, a deep thought, or a quiet, internalized sorrow. The stark contrast between this dark, weighty core and the surrounding vibrant field of reds and magentas further emphasizes its solemnity. While the reds are energetic, they serve to highlight the isolated and profound nature of the dark shape, almost as if a heavy presence exists within a lively, dynamic environment. This creates a feeling not of overt despair or grief, but rather a muted melancholy, a sense of gravity, or a profound introspective mood. The sadness is not aggressive or overt but rather a deep, quiet undercurrent, a feeling of ponderousness that invites contemplation rather than immediate emotional distress."
november-1963-iii-1963.jpg,colorField,70.0,"The painting evokes a palpable sense of sadness primarily through its stark color palette and compositional elements. The dominant expanse of deep black and somber, dark blue in the lower half of the image creates an immediate impression of immense weight, emptiness, and solemnity. Black is universally associated with grief, despair, and a profound absence, and its substantial presence here contributes heavily to a feeling of deep-seated sorrow or a heavy heart. The dark blue further reinforces this melancholic atmosphere, suggesting introspection and a quiet despondency.

Above these heavy, dark masses, a distinct, somewhat irregular band of reddish-orange cuts across the canvas. This vivid color, while not inherently sad, acts as a stark, almost wounding, line of demarcation. It separates the oppressive darkness below from the vast, empty expanse of white above. This division can be interpreted as a separation, a barrier, or even a deep emotional scar, contributing to a sense of loss or profound isolation often linked with sadness. The slightly rough or creased texture visible within this orange band and extending into the white suggests a lack of pristine smoothness, hinting at imperfections, burdens, or emotional wear.

The large field of stark white at the top, while often associated with purity, here feels more like an overwhelming emptiness or a void, especially when contrasted with the density of the dark colors below. This vast, unoccupied space can amplify feelings of loneliness or a poignant absence, further leaning into a melancholic state. The overall impression is one of quiet, profound sorrow, a heavy emotional landscape devoid of lightness or joy, conveying a significant degree of sadness that is both contemplative and somber."
not_detected_242128.jpg,colorField,70.0,"The emotion of sadness is evoked quite strongly in this painting, primarily through the dominant use of a deep, pervasive purple/indigo hue in the upper and central portion of the canvas. This particular shade is profoundly somber and weighty, often associated with solemnity, contemplation, and a sense of melancholy. Its sheer volume creates an enveloping atmosphere that feels heavy and introspective.

The soft, blurred edges of the color fields contribute to this feeling of sadness by suggesting a dissolving or fading quality, evoking a sense of impermanence or loss, rather than sharp, defined joy. This ethereal quality can make the sadness feel pervasive and atmospheric.

While there is a lighter, warm yellow/cream block at the bottom, its comparatively smaller size and the overwhelming presence of the dark purple above it create a visual tension. The dark field appears immense and almost consuming, with the lighter element serving as a more fragile or subdued counterpoint. This dynamic can suggest a feeling of being overshadowed or consumed by a deep, quiet sorrow. The abstract nature, devoid of specific narratives, allows the viewer to project their own feelings, and the profound, dark color field powerfully guides that projection towards a state of deep, contemplative sadness."
ohne-titel-for-thomas-merton-1971.jpg,colorField,12.5,"The overall impression of this painting does not strongly evoke sadness. The dominant use of vibrant orange and deep, rich blue creates a powerful and energetic contrast rather than a melancholic one. While blue is a color often associated with sadness or melancholy, the specific shade employed here is a robust, almost royal blue that conveys depth and stability rather than despondency or sorrow. It feels more profound or foundational than somber. The strong horizontal divisions, while creating distinct fields, do not suggest isolation or despair. There are no drooping lines, somber tones, or narrative elements that typically convey sadness. The application of paint, with its visible brushstrokes and slightly raw edges, gives it a direct, unvarnished quality that feels more about presence and color interaction than emotional distress. Any fleeting sense of sadness derived from the blue would be a very subtle and secondary interpretation, overshadowed by the painting's overall vibrancy and compositional strength."
