image,image_category,sadness_rating,sadness_explanation
seward-park-1958.jpg,colorField,70.0,"The painting evokes a palpable sense of sadness primarily through its stark color palette and heavy, unyielding composition. The dominant use of deep, matte black, particularly in the large central block and the prominent horizontal stripes, immediately conveys a feeling of weight, emptiness, and darkness. Black is culturally and psychologically associated with mourning, loss, and the absence of light, strongly contributing to a somber and melancholic atmosphere. This black feels absorbing and dense, suggesting an emotional void or an oppressive burden.

The accompanying yellow is not bright, vibrant, or cheerful; instead, it is a muted, almost desaturated, jaundiced, or mustardy tone. This dull yellow, rather than providing light or warmth, contributes to the painting's overall somberness, lacking the vivacity that would uplift the mood. It feels drained or tired, adding to the sense of quiet despair. The deep, dark green at the very bottom further anchors the painting in a heavy, earthy, and subdued realm, reinforcing the muted and serious tone.

The composition, with its broad, horizontal bands and the stark, block-like central black area, feels weighty and static. There is an absence of dynamic movement or lightheartedness. The visual elements seem to press down, creating a sense of profound stillness that can be interpreted as a quiet resignation, deep contemplation, or a heavy emotional state, all of which align with sadness. The rough, textured brushstrokes also add to a raw, unpolished emotional quality, suggesting a fundamental rawness of feeling that might be painful or sorrowful. The overall impression is one of solemnity, profound quietness, and a marked lack of joy or dynamism, all contributing to a strong and persistent feeling of underlying sadness."
square-motif-in-white-and-indian-red-1960.jpg,colorField,42.0,"The emotion of sadness is evoked in this abstract composition primarily through the stark formal elements and their interplay, rather than through overt narrative or symbolic representation. The most significant contributor to a sense of sadness is the vast, uninterrupted expanse of white in the lower half of the painting. This white area, framed and delineated by sharp black lines, evokes a profound sense of emptiness, absence, or a void. Absence is a common catalyst for sadness, suggesting something missing or lost.

The black lines themselves contribute to this feeling. Black is often associated with mourning, sorrow, and finality. The horizontal black lines sharply cut across the canvas, creating a definitive division between the vibrant red above and the stark white below. This act of separation, of being 'cut off,' can be interpreted as a rupture or a loss, which can lead to feelings of sadness. The asymmetry and sharp angles of the intersecting black lines (one straight horizontal, another slightly angled, and a vertical line forming a corner in the white space) introduce a sense of disquiet or a fractured state, further contributing to a melancholic or unsettling mood. The vertical black line extending downwards along the left edge of the white area can feel restrictive or like a barrier, enclosing the emptiness.

While the red at the top is vibrant and intense, not typically a color associated with sadness"
tom-s-furnace-1961.jpg,colorField,5.0,"The painting, composed of distinct vertical stripes in shades of deep blue, teal, and bright orange/yellow, evokes very little, if any, sense of sadness. The colors are vibrant and saturated; the blues and teals, while cool, are rich and assertive rather than muted or somber. The central block of warm orange and yellow hues further contributes to a feeling of energy and brightness, counteracting any potential coolness from the blue sections. The highly organized and rhythmic composition, with its precise, uniform stripes, conveys order and stability rather than chaos or distress, which might be associated with melancholic feelings. There are no drooping lines, somber tones, or unsettling visual elements that typically contribute to a feeling of sadness. The overall impression is one of visual harmony, optical vibration, and a certain boldness, all of which are antithetical to a sense of melancholy or sorrow. The painting is abstract and does not present any narrative or figurative elements that could be interpreted as sad. Any minimal score might only come from an extremely subjective and rare association of cool colors with introspection, but even then, the vibrancy here strongly overrides such a connection to sadness."
the-howl-of-terror-1967.jpg,colorField,78.5,"The dominant deep indigo-purple that fills the vast majority of the canvas creates an immediate sense of profound solemnity and introspection, which are often precursors or companions to sadness. This expansive, dark field feels immense and heavy, like a deep, silent void or an overwhelming, somber sky, evoking a feeling of quiet solitude or a pervasive sense of emptiness that can be deeply melancholic. The horizontal lines at the bottom, particularly the delicate, almost ephemeral white and pale grey stripes, stand in stark contrast to the deep darkness above. These lines can be interpreted as distant, perhaps unreachable horizons or faint remnants, contributing to a feeling of wistful longing, separation, or a quiet, drawn-out sorrow. Their subdued and faded appearance, like distant memories or fading hopes, further reinforces a sense of quiet sadness rather than vibrant optimism. The overall stillness and balanced, unchanging composition of the painting contribute to a sense of quiet contemplation and a deep, internal emotional state, aligning with a profound, unexpressed sadness that resides within. There are no elements of joy or overt energy, only a profound sense of quietude that allows for a contemplative and melancholic emotional response."
the-station-of-the-cross-first-station-1958.jpg,colorField,68.0,"The painting evokes a palpable sense of sadness primarily through its stark color palette and the organic, almost weeping quality of its dominant dark form. The large, uneven vertical mass of dark, ink-like pigment on the right side feels heavy and imposing against the expansive, pale, almost empty background. The edges of this dark form are not crisp but appear smudged, diluted, and as if bleeding or dissolving downwards, strongly reminiscent of tears or a profound, uncontrolled outpouring of sorrow. This fluidity suggests a loss of containment, a surrender to a deep emotional state. The contrast between the heavy, dark presence and the vast, lighter space around it creates a sense of isolation or a weighty burden within an otherwise desolate landscape. The faint, subtle yellowish tints in the background contribute to a somber, perhaps aged or faded, atmosphere, further enhancing a melancholic mood rather than providing warmth or vibrancy. The overall effect is one of profound internal gravity, a visual representation of a lingering sorrow or a scar etched into being."
twined-columns-ii-1960.jpg,colorField,5.0,"The painting evokes very little to no sadness. The palette consists of light, translucent, and blended colors (blues, greens, yellows, reds, and purples) that are largely vibrant and ethereal, rather than dark, muted, or heavy hues often associated with melancholy or sorrow. The soft, diffuse edges and layered washes create a sense of lightness and fluidity, which contributes to a serene or contemplative atmosphere, markedly different from the oppressive or rigid forms that might suggest despair. There are no visual elements such as downward-sloping lines, somber figures, or chaotic compositions that typically convey a sense of grief, loss, or distress. Instead, the luminosity and gentle interplay of colors lend themselves more to feelings of calm, contemplation, or even a quiet optimism, thus placing it far from the realm of sadness."
unknown-title-2.jpg!PinterestLarge.jpg,colorField,0.1,"The painting, an abstract composition of vertical stripes in vibrant, saturated colors such as bright red, various greens, deep blue, and clear yellow, evokes no discernible feeling of sadness. The hues used are overwhelmingly bold and lively, typically associated with energy, optimism, and cheerfulness rather than sorrow or melancholy. There are no muted tones, dark shades, or desaturated colors that might suggest somberness, introspection, or despair. Furthermore, the orderly, clear-cut vertical lines create a sense of structure and presence rather than chaos or void. The overall impression is one of vibrancy, clarity, and perhaps even a celebration of color itself, which directly counteracts any potential for sadness. There is nothing in the palette, composition, or abstract nature of the work that cues or reflects a state of emotional downturn or sorrow."
thira-1980.jpg,colorField,5.5,"The painting is an abstract composition primarily featuring geometric blocks and stripes of color. There are no narrative elements, human figures, or discernible scenes that typically evoke sadness. The overall impression is one of structured design and color interplay rather than emotional expression. The palette includes vibrant reds and greens, which are generally not associated with sorrow. However, there are also elements of dark navy blue and a muted olive-khaki green, particularly in the rightmost panel. Darker blues can, in some contexts, be associated with melancholy or ""the blues."" When these darker, more subdued tones are placed alongside the brighter, more active reds, a very subtle, perhaps unintentional, contrast could be perceived by some as lending a slight degree of seriousness or subdued introspection. This is a very mild interpretation, as the dominant feeling conveyed by the painting is one of visual harmony, balance, and formal exploration. Therefore, any sense of sadness is extremely faint and highly subjective, registering as almost negligible."
train-landscape-1953.jpg,colorField,0.0,"The painting, composed of three horizontal stripes in shades of green and yellow, evokes no discernible sense of sadness. The top stripe is a bright, vibrant lime green, the middle a rich, verdant green, and the bottom a cheerful, sunny yellow. These colors are inherently associated with nature, growth, freshness, energy, and optimism. Bright and lively hues like these typically uplift the spirit or create a sense of harmony and vitality, directly contrasting with emotions of sorrow or melancholy. There are no dark, muted, cool, or desaturated tones that are commonly used to convey sadness, nor are there any heavy, somber textures or irregular, unsettling forms. The composition is simple, stable, and orderly, which tends to promote a sense of calm and balance rather than emotional distress or wistfulness. The complete absence of narrative elements or figures means there is no subject matter to relate to in a way that might trigger empathetic feelings of sadness. The overall impression is one of brightness, natural vibrancy, and clarity, providing no visual cues or emotional triggers that would lead to a feeling of sadness."
unknown-title.jpg,colorField,0.1,"This painting exhibits virtually no elements that would typically evoke or represent sadness. The predominant color palette is vibrant and rich, dominated by warm and energetic hues like bright yellows, reds, and oranges, juxtaposed with lively greens, blues, and purples. These colors are generally associated with joy, energy, and liveliness, rather than melancholy or sorrow. There is an absence of muted tones, deep grays, or desaturated blues that often accompany feelings of sadness or introspection. The composition, with its rhythmic grid of colorful, hand-painted shapes and the dynamic vertical lines, suggests movement and vibrancy rather than stillness or somberness. There are no downward-sloping forms, heavy masses, or chaotic elements that might symbolize distress or burden. The overall impression is one of visual excitement and cheerful abstraction, lacking any narrative or figurative elements that could convey loss, grief, or solitude. The painting's aesthetic character is unequivocally far from any interpretation of sadness."
untilted-1959.jpg,colorField,5.2,"The image is an abstract composition of several large, somewhat irregular color blobs on a light background. There are no discernible figures, scenes, or narrative elements that typically evoke feelings of sadness, loss, or melancholy. The colors themselves, while including some darker tones like deep purple and a muted maroon, are balanced by vibrant and active blues, and a strong, warm red/orange. This combination prevents the overall palette from leaning towards somberness or despair. The shapes are organic and somewhat amorphous, lacking any sharp edges or heavy forms that might convey burden or sorrow. The arrangement feels somewhat scattered yet balanced, not suggesting isolation or despondency. Without any contextual cues or symbolic representations typically associated with sadness, the visual elements of this abstract piece offer very little, if anything, to elicit or amplify feelings of sadness in the viewer. The slight presence of dark purples might be interpreted as contemplative, but not inherently sad, especially given the contrasting brighter hues."
two-edges-1948.jpg,colorField,68.0,"The painting evokes a distinct, albeit subdued, sense of sadness primarily through its monochromatic palette and compositional structure. The dominant colors are muted, earthy browns and tans, which lack vibrancy and contribute to a somber, melancholic atmosphere. There's a notable absence of bright, uplifting hues, creating an overall impression that leans towards quiet contemplation and introspection, often associated with sorrow.

The composition, with its strong vertical divisions, adds to this feeling. The broad, dark brown band on the far left feels heavy and oppressive, almost like a looming shadow or a weighty barrier. This creates a sense of solemnity and a lack of openness. The central section, while lighter, maintains the muted tone and features subtle, almost veil-like vertical striations, suggesting a hiddenness or a sense of things being obscured, which can relate to feelings of loss or an internalized sorrow.

The single, stark white vertical line on the far right, while being the brightest element, does not significantly alleviate the overall somber mood. Instead, its thinness and isolation against the expansive muted background can paradoxically heighten the feeling of quiet desolation or a distant, almost unreachable hope. It emphasizes the prevailing subdued state rather than offering a strong counterpoint of joy or light. The overall stillness and lack of dynamic movement in the abstract forms contribute to a sense of quietude that can be interpreted as reflective of a deep, internalized melancholy rather than an active or outward expression of grief. It suggests a solemn and perhaps weary emotional landscape."
unknown-title-15.jpg,colorField,1.0,"This abstract painting evokes an extremely minimal, almost negligible, sense of sadness. The dominant colors are a calm, slightly muted blue and various shades of green, interspersed with vibrant reds, oranges, yellows, and soft lilacs. While blue can sometimes be associated with melancholy, the specific shade used here is more serene or airy than somber or heavy. The greens are fresh and lively, and the warm reds, oranges, and yellows inject energy and brightness into the composition, actively counteracting any potential for a melancholic interpretation.

The strict verticality and orderly arrangement of the stripes contribute to a feeling of stability, balance, and rhythm, rather than distress or sorrow. There are no drooping lines, chaotic elements, or heavy, dark forms that are typically used in art to convey sadness or despair. The overall impression is one of harmonious calm, visual meditation, or even a quiet optimism, which stands in stark opposition to the emotion of sadness. The painting lacks the somber tones, desaturated palette, or narrative cues often found in works that aim to evoke sorrow or grief. Any perceived sadness would be an extremely personal and tangential interpretation, far from the primary emotional response intended or conveyed by the visual elements."
untitled-156-1971.jpg,colorField,0.5,"The visual elements in this image offer virtually no discernible cues that would evoke sadness. The color palette, composed of soft, muted pastels and earthy tones—including light greens, pinks, lavenders, browns, and golds—tends to create a sense of calm, tranquility, and natural harmony rather than sorrow or melancholy. These colors are gentle and pleasing, lacking the somberness of deep blues, greys, or heavy purples often associated with sadness, nor do they possess the jarring intensity that could suggest distress.

Furthermore, the composition of perfectly horizontal, parallel stripes conveys an overwhelming sense of order, stability, and peacefulness. There is no visual tension, jaggedness, downward motion, or chaotic elements that might typically suggest emotional turmoil or despair. The consistent, rhythmic arrangement is soothing and predictable, contributing to a feeling of balance and serenity rather than discomfort or loss.

There are no narrative elements, figures, or objects that could convey a story of sadness. The abstraction itself is clean and harmonious. While one might interpret the subdued nature of the colors as a lack of vibrancy, which could abstractly hint at a 'subdued' emotional state, this is a tenuous connection at best and is far more readily interpreted as calm or quietude. The overall impression is one of gentle calm and understated beauty, rather than any profound or even mild sense of sorrow."
untitled-1957.jpg,colorField,5.2,"The painting, an abstract expressionist work, features a vibrant and dynamic interplay of bright yellow, strong blue, and hints of red against a predominantly white background. The application of paint involves energetic splatters, drips, and broad, spontaneous brushstrokes. There are no discernible figures, narratives, or forms that typically convey sadness. The colors used are generally perceived as lively and energetic rather than somber or melancholic; yellow often connotes joy or warmth, and while blue can sometimes be associated with sadness, in this context, it appears as an active, bold color, contributing to the overall energetic feel. The chaotic and unrestrained movement of the paint, with its active drips and splashes, suggests spontaneity and vitality rather than a feeling of despondency, stillness, or heavy emotion. There are no dark, muted, or heavy tones that might evoke a sense of grief or sorrow, nor are there compositions that feel weighed down or withdrawn. Any very low score above zero acknowledges the subjective nature of emotional response and the potential for a fleeting, minor, or personal interpretation of a single brushstroke or color nuance as slightly less exuberant, but objectively, the overwhelming visual evidence points away from sadness."
untitled-1952.jpg,colorField,75.0,"The painting evokes a profound sense of sadness primarily through its dominant color palette and the application of paint. The pervasive use of deep, muted reds, akin to dried blood or rich, somber earth tones, immediately conveys a weighty and serious emotional landscape, far removed from joy or lightness. This is powerfully contrasted and underscored by the stark, expansive areas of black, which intrinsically carry connotations of emptiness, loss, and mourning.

The most striking element contributing to sadness is the technique of paint application. The thick, impasto brushstrokes are predominantly vertical, creating a strong visual impression of dripping, weeping, or bleeding downwards. This visceral texture and directionality serve as a potent metaphor for emotional outpouring—like tears streaming or internal sorrow slowly manifesting. The heavy, almost viscous quality of the paint enhances this feeling of a burdened, sorrowful release.

Furthermore, the vertical black lines, appearing almost as deep fissures or dark, unyielding columns amidst the flowing red, introduce a sense of rupture, desolation, or an unbridgeable void. These elements combine to create a composition that feels heavy, somber, and imbued with a pervasive sense of melancholy, quiet suffering, and the solemn weight of enduring sorrow. The abstract nature means it doesn't depict a specific sad event, but rather communicates the *feeling* of sadness through its raw, material presence."
untitled-1949-1.jpg,colorField,,Sadness: 68.5
untitled-1959.jpg,colorField,3.0,"The visual characteristics of this painting offer very little to evoke a sense of sadness. The dominant feature is the expansive, vibrant field of orange that occupies the central and largest portion of the canvas. Orange is a color typically associated with energy, warmth, enthusiasm, and joy, qualities that directly counteract feelings of sorrow or melancholy. Its bright, almost radiant quality creates an impression of liveliness and boldness.

While the flanking areas of muted grey-blue might, in isolation, suggest a degree of coolness, neutrality, or even a subtle hint of somberness (as blue can sometimes be linked to introspection or melancholy), their overall tone is more dusty and desaturated rather than deeply melancholic or despairing. Crucially, these grey-blue areas are visually subordinate to the overwhelming presence and luminosity of the orange. The dynamic, somewhat rough texture and the irregular, almost agitated edges where the orange meets the grey-blue suggest movement and a raw, immediate quality, rather than stillness, resignation, or the heavy weight often associated with sadness. There are no drooping forms, dark, heavy shadows, or narrative elements to imply loss, grief, or withdrawal. The overall emotional landscape presented by the artwork is one of striking contrast and energetic presence, leaving very little room for an interpretation of sadness."
untitled-1959-1.jpg,colorField,5.0,"The primary emotional impact of this painting strongly diverges from sadness. The dominant feature is the vibrant, almost fiery orange color that fills the central area of the canvas. Orange is intrinsically associated with energy, enthusiasm, warmth, joy, and vitality, directly counteracting any sense of sorrow or melancholy. This intense hue creates an immediate feeling of dynamism and brightness.

While the surrounding deep blue background can sometimes be linked to feelings of sadness or introspection (""feeling blue""), in this context, its primary function appears to be providing a bold, high-contrast frame for the exuberant orange. The blue itself is rich and profound, suggesting depth or vastness (like a night sky or deep ocean) rather than a muted or somber hue that would induce gloom. The white speckles scattered across the surface further enhance a sense of light or cosmic energy, adding to the overall vibrancy.

There are no visual cues typically associated with sadness, such as downtrodden figures, desolate landscapes, muted or muddy color palettes, or imagery of loss and despair. The abstract and expressive nature of the brushstrokes, particularly in the blue border, suggests a raw energy rather than a somber mood. The overall composition feels assertive and energetic. Any potential for sadness is exceptionally minimal and would be a highly subjective interpretation, perhaps only a faint, fleeting association some might draw from the deepness of the blue, which is powerfully overshadowed by the overwhelming, positive energy of the orange."
tdb.jpg,colorField,48.0,"The painting evokes a discernible, yet subtle, sense of sadness primarily through its dominant color palette and minimalist composition. The vast expanse of deep, earthy brown occupying the majority of the canvas creates an immediate feeling of somberness and weight. This muted hue, devoid of vibrancy, contributes to an overall quietude that can lean towards a sense of loneliness or contemplation, far from any joyous expression.

The thin, delicate light blue horizontal line cutting across this immense brown field introduces a poignant fragility. Its subtle presence against the overwhelming brown suggests a solitary thread, a distant horizon, or a faint, almost vanishing hope amidst a vast, perhaps overwhelming, emptiness. This vulnerability and isolation of the line can evoke a quiet wistfulness or a feeling of being small and perhaps unheard in a grand, silent space.

The solid, vertical red bar on the left edge stands as a stark, unyielding presence. While red can be vibrant, here its block-like form, isolated against the brown, can be interpreted as a boundary, a contained emotion, or a sense of stark separation. It does not integrate but rather stands apart, contributing to a feeling of quiet containment or an inability to escape the surrounding vast"
