image,image_category,sadness_rating,sadness_explanation
the-vertebrate-grotto-transfer-series.jpg,abstract,82.0,"The most striking element contributing to sadness in this artwork is the prominent and undeniable resemblance of the white forms at the bottom to a human skull, particularly with the two large, dark, hollow shapes serving as eye sockets. A skull is a universal and powerful symbol of death, mortality, and the ultimate end of life, concepts intrinsically linked with profound sadness, grief, and loss. The texture of the white material itself appears somewhat melted, decaying, or corroded, with intricate, delicate vein-like patterns, further reinforcing themes of decomposition and the fragility of existence. This visual narrative about the process of decay and the inevitability of an end significantly contributes to a melancholic and sorrowful mood. The dark, expansive background enhances the somber atmosphere, creating a sense of isolation or solemnity around the central figure. While the vibrant pink forms emerging from the top introduce a contrasting color, their organic, almost coral-like or brain-like texture, situated atop the decaying white mass, can be interpreted as a poignant, fleeting sign of life or thought in the face of mortality, which deepens the contemplative sadness rather than alleviating it. The painting evokes a quiet, existential sadness concerning the impermanence of life and the stark reality of death."
title-sekere-visual-artist-ayibiowu-olusola-e-david-medium-oil-on-canvas-year-2004-1.jpg,abstract,0.0,"The painting contains no discernible elements that evoke sadness. The dominant color palette of bright yellows, radiant oranges, and vibrant blues creates an uplifting and energetic atmosphere, which is antithetical to feelings of sorrow or melancholy. There are no muted tones, dark shadows, or somber hues typically associated with sadness. The three stylized figures are depicted upright and engaged, holding luminous, sphere-like objects that radiate light. Their abstract forms and the starburst elements near their heads suggest enlightenment, spiritual connection, or positive energy, rather than any form of despair or grief. The dynamic composition, with its intersecting lines and flowing arcs, conveys a sense of movement and vitality, lacking the stillness or heaviness that might accompany sadness. There are no facial expressions indicating sorrow, no postures of defeat or withdrawal, and no thematic elements suggesting loss, pain, or loneliness. The overall impression is one of light, revelation, and possibly spiritual communion, completely devoid of any visual or emotional cues that would evoke sadness."
the-vertebrated-cavern-series-of-decals.jpg,abstract,85.0,"The painting evokes a profound sense of sadness primarily through its stark visual language and potent symbolism of mortality and decay. The central white form strongly resembles a skeletal torso or a hollowed-out ribcage, set against an absolute black void. This immediate visual reference to death and decomposition is a universal trigger for feelings of loss and the end of existence. The white pigment, with its drippy, dissolving quality, further enhances the impression of melting flesh, decaying bone, or a fleeting, ghostly presence, adding to the melancholic atmosphere.

The empty, dark spaces within the white form suggest absence and hollowness, emphasizing what has been lost or what is no longer present. Above this decaying form, the scattered pink and red elements, some with vein-like green patterns, appear to be dispersing or separating. These could be interpreted as a dissipating life force, a soul detaching, or even fragmented internal organs, all contributing to a narrative of dissolution, fragmentation, and ultimate loss. The chaotic yet organic nature of these elements suggests a final, perhaps painful, release or breakdown.

The overall composition, with the isolated, decaying form against an infinite black background, underscores a sense of loneliness, emptiness, and the finality of death. While the colors might have a vibrant quality in the scattered elements, their context as fragments separating from a decaying body imbues them with a sense of tragedy rather than joy. The artwork cultivates a deep, contemplative sadness regarding the transience of life and the inevitability of decay."
thursday-jeudi.jpg,abstract,72.5,"The painting evokes a palpable sense of quiet melancholy and profound introspection, contributing significantly to a feeling of sadness. The dominant color palette of deep, somber blues and purples immediately sets a mood of solemnity and introspection, colors often associated with twilight, night, and feelings of sorrow or pensiveness. The scattered, small blue dots across the dark background suggest a cold, distant atmosphere, possibly stars in a vast, empty space, enhancing the feeling of solitude and even isolation that can accompany sadness.

The central figure, with its bright yellow, rectangular head, contrasts sharply with the dark background, but its starkness and simplified features contribute to the emotional tone rather than alleviating it. The two thin, horizontal lines for eyes offer no explicit expression of joy or engagement; instead, they convey a sense of a downcast gaze, closed eyes in deep thought, or simply a vacant, non-reactive state. This ambiguity allows the viewer to project a sense of quiet sorrow or deep, perhaps internal, suffering onto the figure. The figure appears somewhat hunched or still, enveloped by the deep blues, further emphasizing a state of quiet contemplation or resignation.

The abstract white forms also subtly contribute to this feeling. The large, flowing white shape on the left could be interpreted as a stylized tear falling, a spectral presence, or a wisp of departing hope, all of which can be linked to loss or sorrow. The crescent white shape on the right, resembling a moon, reinforces the nocturnal and introspective atmosphere, a time often associated with quiet reflection and melancholy. There are no elements of joy, aggression, or dynamism; instead, the overall composition radiates a profound stillness and a sense of weighty emotion, aligning strongly with a contemplative, deep sadness rather than an overt, acute despair. The artwork captures a melancholic, almost mournful, quietude."
the-yellow-curtain.jpg,abstract,3.5,"The painting, with its dominant bright yellow and vibrant blues, does not inherently evoke strong feelings of sadness. Yellow is often associated with joy, light, and energy, while the specific shades of blue here are more suggestive of sky, water, or calm rather than deep melancholy. The organic, flowing shapes, particularly the large yellow form, contribute to a sense of fluidity and natural movement rather than distress or sorrow. The contrasting elements on the left, like the black vertical bar and the patterned red and green, provide visual interest and structure but do not carry a mournful tone.

However, a very faint, almost imperceptible whisper of potential sadness could be *subjectively* interpreted by some viewers. The color blue, even in lighter tones, can occasionally be associated with introspection, a quiet solitude, or a gentle wistfulness for some individuals, depending on their personal associations and emotional state. The vastness of the yellow area, while bright, might also be perceived by a few as overwhelming or even isolating, which could subtly tip into a feeling of quiet melancholy, distinct from overt grief. The black lines, though few, could also provide a very minor somber contrast. But these are highly tenuous interpretations, and the overall emotional register of the painting leans strongly towards serenity, vibrancy, and abstract contemplation rather than sorrow. Therefore, the score for sadness is extremely low, reflecting its near absence as a prominent or even minor emotion evoked by the artwork."
the-wave-1950.jpg,abstract,5.3,"The visual elements within this abstract painting offer very minimal direct cues that would universally evoke a strong sense of sadness. The composition features swirling and wave-like patterns, executed primarily in cool tones of blue, gray, and muted brown, with lighter areas resembling sky or distant horizons. While cool and desaturated color palettes are sometimes associated with melancholy or a subdued mood (""feeling blue""), in this context, they also evoke natural elements like water, sky, and earth, which are not inherently sorrowful. The dynamic, almost turbulent nature of the swirling lines might suggest movement or internal energy rather than a state of despair or dejection. There are no identifiable figures, faces, or narrative situations that typically convey sadness, such as expressions of grief, scenes of loss, or solitary figures. The repetitive and somewhat dense patterns, while intricate, do not inherently carry a burdensome or sorrowful emotional weight. Any perception of sadness would be largely a subjective interpretation stemming from the absence of overt joyous or vibrant elements, leading to a potentially neutral or contemplative feeling that could be loosely construed as a very mild, ambient sense of melancholy by some viewers. However, the painting primarily communicates an aesthetic of form, texture, and abstract motion, rather than a specific human emotion like sadness. The score reflects this extremely low, almost negligible, direct emotional impact for sadness."
totem.png,abstract,5.0,"The painting predominantly features a vibrant and bold color palette, dominated by rich blues, purples, and assertive reds, along with splashes of bright yellow, white, and teal. These colors, used in strong, defined areas, lend a sense of dynamism and energy rather than conveying a somber or melancholic mood often associated with sadness. There are no muted tones, grays, or desaturated colors typically used to evoke feelings of sorrow or despair.

The forms within the abstract composition are bold and somewhat monumental, with a central white vertical element providing a strong sense of structure. While the shapes could be interpreted as intertwined figures, their abstraction prevents any explicit depiction of distress, loneliness, or emotional suffering. There are no narrative cues, facial expressions (as the figures are faceless), or body language that would suggest sadness or a state of unhappiness. The brushwork, visible and confident, adds to the painting's vitality rather than a sense of fragility or vulnerability. Overall, the artwork feels robust, assertive, and energetic, leaving very little visual evidence to strongly evoke or connect with the emotion of sadness. The score is not zero only because abstract art can allow for individual projection, but there are no inherent or dominant elements within the artwork itself that strongly suggest sadness."
tuesday-mardi.jpg,abstract,2.0,"The painting, with its stark, iconic imagery and warm, earthy background, evokes very little to no sense of sadness. The dominant white and yellow forms, set against a reddish-brown, are not colors typically associated with sorrow or melancholia; blues, grays, or muted tones are more commonly linked to sadness. The central figure, if interpreted as a face or an ""Idol,"" consists of abstract shapes that lack any discernible features or expressions that would convey grief or despair, such as downturned eyes, a frowning mouth, or a posture of dejection. The sweeping, almost embracing curves of the white elements, while somewhat enigmatic, do not suggest emotional weight or sorrow. The overall composition feels more symbolic, serene, or even powerful in its simplicity, rather than emotionally burdened or mournful. There are no elements within the painting—be it in terms of color, form, or implied narrative—that actively contribute to an impression of sadness."
topological-contortion-of-a-female-figure-becoming-a-violoncello.jpg,abstract,78.0,"The painting evokes a profound and pervasive sense of sadness, primarily through its somber color palette and the skeletal, deconstructed forms. The dominant muted greys, browns, and off-whites create a melancholic atmosphere, devoid of vibrancy or warmth. The biomorphic shapes, resembling dissected bones or fragile anatomy, suggest decay, fragility, and mortality, inherently linked to a feeling of loss and transience.

Most notably, the prominent ""f-holes"" (typically found on violins or cellos) are rendered as hollow, empty voids, symbolizing silence, absence, or the silencing of music and life itself, which carries a deeply mournful quality. Furthermore, the presence of a figure in the upper-left corner, hunched over with a bowed head, strongly suggests a posture of despair, grief, or deep sorrow. This visual cue of human despondency significantly contributes to the overall feeling of sadness. The overall deconstruction of what appears to be a musical instrument, reducing it to its bare, almost skeletal components, further emphasizes a sense of loss and the end of something harmonious or beautiful. The precision and starkness of the rendering lend themselves to a more contemplative, intellectual sadness rather than an overtly dramatic one, but its pervasive nature makes the emotion quite impactful."
unknown-title-5.jpg,abstract,2.0,"The painting evokes very little, if any, sense of sadness. The dominant color palette consists of warm yellows, vibrant oranges, and clean whites, hues that are typically associated with light, energy, and even optimism rather than melancholy. There is a complete absence of the cool, muted, or dark tones (such as deep blues, grays, or somber purples) that are commonly used in art to convey feelings of sorrow or despair. The shapes are abstract and geometric, appearing structured and organized, rather than distorted, drooping, or chaotic, which could imply distress. There are no recognizable figures or narrative elements that could convey a sense of loss, grief, or unhappiness. The overall composition feels balanced and somewhat upward-moving, contributing to a sense of lightness rather than emotional weight or somberness. While art is subjective, the visual language employed here strongly steers away from any evocation of sadness."
unknown-title-14.jpg,abstract,75.0,"The painting evokes a notable sense of sadness through its restrained color palette and abstract forms. The dominant hues of muted browns, greys, and desaturated whites create a somber, almost melancholic atmosphere, reminiscent of dusk or a quiet, introspective moment. There is a discernible feeling of weight and solemnity in the upper cluster of abstract shapes, with the darker elements appearing heavy or burdened. However, the most poignant contributors to sadness are the forms in the lower portion of the artwork. Here, the distinct and isolated fragments, particularly the black and white semi-circles, powerfully convey a sense of brokenness, separation, or loss. These scattered pieces against a textured, sparse ground suggest an environment of desolation or the aftermath of something that has fractured or ended. The overall quietude and stillness of the composition, devoid of dynamic energy or vibrant colors, allow for a deep, contemplative sadness to permeate, rather than an overt expression of grief. It’s a quiet, profound melancholy, hinting at irreparable loss or the weight of existential isolation."
tumblr-n1ldo3sjum1tur0p6o3-r1-500.jpg,abstract,7.2,"The painting, being abstract, does not offer explicit narrative or figurative elements that directly convey sadness. There are no clear depictions of mournful expressions, sorrowful gestures, or scenes of loss that would typically elicit this emotion. The dominant color palette consists largely of earthy browns, purples, and some reds, which are complex and rich, but not predominantly cool, dark, or desaturated in a way that typically signifies deep melancholy or despair.

However, a very subtle and indirect sense of quietude, perhaps bordering on a contemplative or slightly melancholic tone, *might* be gleaned from certain abstract forms. Specifically, the elongated, somewhat skeletal-like figures on the far left, with their pale outlines against darker masses, could be interpreted by some as possessing a fragile or enduring quality that hints at a subdued solemnity. Their abstract nature, however, prevents a strong or definitive emotional reading. The overall composition is dense and intricate rather than sparse or desolate, which also lessens any strong impression of sadness or loneliness. Therefore, any perceived sadness is extremely understated, highly subjective, and not a primary emotional takeaway from the artwork."
twins.jpg,abstract,1.0,"The artwork, an abstract black and white composition, offers virtually no visual cues typically associated with sadness. There are no figures depicted with mournful expressions, no narrative elements suggesting loss or grief, and no somber or muted color palette (beyond being monochromatic, which doesn't inherently convey sadness). The forms are angular, geometric, and interlocking, creating a sense of structure and complexity rather than emotional distress or vulnerability. While fragmentation could, in some contexts, hint at brokenness, in this piece, it appears to be a stylistic choice focused on the deconstruction and reassembly of form, devoid of emotional implication. The overall feeling is one of intellectual exploration of shape and line, rather than a depiction of sorrow or melancholia. Any perception of sadness would be extremely subjective and not supported by the visual language of the piece."
untitled-1.jpg,abstract,5.0,"The painting primarily uses abstract geometric forms and bold, saturated colors against a dark background, which evokes a sense of structure, mystery, and perhaps a cosmic or architectural contemplation rather than sadness. While the deep, dark blue/black of the background might lend a very subtle feeling of solemnity or night, which could be *remotely* associated with introspective quietness, it does not convey an oppressive or melancholic atmosphere. The vibrant primary and secondary colors of the shapes—such as the bright green triangle, the bold blue form, and the lively reds, yellows, oranges, and purples of the cuboids—actively counteract any potential somberness. There are no elements that depict loss, suffering, emptiness, or any narrative commonly associated with sadness. The crisp lines and distinct shapes suggest order and intellectual engagement rather than emotional distress. Therefore, the presence of sadness in this artwork is exceptionally minimal, almost negligible."
underground-metaphysical-landscape-c-1960-4.jpg,abstract,5.5,"The painting is an abstract composition characterized by bold, fragmented shapes and a vibrant, albeit contrasting, color palette. The dominant colors include bright yellows and greens, juxtaposed with deep reds, dark browns, and blacks, outlined by stark white lines. While abstract art can evoke a wide range of emotions, the visual cues for sadness in this particular piece are minimal. There are no identifiable figures, expressions, or narrative elements that typically convey sorrow, grief, or melancholy. The bright yellows, in particular, tend to imbue the painting with a sense of energy, light, or even optimism, which directly counteracts feelings of sadness.

The fragmented nature and sharp lines could be interpreted as representing conflict, tension, or a sense of disjointedness, which might hint at underlying unease or turmoil. The darker red and black areas provide a weighty counterpoint to the vibrant yellows and greens, preventing the overall mood from being purely joyous or lighthearted. However, this sense of tension or complexity does not translate strongly into sadness. Sadness is often associated with muted tones, drooping forms, a sense of heaviness, or emotional desolation. This painting, conversely, possesses a dynamic quality and a graphic intensity through its contrasts and visible brushwork, which feels more active and engaging than sorrowful. While there might be a very subtle, underlying sense of complexity or fragmentation that some might remotely associate with a negative emotional state, it is far from conveying explicit sadness or a profound sense of sorrow. The painting lacks the somberness, quietude, or despair that typically characterizes works evoking sadness."
unknown-title-16.jpg,abstract,12.5,"The painting evokes a very subtle, almost subliminal sense of sadness, primarily stemming from its muted and introspective aesthetic. The dominant purplish-grey background and the palette of off-whites, beiges, and earthy reds create a subdued atmosphere that lacks overt vibrancy or joy. This absence of energetic or bright tones can contribute to a feeling of quiet solemnity. The abstract forms, clustered together and somewhat reflective, suggest a sense of introspection or pensive contemplation, which can sometimes border on melancholy. While these forms are not explicitly sorrowful, their quiet grouping and the impression of mirroring or internal dialogue lend themselves to a more serious, less overtly cheerful interpretation. Furthermore, the stark, grounded blocks at the bottom of the composition, particularly the dark reddish-brown one, introduce a feeling of weight or a stark reality, which can subtly connect with themes of burden or groundedness that might lead to a sense of subdued sadness. However, there are no explicit visual cues such as weeping figures, desolate landscapes, or overtly dark and oppressive colors that would indicate profound sorrow. The overall composition maintains a contemplative balance rather than conveying distress. Therefore, any perceived sadness is extremely understated, emerging more from the painting's quiet, reflective mood and its lack of exuberant emotion, rather than a direct portrayal of sorrow or despair."
unknown-title.jpeg,abstract,62.0,"The painting evokes a notable sense of sadness through several key elements. The dominant vertical masses, particularly the dark, somber hues on the left, convey a significant visual weight and gravity, akin to a heavy presence or lingering shadow. This immediately imparts a melancholic and reflective atmosphere. The stark horizontal line bisecting the entire composition, cutting through these dark forms, strongly suggests a division, a fundamental break, or a separation. Such fragmentation often inherently triggers feelings of loss, schism, or an irreconcilable split, which are core components of sadness. Furthermore, the soft, blurred, and somewhat feathery texture of these forms lends them an ethereal or fading quality, hinting at impermanence, dissolution, or the slow vanishing of something once tangible. While there are lighter areas, they serve more as a quiet backdrop against which this profound internal weight plays out, rather than offering significant uplift. The overall quiet, abstract nature encourages introspection, a contemplative state where these visual metaphors for separation, weight, and fading can resonate deeply as sources of sorrow, manifesting as a deep, reflective melancholy rather than an overt, acute anguish."
untitled-1947.jpg,abstract,3.5,"The painting is an abstract composition primarily featuring geometric shapes in various shades of green, teal, and a neutral, light beige/off-white, set against a darker, muted brown/grey base. There are very few elements within this artwork that directly evoke sadness. The cool color palette, while not overtly cheerful, lacks the deep, brooding, or desaturated tones typically associated with profound sorrow or melancholy. The greens and teals, while calming, do not convey a sense of grief or despair. Furthermore, the geometric and structured nature of the forms creates a sense of order and stability rather than chaos or brokenness, which might contribute to a feeling of sadness. There are no figures, narratives, or expressions of distress. The overall impression is one of quiet contemplation or a study in form and color, rather than an emotional outpouring of sorrow. While some might find the muted palette or the starkness of the abstraction to be somewhat somber, this is a very mild interpretation and does not align with a strong sense of sadness. The composition is balanced and creates a somewhat serene atmosphere, which is antithetical to feelings of intense sadness. Therefore, the emotional impact related to sadness is extremely low."
