image,image_category,sadness_rating,sadness_explanation
disneyesque-1971.jpg,colorField,5.0,"This abstract sculpture evokes very little, if any, sense of sadness. The dominant colors include a neutral light grey/blue for the large cubic base, and a darker grey, vibrant red, and energetic orange for the undulating form on top. Red and orange are typically associated with warmth, energy, and dynamism, directly contrasting with emotions of sorrow or melancholy. While the dark grey could lend a serious or slightly somber tone in isolation, its pairing with such bright, assertive colors, and its fluid, almost unfurling shape, prevents it from inducing sadness. The clean lines, precise construction, and bold visual statement inherent in this type of abstract, minimalist sculpture tend to focus on form, color, and spatial relationships rather than narrative or emotional states like grief or despair. There are no drooping forms, muted palettes, or symbolic elements typically linked to sadness. Any feeling of sadness derived from viewing this piece would likely be highly subjective and not intentionally embedded in the artwork's design or aesthetic."
concerto-1975.jpg,colorField,8.5,"The painting evokes a very low degree of sadness, bordering on negligible. The primary reason for any subtle hint of this emotion stems from the background, which is rendered in a desaturated, cool blue-grey hue. This color palette inherently lacks warmth and vibrancy, often associated with a subdued, introspective, or even melancholic mood. Furthermore, the visible, swirling brushstrokes in the background could be interpreted as a turbulent or restless mental state, which might, in some very abstract sense, carry a whisper of unease or sorrow, as if hinting at underlying emotional currents that are not entirely serene.

However, any potential for sadness is overwhelmingly counteracted by the prominent, vibrant, and highly saturated diagonal strokes in the foreground. These bursts of orange, red, white, blue, green, pink, yellow, purple, and gold are dynamic, energetic, and assertive, injecting a strong sense of vitality and movement into the composition. Their presence strongly overshadows the subtle, muted quality of the background, preventing any feeling of despondency or gloom from taking hold. There is no specific imagery traditionally associated with sadness, such as downtrodden figures, desolate landscapes, or overt symbols of loss or grief. The overall impression leans more towards an abstract expression of energy and color, with only the barest, most abstract undercurrent of a cool, possibly reflective, and therefore minimally sad, atmosphere provided by the backdrop."
dalet-tet-1959.jpg,colorField,82.5,"The dominant visual characteristic of this painting is the vast, consuming field of deep, almost impenetrable darkness that occupies the majority of the canvas. This profound blackness immediately evokes a powerful sense of solemnity, gravity, and the void, which are deeply resonant with feelings of sadness, loss, and mourning. The very absence of light and vibrant color within this central mass contributes significantly to a melancholic and heavy atmosphere.

Beneath the surface of this oppressive darkness, one can discern subtle, vertical streaks and muted tones—hints of deep reds, greens, and other colors that appear to be bleeding or submerged within the dominant dark pigment. These underlying hues do not offer a sense of vibrancy or uplift; instead, they seem to be absorbed or overwhelmed by the black, suggesting a fading of life, joy, or vibrancy, which further intensifies the feeling of sorrow. They can be interpreted as traces of past emotions or experiences that have been covered over by a pervasive sadness. The textural quality, particularly the visible, somber brushstrokes or marks, adds a sense of raw, unrefined emotion, akin to the rawness of grief.

Furthermore, the overall abstract nature of the piece, devoid of specific figures or narratives, allows the viewer to project universal feelings of despondency and profound introspection onto it. The subtle bleed of muted colors at the edges of the dark mass, rather than providing relief, emphasizes the encroaching weight of the central darkness, as if colors themselves are receding into a state of melancholy. The sheer visual weight and the somber quietude of the composition create an inescapable feeling of deep, introspective sadness, a quiet and enduring sorrow that settles heavily on the viewer."
corot-s-mark-1987.jpg,colorField,72.0,"The emotion of sadness is strongly evoked in this painting primarily through its dominant and pervasive use of a deep, rich blue hue. Blue is universally associated with feelings of melancholy, introspection, and quiet sorrow, and this specific shade, which leans towards a somber, almost indigo or Prussian blue, carries significant emotional weight. The sheer expanse of this color creates an immersive atmosphere that feels contemplative and subdued, contributing to a sense of profound quietude often linked with sadness.

The abstract nature of the composition further allows the viewer to project these feelings onto the canvas without the distraction of a specific narrative or figure that might dictate a different emotion. The subtle shifts in tone within the blue field, from lighter, almost hazy areas to deeper, more saturated zones, can be interpreted as variations of emotional states, perhaps moments of fading hope or a lingering sense of loss. The slightly diffused or ""washed"" appearance in certain areas might evoke the blurred vision associated with tears or a general feeling of indistinctness and melancholic reverie.

The faint, delicate lines and amorphous shapes, lacking clear definition or purpose, contribute to a sense of quiet yearning or a search for something lost, reinforcing a feeling of pensive sadness. The relatively straight horizontal line near the bottom could symbolize a horizon, a boundary, or even a sense of being grounded by a heavy emotion. The absence of any bright, warm, or energetic colors further ensures that the emotional register remains within the realm of the serious and contemplative, leaning heavily towards a pervasive sense of quiet sadness rather than vibrancy or joy. It's a sadness that feels internalized, a quiet melancholy rather than overt despair."
delta-lambda-1961.jpg,colorField,5.0,"The painting predominantly features a clean, expansive white background, which typically conveys a sense of openness, lightness, or neutrality, rather than the weight or solemnity often associated with sadness. The vibrant and diverse palette of colors used in the dripping lines, ranging from bright yellows and oranges to deep greens, purples, and browns, introduces a dynamic and energetic quality that generally counteracts feelings of melancholy or sorrow. While the downward dripping motion of the paint could, in some abstract interpretations, be loosely associated with tears or a sense of falling, the overall effect is more akin to fluid movement, natural flow, or spontaneous expression rather than despair or grief. There is no somber narrative, muted color scheme, or heavy compositional elements that would strongly evoke sadness. Any perceived sadness is minimal and likely derived from a very abstract and tenuous personal association with the 'dripping' motif, rather than a clear visual cue inherent in the artwork's core aesthetic. The painting's overall impression leans towards vitality and abstract expression, making it largely devoid of a strong emotional pull towards sadness."
double-gray-scramble-1973.jpg,colorField,2.5,"The artwork, a diptych composed of concentric squares by Frank Stella, evokes virtually no sense of sadness. Its nature is entirely abstract and geometric, focusing on formal elements such as line, shape, and color relationships rather than narrative or emotional content. The precision of the lines and the methodical arrangement of the squares create a sense of order and structure, which typically does not align with feelings of sorrow or despair. The color palette, while varied, includes numerous bright and warm hues (yellows, oranges, reds) alongside cooler tones and neutrals. There is no dominant use of colors traditionally associated with sadness (e.g., deep, muted blues or heavy greys), nor are the colors applied in a way that suggests melancholy or heaviness. The visual effect is one of optical illusion and spatial depth, inviting intellectual engagement or a meditative focus on pattern and color shifts, rather than an emotional response rooted in sorrow. There are no figures, expressions, landscapes, or objects that could convey loss, grief, or any other cause for sadness. Therefore, any feeling of sadness derived from this piece would be highly individual and tangential, rather than an inherent or intended emotional evocation of the artwork itself."
dawn-stroke-1977.jpg,colorField,72.5,"The painting evokes a discernible sense of sadness, primarily through its subdued color palette and evocative forms. The dominant muted tones of peach, beige, and faded brown create an atmosphere that feels quiet, almost wistful, devoid of vibrant energy. This desaturated quality contributes to a feeling of quiet melancholy rather than overt despair.

The most striking element contributing to sadness is the prominent vertical white streak on the right side of the canvas. This streak strongly resembles a tear flowing downwards, a universally recognized symbol of sorrow and weeping. The subtle reddish hue near its origin further enhances this interpretation, suggesting a raw or irritated source, akin to eyes swollen from crying. This visual metaphor directly taps into an emotional response linked to sadness.

Furthermore, the overall fluid and washed appearance of the paint, with its soft blending and drips, can suggest a sense of things dissolving, fading, or slipping away, aligning with themes of loss or transience that often accompany sadness. The small, isolated patch of green in the lower-middle, contrasting with the muted background, might be interpreted as something vulnerable, fragile, or perhaps even a memory, further contributing to a sense of quiet lament. The abstract nature of the work prevents a specific narrative of suffering, but it allows for an open interpretation of a deep, pervasive, yet perhaps resigned, sadness. It is a contemplative sadness, not loud or dramatic, but rather a profound, internal experience."
earth-sermon-beauty-love-and-peace-1971.jpg,colorField,1.0,"This painting evokes virtually no sadness. The vibrant, diverse, and luminous color palette, featuring a spectrum of bright reds, oranges, yellows, greens, blues, pinks, and purples, is inherently cheerful and energetic. There are no dark, muted, or somber tones typically associated with feelings of melancholy or sorrow. The composition of vertical stripes, made up of countless small, distinct brushstrokes (reminiscent of mosaic tiles or pointillist dots), creates a dynamic and textured surface that feels lively and optimistic rather than heavy or dispiriting. The overall effect is one of brightness, rhythm, and visual stimulation, all of which are antithetical to the emotion of sadness. There is no narrative, subject matter, or formal element within the artwork that suggests loss, despair, or any form of emotional distress. The painting's character is overwhelmingly positive and visually engaging, leaving no room for a sense of sadness."
e-226-1955.jpg,colorField,0.0,"The painting evokes no sense of sadness. Its dominant color palette of vibrant orange, warm reds, and bright yellow, along with a small, contrasting blue line, are typically associated with warmth, energy, passion, and optimism, rather than melancholy or sorrow. The large, abstract, somewhat organic red shape, while having darker tones at the top, transitions smoothly into a more luminous red, and is set against an equally vibrant orange background. There are no visual cues such as muted or cold colors (beyond a tiny, bright blue accent), drooping forms, desolate landscapes, or figures expressing grief that would typically convey sadness. The overall impression is one of bold abstraction and a dynamic interplay of warm hues, entirely devoid of any somber or depressive qualities."
exposition-sam-francis-19-mars-5-mai-1983-poster.jpg,colorField,1.5,"The painting, an abstract work characterized by a vibrant and diverse palette of splattered colors, evokes little to no sense of sadness. The dominant hues – bright oranges, yellows, lively blues, verdant greens, and rich purples and reds – are typically associated with energy, dynamism, and vivacity, rather than somberness or melancholy. There is a complete absence of the muted, cool, or dark tones (such as grays, deep blues, or blacks) often employed to convey sorrow or introspection.

Furthermore, the technique of paint splattering and dripping creates an impression of spontaneous action and chaotic energy. This active and unconstrained application of paint contributes to an overall feeling of exhilaration or expression, which stands in stark contrast to the stillness, heaviness, or quiet despair often linked with sadness. There are no discernible figures, forms, or narrative elements that could suggest a story of loss, grief, or wistfulness. The composition's sheer vibrancy and the vigorous nature of its execution overwhelmingly communicate an energetic and lively mood, making it extremely difficult to perceive any inherent sadness within the artwork itself."
east-and-beyond-1973.jpg,colorField,5.0,"The predominant yellow hue in this abstract composition immediately works against any strong sense of sadness; yellow is typically associated with light, warmth, and optimism, making it difficult for melancholic feelings to take hold. There are no figures, narratives, or conventionally sad imagery present that would directly evoke grief, sorrow, or despair. The forms themselves are abstract and somewhat geological, resembling a deep valley or gorge. While the dark, textured areas at the bottom might convey a sense of depth, weight, or even isolation, their starkness is mitigated by the vast, luminous yellow expanse above. There is a slight, almost imperceptible whisper of solemnity in the dark, rugged forms, which could be interpreted by some as a very minor undertone of somber contemplation or the quiet burden of profound depth. However, this is far from an overt feeling of sadness, which is why the score remains very low, acknowledging only the most remote and subtle possible association."
dominican-1952-1.jpg,colorField,25.5,"The primary element contributing to a sense of sadness in this painting is the substantial band of grey at the bottom. Grey is a color commonly associated with melancholy, somberness, neutrality, and a lack of vibrancy, which can evoke feelings of dullness or quiet despondency. Its placement at the very base of the composition might suggest a grounded, perhaps inescapable, feeling of solemnity.

However, any potential for deep sadness is significantly diminished by several factors. The upper half of the painting is dominated by two large fields of yellow, a color overwhelmingly linked to cheerfulness, warmth, and optimism. These bright areas actively counteract and lighten any somberness introduced by the grey. The crisp, clean horizontal lines and the overall geometric, abstract nature of the composition lend a sense of order, balance, and controlled calm rather than emotional turbulence or despair. There are no forms, figures, or narrative elements to suggest loss, grief, or struggle. The thin black line acts as a stark divider, providing a sharp contrast and a sense of absolute separation, which could be interpreted as cold or unfeeling, but not necessarily sad. The white band is largely neutral, contributing to the overall sense of clean minimalism. Therefore, while the grey introduces a faint undertone of sobriety or subdued melancholy, it is heavily outweighed by the brighter colors and the painting's overall composed, serene, and almost intellectual aesthetic, resulting in a very low, almost negligible, evocation of true sadness."
elements-v.jpg,colorField,30.0,"The painting subtly evokes a sense of sadness primarily through its color palette and compositional gravity. The expansive, dark gray/black block occupying the top portion of the canvas creates a distinct feeling of weight, somberness, or even oppression, which can psychologically contribute to a mood of gloom or quiet sorrow. This darkness lacks any light or vibrant accent, reinforcing a sense of absence or void.

Below this heavy expanse, the three vertical stripes feature deep, muted colors: a deep, earthy red; a profound, somber blue; and a subdued, mustard yellow. The dark blue, in particular, is frequently associated with melancholy, introspection, and a quiet sense of pensiveness. While red and yellow can be vibrant, their specific shades here are muted and desaturated, stripping them of any inherent cheerfulness or energetic quality. Instead, they blend into the overall serious and subdued atmosphere.

The rigid, geometric composition, devoid of dynamic movement or figurative elements, offers no narrative to uplift or distract from this weighty, contemplative mood. The overall impression is one of solemnity and quietude, leaning towards a reflective or even melancholic state rather than overt joy or energy. It's not an intense, acute sadness, but rather a pervasive, atmospheric melancholy or a sense of gravitas that can accompany moments of quiet sorrow or resignation."
duo-1965.jpg,colorField,12.0,"The painting, with its abstract forms and minimalist composition, primarily evokes a sense of calm and quietude rather than overt sadness. The dominant large field of muted periwinkle blue creates a spacious and serene atmosphere, which is not inherently melancholic. However, certain elements contribute to a very subtle, almost introspective, quietness that might, for some viewers, carry a hint of solemnity or a gentle, non-distressing melancholy, leading to a very low sadness score.

Specifically, the cool, desaturated palette—featuring the muted blue-grey, the deep teal, and the earthy reddish-orange—contributes to a subdued emotional register. While not somber, these colors lack vibrancy and energy, fostering a contemplative mood that can sometimes lean towards pensiveness. Furthermore, the two distinct, organic shapes, positioned on opposing sides of the large blue expanse, might be interpreted as somewhat isolated or distant from each other. This sense of separation or quiet solitude, rather than active connection, could evoke a very mild feeling of introspection or a gentle awareness of aloneness, which is a subtle facet of sadness.

There are no strong visual cues typically associated with profound sadness, such as heavy darkness, chaotic forms, or symbols of loss or despair. The overall impression is one of harmonious balance and tranquility. Therefore, any perceived sadness is extremely understated, akin to a quiet, reflective moment rather than an experience of grief or sorrow."
farbraum-1963.jpg,colorField,55.0,"The predominant use of soft, diluted blues in this abstract piece immediately evokes a sense of melancholy and introspection, colors widely associated with sadness and contemplation. The diffuse, watercolor-like washes and the gentle bleeding of pigments create a feeling of quiet solitude and perhaps a subtle sense of transience or fading, which can be inherently wistful. The lack of sharp lines or intense contrasts contributes to a subdued atmosphere, suggesting a sadness that is quiet and internal rather than dramatic or acute. The pale, almost empty background and edges further emphasize a sense of space or absence, which can subtly feed into feelings of loneliness or a gentle longing. While the overall impression is serene and somewhat ethereal, it's a serenity that coexists with a palpable undercurrent of blue-tinged sorrow. It's not an overwhelming despair, but rather a quiet, persistent ache, like the gentle melancholy of a rainy day or a deep, introspective moment. The subtle variations in the blue, sometimes appearing slightly granular, add a texture that could be interpreted as reminiscent of tears or a quiet emotional disturbance, though still very much contained."
evening-glow-1972.jpg,colorField,38.0,"The predominant deep indigo blue background strongly contributes to a sense of quiet melancholy and introspection, often associated with feelings of solitude or a subdued emotional state. This vast, enveloping blueness can evoke a feeling of emotional depth or a gentle, pervasive emptiness, which borders on sadness. The small, numerous, and somewhat fragmented shapes scattered across this expanse might be interpreted as isolated entities or quiet struggles against an immense backdrop, subtly hinting at a sense of insignificance or quiet pathos. Furthermore, the gradient of color within these shapes, transitioning from warmer reddish-orange to cooler, almost white tones, could suggest a gradual fading or a loss of vibrancy, which can subtly trigger a feeling of gentle sorrow or a wistful sense of decline. The repetitive, patterned nature of the shapes, while maintaining visual order, also contributes to a sense of quiet persistence or a mild resignation, which can manifest as a low-grade sadness. However, the overall composition does not convey acute distress, loss, or despair, but rather a contemplative and somewhat somber mood."
foley-1967.jpg,colorField,5.0,"The painting, with its stark, simplified shapes and vibrant primary and secondary colors, offers very little visual information that would typically evoke sadness. The dominant bright yellow background is often associated with cheerfulness and energy, counteracting any potential somberness. While the presence of blue (a color sometimes linked to melancholy) might slightly nudge the emotional needle, the particular shade used here is a light, almost sky-blue, which feels more serene or airy than deeply mournful. The red triangle is vibrant and active, not subdued, and the dark line is a simple, neutral divider. There are no figures expressing sorrow, no desolate landscapes, no somber tones, and no narrative elements that suggest loss, regret, or despair. The composition is balanced and almost playful in its simplicity, aligning more with clarity or abstraction than any form of emotional distress. Any perception of sadness would be highly idiosyncratic and not inherent in the artwork's visual cues; hence, the rating remains very low, accounting only for the slightest, most indirect potential interpretation that might arise from the isolated nature of the shapes for a particularly sensitive viewer, though this is a significant stretch."
gomelza-1965.jpg,colorField,5.0,"The artwork presents an abstract, repetitive pattern composed of stylized cross-like shapes in red and blue against a white background. The forms are rounded and organic, suggesting a flowing or interconnected design rather than anything rigid or sharp. The colors chosen, a vibrant red and a gentle periwinkle blue, are generally not associated with somber or melancholic moods; red often conveys energy or passion, while light blue can evoke calm or spaciousness. There are no elements within the composition—such as specific imagery, distorted forms, dark or muted color palettes, or visual narratives—that typically trigger feelings of sadness or loss. The overall impression is one of rhythmic design and visual balance, which leans away from any emotional resonance of sorrow or distress. While abstract art can sometimes evoke complex emotions, the specific interplay of these shapes and colors in this balanced, decorative pattern does not suggest any inherent sadness; rather, it feels neutral or even slightly uplifting due to its organized vibrancy."
farbraumk-rper-1982.jpg,colorField,5.5,"The painting is dominated by vibrant yellow and gold hues, which are typically associated with warmth, energy, and joy, thereby inherently working against a strong impression of sadness. The overall visual effect is one of luminosity and active texture.

However, a very subtle and almost negligible sense of sadness can be gleaned from a few minor elements. The yellows are not uniformly bright; some areas lean towards more muted, earthy tones like ochre or mustard, which can carry a less purely optimistic feel than brilliant yellows. These are interspersed and sometimes blended with darker, more subdued shades of brown and olive green, particularly noticeable around the edges and within the deeper textures of the painting. These darker, more grounded tones introduce a faint sense of weight, somberness, or perhaps a hint of decay or aging, subtly tempering the overall brightness. This isn't overt gloom, but a very slight undertone that might evoke a contemplative or slightly melancholic mood. Furthermore, while the brushstrokes contribute to a sense of dynamism, some of the visible textures and layering could be interpreted as having a slight roughness or complexity, hinting at an underlying narrative that isn't entirely smooth or carefree, which in a very abstract and indirect way, might touch upon human experiences that include less joyful moments. These factors combine to create a barely"
