image,image_category,sadness_rating,sadness_explanation
2005-60-80.jpg,abstract,5.0,"The painting predominantly features a vibrant and strong color palette of bright red, clear blue, and deep green, interspersed with creamy yellow and bold black lines. These colors are generally associated with energy, vitality, or intensity, rather than the muted, somber, or desaturated tones often linked to sadness, melancholy, or despair. The absence of subdued blues, grays, or deep, oppressive blacks that typically evoke a sense of sorrow contributes significantly to this low score.

Furthermore, the composition is highly dynamic, characterized by sharp angles, sweeping curves, and interlocking abstract forms defined by thick black outlines. This creates a sense of movement, tension, and a powerful, almost assertive, visual statement. There are no drooping forms, fragmented shapes that suggest vulnerability or brokenness, or isolated elements that might convey loneliness or a feeling of being weighed down. The energetic and robust nature of the forms actively works against the quietude, stillness, or resignation often associated with sadness. The overall visual impression is one of expressive force and vigor, which does not align with feelings of sorrow, loss, or emotional pain. There is nothing within the visual language—no implied narrative of hardship, no depiction of a somber environment, and no visual cues of distress—that would prompt a feeling of sadness in the viewer."
abstraccion-no-3-1953.jpg,abstract,28.0,"The painting evokes a subtle sense of sadness primarily through its muted and desaturated color palette, which includes various shades of grey, soft blues, browns, and subdued pinks. These colors lack vibrancy and dynamism, contributing to an overall somber and contemplative atmosphere rather than one of cheerfulness or joy. While no specific element overtly depicts sorrow, the quietude suggested by the color scheme and the abstract, often curvilinear forms can lead to an introspective and slightly melancholic feeling. The soft, flowing black lines, in particular, may be interpreted as gentle, perhaps pensive movements, adding to this subdued emotional tone. There is an absence of visual cues typically associated with happiness or excitement, leaving room for a quiet, understated form of sadness or wistfulness to settle in the viewer's interpretation. It's a gentle, unaggressive sadness, akin to quiet contemplation rather than overt grief."
abstraction-1926.jpg,abstract,1.5,"The painting, an abstract composition, offers very little to evoke feelings of sadness. The dominant color palette is warm and vibrant, featuring lively oranges, yellows, and bright whites, which are generally associated with energy, warmth, and vitality rather than melancholy or sorrow. While there is a dark, speckled background, it doesn't convey an overwhelming sense of somberness; rather, it appears as a cosmic or textural void from which the colorful, organic forms emerge. The black lines, though present, act as energetic outlines and details, contributing to the dynamic and fluid nature of the imagery rather than creating heavy or oppressive forms. The overall impression is one of chaotic energy, perhaps cellular activity, cosmic events, or internal psychological landscapes, but none of these visual cues inherently lean towards a feeling of despondency, loss, or grief. There are no recognizable figures or situations that would typically trigger sadness, nor are there drooping forms, muted tones (beyond the background), or a sense of stillness or isolation often associated with this emotion. The blue star-like elements, while a cooler color, appear as luminous points of light, adding to the vibrancy rather than dampening it. Any perceived sadness would be purely coincidental or highly idiosyncratic to an individual viewer, as the visual language strongly contradicts it."
abstract-1940.jpg,abstract,8.0,"The painting, with its abstract geometric forms and strong, non-representational colors, does not overtly convey sadness. There are no narrative elements, figures, or situations that directly evoke this emotion. However, a very subtle and indirect hint of solemnity or a contemplative mood, which could be distantly related to melancholy, can be inferred. This arises primarily from the expansive use of deep, dark blue in the background, a color often associated with introspection, seriousness, or a quiet, somber tone. The rigid, receding geometric structure itself, while imposing, also lacks warmth or exuberance, contributing to an overall sense of gravity or impersonality rather than overt cheerfulness. The sharp, defined lines and the somewhat confined nature of the central form do not alleviate this neutrality. Nevertheless, the vibrant orange and deep red within the structure introduce a certain intensity that counters significant emotional despondency. Therefore, any perceived sadness is extremely minimal, arising more from the atmospheric quality of the deep blue and the painting's overall quietude rather than any direct emotional expression of sorrow or despair."
a-time-to-turn-48x48.jpg,abstract,5.0,"The painting, an abstract composition, primarily conveys a sense of dynamic movement and ethereal light rather than sadness. While the lower left quadrant features deeper, muted tones of dark brown and purple, which can sometimes be associated with introspection or somber moods, these colors do not dominate the overall palette. Instead, they provide a contrasting foundation from which brighter, more luminous forms emerge and sweep across the canvas. The prevailing impression is one of energetic unfolding or a powerful, almost spiritual, emergence from darkness into light. There are no discernible elements such as slumped forms, weeping, desolate landscapes, or heavy, oppressive color schemes that are typically used to evoke sadness. The active, sweeping brushstrokes suggest a vibrant force or transformation, which counteracts any potential melancholic undertone from the darker hues. Therefore, while a very subtle hint of somberness *might* be perceived in the deepest parts, it is minimal and quickly overshadowed by the light and motion, resulting in a very low score for sadness."
abstract.jpg,abstract,62.5,"The painting evokes a significant degree of sadness through its predominant use of deep, muted reds and expansive, almost oppressive dark (near-black) masses. These colors combine to create a somber, heavy atmosphere that resonates with feelings of melancholy and profound introspection. The deep reds, instead of conveying passion or energy, lean towards tones of bruised or subdued intensity, contributing to a sense of internal weight. The large, angular, and imposing dark blocks within the composition act as visual anchors that draw the viewer into a feeling of gravitas and perhaps a sense of burden or emptiness, which are often associated with sadness.

There is a distinct lack of bright, uplifting colors or expansive, open spaces that might alleviate this somber mood. While there are instances of lighter pinks, they appear often contained, surrounded, or even overshadowed by the darker and heavier hues, preventing any sustained feeling of lightness or hope. The visible, textured brushstrokes, while dynamic, do not convey joy or lightness but rather an intensity that can be interpreted as a raw, internalized emotion, consistent with a deeply felt, quiet sorrow. The overall visual experience is one of profound solemnity and a contained emotional intensity that leans distinctly towards a melancholic and somewhat mournful disposition, without being overtly dramatic or despairing."
abstraction-1927-1.jpg,abstract,5.0,"The visual elements within this artwork offer very little direct evocation of sadness. The central abstract composition, with its vivid blues, lively teals, and dynamic white and black forms, seems to convey energy, movement, or abstract cosmic elements rather than sorrow or despair. There are no recognizable figures expressing distress, no somber or desolate landscapes, nor a palette overtly dominated by colors typically associated with melancholy (like deep grays or blues used in a heavy, oppressive manner). The overall impression is more one of abstract vitality or even a sense of wonder.

However, a very subtle and indirect hint of potential sadness might arise from the physical state of the framing elements and the background material. The visible wear and tear on the golden-toned frame, including chipped paint and a somewhat distressed appearance, alongside the muted, earthy reddish-brown tones of the board, could suggest age, decay, or neglect. This subtle sense of transience, or the passage of time reflected in the aging materials, might evoke a faint and wistful melancholic feeling for some viewers, a mild form of sadness associated with things past or fading. Yet, this is a highly peripheral interpretation, as the core artistic expression within the image does not actively cultivate sorrow. Therefore, any perceived sadness is minimal, accidental, and secondary to the overall abstract and dynamic nature of the piece."
abstraction-white.jpg,abstract,40.0,"The painting, an abstract composition dominated by cool blues, whites, and a profound central dark crevice, subtly evokes a sense of quiet sadness or melancholy. The extensive use of pale, almost ethereal blues and whites can be interpreted as conveying a sense of isolation, emptiness, or a desolate quietness, rather than warmth or vibrancy. The most impactful element contributing to a feeling of sadness is the deep, stark black line that dissects the composition, forming a chasm or a profound void. This central division can metaphorically represent a rift, a sense of separation, or an inherent emptiness, which are concepts often linked to sorrow or loss. The overall atmosphere is one of solemn introspection, lacking any elements that suggest joy, energy, or comfort. While not overtly depicting scenes of suffering or despair, the contemplative and somewhat stark aesthetic, particularly the suggestion of a deep, dark abyss amidst the soft, receding forms, can resonate with a subtle, internal feeling of quiet sorrow or longing for some viewers. The sadness conveyed is therefore not one of acute pain, but rather a subdued, almost lingering melancholic undertone, inherent in the cool, distant palette and the profound sense of a void."
animal-head-1938.jpg,abstract,5.5,"The painting, being abstract, does not depict any narrative elements or figures typically associated with conveying sadness directly, such as weeping, suffering, or desolate landscapes. The colors employed – black, white, a muted olive green, and an earthy orange-brown background – while including black which can sometimes be linked to somber moods, do not collectively create an overwhelmingly melancholic palette. The white and green hues, especially, bring a certain lightness or organic vitality that counteracts any potential heaviness from the black. The forms themselves are curvilinear, organic, and somewhat playful or whimsical, resembling stylized eyes or abstract creatures. There are no drooping lines, heavy masses, or somber compositions that would typically evoke a sense of sorrow or despair. While the abstract nature leaves room for subjective interpretation, there's nothing inherent in the lines, shapes, or color interactions that specifically suggests grief, melancholy, or a profound sense of loss. The overall impression is more of an intriguing, perhaps even curious or vital, abstract world rather than one steeped in sadness. Any minimal hint of sadness might come from a very abstract reading of the black shapes as somewhat encompassing or the ""eyes"" as perhaps holding a distant, unknowable gaze, but this is extremely weak and speculative given the dominant visual cues."
african-1958.jpg,abstract,35.0,"The emotion of sadness is present, but not dominant, in this abstract composition. The fragmented and disjoined nature of the forms, resembling a shattered mosaic or stained glass, creates an initial sense of disquiet or brokenness, which can subtly evoke a feeling of melancholy or underlying sadness. Some of the black, amorphous figures, particularly in the upper left and upper right, can be interpreted as distressed or anguished faces, with what appear to be open mouths, possibly screaming or roaring in a primal expression of pain or struggle. This visceral sense of turmoil within the figures contributes to a feeling of distress that a viewer might associate with sadness or suffering.

However, the artwork does not overwhelmingly convey sadness. There are no clear iconographic elements typically associated with profound sorrow, such as tears, downtrodden postures, or scenes of mourning or loss. The composition feels energetic and somewhat chaotic, suggesting a dynamic struggle or conflict rather than quiet despair or grief. The presence of vibrant blue and orange blocks interspersed throughout the muted browns and greys introduces a certain vitality and prevents the overall palette from being entirely somber. While the fragmented figures hint at a state of unease or anguish, their expressiveness leans more towards an outward, active distress rather than an internal, passive sorrow. Therefore, while a thread of sadness stemming from perceived suffering or fragmentation exists, it is interwoven with other emotions like tension, struggle, and abstract energy, preventing it from being the primary emotional impact."
against-the-light-1986.jpg,abstract,15.0,"The painting evokes a very low degree of sadness, primarily due to subtle atmospheric qualities rather than direct emotional cues. The dominant feature is a gradient transitioning from a bright, ethereal golden yellow at the top to a dark, muted brown or almost black at the bottom. While the descent into darkness at the lower portion of the canvas can evoke a sense of weight, somberness, or fading, which might be loosely associated with melancholy, this effect is significantly mitigated by the luminous, almost hopeful quality of the golden light occupying the upper and central parts of the composition.

The abstract squares and circles, while scattered, do not present themselves in a way that suggests distress, loss, or brokenness. The texture within the squares appears somewhat scratched or worn, which could be interpreted as hinting at age or slight disquiet, but this is a very minor detail and doesn't strongly push towards sadness. Similarly, the thin, diagonal lines, particularly visible in the darker areas, could vaguely suggest rain or streaking, which might carry melancholic associations for some, but they are too abstract and subtle to strongly convey this emotion. The overall impression is more contemplative or ethereal than sorrowful. There are no figures, explicit narrative, or overtly mournful color palettes (like dominant blues or grays) that would typically elicit a stronger feeling of sadness. Any perception of sadness is likely to be a very mild, incidental, or interpretive response rather than a direct emotional impact."
altar-painting-1915.jpg,abstract,5.0,"This artwork, with its highly structured, geometric forms and prominent use of gold and radiating light, primarily conveys themes of order, spirituality, and perhaps a systematic understanding of existence. The large golden circle at the top, surrounded by light rays, evokes concepts of divinity, enlightenment, or cosmic energy, which are generally associated with awe or reverence rather than sorrow. The pyramid structure below, systematically organized with a spectrum of colors, suggests a methodical progression or a layered understanding of a concept, again devoid of inherent emotional distress.

While the presence of darker hues, particularly the deep black background, might on a superficial level be associated with somberness or emptiness, in this context, it primarily serves to make the luminous gold and structured pyramid stand out, enhancing their symbolic power rather than instilling a sense of despondency. The blues and purples within the pyramid's spectrum, which can sometimes carry melancholic connotations, are here part of a broader, organized chromatic display, balancing with vibrant reds, yellows, and earthy tones. There are no drooping lines, distressed figures, chaotic elements, or fragmented forms that typically evoke sadness or loss. The overall impression is one of profound stillness, conceptual clarity, and abstract beauty, leaving very little room for an interpretation of sorrow or unhappiness. Any perceived sadness would be minimal and highly subjective, stemming more from an individual's projection onto the abstract forms rather than being directly suggested by the artistic elements themselves."
after-the-floods-1936(1).jpg,abstract,8.0,"The painting evokes very little sadness. The primary reasons for this low rating stem from the absence of visual cues typically associated with this emotion. There are no explicit depictions of sorrow, grief, or suffering in any of the abstract forms or figures. The simple, almost hieroglyphic shapes, while open to interpretation, do not convey any sense of despair or melancholy through their posture, expression, or interaction.

The color palette, while muted and earthy, consisting largely of browns, subtle blues, greens, and purples, does not lean towards a sorrowful or depressing tone. Instead, these colors create a sense of antiquity, organic texture, or a quiet, contemplative atmosphere rather than an actively sad one. They lack the deep, somber blues, heavy grays, or stark, desaturated tones often used to convey profound sadness.

The overall composition feels stable and somewhat structured, despite its abstract nature, which does not contribute to a feeling of distress or emotional turmoil. The thick black lines define forms that appear more symbolic or playful than emotionally burdened. While the painting might be interpreted as quiet or introspective due to its subdued palette and enigmatic forms, this quietude does not translate into an overwhelming sense of sadness. There is no narrative of loss or hardship presented, nor do the artistic elements elicit a strong empathetic response of sorrow."
abstraction-with-reference-to-a-flowering-tree-1925.jpg,abstract,12.5,"The painting, with its grid of varied colored squares, does not primarily evoke a strong sense of sadness. While there are darker, more muted tones towards the edges of the composition (such as deep browns, greens, and purples), which might lend a slight air of solemnity or gravitas, these are counterbalanced by the vibrant and luminous core. The central cluster of squares features bright whites, yellows, light greens, pinks, and light blues. These colors are generally associated with cheerfulness, light, and vitality, actively countering any profound sense of sorrow.

There are no drooping forms, sharp angles, or chaotic fragmentation typically associated with distress or despair. Instead, the grid, while irregular, provides a sense of underlying order and contemplation. The texture appears soft and somewhat muted, which might contribute to a quiet, introspective mood rather than an outwardly sad one. The overall impression is more meditative or harmonious, with a subtle interplay of light and shadow, rather than an expression of grief, melancholy, or despair. The very minor score reflects only the slightest hint of pensiveness that might arise from the subdued peripheral tones, but this is a fleeting and very indirect association with sadness, heavily offset by the painting's overall chromatic warmth and contemplative balance."
armonie-di-forme-contrarie-1935.jpg,abstract,5.0,"The painting, an abstract composition dominated by swirling pinks and reds alongside sharp, star-like forms in muted browns and greys, evokes very little sadness. The overall visual impression is one of dynamic energy and movement, rather than the stillness, introspection, or solemnity often associated with sorrow. The warm, though sometimes intense, color palette of the large, sweeping forms tends to create a sense of passion, vibrancy, or cosmic unfolding, which strongly counteracts any pervasive feeling of melancholy. There are no discernible figures, scenes, or narratives that would typically convey themes of loss, grief, or despair, leaving the emotional interpretation largely to the abstract interplay of form and color.

However, a marginal degree of sadness could be perceived, if at all, through a highly subjective interpretation of certain subtle elements. The sharp, fractured, and somewhat darker central forms, rendered in somber greys and browns, contrast sharply with the softer, more encompassing pink hues. This stark contrast, and the way these sharp, almost crystalline elements appear to emerge from or even break through the swirling organic shapes, *could* subtly suggest a disruptive, forceful, or perhaps even a slightly painful emergence or transformation for some viewers. This ""break"" in the more fluid, encompassing forms might, to a very small extent, allude to a sense of fragmentation or difficulty that can be tangentially linked to a feeling of underlying sorrow or unease. The slightly granular texture throughout the painting also adds a certain gravity to the surface, but this is far from the primary emotional driver. Ultimately, any feeling of sadness is extremely faint and overshadowed by the painting's dominant qualities of dynamism, abstract form, and energetic composition."
catedral-1973.jpg,abstract,5.0,"The artwork, composed primarily of geometric shapes in varying shades of blue, green, and hints of pink and white, evokes a sense of coolness, order, and perhaps tranquility rather than sadness. The dominant blues, while sometimes associated with melancholy, are here presented in lighter, often pastel tones, which tend to diffuse any potential somberness. The crisp, upward-pointing triangles and structured rectangular forms contribute to a feeling of ascent, stability, or even a crystalline, mountain-like landscape, none of which inherently convey sorrow. There are no dark, heavy, or muted colors that typically suggest gloom or despair. The composition is clean and organized, lacking any chaotic or drooping lines that might imply emotional distress. Overall, the visual language of the piece leans towards abstract serenity and geometric harmony, offering very little to evoke feelings of sadness, loss, or melancholy."
blue-view-from-the-window-1959.jpg,abstract,5.0,"The painting exhibits very little, if any, discernible sadness. The predominant bright blue background, while a cool color often associated with melancholy, is here rendered in a vibrant, almost electric hue that feels more ethereal or expansive than somber. The scattered golden-yellow dots and linear patterns introduce a lively, almost celebratory, or whimsical quality, akin to confetti, light, or stars, which strongly counters any potential for sadness. The abstract forms, including the hanging diamond shapes and the more geometric structures on the right, are dynamic and visually interesting rather than evoking feelings of despair, loss, or heaviness. There are no downtrodden figures, gloomy narratives, or dark, oppressive color schemes that would typically signify sadness. The overall visual language leans towards a sense of lightness, movement, and perhaps contemplation, but lacks the emotional depth or stylistic cues commonly associated with sorrow. The small score reflects a minimal, almost negligible, potential for any viewer to project sadness onto the blue color without other reinforcing elements, which are entirely absent here."
bandeirinhas-e-mastro.jpg,abstract,1.0,"The artwork primarily features a vibrant and repetitive pattern of flag-like shapes, strongly reminiscent of the festive bunting used in celebrations such as Brazil's Festa Junina. The colors employed – including various shades of red, blue, purple, pink, and turquoise – are generally bright and varied, conveying a sense of energy and liveliness rather than somberness or despair. The composition, with its rhythmic arrangement of these colorful elements, evokes a feeling of festivity and visual playfulness. While there is a prominent diagonal red line cutting across the central left, which could be interpreted as a disruption, its sharp, bolt-like quality feels more energetic or dynamic than sorrowful. Similarly, the slight irregularities in the pattern or the hand-drawn quality do not lend themselves to an interpretation of sadness. There are no muted tones, melancholic figures, or narrative elements that suggest sorrow or loss. The overall impression is one of movement, color, and celebration, making it exceedingly difficult to find any intrinsic visual cues that would evoke sadness. The score of 1 reflects an extremely minimal allowance for highly subjective or idiosyncratic interpretation, as the visual evidence overwhelmingly points away from this emotion."
