image,image_category,surprise_rating,surprise_explanation
65poppiesClaude_Monet_037.jpg,leslie,3.0,"The painting, ""Poppy Field near Argenteuil"" by Claude Monet, evokes a very low degree of surprise. The scene is a quintessential Impressionist landscape, depicting a peaceful and idyllic summer day. There are no sudden movements, unexpected figures, or abrupt changes in the composition that would startle the viewer. The figures, including the woman with the parasol and the child, are engaged in a calm and leisurely stroll, blending harmoniously with the natural setting. While the vibrant red poppies create a striking visual impact against the green field, their presence is entirely expected given the title and the nature of the landscape; they are a key feature rather than an unexpected element. The overall mood is one of serenity and pleasant observation, which is generally antithetical to the emotion of surprise. Any minimal score for surprise might arise solely from the sheer beauty or the immersive quality of the scene, perhaps prompting a fleeting, soft ""oh, how lovely"" rather than a true jolt of the unexpected. However, there is no element of revelation, sudden discovery, or anomaly that would genuinely elicit surprise."
68_5174410_happy3lambs.jpg,leslie,2.0,"The emotion of surprise is almost entirely absent from this painting. Surprise typically arises from an unexpected event, a sudden realization, or a startling visual element. None of these are present here. The scene depicts three young lambs peacefully observing a field of vibrant flowers. Their postures are calm and contemplative, with their heads slightly lifted, suggesting quiet observation or perhaps contentment rather than a startled reaction. There is no dynamic action, sudden movement, or unexpected object in the composition that would elicit surprise from the viewer. The colors, though vivid, are harmoniously arranged, creating a serene and idyllic atmosphere rather than a jarring or surprising visual impact. The overall mood is one of tranquility and appreciation for nature's beauty, making the emotion of surprise highly improbable as a primary or even secondary response. The very low score reflects this extreme lack of any visual cues or narrative elements that would suggest surprise in either the subjects or the viewer."
69vanGogh_Starry_Night_Over_the_Rhone.jpg,leslie,8.0,"The painting primarily evokes feelings of wonder, tranquility, and a unique sense of atmospheric beauty, rather than surprise. There are no sudden events, unexpected narrative elements, or jarring compositional choices that would elicit a strong sense of surprise. The scene is contemplative and harmonious.

However, a very mild degree of surprise might arise for a viewer unaccustomed to Vincent van Gogh's style, particularly in his use of incredibly vibrant and intense colors (such as the brilliant yellows and deep blues) to depict a night scene. Traditional depictions of night often leaned towards more muted or somber tones. This unexpected vividness, while characteristic of Van Gogh, could be a gentle, cognitive surprise for someone seeing it for the first time or with different expectations of a nocturnal landscape. This is a stylistic surprise, rather than a narrative one. The ""exploding"" stars and the painterly reflections on the water are expressions of the artist's unique vision, contributing to the painting's energy and beauty, but they are more likely to inspire awe or fascination than a sudden jolt of surprise."
71Hundertwasser Poster.jpg,leslie,87.0,"This painting elicits a very high degree of surprise due to its intensely unconventional and idiosyncratic nature. The immediate impact is one of being confronted with something entirely unexpected and visually distinct from typical artistic representations.

Firstly, the **style** itself is inherently surprising. Friedensreich Hundertwasser's signature rejection of straight lines, his embrace of organic, undulating forms, and his vibrant, non-naturalistic color palette instantly defy expectations. The painting feels like a fantastical dreamscape, where architectural elements blend with natural forms in a whimsical and unpredictable manner.

Secondly, the **composition** is densely packed with unusual elements, creating a visual overload that constantly presents novelties. Figures are stylized and peculiar, buildings boast irregular windows and onion domes that seem to sprout from the ground like trees, and various forms are connected by strange, root-like red structures. The sheer amount of detail ensures that new, surprising elements are discovered with each glance.

Specific elements contribute significantly to this feeling:
*   The large **blue spiral** in the upper center, filled with abstract symbols and small figures, is an unexpected focal point, drawing the eye into a complex inner world.
*   The **biomorphic, head-like form** at the bottom, from which a river flows, is particularly striking and defies easy categorization, acting as a profound source of visual surprise. Its dual-lobed shape and the way it integrates with the landscape are wholly unconventional.
*   The **whimsical figures** throughout the canvas, with their unique attire and expressions, add to the sense of a fantastical world where the ordinary is consistently subverted.
*   Even common objects like **cars and buildings** are rendered in a charmingly naive and peculiar way, making them feel fresh and unexpected.

The painting offers no clear, linear narrative, instead presenting a complex, interconnected visual puzzle. This lack of a straightforward story encourages prolonged engagement, during which the viewer continually encounters unexpected forms, colors, and juxtapositions, leading to a sustained sense of wonder and surprise at the artist's boundless imagination and unique vision. It's a delightful, rather than jarring, surprise, stemming from the sheer originality and density of unexpected details."
73painting-10.jpg,leslie,92.5,"The painting evokes a profound sense of surprise primarily due to its utterly unexpected and highly imaginative premise. The core concept—a young woman playing a flute from which an entire fantastical, multi-layered universe emerges—is inherently defying of logical expectations. From the flute's end, there's an explosion of disparate elements: swirling cosmic nebulae, identifiable planets and stars, vibrant bursts of fiery energy, mythical figures riding shells, delicate butterflies, and even children floating in a boat, all intermingling seamlessly. This sheer density and variety of highly unconventional imagery, all originating from a singular, seemingly simple act, creates a continuous sense of visual astonishment. The unexpected juxtaposition of celestial bodies with natural elements, and the sudden shift in scale from vast cosmic scenes to intricate details like castles nestled within flower petals, constantly reveals new and unforeseen narrative and visual depths, thereby sustaining a high level of surprise throughout the viewing experience. The artwork challenges conventional reality and presents a world entirely born from creative fantasy, making every discovery within it an unexpected delight."
74painting-02.jpg,leslie,75.0,"The painting evokes a significant degree of surprise due to its unexpected and surreal integration of multiple miniature narrative scenes within and around the subject's straw hat. Upon first glance, one sees a beautiful woman in a large hat adorned with flowers and wheat. However, a closer look reveals intricate, tiny human figures engaged in diverse activities—from farming and harvesting to cycling, picnicking, and playing music—seamlessly interwoven into the hat's structure and the surrounding landscape. This sudden realization of a ""world within a hat"" creates a strong sense of wonder and unexpectedness. The surprise stems from this clever juxtaposition of a seemingly ordinary object with a rich, allegorical, and miniature world, defying conventional artistic representation and inviting prolonged, curious examination. It is a pleasant, intellectual surprise, rather than a shocking or startling one, as it prompts delightful discovery and admiration for the artist's imaginative vision."
75art-nouveau-cat-painting.jpg,leslie,5.5,"The emotion of surprise is notably low when viewing this painting. The artwork presents a cohesive and aesthetically harmonious scene that largely aligns with initial visual expectations. There are no jarring elements, sudden shifts in perspective, unexpected juxtapositions of objects, or unsettling imagery that would provoke a startle response or a sense of sudden unexpectedness. The subject matter—a cat amidst flowers and butterflies—is inherently pleasant and tranquil, and the vibrant, illustrative style maintains a consistent, dreamlike quality throughout. While the intricate details, such as the 'eyes' on the large green butterfly's wings or the subtle figures incorporated into the ornate borders, might offer a momentary ""aha!"" upon closer inspection, this feeling is more akin to discovery or appreciation of intricacy rather than genuine surprise. The overall impression is one of gentle beauty and elaborate design, inviting contemplation rather than eliciting any form of emotional shock or unexpected revelation. The artwork is crafted to be absorbed and enjoyed for its consistent aesthetic and rich detail, not to disrupt the viewer's emotional equilibrium."
76walker-1.jpg,leslie,68.5,"The primary element contributing to a sense of surprise in this painting is the overwhelming and unexpected explosion of vibrant, almost chaotic color applied to a recognizable human form. Upon first glance, the sheer intensity and seemingly spontaneous distribution of neon-like hues—blues, yellows, reds, and oranges—splashed across the face and hair create a powerful visual jolt. This deviates significantly from traditional portraiture, where one might anticipate more subtle or naturalistic color palettes.

Furthermore, the dynamic lines and drips emanating from and around the subject suggest immense energy and motion, which is an unexpected way to depict a person; it's almost as if the individual is vibrating with color or radiating a powerful aura. This abstract, energetic rendering contrasts sharply with the detailed, almost realistic features of the woman's face, particularly her eyes and lips. This juxtaposition of highly detailed figurative elements with wild, unrestrained abstract expressionism adds another layer of mild surprise, as the viewer might not anticipate such a blend within a single piece. The raw, unfiltered nature of the paint application, typical of graffiti or street art, also contributes to the immediate and arresting quality of the image, eliciting a momentary ""wow"" or a slightly startled visual response due to its bold and unconventional aesthetic."
78imari.jpg,leslie,5.2,"The painting evokes very little, if any, sense of surprise. The subject matter, a tiger, is a revered and common motif in East Asian art, symbolizing strength and courage, making its presence entirely expected. The artistic style, characterized by the opulent gold leaf background, stylized mountains and bamboo, and the detailed yet somewhat flattened depiction of the animal, is highly characteristic of traditional Japanese or Chinese screen painting (*byōbu* or similar). There is no unconventional technique or unusual medium employed that would disrupt expectations. Furthermore, the tiger's pose is majestic and powerful, but static; it is not depicted in a sudden pounce or an alarming state of aggression that might startle the viewer. Its expression, though direct, conveys a sense of calm dignity rather than ferocity or alarm. The composition is balanced and typical for a decorative screen, presenting no unexpected angles, disorienting perspectives, or hidden elements that would emerge unexpectedly. The overall impression is one of established grandeur and adherence to classical artistic conventions, leaving virtually no room for elements of visual or narrative surprise. The very low score accounts for the slight, almost negligible possibility of a viewer finding something subtly ""different"" in the rendering of the tiger's face (e.g., the slight blue around the eyes), but this is a very minor detail within an otherwise entirely conventional and unsurprising artwork."
80il_570xN.jpg,leslie,0.5,"The painting evokes virtually no sense of surprise. Its subject matter, a botanical study of a plant, is inherently common and non-alarming. The artistic style, traditional East Asian ink wash painting, is characterized by its serene aesthetic, fluid brushwork, and emphasis on natural beauty, none of which typically aim to startle or unexpected. The composition is balanced and harmonious, presenting the plant in a straightforward and naturalistic manner without any jarring perspectives, unusual juxtapositions, or sudden visual elements. The muted color palette of grays, black, white, and a touch of red is calm and expected, lacking any vibrant or clashing hues that might cause an unexpected jolt. There are no unexpected narrative elements, hidden figures, or uncanny details that would trigger a sudden cognitive shift or a feeling of being taken unawares. The overall impression is one of quiet contemplation and organic beauty, which is the antithesis of surprise. Any minuscule score above zero would only account for the extremely remote possibility of seeing this specific plant species for the very first time, which is not an artistic surprise, but rather a momentary recognition of novelty."
82African-Art-Paintings-002.jpg,leslie,0.1,"As an art expert, my evaluation of ""surprise"" for this painting registers at an almost imperceptible level. The artistic style, characterized by its vibrant colors, stylized figures, and depiction of daily life scenes often associated with African folk art or naive art, is well-established and predictable within its genre. There are no unexpected elements in the composition, such as anachronistic objects, a sudden shift in perspective, or a hidden detail that reveals a deeper, unforeseen narrative upon closer inspection. The subject matter—figures carrying items and children—is common and does not present any jarring or unfamiliar visual information. The color palette, while rich and appealing, uses combinations typical of this style and does not evoke a sense of shock or novelty. There is no visual trickery, optical illusion, or conceptual twist that would cause a momentary jolt of surprise or a feeling of ""I didn't expect that."" The painting is aesthetically pleasing and culturally resonant, but it offers no unexpected revelations or challenges to conventional artistic or thematic expectations. Therefore, the emotional response of surprise is virtually nonexistent."
84_7-CV-50.jpeg,leslie,1.5,"The painting largely lacks elements that would evoke or portray surprise. There are no characters depicted with expressions of astonishment, wide eyes, or sudden, unexpected gestures indicative of shock. The central figure appears pensive or weary, rather than surprised. The other figures are engaged in the act of fishing, their focus on their task rather than on any sudden discovery or unexpected event. While a shark is present in the background, a potential source of danger, its depiction does not capture a moment of sudden encounter or reaction of surprise from the fishermen; it's more of a looming presence within the scene. The overall narrative of the painting appears to be about the act of fishing and the challenges of the sea, not a specific moment of unexpected revelation. The artistic style, while dynamic with swirling waters, does not employ visual cues like abrupt changes in light, color, or composition that would startle the viewer. Therefore, both the characters within the painting and the viewer's emotional response to the painting itself demonstrate a near absence of surprise. The very minimal score accounts for the exceedingly remote possibility of a viewer finding some subtle, highly personal, and unexpected aspect that might register as a fleeting hint of mild surprise, though it is not explicitly conveyed or intended."
85_2003_cuban_painting_alberto_4_la_cola.jpg,leslie,2.0,"The painting evokes very little, if any, sense of surprise. The depicted figures all share a common expression of serene contentment, with closed eyes and pursed lips, suggesting a state of peaceful internal focus rather than a reaction to anything sudden or unexpected in their environment. There are no elements within the scene itself—no sudden movements, unexpected objects, or dramatic events—that would trigger a feeling of surprise in the viewer. The overall atmosphere is calm and placid. While the exaggerated proportions (characteristic of Fernando Botero's style) might initially be striking to a viewer unfamiliar with his work, this is more of an intellectual observation about the artistic style than an emotional response of surprise directly elicited by the painting's narrative or emotional content. The scene is one of everyday life, rendered in a distinctive style, but it does not present any narrative incongruities or visual shocks that would lead to a sensation of surprise."
86original-paintings-two-lovely-australian-terrier.jpg,leslie,2.1,"The painting, featuring two West Highland White Terriers in a pastoral setting, evokes very little to no surprise. Surprise as an emotional response typically arises from an unexpected event, a sudden change, or the presentation of something novel or unusual. This artwork, however, presents a very common and endearing subject matter (pet dogs) in a highly conventional and comforting manner. There are no sudden movements, unexpected compositional elements, or jarring visual details that would elicit a startled or surprised reaction from the viewer. The expressions of the dogs are natural and gentle; while the dog on the left has a charming head tilt and perked ears that might convey curiosity or attentiveness, this pose is a well-known characteristic of many dog breeds and is not surprising in itself. The overall atmosphere is one of tranquility and pleasant familiarity, rather than one designed to challenge expectations or introduce the unexpected. The painting's primary emotional impact lies in its warmth and charm, far removed from the sensation of surprise."
87the_dawn.jpg,leslie,5.0,"The painting, while visually captivating and rich in detail, conveys very little, if any, sense of surprise. The central figure, a graceful dancer, appears deeply immersed in her movement, with her eyes closed or cast downwards, exhibiting a serene and contemplative state rather than a reaction to an unexpected event. Her pose is fluid and intentional, not indicative of a sudden jolt or discovery. Similarly, the ethereal blue figures in the background are depicted as flowing, almost ghost-like presences, devoid of any expression or posture that would suggest surprise. The overall atmosphere is one of mystical flow, harmony, and dreamlike beauty, rather than abruptness or unexpectedness. There are no elements within the composition – such as sudden shifts in light, unexpected objects appearing, or dramatic changes in the scene – that would elicit or depict surprise. The dominant blues and flowing lines create a cohesive and tranquil environment, reinforcing the absence of any startling visual cues. While the viewer might be pleasantly surprised by the sheer beauty or intricacy of the artwork, the emotion of surprise is not overtly portrayed by the subjects nor strongly evoked by the narrative or compositional elements within the painting itself."
88look-of-Egyption-750x1024.jpg,leslie,7.0,"The painting registers an extremely low score for evoking or depicting the emotion of surprise. There are virtually no visual cues within the artwork that suggest suddenness, unexpectedness, or a jolt, which are hallmarks of surprise. The central figure, while having wide-open eyes, displays a serene and composed expression. Her gaze is directed upwards and away from the viewer, implying contemplation, reverence, or a fixed focus rather than a reaction to an unforeseen event. There is no tension in her brow, her mouth is closed, and her posture is elegant and still, completely lacking the physical manifestations commonly associated with surprise, such as raised eyebrows, a gasp, or a sudden movement.

From a compositional standpoint, while the inclusion of the Eye of Providence on an ancient Egyptian figure might present a minor anachronism or an unexpected symbolic juxtaposition, this elicits more intellectual curiosity or a thoughtful pause than a strong emotional jolt of surprise. The overall arrangement of elements—the regal figure, the stylized cat, the scarab, and the staff—is balanced and static. There are no sudden shifts in perspective, jarring colors, or narrative elements that suggest an abrupt incident has occurred or is about to occur. The painting conveys a mood of timeless symbolism and dignity, which is antithetical to the fleeting and reactive nature of surprise. Therefore, any sense of surprise, if present at all, is extremely subtle and incidental, deriving more from conceptual interpretation than from immediate emotional impact."
89timthumb.jpg,leslie,78.5,"The primary element contributing to surprise in this image is the fundamentally unrealistic and fantastical nature of the subject matter. A towering, jagged mountain spire emerging from an infinite sea of clouds, seemingly floating above a cloud layer that acts as a vast, ethereal ground, is an utterly unexpected and non-conventional sight. This immediate departure from observed reality or common landscape photography triggers a strong initial sense of surprise. It's not a jump-scare surprise, but rather a 'what is this?' or 'this is extraordinary' type of surprise. The scale of the scene further enhances this, as the viewer grapples with the sheer immensity of the cloudscape and the solitary, defiant peak. The dramatic sunset lighting, while beautiful, also contributes to the surreal atmosphere, making the impossible seem tangible and enhancing the feeling of witnessing something truly unforeseen and out of the ordinary. The image challenges expectations of what a landscape can be, leading to a sustained sense of wonder mixed with genuine surprise at its imaginative concept."
91landscape-painting-6.jpg,leslie,5.0,"The emotion of surprise is minimally evoked by this painting. While the artwork is vibrant, dynamic, and visually striking, it does not contain elements that typically trigger a strong sense of unexpectedness or astonishment. The scene depicts a familiar subject – a forest path – rendered in a distinct impressionistic style with heavy impasto. The dominant light source emanating from the top center creates a powerful, almost ethereal glow, but this is presented as a central feature and the natural outcome of intense sunlight, rather than an unforeseen event or revelation within the composition. There are no sudden shifts in narrative, no incongruous objects, no hidden figures, or unusual spatial distortions that would startle or challenge the viewer's immediate perception. The energy in the brushstrokes and the intensity of the colors, particularly the yellows and greens, might capture attention forcefully, but this engagement leans more towards awe, wonder, or admiration for the technique and atmosphere rather than genuine surprise. The painting is cohesive and inviting, guiding the eye smoothly along the sun-dappled path, offering no abrupt visual shocks or unexpected twists that would elicit a strong surprised reaction. The mild score reflects only the slightest possibility that the sheer intensity of the light or the bold application of paint might be mildly unexpected for a viewer anticipating a more subdued or realistic landscape."
94-realistic-painting-musician.jpg,leslie,0.0,"The painting conveys a profound sense of introspection, deep emotion, or perhaps weariness and sorrow, but not surprise. The man's head is bowed, his eyes are either closed or looking down intently at the guitar, and his facial muscles are relaxed or drawn in a way that suggests internal focus rather than a reaction to an external, unexpected event. There are no visual cues commonly associated with surprise, such as widened eyes, raised eyebrows, or an open mouth. His body language is entirely inward and concentrated, absorbed in the act of playing or simply being with his instrument, which is the antithesis of a sudden, unexpected jolt. The atmosphere of the painting is one of quiet contemplation, devoid of any element that would elicit or depict surprise."
95Cherry_Ripe_1879.jpg,leslie,5.0,"The emotion of surprise is minimally present in this painting. While the subject, a young girl, has wide, open eyes, which can sometimes be an indicator of surprise, other crucial visual cues for this emotion are largely absent. Her eyebrows are not noticeably raised in an arch, her forehead appears smooth, and her mouth is closed, showing no sign of a gasp or dropped jaw typically associated with a startled reaction. Her posture is composed and still, with her hands clasped, suggesting a state of calm observation or gentle engagement rather than a sudden response to an unexpected event. The overall expression conveys more of an innocent, direct, and perhaps slightly curious gaze, rather than one of genuine astonishment or shock. The wide eyes seem more characteristic of a child's natural expressiveness or a stylistic choice by the artist to create an engaging focal point, rather than conveying a fleeting moment of unexpectedness. Therefore, any interpretation of surprise is extremely subtle and not a primary emotional element."
