image,image_category,surprise_rating,surprise_explanation
140abstract.jpg,leslie,72.0,"The primary source of surprise in this image stems from the unexpected juxtaposition of its elements. Initially, the large, flowing white form against the deep blue background presents itself as an abstract, organic shape, perhaps a liquid splash, a cloud, or even a stylized hand with its finger-like extensions and subtle ""fingernail"" details. This initial perception creates a certain expectation of an abstract or natural theme. However, the eye is then drawn to the upper right corner where a small, distinctly mechanical and recognizable object appears: a black, red, and yellow disc resembling a vinyl record, complete with a thin black line suggestive of a stylus or needle. This sudden inclusion of a precise, technological element within an otherwise fluid and abstract composition is highly unexpected. The ""aha!"" moment of recognizing the record player and its stylus interacting with the ""liquid"" or ""hand"" form creates a cognitive surprise, prompting a re-evaluation of the entire image and its potential meaning. This isn't a shock or fright, but rather a mild, intellectual surprise derived from the unforeseen combination of disparate visual themes and the sudden shift in interpretative context."
141woman.jpg,leslie,5.0,"The emotion of surprise is notably absent in this portrait. The subject's facial expression, while distinctive, offers no visual cues typically associated with a sudden, unexpected event. Her eyes, though a striking blue, are not wide with astonishment but rather possess a serene, almost contemplative quality. There is no raising of the eyebrows, which is a common indicator of surprise, nor is there any tension around the eyes or forehead that would suggest a sudden shift in attention or a startled reaction. Furthermore, her mouth is closed and small, without the slight opening or gasp often seen in moments of surprise. Her posture is calm and posed, with a slight tilt of the head that conveys elegance rather than any form of sudden movement or recoil. The overall mood conveyed by the elongated features and the static composition is one of quiet introspection or perhaps melancholic grace, entirely devoid of the dynamic and often momentary visual manifestations of surprise. The painting captures a sense of timeless stillness, completely contrasting with the abruptness inherent in surprise."
142girl.jpg,leslie,5.0,"The painting conveys very little, if any, sense of surprise. The young girl's direct gaze towards the viewer might, in some interpretations, suggest a momentary acknowledgment or a pause in her activity, as if caught in a quiet moment. However, her facial expression does not register any of the typical physiological cues associated with surprise. Her eyes are open but not wide with alarm or shock; her eyebrows are neutral, not raised in astonishment; and her mouth is closed and relaxed, not agape. There is no tension in her posture, nor any visual indication of a sudden unexpected event. Instead, her demeanor appears calm, contemplative, and focused on her drawing, suggesting an absorption that precludes a sudden reaction of surprise. The overall impression is one of quiet presence and perhaps mild curiosity, rather than an emotion evoked by an unexpected stimulus."
143matisse.Jpg,leslie,72.0,"The painting evokes a significant degree of surprise, not through a narrative event or the subject's expression, but through its radical and unexpected artistic choices. At the time of its creation (1905), Henri Matisse's ""Woman with a Hat"" was a groundbreaking work that dramatically broke from established academic and Impressionistic conventions. The most surprising element is the audacious, non-naturalistic use of color. The vibrant, almost clashing hues – the shocking red of the hat adorned with bright yellow, the green and pink tones on the woman's face, and the strong blue background – are applied with a raw, almost violent intensity that was truly unprecedented"
144woman.jpeg,leslie,0.0,"The painting elicits virtually no sense of surprise. From the perspective of an art expert, every element within this Impressionistic work aligns perfectly with established conventions and expectations for the style and subject matter. There is nothing unexpected or jarring about the scene itself—a woman quietly seated in a verdant garden is a common and tranquil theme. The composition is balanced and harmonious, devoid of any sudden shifts in perspective or unusual arrangements that might startle the viewer. Furthermore, the color palette is soft, natural, and entirely consistent with an outdoor, sunlit setting, presenting no unexpected contrasts or startling applications of pigment. The figure's posture and implied activity (likely needlework or reading) convey a sense of calm focus rather than any reaction to an external, surprising event. There is no narrative tension or abrupt visual cue that would prompt a feeling of unexpectedness or suddenness. Consequently, the artwork resides entirely within the realm of the anticipated and the serene, offering no elements that would cause an expert viewer to feel taken aback or surprised."
145banjo.jpg,leslie,5.0,"The painting conveys a very low degree of surprise. The subject's expression features a slightly open mouth and eyes that are wide and engaged, looking off to the left of the canvas. While a slightly open mouth can sometimes be associated with surprise, in this context, it appears more as part of a gentle, anticipatory smile or a moment of quiet engagement rather than a sudden, unexpected reaction. There is an absence of other key visual indicators of surprise, such as raised eyebrows, a startled or tense posture, or eyes widened in shock. The overall demeanor of the young man is relaxed and pleasant, suggesting amusement, contemplation, or a response to something positive occurring off-frame, rather than a genuine feeling of being startled or taken aback. Any potential hint of surprise is extremely subtle and heavily overshadowed by other more dominant and convivial emotions."
148trees.jpeg,leslie,2.5,"The overall impression of this painting is one of profound serenity and tranquility, which inherently works against any strong sense of surprise. Surprise typically arises from the unexpected, the sudden, or the novel, and this artwork unfolds in a gentle, predictable manner. The composition, a classic forest scene with filtering light and a winding path, aligns perfectly with expected landscape conventions. The presence of the deer, while a focal point, is not presented in a startling or abrupt way; they are integrated naturally into the environment, grazing peacefully as one might expect in such a setting. There are no sudden contrasts in light or shadow, no hidden elements that jump out unexpectedly, nor any dramatic action that would jolt the viewer. The soft, diffuse light and muted palette contribute to a calm, contemplative atmosphere rather than one of discovery or astonishment. While the mind processes the information (e.g., ""oh, deer are present""), this is a cognitive recognition rather than an emotional jolt of surprise. The painting invites peaceful observation, not a sudden gasp or a sense of being caught off guard. Therefore, the emotional resonance of surprise is extremely low, barely registering above absolute zero, as the scene perfectly meets the viewer's expectations for a harmonious natural landscape."
149spots.jpg,leslie,68.0,"The painting evokes a distinct, albeit not overwhelming, sense of surprise primarily due to its bold abstraction and immediate visual impact. The stark contrast of the dense black forms against the pristine white background, punctuated by the single, vivid splash of red, creates an arresting initial impression that can catch the viewer off guard. This sudden graphic intensity demands attention and departs from typical visual expectations, prompting a momentary jolt of ""what is this?"" or ""that's unexpected.""

Furthermore, the ambiguous yet suggestive forms contribute significantly to this feeling. While clearly abstract, the arrangement of shapes hints at an unconventional, perhaps whimsical or even primeval, creature or mask. The central black mass with its prominent red interior resembles an open mouth or an eye, which, combined with the irregular shapes above and to the sides (suggesting limbs or appendages), forms an entity that is both recognizable as a gestalt but entirely unfamiliar in its specifics. This perceptual tension – seeing something that is *like* something but isn't quite anything – generates a cognitive surprise, as the brain attempts to reconcile the input with known patterns. The distinctness of each disconnected black element, yet their harmonious composition into a perceived 'whole', also adds an element of visual novelty, surprising the viewer with its simplicity yet striking effectiveness. It's a subtle surprise born from aesthetic novelty and a momentary perceptual enigma, rather than shock or alarm."
151guitar.jpg,leslie,75.0,"The painting evokes a significant degree of surprise primarily through its deeply idiosyncratic and unconventional interpretation of a seemingly familiar subject: a farm. The viewer is met with a continuous stream of unexpected visual elements and juxtapositions that defy conventional representation.

Firstly, the colossal, egg-shaped head dominating the upper portion of the canvas, with its vibrant red interior suggesting either a face or a blazing sun, is an immediate and striking departure from expectation. This grand, surreal focal point instantly surprises by its scale and its highly abstracted, yet profoundly emotive, presence.

Secondly, the entire composition is a meticulously detailed yet fantastical reimagining of farm life. Each animal, object, and figure is rendered with an imaginative freedom that consistently surprises. The guitar, for instance, bears a star and an almost human-like quality, while various creatures are simplified to essential, often whimsical, forms that are both recognizable and entirely unique (such as the multi-eyed, dog-like figure or the precisely rendered but surreal snail). This persistent transformation of the mundane into the extraordinary creates a sustained sense of visual novelty.

Furthermore, the painting's dreamlike quality contributes to surprise. Elements are placed with an internal logic that is not strictly realistic, prompting the viewer to continually re-evaluate what they are seeing and how these disparate parts coalesce into a unified, albeit fantastical, world. The small, curious details – like the tiny figures, the strange geometric shapes, or the unusual depiction of a foot – are constantly being discovered, each revealing a new, unexpected facet of Miró's vision, leading to a series of delightful, unfolding surprises rather than a single, shocking impact."
152horses.jpg,leslie,82.5,"The most significant source of surprise in Franz Marc's ""The Large Blue Horses"" stems directly from the artist's radical and non-naturalistic use of color, particularly for the central figures. Viewers are accustomed to seeing horses depicted in earthy tones—browns, blacks, whites, grays. To encounter three prominent horses rendered in such a luminous and intense yellow is an immediate and striking departure from expectation. This vivid yellow is not merely a stylistic choice; it's an assertive challenge to conventional representation, causing an initial jolt of cognitive dissonance. The stark contrast of these bright yellow creatures against the deep, rich blues and greens of the background further amplifies this unexpected visual spectacle. The surprise is not one of sudden movement or hidden elements within the narrative, but rather an intellectual and aesthetic shock, stemming from the artist's deliberate subversion of reality through color. The painting forces the viewer to confront a familiar subject presented in an utterly unfamiliar and symbolic chromatic language, leading to a profound sense of ""unexpectedness"" and thus, surprise."
153eakins.Jpg,leslie,0.5,"The painting exhibits virtually no elements that would evoke or depict surprise. The subject, a man playing the cello, is shown in a state of deep concentration or contemplation. His head is bowed, and his right hand is raised to his face, suggesting introspection or careful listening rather than a sudden reaction. There are no classic visual cues for surprise such as wide-opened eyes, raised eyebrows, an open mouth, or a sudden, startled posture. The overall mood is calm and absorbed, lacking any dynamic or unexpected elements that might elicit surprise from the viewer or within the depicted scene. The serene, focused demeanor of the musician completely overrides any possibility of interpreting surprise in his expression or body language."
154eakins.jpg,leslie,5.0,"The painting, titled ""The Amateur,"" depicts a scene of quiet musical performance and attentive listening, which evokes very little, if any, sense of surprise. The central figure, the guitarist, has his head tilted back and eyes gazing upwards, suggesting a state of deep concentration, passion, or perhaps inspiration while singing or playing. His expression is one of engrossment in his art, not of being taken unawares or astonished by anything. There are no widened eyes, sudden shifts in posture, or open-mouthed gasps that would indicate surprise on his part. Similarly, the figure on the right, the listener, observes the musician with a calm and somewhat neutral expression. He is holding cutlery, appearing to be patiently listening, rather than reacting to anything unexpected. His gaze is steady, and there's no indication of a startle or sudden realization. The overall atmosphere of the painting is one of contemplative quietude and shared experience, devoid of any elements that would induce or reflect a feeling of surprise. The mundane setting and the everyday nature of the depicted activity further reduce any potential for surprise."
155woman.jpg,leslie,35.7,"The emotion of surprise in this painting is primarily evoked through a subtle, direct engagement with the viewer, rather than depicting a dramatic event causing surprise within the scene itself. The main subject, the woman in the foreground, is depicted mid-stride, seemingly caught in an instant. Her gaze is unwavering and directed straight out of the canvas, directly meeting the viewer's eyes. This creates a momentary jolt of recognition for the viewer, a feeling of being 'seen' or having interrupted a private moment, which can elicit a mild sense of surprise. The dynamic posture, with her body angled and her right foot mid-step, enhances this feeling of an unexpected encounter, as if she has just turned her head and noticed the observer.

However, the intensity of this surprise is intentionally muted. Her expression features a slight smile or smirk rather than wide eyes of shock or an open mouth of astonishment. This softens the impact, making the surprise more akin to a playful acknowledgement or a knowing glance, rather than a startling or disorienting experience. The surprise is therefore less about an unexpected event unfolding in the painted world, and more about the unexpected direct interaction between the painted subject and the observer. The common visual cues for strong surprise (e.g., a sudden recoil, an expression of fright, or a dramatic occurrence) are absent, limiting the score to a moderate level that reflects a gentle, interactive surprise rather than a profound one."
156houses.jpeg,leslie,12.5,"The element of surprise evoked by this painting is remarkably low. Upon first viewing, there might be a fleeting, almost imperceptible, flicker of mild novelty due to the unusually high, bird's-eye perspective looking directly down upon the rooftops. This isn't the typical eye-level view of a street or a house, and that initial processing of the unfamiliar angle could momentarily register as a very slight ""oh, that's interesting."" However, this sensation is extremely transient and resolves almost immediately. There are no jarring or unexpected visual elements within the composition itself that would elicit a sustained feeling of surprise. The subject matter—houses and rooftops—is entirely familiar and benign. The colors, while vibrant and rich, are harmonious and do not present any sudden, clashing, or anachronistic combinations that would shock the viewer. There are no hidden figures, sudden movements implied, or unexpected objects tucked into the scene. The overall impression is one of static beauty and organized density, not one that intends to startle or reveal something previously unseen or unimaginable. The deliberate, almost patterned arrangement of the houses, along with the consistent stylistic treatment, reinforces a sense of calm and intentionality rather than unexpectedness. Therefore, any perceived surprise is minimal, momentary, and quickly dissipates into an appreciation of the aesthetic and compositional choices, rather than a genuine emotional jolt."
158appleoil.jpg,leslie,42.0,"The primary element contributing to surprise in this artwork is the unexpected juxtaposition of the figure's characteristics and actions. We observe a seemingly portly individual, clad in a jester-like or harlequin costume, engaged in a dynamic, almost acrobatic pose, reaching up and seemingly interacting with delicate, stylized vines. This specific combination — a figure of substantial build performing a light or precarious action, dressed in such whimsical attire, and suspended or balancing amidst intricate natural elements — is not a common or anticipated sight. The surprise is gentle, rather than startling; it stems from the slight absurdity and whimsical unconventionality of the scene. The viewer's expectation of typical human interaction with nature or common character portrayals is subtly challenged by this unique and imaginative tableau, prompting a mild ""Oh, that's unusual"" reaction. The artist deliberately presents an image that deviates from the ordinary, creating a quiet, appreciative sense of unexpectedness in the visual narrative."
160mr-art-deco-2.jpg,leslie,5.5,"The painting elicits a very low degree of surprise. The primary reason for this low score is the absence of any narrative context or dynamic movement that would suggest a sudden, unexpected event has occurred or is unfolding. The figure's pose is relaxed, almost languid, which contradicts the suddenness inherent in surprise. While the man's eyes are depicted as wide, a common physiological indicator of surprise, in this particular portrayal, they convey more of a fixed, intense, or even unsettling stare rather than a fleeting moment of astonishment or shock. There's no tension in his body language or a specific point of focus that indicates he has just been caught off guard or witnessed something unexpected. The stylized, flat composition and the cool, controlled palette further contribute to a sense of detachment rather than an immediate emotional reaction. The gaze feels more like a deliberate observation or an internal state of mind than a spontaneous response to external stimuli."
161andy-warhol-marilyn.jpg,leslie,82.5,"The primary driver of surprise in this artwork is the audacious and unconventional use of color applied to a universally recognizable subject. Upon first viewing, the vibrant, non-naturalistic skin tones (ranging from bright pinks and blues to greens and olives) are immediately unexpected and create a distinct visual jolt. This departure from realistic representation is jarring, as the viewer's brain attempts to reconcile the familiar facial features of Marilyn Monroe with these radically altered and often clashing color palettes for her hair, skin, and makeup. The artist deliberately employs highly saturated hues that are not only artificial but often placed in surprising combinations, such as blue skin with yellow hair and red lips, or green skin with pink lips. This constant subversion of expected color schemes across the nine panels maintains a continuous sense of novelty and unexpectedness. Even as the viewer recognizes the pattern of color variation, each subsequent panel presents a fresh and unanticipated combination, ensuring that the element of surprise is refreshed rather than diminishing entirely. The systematic repetition of the same image, while conceptually understood, ironically amplifies the surprise inherent in the individual color treatments by highlighting the artist's deliberate choice to manipulate and re-present the iconic image in such visually arresting and unexpected ways."
164peaceful_eve.jpeg,leslie,3.5,"The painting, depicting a sky possibly at dawn or dusk above a muted mountain range, primarily evokes feelings of tranquility, beauty, and atmospheric wonder rather than surprise. The subject matter itself—a landscape with a prominent sky—is conventional and easily recognizable, offering no sudden departures from expected artistic themes. While the color palette is notably vibrant and diverse, featuring an ethereal blend of blues, greens, yellows, pinks, and purples, these colors are harmoniously integrated through soft, blended brushstrokes. There are no jarring juxtapositions, sharp contrasts, or unexpected shifts in color that would elicit a jolt of surprise. Similarly, the composition is fluid and organic, lacking any sudden or disorienting elements. There are no hidden figures, optical illusions, or abrupt stylistic changes that would catch the viewer off guard. The overall mood is one of gentle unfolding and natural beauty, consistent with an Impressionistic or Tonalist approach to capturing light and atmosphere. Any minute sense of unexpectedness might come from the sheer beauty of the blended hues, perhaps a fleeting thought of ""Oh, I hadn't quite anticipated that exact soft blend of colors,"" but this is a very minor aesthetic appreciation rather than a true emotional jolt of surprise. The painting does not aim to challenge expectations or present a sudden revelation; instead, it invites contemplation and a serene appreciation of its visual qualities."
166abstract.jpg,leslie,62.5,"The painting evokes a notable degree of surprise primarily through its radical departure from conventional representation and the introduction of highly unusual visual elements. The initial impression is one of immediate unexpectedness due to the distorted, almost alien-like figuration rendered in strong, non-naturalistic blues against a vivid, fiery orange and yellow background. This bold color contrast, while aesthetically striking, contributes to the sense of an otherworldly or surreal scene. More specifically, the surprise deepens upon observing particular details: the bright, almost luminous orb positioned on the left figure's head or face is highly unexpected, functioning either as an exaggerated eye, a mystical light source, or an enigmatic symbol, compelling the viewer to pause and question its nature. Similarly, the hands of the right figure are rendered in an extremely stylized, multi-pronged, or claw-like fashion that deviates significantly from human anatomy, creating a surprising and somewhat unsettling effect. The overall ambiguity of the scene—what the figures are doing, what objects they hold, or the nature of their interaction—further contributes to a mild intellectual surprise as the mind attempts to make sense of the unconventional narrative. While not a startling or shocking surprise, the cumulative effect of these unconventional artistic choices and specific unusual details elicits a strong sense of unexpectedness that challenges the viewer's visual expectations."
168mustache.jpg,leslie,18.0,"The painting evokes a very low degree of surprise. The overall atmosphere is one of calm, leisure, and introspection, rather than suddenness or revelation. The subject's expression is relaxed and contemplative, not startled or caught off guard, which would typically be a primary indicator of surprise within a scene. The composition is stable and uncluttered by dramatic action.

However, there is a very subtle element of unexpectedness that prevents the score from being zero. This stems from the informal portrayal of a military figure. While military portraits often depict officers in formal settings or heroic poses, this painting shows a man in what appears to be a military uniform (or parts of it) lounging casually on a sofa, smoking, with books at his side, and even parts of his gear (like the cuirass and hat) casually placed around him. This juxtaposition of the strict discipline associated with military life and the relaxed, domestic, almost indolent pose can create a mild, intellectual sense of surprise for a viewer accustomed to more conventional depictions of soldiers. It subtly subverts expectations about military formality and duty, presenting a private, human moment rather than a public, official one. This deviation from the anticipated or stereotypical image of a military man contributes to a small, gentle sense of surprise, but it is far from a jarring or startling sensation."
