image,image_category,surprise_rating,surprise_explanation
169lighthouse.jpg,leslie,1.0,"The painting ""Lighthouse and Buildings, Portland Head, Cape Elizabeth, Maine"" by Edward Hopper elicits an extremely low level of surprise. The subject matter – a lighthouse and associated buildings on a hill – is conventional and easily recognizable, offering no inherent unexpectedness. Hopper's signature style, characterized by clear forms, strong natural light, and a sense of stillness, is consistently applied here, providing no sudden visual shocks or unconventional artistic choices. There are no abrupt shifts in color, dramatic distortions of perspective, or unexpected elements introduced into the scene. The composition is straightforward, presenting the structures in a legible and balanced manner. Furthermore, the mood conveyed is one of quiet contemplation or isolation rather than sudden revelation or unexpected occurrence. There is no narrative implied that would lead to a moment of surprise, nor are there any hidden details that suddenly emerge. The overall impression is one of calm observation of a familiar architectural landscape."
170abstract.jpg,leslie,2.5,"The emotion of surprise is minimally evoked by this painting. Mark Rothko's characteristic style, featuring large, luminous rectangles of color arranged in a stacked, horizontal composition, is well-established and predictable within the context of abstract expressionism. There are no sudden, jarring, or unexpected visual elements that would elicit a feeling of surprise. The colors – deep blue, a vibrant yellow, and a muted off-white/light gray – are harmonious rather than clashing, and their transitions are soft and blurred at the edges, encouraging a gradual, contemplative gaze rather than a sudden jolt. There are no hidden figures, narrative elements, or unexpected textural shifts to discover. The overall effect is one of serene contemplation and immersive color interaction, which is largely antithetical to the sensation of surprise. Any fleeting moment of ""surprise"" might only arise for a viewer completely unaccustomed to abstract art, where the *concept* of the painting itself could be initially unexpected. However, even in such a case, the visual content of the painting does not sustain or amplify that initial intellectual novelty into a strong emotional surprise."
171coffee.jpg,leslie,62.5,"The primary source of surprise in this painting originates from the highly unconventional and visually unexpected depiction of coffee steam. Instead of dissipating naturally or forming vague wisps, the steam from the two coffee cups coalesces into a distinct, white, winged figure that strongly resembles a stylized dove or bird in flight. This artistic choice creates a significant cognitive discrepancy; viewers anticipate the typical behavior of steam, but are presented with a tangible, symbolic form emerging from the mundane. The surprise is not one of alarm or shock, but rather a gentle ""aha!"" or ""how interesting!"" moment. It compels the viewer to pause, reassess, and perhaps ponder the symbolic meaning of this unexpected fusion of the everyday (coffee) with the ethereal (a soaring bird, often associated with peace or spirituality). The very originality of this concept, transforming an ephemeral element into a concrete, symbolic entity, is the core of the surprise. While the overall mood of the painting remains calm and inviting, the ingenious and imaginative portrayal of the steam introduces a layer of unexpected visual poetry that subtly catches the viewer off guard in a delightful, rather than startling, way, prompting a moment of mild intellectual curiosity."
172piano.jpeg,leslie,78.0,"The initial reaction to this painting evokes a notable sense of surprise due to the unexpected fluidity and dynamism of its abstract forms. My surprise isn't born from confusion or shock, but rather from the highly inventive and energetic interpretation of a familiar theme (music). The instruments, particularly the piano keys, are depicted not as static objects but as curving, almost sentient entities that flow and dance across the canvas, an unexpectedly lively representation that defies conventional portrayal. Furthermore, the way the abstract shapes seamlessly blend the suggestion of musical instruments with implied, almost anthropomorphic figures on either side—appearing to sway or play—is a truly fresh and surprising synthesis. This fusion of musical elements with human-like motion, all rendered in such vibrant, expressive lines, creates an engaging visual narrative that one might not anticipate from an abstract composition. The skillful balance of deconstructed forms that still convey their essence, coupled with an overwhelming sense of joyful, spontaneous movement, provides a delightful and strong element of surprise through its sheer artistic ingenuity."
173chubby.jpeg,leslie,2.5,"As an art expert, my encounter with this painting elicits an extremely low level of surprise. Fernando Botero's distinctive ""Boterismo"" style, characterized by the exaggerated volume and corpulence of his figures, is instantly recognizable and widely known within the art world. This particular work is a quintessential example of his artistic vision: the placid expressions, the smooth, rounded forms, and the slightly surreal, yet serene, domestic setting are all hallmarks of his established oeuvre. There are no unexpected elements in terms of subject matter (a picnic scene), composition, color palette, or technique that deviate from what an expert would anticipate from Botero. The very familiarity of his unique aesthetic means that encountering a characteristic piece like this primarily evokes recognition rather than genuine astonishment or shock. While Botero's style might be surprising to someone unfamiliar with his work, for a knowledgeable art expert, its presence is an expectation, not a novelty. Therefore, the element of true surprise, which would imply a radical departure or an unforeseen visual jolt, is virtually absent."
174boat.jpg,leslie,5.0,"The painting, a watercolor scene of a beach with figures and boats, does not evoke a sense of surprise. The depicted moment appears calm and ordinary, showcasing a tranquil, everyday activity. The main figure is engrossed in reading, suggesting a state of quiet concentration rather than anticipation of the unexpected. The second figure in the boat is also still, contributing to the peaceful atmosphere. There are no sudden movements, dramatic facial expressions, or unexpected elements in the composition that would startle or surprise the viewer. The colors are soft and muted, and the overall composition is stable and balanced, reinforcing a sense of serene normalcy. There is nothing within the narrative or visual elements of the artwork that deviates from a common, uneventful beach scene, thus offering no cause for sudden wonder or astonishment. The low score reflects the absence of any visual cues or narrative tension that would elicit a feeling of surprise."
175the-family-african.jpg,leslie,0.0,"The painting evokes no sense of surprise whatsoever. There are no elements within the artwork that are sudden, unexpected, or jarring. The composition is static and balanced, depicting a calm family scene. The figures stand still, and their interactions (a child holding hands with an adult, babies carried on backs) are gentle and predictable. There are no dynamic movements, dramatic expressions (the faces are featureless silhouettes), or unusual objects or events to provoke surprise. The color palette is harmonious, and the overall impression is one of tranquility, familiarity, and warmth, rather than astonishment or an unforeseen revelation. The subject matter itself, a family unit, is a common and comforting motif that does not typically induce surprise."
18Ernst-LaVilleEntiere.jpg,leslie,65.0,"The painting evokes a significant degree of surprise, primarily stemming from the artist's bold and unconventional choices in depicting the landscape. Firstly, the intensely saturated, almost otherworldly yellow-gold sky immediately captures attention. This hue is far from naturalistic, creating an unexpected and dramatic backdrop that deviates from common landscape portrayal. The sheer vibrancy and luminous quality of the sky are surprising in their artistic exaggeration, compelling the viewer to pause and question the intended atmosphere or time of day.

Secondly, the intricate and overwhelming detail of the ancient structures, resembling a vast, layered city or an immense ruin, contributes strongly to the sense of astonishment. The eye struggles to comprehend the sheer complexity and multitude of individual forms within the structure, giving the impression of an impossibly grand and ancient civilization. This level of detailed, almost tessellated, architecture is unexpected in its scale and intricacy, leading to a ""wow"" moment of realizing the monumental nature of the depicted site. The composition emphasizes this grandeur, presenting the structures as a massive, almost alien entity rising from the earth.

While not a surprise in the sense of a sudden fright or an unforeseen object, the surprise here is one of profound astonishment and wonder at the monumental scale, the meticulous detail, and the striking atmospheric choices. It's the surprise of encountering something truly remarkable and grand, challenging expectations of a typical landscape and presenting a vision that feels both ancient and profoundly unique."
19Rembrandt-MilitaCompany.jpeg,leslie,88.0,"""The Night Watch"" evokes a powerful sense of surprise primarily due to its revolutionary departure from traditional group portraiture of its era. Instead of a static, formal arrangement of figures, Rembrandt presents a dynamic, action-filled scene, as if catching the civic guard company in the very act of stepping out. This immediacy and sense of a captured moment is inherently surprising, as it breaks the conventional norms of such commissions.

The dramatic use of chiaroscuro is another significant source of surprise. The sudden and intense illumination of the central figures, particularly Captain Frans Banninck Cocq and Lieutenant Willem van Ruytenburch, emerging from the deep shadows, creates a theatrical effect, almost like a spotlight has just been turned on. This startling contrast of light and dark draws the eye and emphasizes the motion, making the scene feel alive and unexpected.

Perhaps the most enigmatic and surprising element is the small, brightly lit girl located to the left of the central figures. Her ethereal glow, unique presence (given the military context), and the symbolic dead chicken hanging from her belt are highly unconventional and instantly capture the viewer's attention with a sense of ""what is she doing here?"" or ""what does she represent?"". Her otherworldly appearance amidst the rugged militiamen is a deliberate and striking anomaly that fosters profound surprise and curiosity.

Furthermore, the painting's sheer scale, combined with its bustling activity and the feeling of figures pushing forward into the viewer's space, contributes to an overwhelming and surprising sensory experience. It's not a subtle unexpectedness, but a bold, almost confrontational display of artistic innovation that was, and remains, truly astonishing. The surprise isn't one of shock or fear, but rather one of profound aesthetic and conceptual awe at its originality and boldness."
28Monet-theGrainstack.jpg,leslie,5.0,"The painting, a characteristic work from Monet's Haystacks series, evokes very little to no sense of surprise. The subject matter – a single haystack in a field under a dramatic sky – is familiar and iconic within the artist's oeuvre. The composition is straightforward, centered around the haystack, and presents a stable, traditional landscape view without unexpected angles, disorienting perspectives, or unusual cropping that might jolt the viewer. While the color palette is intensely vibrant, dominated by rich purples, oranges, and pinks that brilliantly capture the fleeting light of dawn or dusk, these qualities are precisely what one expects from an Impressionistic master like Monet. There are no sudden or jarring color shifts, no hidden elements or figures revealing themselves unexpectedly, and no narrative twists or optical illusions that would lead to a sensation of being startled or caught off guard. The brushwork, though distinct, is consistent with the Impressionist style. The overall emotional impact is one of peaceful contemplation, awe at natural beauty, or sensory delight in color, rather than any form of sudden or unforeseen discovery. The absence of any unpredictable elements or deviations from conventional landscape representation significantly lowers the surprise factor."
29Klee-AdMarginen.jpeg,leslie,68.5,"The painting evokes a notable degree of surprise primarily through its unique visual language and the unexpected juxtaposition of its elements. The most immediate source of mild surprise is the striking red circle, centrally placed against a predominantly muted, textured yellow-green background. Its vivid color and perfect spherical shape stand out sharply, creating an initial, gentle jolt of visual unexpectedness, almost as if it's hovering or a sudden apparition in an ancient, ethereal landscape.

Beyond this central focal point, the surrounding abstract and symbolic elements contribute to a sustained, contemplative surprise. One's eyes are led to discover various peculiar forms: an ""eye"" symbol, a bird-like creature with dangling red spheres, a prominent letter 'U', and numerous other enigmatic shapes and figures that defy easy categorization or immediate recognition. Each discovery of these whimsical, almost childlike symbols nestled within the textured backdrop generates a small, individual moment of ""what is that?"" or ""how curious!"", building a cumulative sense of wonder and mild astonishment at the artist's imaginative world. The overall surreal and dreamlike quality of the composition, where familiar forms are abstracted and presented out of context, consistently challenges the viewer's expectations of reality and narrative, leading to a continuous, albeit gentle, sense of pleasant surprise as one attempts to unravel its mysteries. It's not a sudden, shocking surprise, but rather a gradual unfolding of delightful and intriguing novelties that keep the mind engaged."
33Renoir-BalduMoulindelaGalett.jpg,leslie,1.5,"The painting, ""Bal du moulin de la Galette,"" depicts a lively and bustling outdoor dance hall filled with people enjoying themselves. The overall atmosphere is one of joyful social interaction, conversation, dancing, and relaxation. There is no element within the scene that suggests an unexpected event, a sudden revelation, or any form of shock or astonishment among the depicted figures. Their expressions and body language consistently convey engagement, pleasure, and ease, fitting for a leisurely social gathering. No eyes are wide with sudden realization, no mouths are agape in disbelief, and no gestures indicate an abrupt, unforeseen occurrence. The composition flows naturally, and the interactions appear entirely predictable for the setting. Therefore, the emotion of surprise, as experienced by the subjects within the painting or conveyed through the narrative content, is virtually absent. A very minimal score is given to account for the infinitesimally small possibility of an unidentifiable, fleeting micro-expression on a distant figure, but fundamentally, surprise is not a component of this scene."
36VanEyck-Rinaldo.jpg,leslie,5.0,"The emotion of surprise is barely present in this painting, both in terms of what is depicted within the scene and the feeling it evokes in a viewer. The central figures, particularly the seated woman and the young man looking up at her, display expressions that are far from surprised. The woman's countenance is calm and serene, perhaps contemplative or benevolent, lacking any indication of sudden shock or astonishment. Her eyes are not widened, nor are her eyebrows raised, and her posture is relaxed. Similarly, the young man gazing at her appears to be in a state of reverence, adoration, or earnest supplication, rather than surprise. His gaze is fixed, and his slight mouth opening seems more indicative of awe or a plea than an unexpected revelation.

The overall narrative and composition of the painting also do not lend themselves to surprise. It appears to be a posed, allegorical, or mythological scene, likely depicting a moment of encounter or revelation, but one that is anticipated or part of a grand narrative rather than an unforeseen event. There are no sudden movements, dramatic interruptions, or unexpected elements that would trigger surprise within the scene itself. The cherubs (putti) scattered around are engaged in various leisurely activities, none reacting with a sense of suddenness or unexpectedness. While the lighting is dramatic, with bright light breaking through clouds, it feels composed and purposeful within the classical setting, not like a sudden, jarring flash. The entire atmosphere is one of timelessness and classical composure, rather than a moment of unforeseen occurrence."
38Eyck-Virgin.jpg,leslie,5.0,"The painting, ""The Madonna of Chancellor Rolin"" by Jan van Eyck, primarily evokes feelings of reverence, awe, and meticulous admiration rather than surprise. There are no sudden movements, unexpected expressions, or jarring compositional elements that would elicit a strong sense of surprise in the viewer. The figures within the painting, from the devout Chancellor Rolin to the serene Virgin Mary, the blessing Christ Child, and the graceful angel, all display calm and contemplative demeanors, none indicating surprise.

However, a very subtle, intellectual form of surprise might arise from the sheer depth and hyper-realistic detail of the landscape visible through the arches. For a viewer, especially one accustomed to earlier, less detailed"
46monet_poplars_epte.jpeg,leslie,5.0,"The painting, a serene landscape featuring tall trees against a bright blue sky, evokes very little sense of surprise. There are no unexpected elements, sudden movements, or jarring visual shifts that would typically elicit such an emotion. The composition is balanced and harmonious, with the trees rhythmically spaced and the colors, while vibrant, blend smoothly. The light is consistent and depicts a calm, clear day. There are no hidden figures, startling events, or disruptive contrasts in form or color that would catch the viewer off guard. The overall impression is one of tranquility and natural beauty, which is antithetical to a feeling of surprise or shock. The scene unfolds in a predictable and peaceful manner, offering a contemplative rather than an astonishing experience."
49Schiele-Rainerbub.jpg,leslie,5.2,"The painting evokes very little surprise. There are no sudden movements, unexpected compositional elements, or narrative twists that would elicit a jolt or gasp from the viewer. The subject's expression is not one of shock, alarm, or sudden realization; rather, it's a fixed, intense, and somewhat melancholic gaze. The overall mood is contemplative and psychological, not reactive or startling. While Egon Schiele's expressionistic style, with its characteristic distortion and raw depiction, can be striking or even unsettling to an unfamiliar viewer, this initial impression is more akin to artistic intensity or uniqueness than a genuine feeling of surprise. The depicted hands, though somewhat elongated and posed, contribute to the overall stylistic character rather than presenting an unexpected visual event. Therefore, any element of surprise is minimal, perhaps only arising from the initial encounter with the artist's distinctive and unconventional aesthetic for someone unfamiliar with it, but it quickly dissipates into an appreciation of the painting's deeper emotional and psychological qualities rather than its surprising nature."
53cezanne-still-life-basket.Jpg,leslie,72.0,"The primary source of surprise in Cézanne's ""Still Life with a Basket of Apples"" stems from its deliberate departure from traditional linear perspective and the resulting perceptual instability. Upon first glance, the painting appears to be a conventional still life, but closer inspection reveals numerous visual paradoxes that challenge a viewer's expectations of how objects should behave in space.

Specifically, the table on which the objects rest appears to be tilting forward, giving the impression that the fruits, particularly those on the edge, are precariously balanced and might slide off. This unsettling visual defies the laws of physics as typically represented, creating a moment of subtle disorientation and surprise. Furthermore, Cézanne's use of multiple viewpoints within a single image – for instance, the rim of the basket seen from above while its base is viewed more directly – leads to a surprising sense of spatial ambiguity and inconsistency. The white tablecloth, with its complex, almost architectural folds, also contributes to this feeling of a non-flat, dynamic surface, adding to the visual puzzle.

The surprise is not abrupt or startling, but rather a sustained, intellectual and perceptual surprise that arises as the viewer's eye tries to reconcile the solidity of the depicted objects with the impossible or unstable space they inhabit. It's a ""wait, how is that standing?"" or ""that doesn't quite look right"" kind of surprise, challenging preconceived notions of pictorial representation and forcing a re-evaluation of what is being seen."
54Claude_Monet.jpg,leslie,5.0,"The painting, while undeniably beautiful and skillfully executed, elicits a very low degree of surprise. The subject matter—Venice at sunset, with San Giorgio Maggiore silhouetted against the sky—is iconic and frequently depicted in art, leading to a sense of familiarity rather than unexpectedness. The artistic style is distinctively Impressionistic, characteristic of Claude Monet, and therefore, for anyone familiar with his work or the movement, the loose brushwork and vibrant application of color are expected rather than surprising. There are no sudden or jarring visual elements, no unusual juxtapositions, no hidden details that reveal themselves unexpectedly, nor any narrative twists that would cause a viewer to be caught off guard. The dramatic light and color, while intense and captivating, are consistent with natural phenomena at sunrise or sunset and are rendered in a manner typical of the artist's well-known approach to capturing light and atmosphere. The overall impression is one of serene beauty and masterful depiction, which evokes admiration and appreciation rather than a feeling of shock or unforeseen discovery."
61Monet-The-Water-Lily-Pond.jpg,leslie,5.5,"The emotion of surprise is almost entirely absent when viewing this painting. The scene depicts a tranquil pond with a bridge and water lilies, a subject matter that is inherently serene and expected from an Impressionist master like Claude Monet. There are no sudden, jarring elements, unexpected juxtapositions, or unusual perspectives that would provoke a sense of shock or unexpectedness. The vibrant colors and dynamic brushstrokes, while visually engaging, contribute to an overall sense of harmonious beauty and meditative observation rather than surprise. One might experience a mild, fleeting sense of being ""caught off guard"" by the sheer intensity and abstract quality of the reflections in the water, or the way the light seems to dissolve the forms into pure color. However, this sensation is momentary and quickly resolves into an appreciation of the artistic skill and the natural beauty, rather than sustained surprise. The painting invites contemplation and immersion, not an unexpected jolt."
64van-gogh-self-portrait.jpeg,leslie,85.0,"The painting evokes a strong sense of surprise primarily due to the central, unexpected visual information presented: the prominently bandaged ear. Self-portraits typically capture a subject's likeness or convey a mood, but the inclusion of such a stark physical injury is highly unusual and immediately catches the viewer off guard. This unexpected detail challenges conventional expectations of portraiture, which rarely features such an overt depiction of trauma. The directness with which Van Gogh presents this vulnerable and injured state, without any attempt to conceal or idealize, creates an arresting and unforeseen visual encounter. The surprise stems from this sudden confrontation with an unvarnished reality, forcing an immediate re-evaluation of what a self-portrait can convey, and demanding the viewer's attention to an unforeseen and poignant aspect of the artist's life."
