image,image_category,surprise_rating,surprise_explanation
01Klimt-Beethovenfries.png,leslie,5.5,"The emotion of surprise is notably absent from Gustav Klimt's ""Beethoven Frieze."" The overall tone of the artwork is one of profound symbolism, contemplation, and a journey from suffering to the attainment of happiness and peace. The figures depicted, from the ""Longing for Happiness"" group on the left to the embracing couple on the right, exhibit emotions ranging from longing and sorrow to serenity and transcendent absorption. None of their facial expressions or body language conveys a sense of shock, astonishment, or an unexpected discovery. The scene is static and allegorical, rather than dynamic or event-driven.

From the viewer's perspective, while Klimt's unique style, the intense use of gold leaf, and the bold combination of abstract patterns with naturalistic figures might initially strike one as unusual or novel, this aesthetic appreciation typically falls outside the immediate emotional response of ""surprise"" as a reaction to a sudden or unexpected event depicted within the painting. There is no visual element that serves as a jump scare, an unforeseen twist, or an abrupt revelation. The narrative unfolds symbolically and contemplatively. The score is not zero because any complex artwork can evoke a minor, intellectual ""surprise"" at its sheer scale, detail, or the unconventional nature of its presentation if one is completely unfamiliar with the artist or genre, but this is a very weak and indirect form of surprise, not central to the work's emotional impact."
07Monet-nympheas.jpg,leslie,2.5,"The painting evokes very little surprise. The scene itself, a bridge over water lilies, is a tranquil and commonly depicted motif, especially within Monet's body of work, so there's no inherent element of shock or unexpectedness in the subject matter. The composition is balanced and harmonious, with the elegant curve of the bridge creating a sense of calm continuity rather than abruptness. The soft, impressionistic brushwork and the dominant palette of greens and blues, while beautiful and vibrant, blend seamlessly, contributing to a serene and contemplative mood. There are no sudden contrasts, jarring lines, or unusual perspectives that would startle or provoke an immediate, unexpected reaction. The beauty of the light and reflections, while captivating, is characteristic of Monet's style and thus anticipated rather than surprising. Any minimal score for surprise might arise from a momentary, gentle 'aha' moment upon noticing a subtle interplay of light or a particular detail in the water lilies, but it is far from a strong or impactful feeling of surprise."
100painting-04.jpg,leslie,3.0,"The painting evokes a very low degree of surprise. The scene is a classic, idealized landscape featuring majestic snow-capped mountains, a serene lake, and lush evergreen trees under a clear blue sky with fluffy clouds. Every element is exactly where one would expect it to be in such a composition. There are no unexpected objects, peculiar juxtapositions, or dramatic events unfolding that would startle or cause a jolt of unexpectedness. The colors are vibrant yet natural and harmonious, contributing to a sense of calm and beauty rather than shock. The style, reminiscent of Bob Ross, is known for creating comforting and predictable idyllic scenes, reinforcing a feeling of pleasant familiarity rather than surprise. The overall impression is one of peaceful serenity and predictable beauty, leaving little room for any element of surprise."
103red-plum-painting-water.jpg,leslie,1.5,"The painting elicits an extremely low level of surprise. The subject, a single piece of fruit, is conventional for a still life, offering no inherent shock or unexpected elements. The composition is straightforward, centered, and balanced, conforming to traditional artistic approaches rather than attempting to subvert expectations. The warm, rich color palette and natural lighting contribute to a sense of calm and realism, not abruptness or the unexpected. There are no jarring juxtapositions, unusual objects, or dynamic actions that would typically provoke a feeling of surprise. While the subtle glistening trails of liquid on the surface might invite a moment of closer inspection or a mild ""discovery"" upon first noticing them, this observation is far from an emotional surprise. It’s a detail that enhances the realism and perhaps suggests freshness or ripeness, but it does not startle, confound, or present anything fundamentally unforeseen or out of place within the context of a still life. The painting's primary effect lies in its masterful execution and realistic rendering, which evoke admiration for skill rather than a feeling of being taken aback."
104Strawberries_oil_painting_by_belka10.jpg,leslie,5.0,"The painting, while visually appealing and skillfully executed, elicits very little in the way of surprise. The subject matter – a close-up of numerous strawberries – is quite conventional for a still life or food-themed artwork. There are no unexpected elements within the composition, no unusual juxtapositions, nor any particularly jarring or avant-garde stylistic choices that would disrupt typical expectations. The perspective is straightforward, and the naturalistic rendering of the fruit, including their vibrant red hues and the subtle textures, aligns with what one would anticipate from such a depiction. While one might feel appreciation for the artist's technique or the appealing quality of the strawberries, these emotions are distinct from surprise. The artwork does not challenge preconceived notions, present a narrative twist, or employ a technique so novel as to create a moment of unexpected revelation. It is a well-executed, pleasant, and familiar scene, leading to a very low score for surprise."
111abstract.jpg,leslie,82.0,"The painting strongly evokes a sense of surprise through its sudden visual impact and dynamic composition. The most striking element is the abrupt eruption of intense golden hues, stark blacks, and brilliant whites from within and against a predominantly muted, atmospheric grey background. This contrast is not gradual but rather feels like an unforeseen event, a sudden burst of energy or revelation. The gestural brushwork and fragmented forms contribute to this feeling, as if something has suddenly fractured or exploded. The sharp, almost violent strokes and splatters of black and white further punctuate this sense of instantaneous occurrence, akin to a flash or a rapid, unexpected movement. There's an immediate jolt that commands attention, challenging the eye to process the sudden appearance of such vibrant and forceful elements within an otherwise diffuse environment. The surprise here is primal and visual, stemming from the unexpected intensity and chaotic beauty of the central forms."
114Degas Dancers pastel 1899.jpg,leslie,0.0,"As an art expert evaluating the emotion of surprise within this painting, I find absolutely no visual cues or narrative elements to suggest its presence. Surprise typically manifests through specific facial expressions such as wide-opened eyes, raised eyebrows, or an open mouth (often a gasp), as well as through sudden, startled, or recoiling body postures. In this work by Degas, depicting ballerinas, the figures are absorbed in their individual states – be it a moment of performance, rehearsal, or rest.

The leftmost dancer, with her head tilted upwards and eyes seemingly cast skyward, demonstrates a pose that could be part of a dance routine or a moment of contemplation, rather than a reaction to an unexpected event. Her facial features, though somewhat indistinct due to the pastel medium, show no indication of widened eyes or a gasping mouth. The central dancer, seen from behind with her head bowed, and the partially visible dancer on the right also display no bodily tension or reactive gestures indicative of surprise.

The overall atmosphere of the painting is one of quiet introspection, grace, or focused effort, characteristic of Degas's studies of dancers. There is no external stimulus or sudden shift in the depicted scene that would elicit surprise from the figures, nor is there any element in the composition that would evoke surprise in the viewer in relation to the subjects' emotional state. Therefore, based on a rigorous analysis of expressive cues, the emotion of surprise is entirely absent from this artwork."
115broadway.jpg,leslie,35.0,"As an art expert, the overall style and context of Piet Mondrian's ""Broadway Boogie Woogie"" are well-known, thus eliminating any profound shock or initial bewilderment that a novice might experience. However, even with familiarity, the painting still evokes a distinct, albeit subtle, sense of surprise due to its exceptional execution and unexpected visual qualities.

The primary source of surprise stems from the painting's remarkable success in conveying dynamic rhythm and movement, directly referencing the ""boogie woogie"" jazz music from which it draws inspiration. Given Mondrian's prior works, which often emphasized static, balanced compositions and rigid grids, the kinetic energy present here is genuinely unexpected. The fragmentation of lines into discrete, pulsing yellow, red, and blue blocks, rather than continuous unbroken lines, creates a visual syncopation. The eye is not allowed to rest but is constantly pulled across the canvas, jumping from one ""beat"" to another, mirroring the improvisational and unpredictable nature of the music. This successful translation of sound and temporal rhythm into a static, two-dimensional geometric abstraction is a delightful and clever artistic feat. The ingenuity of achieving such a lively, almost vibrating sensation with such restrained elements (primary colors and basic shapes) is surprising. It's a ""how did he manage to make it *dance* like that?"" kind of surprise, rather than a shocking revelation, but a clear element of unexpected delight and admiration for the artist's inventive solution."
120step_by_step.jpg,leslie,8.5,"The emotion of surprise is minimally evoked within this painting. The Yorkshire Terrier's direct gaze and prominent, dark eyes might suggest a moment of attentiveness or gentle curiosity, as if the dog has just registered something in its immediate environment. This very subtle form of initial awareness could be interpreted as a fleeting precursor to surprise, a ""what's that?"" sort of moment. However, there are no strong visual cues typical of pronounced surprise, such as a raised brow, a wide-open mouth, or a sense of sudden reaction or astonishment in the dog's posture or expression. The overall impression is one of calm engagement and sweetness, rather than a startled response. The painting's composition and subject matter also offer no narrative context or unexpected elements that would trigger a feeling of surprise in the viewer. Therefore, while there's a slight suggestion of alertness in the dog's attentive stare, it falls far short of conveying a genuine or significant sense of surprise."
122acrylic-painting.jpg,leslie,5.2,"The painting, a vibrant depiction of an autumn rural scene, evokes feelings of tranquility, warmth, and appreciation for nature's beauty, rather than surprise. There are no elements within the composition that are unexpected, out of place, or sudden in their appearance or impact. The scene presents a familiar and idyllic landscape with a clear blue sky, a barn, a large autumn-colored tree, a winding path, and distant hills and a church steeple. The colors, though rich and vivid, are harmonious and expected for the autumnal theme, not startling or shocking in their intensity. The artistic style, characterized by visible brushstrokes and impasto, adds texture and visual interest but does not introduce any unexpected visual effects that would trigger a sense of surprise. The overall impression is one of calm and peaceful observation, with nothing to jolt the viewer or provoke an involuntary startle response. The composition is balanced and inviting, guiding the eye gently through the scene without any sudden reveals or dramatic turns. Therefore, the emotion of surprise is minimally, if at all, engaged by this artwork."
127Raphael.jpeg,leslie,2.5,"My emotional response of surprise to this painting is exceedingly low. The artwork presents a calm and composed portrait, entirely devoid of elements typically associated with evoking a sudden, unexpected reaction. The subject's gaze, while direct and engaging, is steady and lacks any wide-eyed astonishment or raised eyebrows that might suggest shock or revelation. His mouth is closed, and his overall expression is one of placid presence rather than sudden movement or reaction. The composition is balanced and traditional, offering no jarring angles, unexpected juxtapositions, or optical illusions that could startle the viewer. The plain, neutral background provides no sudden visual cues or hidden details to unexpectedly reveal themselves. Furthermore, the subject matter itself, a standard bust-length portrait, holds no inherent narrative tension or dramatic action that would lead to a feeling of the unexpected. The painting does not utilize abrupt shifts in light, vibrant and clashing colors, or unusual forms that might jolt the senses. Instead, the mastery lies in its serene execution and the sense of quiet dignity it conveys, qualities that stand in direct opposition to the suddenness required for an emotional response of surprise. While a deeper appreciation of the artist's skill might evolve, the immediate, visceral feeling of surprise is virtually absent."
130woodblock1.jpg,leslie,5.5,"The feeling of surprise evoked by this painting is minimal. The scene depicts a tranquil, predictable winter landscape with common elements: snow-covered hills, a river, a simple wooden bridge, a person on horseback, and a couple of walking figures. There are no sudden movements, dramatic events, or unexpected narrative elements that would cause a viewer to feel surprised. The composition is calm and balanced, guiding the eye through the scene without any jarring or disorienting perspectives. The color palette, predominantly muted whites, blues, and browns, is typical for a winter setting and does not contain any jarring or unusually vibrant hues that would unexpectedly pop out. The figures are engaged in mundane activities – crossing a bridge and walking uphill – and their postures or expressions do not suggest any surprise on their part or aim to elicit it from the viewer. While the leaning tree on the right side is a distinct visual element, its presence feels natural within a wild winter landscape rather than surprising. Similarly, the intense blue of the river, while striking against the snow, is an aesthetic choice that enhances the scene's beauty rather than an unexpected anomaly. The overall mood is one of quiet serenity or perhaps mild contemplation, which is antithetical to the suddenness and unexpectedness associated with surprise."
131landscape.jpeg,leslie,1.0,"The painting, a traditional Chinese ink wash landscape, evokes feelings of serenity, contemplation, and appreciation for nature's beauty, but it generates almost no sense of surprise. Its composition, subject matter (mountains, water, mist, trees), and monochromatic style are deeply rooted in established artistic conventions for this genre. There are no unexpected elements, jarring contrasts, hidden figures, or unusual techniques that would disrupt the viewer's expectations or cause a sudden jolt of recognition or astonishment. The scene unfolds with a gentle, harmonious progression, inviting quiet observation rather than startling discovery. While any new visual input contains a minuscule element of novelty, this painting is designed to be aesthetically pleasing and familiar within its cultural context, intentionally avoiding anything that would provoke an emotional reaction of surprise."
134DiegoRivera_DreamCenter.jpg,leslie,88.0,"The painting evokes a strong sense of surprise through several distinct and powerful elements. Foremost is the prominent figure of La Calavera Catrina, the elegantly dressed skeleton, standing centrally and interacting with living historical figures. For many viewers unfamiliar with Mexican culture and the allegorical representation of death in art (particularly from Día de Muertos traditions), encountering such a sophisticated and non-macabre skeletal figure as a key participant in a historical promenade is profoundly unexpected. It challenges conventional artistic depictions of human gatherings and serves as an immediate visual jolt.

Beyond the iconic Catrina, surprise is also generated by the audacious and anachronistic assembly of historical figures from vastly different eras and ideologies, all coexisting in the same pictorial space. Figures like Hernán Cortés and Porfirio Díaz are placed alongside revolutionaries like Emiliano Zapata and intellectuals like Benito Juárez, creating a temporal and political collage that defies a straightforward historical narrative. This intellectual juxtaposition leads to a continuous sense of unexpected discovery as the viewer identifies more characters and grapples with their improbable gathering.

Furthermore, the deeply personal and allegorical inclusion of the artist, Diego Rivera, as a child holding hands with Catrina and his future wife Frida Kahlo, is a highly unusual and surprising self-insertion within a grand public mural of historical scope. This intimate, yet anachronistic, detail adds another layer of the unexpected, inviting viewers to ponder the artist's personal connection to the historical narrative and the allegorical representation of Mexico's past, present, and future. The painting doesn't aim for a shocking surprise, but rather a rich, unfolding sense of wonder and intellectual revelation as its unique layers are perceived."
135kahlo.JPG,leslie,92.5,"The painting, a unique still life by Frida Kahlo, evokes a profound sense of surprise through its deliberate subversion of expectations and the inclusion of numerous unexpected elements. The most striking and immediate source of surprise is the anthropomorphic coconut, whose deeply expressive, almost human-like face with wide, slightly downturned eyes is completely out of place in a typical fruit arrangement. This unexpected personification immediately startles the viewer, prompting a double-take.

Further contributing to the surprise is the prominent presence of a detailed owl resting amongst the fruits, a creature not commonly associated with still life compositions, particularly one focusing on tropical produce. Its calm, watchful gaze contrasts sharply with the dynamic arrangement of the fruits. The blonde doll, placed awkwardly yet prominently among the fanned-out watermelons, also introduces a highly unusual and narrative element, as if she has just been dropped into the scene, looking on with a sense of apprehension or wonder. The very title of the piece, ""La novia que se espanta de ver la vida abierta"" (The bride who is frightened/startled by seeing life opened), explicitly names the emotion of being startled or surprised, directly linking it to the visual theme of the ""opened life"" represented by the sliced fruits. The dramatic fanning out of the watermelon slices, revealing their vibrant red flesh and seeds in such an exaggerated manner, also adds a visual dynamism that can be surprising in its intensity, far beyond a simple presentation of food. The presence of a large insect on the bananas, while naturalistic, is also prominent enough to draw a surprised closer look. The cumulative effect of these incongruous and surreal juxtapositions—human-faced fruit, an owl, a doll, and an explicit narrative of fright—creates a sustained and high level of surprise for the viewer, compelling them to question and re-evaluate what they are seeing."
136ship.jpg,leslie,0.0,"The painting evokes virtually no sense of surprise. The central figure, a woman on a ship's deck, displays a calm, pensive, and perhaps slightly wistful expression as she gazes out towards the horizon. Her posture is relaxed and stable, not indicative of any sudden movement, flinching, or a startled reaction. Her eyes are not wide with shock, nor is her body tensed in anticipation of an unexpected event. The scene itself is serene, featuring a distant cityscape and a calm body of water, devoid of any dramatic or unforeseen elements that could trigger surprise. There are no sudden shifts in light, unexpected figures appearing, or any signs of an imminent incident. The presence of binoculars in her hand suggests deliberate observation, not a spontaneous reaction to something unexpected. The overall mood is one of quiet contemplation and tranquility, which is antithetical to the sudden and often jarring nature of surprise."
137girl.jpeg,leslie,7.5,"The feeling of surprise evoked by this painting is remarkably low. As an art expert, I approach works with an awareness of historical context, stylistic trends, and common artistic conventions. This particular piece, while beautifully executed and aesthetically pleasing, offers very little in the way of the unexpected. The subject—a portrait of a woman—is a timeless and ubiquitous motif in art history. Her pose, with her chin resting contemplatively on her hand, is classic and does not present any novel or jarring compositional choices. Furthermore, her expression is one of calm contemplation, not one that mirrors or instigates surprise in the viewer. The artistic style, characterized by loose, visible brushstrokes and a vibrant, somewhat impressionistic use of color, is well-established and falls within a recognized tradition. While the skillful application of light and shadow creates depth and mood, these are expected outcomes of a competent artist rather than surprising breakthroughs. There are no sudden shifts in perspective, anachronisms, surreal elements, or narrative twists that would jolt the viewer's expectations. The painting feels harmonious and adheres to familiar aesthetic principles, leaving no room for a sudden, unexpected revelation or a feeling of astonishment. Its beauty lies in its execution and traditional appeal, not in its capacity to subvert or astonish."
138field.jpg,leslie,0.1,"The painting depicts a serene and tranquil rural landscape with two women walking purposefully alongside a river. There are no visual elements within the composition that suggest a sudden, unexpected event or a feeling of being taken aback. The figures' postures are calm and their movements appear deliberate, rather than reactive to something unforeseen. Their gazes are either downcast, focused on their path, or directed towards each other in what appears to be a quiet interaction, none of which convey an expression of astonishment or shock. The surrounding environment is equally peaceful, with a placid river and rolling hills, devoid of any sudden changes in weather, dramatic occurrences, or startling elements that might elicit surprise. The overall mood is one of quiet industry and peaceful coexistence with nature, completely lacking the tension, abruptness, or wide-eyed wonder typically associated with the emotion of surprise. Therefore, the feeling of surprise is virtually nonexistent in this artwork, as every visual cue points towards an absence of the unexpected."
139book.jpeg,leslie,5.0,"As an art expert, my familiarity with the Cubist movement and the historical context of such works naturally tempers any overwhelming sense of visual shock or novelty. The painting, characteristic of synthetic Cubism with its abstracted, geometric forms and earthy palette, aligns with established artistic conventions of its period. Therefore, there is no sudden, jarring, or completely unexpected element that would elicit a high score for surprise in the way a truly unprecedented or radically experimental piece might.

However, a very subtle, almost intellectual, form of unexpectedness does exist, preventing a score of absolute zero. While the general style is known, the specific execution here presents a unique quality. The figure possesses a remarkable sculptural weight and monolithic presence, almost as if it were a carved stone form rendered on canvas. This particular blend of volumetric solidity within the fragmented Cubist framework, especially the way the head and arms convey such mass and gravity, offers a slight deviation from the more planar or purely geometric interpretations often seen in Cubism. This distinct approach, a subtle artistic choice within a familiar style, creates a mild sense of ""oh, that's interesting"" or ""that's a unique take,"" which registers as a fractional degree of unexpectedness rather than a profound emotional jolt. It's a recognition of the artist's individual voice within a well-understood stylistic language, prompting a very minor, intellectual surprise rather than a visceral one."
